id;spiegazione
277;I've seen this movie many time over the years and always enjoy Al Pacino's 'honest cop in a crooked police force' portrayal.
278;After years of having to live with the previous VHS release, with its sides cropped and its colors faded, I was more than pleased to finally see Serpico as originally intended, in widescreen, and gorgeous Technicolor.
279;release, and it's worth every cent.
280;sidney Lumet is often thought of as an actors' director, more so than a cinematic genius, but Serpico more than delivers in both arenas.
281;Al Pacino's portrayal of the eccentric Frank Serpico .
282;a NYPD cop of unyielding integrity .
283;is one of his best roles ever.
284;He's animated, tough and very human in his role, and one can sense that a lot of the real Serpico rubbed off on him.
285;Serpico also boasts an excellent supporting cast.
286;known from his roles in Woody Allen movies, take a look at these then.
287;handedly, took a stand against the enormous corruption within the NYPD, and paid for it dearly, is still fascinating and still relevant
288;the classic Dog Day Afternoon (also based on a true story, but with a bit more liberties taken) .
289;but it rises entirely thanks to Pacino, who turned Serpico into a universal icon of integrity and idealism, with his beard, long hair and penetrating stare, as a hero who fights within the establishment and against it.
290;along with The Godfather saga and Dog Day Afternoon this is one of Pacino's greatest performances, and one that earned him an Oscar nomination, and helped make him one of the prominent American actors of the 70's, alongside the likes of Robert De Niro, Jack Nicholson and Dustin Hoffman.
291;time essential classics
292;This is a good movie, but not Pacino's best.
293;This is based on a true story, and you really get an idea of how corrupted the police force once was.
294;I am a big Pacino fan and he plays the straight cop who will not be a cop on the take and he plays the part very well!
295;One of the best dirty cop movies ever made.
296;Being based on a true story makes it even better.
297;Enjoyed it as much today as when it first came out.
298;This great little low budget gem from 1973 is one of Sidney Lumet's best films,and one of Pacino's best performances!!!
299;The other great character actors(Jack Kehoe,M. emmett Walsh,Alan Rich and so on) also are in great form!!!
300;One of the best films of the 70's!!!
301;And if you love cop movies,than this one is a must see!!!
302;Pacino did a fantastic job portraying Serpico, who selflessly struggled to reform and clean.
303;A terrific expose of a dark, dark period in NYPD's history, and even more incredible given that the movie was made on a year or so after the events took place, when the force wasn't yet purged of the corruption.
304;It turned a good movie into a great one.
305;The movie is a bit dated, but it is still a classic.
306;You can see that a young Pacino was going to have great career.
307;It's fun to watch actors performing in their young, beautiful years who've since achieved the pinnacle.
308;from the first frame of the film one can see what is coming.
309;Naturally he believes that taking it to an authority figure in the department will start some kind of investigation.
310;in the tradition of the saints, he remains joyful and full of life despite his untenable situation.
311;Girlfriend after girlfriend come and go, at first enjoying his joie de la vivre and then being overwhelmed by his moods of agitation and fury at the corruption surrounding him.
312;Pacino does all this with his trademark intensity: perhaps the best scene in the film, also taken from the book, is when he humiliates a mobster who he arrests on the street for running numbers and who is a good buddy of all the men he works with.
313;His best friend, a more formal but equally just cop (Bob Blair played by Tony Roberts in an understated, realistic performance) uses all the connections he has to get Serpico a hearing on police corruption.
314;The might of one strong, good man truly cannot be nailed down by a thousand weak corrupt ones.
315;Great true life story about an Honest Cop who had to take on the whole NYPD police department and their corrupt Supervisors.
316;Definitely worth seeing and a great read in book form too.
317;Nothing is so potent as the truth.
318;One of Pacino's best early roles.
319;true life event that inspired a nation to crack down on poice corruption.
320;What Al Pacino does in this movie as in any other is great, Serpico while looking like some smelly hippie is one cool cat minus the ballet,he's a good cop in a force full of dirty ones.
321;I love this movie,time to bust criminals!
322;Love Pacino, one of the greatest actors of the 20th century.
323;This film is a drama, character study, thriller, among other things.
324;It is a tour de force, near magna cumme laude.
325;I enjoyed the brilliant acting of the sometimes, slightly, overrated Al Pacino.
326;He is in top form here, rarely ever overacting, or letting down the character.
327;He really does a superb job
328;because life itself is a very complex thing, it is all the more astonishing that they managed to pull this off so well.
329;Typically, film makers/Hollywood have a tough time with recreating true.
330;That is why this film is so impressive.
331;another reason why this film is so successful is, simply, the courageous story.
332;written movie that takes great pains to study character.
333;it is pretty simple, really.
334;A great story that pays homage to its own material
335;Serpico is a pure classic Al Pacino at his best the setting N.Y early 70's plus a young Al Pacino can't ever be remake love this movie again pure classic!!!!!
336;In my top 50 of the best movies made!
337;This movie is still interesting even after all these years.
338;Movie was a little slow but Pacino is amazing in this role.
339;The technicolor process really gave this movie a realistic mood.
340;Loved this movie years ago and decided to see it again.
341;Al Pacino is the best and deserves accolades for being the most talented actor around then and now.
342;Based on the biography SERPICO by Peter Maas, Producer Martin Stegman and Director Sidney Lumet capture perfectly the gritty realities of Frank Serpico's tenure with New York's Finest, when for a time it seemed that Serpico was alone in his refusal to take graft and his resistance to the system that allowed it to flourish.
343;in party scene beautifully foreshadows Pacino's performance as SCARFACE Tony Montana in the Club Babylon ten years later, and Pacino's depiction of Serpico's assumption of disguises (as a junkie, a deliveryman, and a Hasidic rabbi) are moments of humor in what is overall a rather grim biopic.
344;Serpico is one of the best movies Al Pacino made!
345;He is so real and you feel his frustration.
346;The movie was great also a classic, Al Pacino is one of my favorites is a great actor Amazon yah did it again thank you
347;This is one of the finest movies from the 70's He played a important role at that time, ny finest.
348;great on location scenes of 1970s NYC.
349;top Pacino is very good in the crooked cops story.
350;His performance is in sharp contrast to his later style which often mistakes shouting for drama.
351;Ok, so I'm not the brightest of people but I am good with my films.
352;Francisco Serpico was an honest Italian cop .
353;Because of his dedication to honest police work and a burning desire to do the right thing Serpico goes from a non.
354;participant in the graft to actively fighting it.
355;The right time never arrives and Serpico, prodded by his friend Bob Blair (played by Tony Roberts), brings his complaints outside of the department .
356;Certainly the extra money that they received was tempting .
357;serpico is one of the most visible examples of someone doing the right thing against incredible odds, even as his life was threatened.
358;This is a good story that needs to be told and Sidney Lumet and Al Pacino tell it well.
359;I watched this movie years ago, now our grandson is going to be a police officer, so this was a good movie and they said they liked it also when they watched it.
360;pacino is fantastic as serpico.
361;Very good depiction of crime.
362;I enjoyed being able to watch this at home and share this with others.
363;i was fooled by the posiitve reviews in here, and i thought a movie with Pacino must be as good as these reviews, well, its not.
364;i can understand that people who saw it back then (70s) must've found it a great movie, and im sure it was.
365;Awesome movie Al pacino at his best movie blew me away really enjoyed it hope this helps you on deciding to watch
366;The movie Serpico was one of the finest roles Al Pacino hasever done.
367;the acting by Pacino rivals the roles that he played on the Godfather.
368;This is a must see film.
369;Al Pacino in one of his many Oscar nominated performances, inhabits the role of Serpico with vibrant purpose and brings home the desperate plight of an honest cop amid such corruption.
370;making schemes of the dishonest cops and has the courage to stand for true justice, even risking his relationships and life.
371;Many such crime stories that surfaced later all felt the impact of this dynamic movie and it still stands today as an important piece of cinematic excellence.
372;My wife and I enjoyed the movie.
373;It was nice to see how Internal Investigations got it's start, although from what I understand by way of a cop friend of mine, it is still necessary.
374;I must admit the dancing at the party was a real treat!
375;good plot and based on a true story, however it was slow moving and not written well.
376;Serpico is a movie that is worth seeing for Al Pacino fans.
377;He puts on a great performance.
378;This movie strives to stay true to its biographical source, which means there are dozens of characters and events that unfold that don't seem to flow together.
379;I'm glad I saw it and I would recommend it to Pacino fans.
380;the acting and movie pace are perfect,,,this could be Al Pucino's best film, even better than Godfather III.
381;the sound score by Mikis Theodorakis was absolutely the best and well suited to this film.
382;I had to hit pause a couple of times during the movie to truly appreciate the goodness.
383;The two go hand in hand to produce a classic that I should have seen a while ago.
384;The story is in the grand tradition of French Connection but much better (at least I think so).
385;The performance delivered by Al Pacino is, of course, superb.
386;Al Pacino's performance as idealistic New York cop Frank Serpico not only ranks as one of the great actor's definitive performances, but the film itself is one of the defining films of the 70's.
387;Though he was robbed of an Oscar for Best Actor, Pacino is unbelievably brilliant as he displays all the strengths and vulnerabilities of the title character.
388;His performance alone makes Serpico one of the finest crime/cop films of the 20th century, and is worth the price of admission alone.
389;Honesty in that profession is refreshing, but you also pay a very high price for your honesty.
390;this movie is really entertaining because of how real it feels.
391;names and the scenary is very raw and all shot on location.
392;outs or truly heroic moments that so many other cop films depict.
393;al Pacino's performance in this film is fabulous and is very convincing.
394;this is a really entertaining movie about a man who believed in his ideals of honesty, dignity and trust and is inspirational in the sense that it makes the viewer want to act on their ideals in the same way.
395;An interesting look at corruption in the NYC police department.
396;This movie is based on a real life hero who still resides in upstate New York and lectures about his life experiences.
397;this is one of the best ones!
398;The Godfather may have alerted us to the great actor Al Pacino but that classic first instalment of the trilogy was really Marlon Brando's movie.
399;This true story of an NYPD cop standing alone in the midst of corruption on a staggering scale, is both compelling and engaging.
400;school New York movies anyway (made back when cars still had yellow licence plates) and even the music, by Mikis Theodorakis and arranged and conducted by jazz legend Bob James, was brilliant.
401;Supporting cast give great performances, especially Barbara Edna.Young as Serpico's long.
402;this is a must for any Pacino fan or any lover of classic movies.
403;Fantastic film with Al Pacino in the title role playing Frank Serpico, a real.
404;life NYPD detective whose integrity nearly cost him his life (by disgruntled co. workers) and definitely cost him his career.
405;Pacino is amazing in this.
406;Serpico is such a movie.
407;I've always enjoyed Al Pacino's acting abilities in whaever movie he's been in that I've seen.
408;It takes a man of incredible courage to determine to remain honest in the face of the terrible temptations to do otherwise.
409;Great acting by Al Pacino, and an inspiring, if somewhat depressing story.
410;Al Pacino became a star thanks to his role as Michael Corleone in The Godfather.
411;The film that cemented Mr. Pacino as one of the best actors of his generation was Serpico.
412;Mr. Pacino brings a realistic approach to the role and you feel sympathy for Serpico.
413;The movies were replete with new themes, reflective of the times, (the end of the 1960's) and it was interesting to see the images from 40 years ago.
414;Serpico is a perfect blend of fine acting, great story, and thoughtful direction.
415;One of the best movies from the 1970s, it shows you don't need car chases and special effects to make an exciting film.
416;al Pacino does a terrific job of bringing the character of Serpico to the screen.
417;The way the whole story is woven makes for an interesting movie but it is the acting that raises the level even higher.
418;There is a romantic and social side of Serpico.
419;I hope so because it is an excellent movie.
420;Just when I thought The Godfather was Pacinos best performance.
421;Better than almost every movie that comes out these days but beat the heroes integrity and the corruption of the police force over the viewers head.
422;I really appreciated the excellent directing and the excellent performance by Al Pacino.
423;The pressure he was under was tremendous.
424;As some others have said, it WAS a real.
425;I liked the part when he first met the bag.
426;But I still loved the time capsule effect of seeing NYC back then, and also the close.
427;spirit girlfriend ended up being traditional after all.
428;Fantastic drama, superb acting, great rhythm.
429;be it as it is, enjoy the movie, guys!
430;Great storyline coupled with the usual terrific acting.
431;The great part of this storyline is the majority was based on true happenings throughout the municipal police department of New York City.
432;In my opinion this is one of the best films ever, and Al Pacino gives as masterful a performance as any he has ever done.
433;The fact this is based on a true story makes it that much more memorable.
434;We also see a scary lesson of what happens when one honest man takes on an entire bureaucracy that does not welcome him and what can ultimately happen to him.
435;A powerful film that is just as relevant today as when it was made.
436;the supporting cast is excellent as well, with so many guys playing tough ,jaded NYC cops from the era.
437;i guess the definition of a classic is a movie that represents it's era and yet can be viewed and enjoyed years later.
438;Serpico certainly meets that criteria.
439;There are some movies that everyone should see in their lifetime, and this movie is one of them.
440;It got great acting throughout with lots of excitement, and it's based on a true story.
441;I loved his idealistic idea of how the police should be.
442;Serpico is an indispensable product of that period, and if you haven't seen this yet, you won't get a chance to find out why Al Pacino is one of our most interesting actors.
443;When the movie makes you want to read the book immediately after viewing, you know you've come across something special.
444;Al Pacino is great in this movie.
445;This should be required viewing for high school students.
446;Based on a true story, Frank Serpico, beautifully portrayed by Al Pacino (better than he was in his Academy Award winning performance in Scent of a Woman), is an honest, ethical police officer.
447;But, Serpico keeps saying No to them, which is a wise thing to do.
448;As a criminal justice and law student with many friends in law enforcement, and some of them with the NYPD, I found this movie amazing.
449;It was pretty realistic, and kept with what really happened in real life pretty well.
450;Besides that, it was a great movie, and it's one of the movies I own that I'll definitely be watching more than once.
451;Well told story and well acted too.
452;Really gives you a feel of what late 60's early 70's NYC police life was like.
453;Really have always loved your work and this is one of the best.
454;Very interesting story and wonderful cast, enjoy it everytime i watch it!
455;great actor in a great movie.
456;Movies intense and balanced, where an honest person, unfortunately, turns into a martyr embittered by events.
457;Al Pacino's first real stand alone work away fromThe Godfather Saga is an excellent piece of work about a real life cop who just wanted to be an honest cop.
458;Great movie to watch when you are bored, trying to kill time, and have popcorn!
459;Coming out right after the Godfather, this is the film that was all about Al, though the Godfather is a timeless classic it is often looked at as Brando's movie, while Serpico gave Al the chance to shine and demonstrate just how talented he was as a lead actor.
460;The script is a fantastic adaptation of the book of the same name and Sidney Lumet does an incredible job, proving himself as one of those great directors that continues to do brilliant work throughout multiple decades.
461;It is a moving character study that can only be accomplished this well by an actor with incredible talent.
462;Classic 70's cinema from a legendary actor and director.
463;Pacino does a great job portraying this true story character.
464;I'm sure there were creative liberties taken during the production, but its a great glimpse into the past, and a corrupted police force in NYC.
465;Sidney Lumet, whose other big hit with Pacino was Dog Day AfternoonDog Day Afternoon (Two.
466;disc Special Edition), had a good eye for keeping it real in a time when most movies were usually overly melodramatic.
467;serpico still had its 70s era movie making quirks, but overall it was ahead of its time for making you feel truly involved with its characters.
468;And having a young, talented Al Pacino in the cast (as the lead) certainly helped make an award.
469;Serpico is based on the real.
470;the movie gets a bit long in the badge by the final 30 minutes, but the suspense of seeing if/how Frank Serpico collars his peers keeps you interested.
471;Interesting piece of history for one of those evenings that your queue is light on the new.
472;Pacino is at the top of his game in Serpico.
473;He brings a level of passion to this role that you can feel through the screen.
474;This is the Pacino that created the legend.
475;Here it's the New York City police, and you can see how Peter Maas's book on the real Serpico must have appealed to him.
476;But his way into such stories is through character, and Al Pacino gives us a here a stubborn, honest, not.
477;likable man who simply can't stand it that so many police are on the take .
478;Lumet also knows that you can't treat serious, systemic corruption .
479;corruption that goes right to the top of an organization .
480;and end a narrative with a sentimental kiss.
481;the supporting cast of largely unheralded actors is excellent, and Pacino (in 1973 just a year out from Godfather Part 1) gives a performance of great intensity that nevertheless is not all about chewing the scenery .
482;Given that Serpico, as an undercover cop, is often himself acting, the focus and discipline of Pacino's attention to the character is impressive.
483;For me it's a great American movie.
484;Anything Pacino does is going to be outstanding!
485;He's one of the best actors and one of my favorites certainly.
486;I enjoyed it, perhaps just as much as Prince of the City.
487;thanks for the quick delivery service.
488;A good flick based on a real cop.
489;Al Pacino does a great job, but when doesn't he?
490;He is one of my all time great actors and he really reached the top of his pinnacle as the gruby (honest)cop in NY.
491;This is a must for all Pacino fans this is one of his earlier films and it is a true story about kind of a hippy under cover cop and all the situations that he goes through being undercover and how he might possibly be the one good cop that doesnt take bribes and trying to avoid becoming a crooked copHighly Recomended
492;But for me, the cream of Pacino's crop was in the 1970s, and among his great performances in that decade was in the 1973 movie Serpico.
493;In this feature directed by Sidney Lumet (who also directed another Pacino film, 1975's Dog Day Afternoon), Al plays a cop who joins the force with the best of intentions.
494;He's honest, sincere, and treats criminal suspects impartially.
495;qualities that should enable an officer to advance in his field.
496;Frank's job ultimately takes a toll on his life, both professionally and romantically, and by the end of the movie, he's transformed from an eager.
497;please cop to a jaded officer.
498;I'd hesitate to call Serpico a classic, but it's a fine and gritty drama that has an award.
499;Started to collect Al Pacino movies.
500;Al Pacino shows why he is one of the greatest of all time!
501;A good film, with the great story outshining the movie's good production.
502;A great reminder of the benefits of transparency in public systems.
503;Great cinema in more subtle times, less cgi and more story
504;Even it's an older movie , it's still a good movie to watch
505;The lone good cop in a sea of corruption.
506;The best part is that this is a true story.
507;I had a lone good cop in my life once, so it's a role that I sympathize with.
508;watching the cops dial on rotary phones was great!
509;Al Pacino is at his best, protraying Frank Serpico and brings him to life on the screen.
510;A must watch if you are a Pacino fan or are interested in learning a bit about Frank Serpico.
511;prompt and courteous service, product arrived on time and in good condition as promised.
512;the cosmos galaxies and the universe will be open to valuable people to exploit and use the substance matter universe to create the happiness the only real emotion that can be obtained by value producers.
513;Without those brave and courages creator.
514;This is a great movie with some great acting.
515;really takes you back into life in New York in the 70's.
516;pacino was fantastic and you knew he was on his way to becoming a star.
517;Good crime drama
518;The one outstanding experience I had whilst watching was the perfectly formed sense of time and place.
519;The pealing paint on office walls, the colour in the clothes but most of all those wonderful old, old cars.
520;I really enjoyed reading about what it takes to win an Oscar.
521;So take a trip back to the early seventies.
522;Al Pacino is amazing in this classic movie.
523;Highly recommend seeing it if you haven't already.
524;And if you have, see it again!
525;Great story, amazing cast and it was all filmed in NYC.
526;If you ever need ideas for costumes on holloween then this movie will give you plenty of inspiration.
527;Sidney Lument made a brilliant move choosing to direct Serpico.
528;This is the film that put Al Pacino on the map.
529;with realistic acting and realistic actors .
530;Serpico has a gritty realistic feel that makes the story stand out even more than it would have otherwise.
531;Al Pacino showcases his acting technique in the portrayal of a beleaguered New York cop who just wants to do his job.
532;When he finds himself amidst high levels of corruption and money payoffs, he sets out to make it right.
533;time has been good to this film and it still shines over 30 years later as a superb police film and real.
534;This is an excellent movie with Al Pacino at his best.