id;spiegazione
1293;Ledger's performance as Ennis, a quiet and lonely man, showcases his talents further than in the past.
1294;Gyllenhaal's performance as Jack, an eccentric and and outgoing man, fits well with Ennis and the overall film.
1295;Williams and Anne Hathaway successfully placed their teenage image aside for the film.
1296;Williams proves that she is much more than just Dawson's Creek as the lonely and gentle Alma.
1297;Hathaway proves that she is much more than just The Princess Diaries as the sassy and feisty Lureen.
1298;Therefore, this is destined to become a classic.
1299;I waited to see this film divorced from the hype on it's initial release.
1300;Is this a great film?
1301;That's debatable but it is a very good one.
1302;I was impressed with a few things about this film primarily the direction by Ang Lee.
1303;He allows the story to develope deliberately.
1304;Great supporting work is offered here by Michelle Williams, Anne Hathaway, Linda Cardellini and Randy Quaid.
1305;Another bonus is the splendid cinematography and the touching score.
1306;The cinematography is breathtaking, and the acting couldn't have been better if it were a documentary.
1307;This film just moved me to tears, every actor gave heart and soul to their performances.
1308;A wonderful testament to the human race.
1309;The audience is totally immersed in the film from beginning to end.
1310;The story is very touching and will probably make many men look at thier passing thoughts of other men more closely than before and make them understand the stigma of homosexuality is not what they had believed.
1311;You will totaly enjoy it coming out with a new view of the world.
1312;Who can approve two human beings can love or not love each other.
1313;wonderfully filmed, as Ang Lee's movies usually are, and well acted, but deeply depressing.
1314;motion train wreck on an ironically beautiful, bright sunny day.
1315;as far as courage and integrity are concerned, the one bright spot in the picture was when Jack Twist stood up to his domineering father.
1316;the murder of Jack was skillfully foreshadowed and resonates, of course, with events that occur in many U. s. communities today.
1317;At the end of the film, we can feel certain that he will never find happiness of any sort in the remainder of his own life.
1318;The movie has a lot going for it, as has been said , and said well, here and elsewhere.
1319;For myself, the movie was visually pleasing and refreshing in some ways, too, but I had some problems with what is by now esteemed a virtual classic.
1320;In this movie the guys are always crying.
1321;Thanks to all that made BM possible.
1322;out crowd in the theatre's largest auditorium, one of three screens that showed that film.
1323;Their friendship leads to a cold night in a pup tent, which sparks a passionate romp during which the two men have sex.
1324;The rest of the summer brought them closer and closer together.
1325;Of the two actors, Ledger rises far above the brilliant Gyllenhal, especially during a scene immediately after their scuffle in which Ennis must cope with the fact that he's truly in love, even if it's a forbidden love.
1326;the rest of the film is a montage of the lives of the two men over the next twenty years, and we're introduced to both of the characters' wives.
1327;Brokeback is clearly Ledger's shining moment, and Gyllenal's performance has its own passion.
1328;The chemistry between the two men is real, and the beauty of the cinematography is stunning.
1329;The power of love that's displayed in Brokeback is beyond borders, greater than fear, and brilliant even until that final frame.
1330;But it is a powerful love story as only Ang Lee could tell.
1331;In the end, Brokeback Mountain will bury itself into your heart as the force of nature it is.
1332;in the end, it's worth the time, the drive, and your ten bucks.
1333;This is the best movie ever made, and this collector's edition is wonderful.
1334;a simple story delivered with incredible emotion and conviction.
1335;stunning cinematography and remarkable performances.
1336;This is the best (film) love story since Out of Africa.
1337;the real life of this sweet, decent, unfulfilled man.
1338;(One particular moment of astonishingly good acting is when .
1339;without ever letting Ennis' shoulders come down, or his body to let free, Mr. Ledger laughs so sweetly
1340;It is some of the best acting you will ever see).
1341;Jake Gillenhaal is the perfect gem of a character that, in other circumstances, would have made the perfect love partner for Ledger's Ennis.
1342;All heart and love just emminates from him when .
1343;gives a deeply felt truth to the events she witnesses that must have torn her inner self assunder.
1344;From her first discovery of their shared passion to her final disclosure to her husband, she makes real the genuine loss that she has lived with.
1345;(I was completely flumoxed as to why Crash won best picture
1346;This is a must for all who believe that art is a reflection of life
1347;This film beautifully, sweetly, and emotionally holds the mirror right up to nature (as it were).
1348;This is a movie for all people to see and feel.
1349;It is a genuine .
1350;heart on it's sleeve .
1351;romance
1352;terrestrial or The Sixth Sense, in that it casts its spell so deliberately and carefully, you have to pay extra.
1353;special attention to it during the set.
1354;But when the dramatic moments come, they come like a prairie thunderbolt, and you realize with a shock how carefully Ang Lee and his brilliant cast (all sensational, but Ledger and Gyllenhall are iconic) have set up your expectations, have hooked you so throughly that you are hit as if it were a sucker punch.
1355;Again, this is a movie that fits Ang Lee's oeuvre of charcters at war between their inner passions and desires and a community that encourages conformity and self.
1356;denial
1357;But after a cautiously positive reaction seeing it the first time, I found myself seeing it again and being overwhelmed by its emotional impact, to the point where I actually think/thought about the characters as real people.
1358;This is a love story for the ages.
1359;It is with great reluctance that I write this review.
1360;I anticipated this movie with great enthusiasm as it was heralded as the next best thing since the wheel all over hollywood.
1361;Then came the nominations, and I was certain this was 'the one.'
1362;This picture is well acted and the cinematography is breath taking.
1363;Ang Lee is a very creative director and Heath Ledger and Jake Gyllenhaal are both extremely good actors.
1364;I lived through the violent years of being gay myself, and am very proud of the struggles and progress we have made.
1365;It is with my sincerest hope that this may help someone realize.
1366;There is more to life.
1367;Perhaps someday Hollywood will get this right.
1368;I was seriously impressed with both these actors
1369;I hope that they will choose well in the future because these are talented actors who deserve good roles in good movies.
1370;That being said, what this is is an extraordinarily GOOD movie.
1371;This is simply an extremely well written, photographed and acted love story were the two lovers happen to be men.
1372;i'll skip over the story, which I'm sure everyone should know by now, and explain why, in my opinion
1373;The dialog is extremely well written, and again, you have to pay close attention because you WILL miss things that will become important later in the movie.
1374;I found it fascinating how the character of Enis is not particularly likeable, but is far and away the most sympathetic character.
1375;Much has been made of the two female supporting actresses.
1376;And if you've never done that, bud you have issues and should NOT watch this movie!To sum up, this is a movie you have to make up your own mind about, but you really should watch.
1377;I found it a truly moving movie, beautifully photographed, extremely well written and with truly outstanding performances by Heath Ledger and Jake Gyllenhaal.
1378;Never has such a movie touched so many.
1379;Heath Ledger and Jake Gyllenhall embodied the souls of every person denied the freedom to love.
1380;My husband and I are both straight yet were profoundly effected by its message of the power of love.
1381;It haunts my every dream.
1382;He absorbs the love of others like an emotional vampire and then wrings the people who love him dry.
1383;It is an amazingly artful depiction of a man completely divorced from.
1384;It explodes the myth that the strong silent type is a desirable life partner.
1385;the film is a chronicle of the fallout from loving the emotional recluse that is Ennis Delmar.
1386;well, to do something, I guess.
1387;For the rest of us who have been (im)patiently waiting to see an honest, adult depiction of a gay love story, this film is an overdue triumph.
1388;What Ennis chooses by allowing his life to go on, year after year, without making a choice to risk everything for love.
1389;heath Ledger as Ennis DelMar is obviously brilliant, as has been pointed out many times over.
1390;It's the yin and yang of the actor's portrayals that makes vivid the yin and yang of the men's love for each other.
1391;a perfect, beautiful movie in every possible way.
1392;An all time favorite for me.
1393;Silence speaks louder than words.
1394;brokeback Mountain is at once the most lyrical, powerful, inspirational, yet heart.
1395;wrenching film in a long time, without doubt one of the most important and greatest films of the last few decades.
1396;This is truly an exceptional achievement, a landmark film with an amazing story/script, outstanding and exceptional acting, masterful direction, unhurried and controlled pace, breathtaking cinematography, simple yet excellent and beautiful music, and most importantly, unprecedented emotional impact.
1397;Its treatment of human nature, loneliness, longing for love, self.
1398;repression, intolerance, is done with admirable subtlety and sensitivity.
1399;This story is simply universal.
1400;Images of this film and stirring emotions will haunt you for days and weeks.
1401;This is an extraordinary deeply moving film.
1402;simply unforgettable!Brokeback Mountain is a rare work of art in which silence speaks louder than words.
1403;Eyes and smiles can be very eloquent.
1404;Yet, this is surely one the most powerful and probably one of the most unforgettable scenes in recent cinematic history for its meaning and emotional impact.
1405;love speaks louder than words.
1406;Ang Lee realizes the full power of image in his exploration of the most intimate human emotions.
1407;life characters and, thanks of course to the unforgettable and heartbreaking performances of Heath Ledger and Jake Gyllenhaal, Ennis and Jack now live forever, they are now undeniably part of the American literary and cinematic culture.
1408;Rarely did a film have such a strong impact on society, in the media, and with the general public.
1409;event and most important film of 2005 despite the inexplicable absence of an Oscar for Best Picture to its already impressive crown.
1410;it's sad to say, but the recent disgraceful Oscar scandal proved how important and necessary this film is, and how many boundaries there are still to be conquered.
1411;This film is not pushing a specific moral, instead, it makes us think, it makes us feel, it makes us reflect on the true meaning and value of our lives.
1412;i think I'm use to seeing more affection between two people in love as well.
1413;Since I would like to enjoy and appreciate every movie and feel privileged to read the heart felt comments I received from many individuals, I have gladly viewed the film again.
1414;There is definitely something for everyone in BBM.
1415;Heath Ledger (as Ennis) and Jake Gyllenhaal (as Jack) are at the very least attractive and vulnerable, two of many elements common with falling in love.
1416;The men work together and a close friendship is formed.
1417;They simply want to live and have some kind of life in this world.
1418;The way anyone can feel they are a part of or the soul mate to another.
1419;the complexity and intricacy of each character, the acting of everyone in the film including the depicted societal constrains during that era is outstanding.
1420;The cinematography throughout the film is commendable as well.
1421;i thank those that patiently wanted to understand my point of view in initially not liking the film and feverishly documenting there own views.
1422;Any director deserves the Oscar when able to depict an otherwise very common story, in an outstanding way, full of symbols that haunt with melancholy.
1423;Anyone who has heard this tale, goes knowing the twists and turns.
1424;make the men cowboys for cultural iconic shock effect, a tool for marketing writers.
1425;put them in a paradise, to help create a romantic mood.
1426;Again, the story is told well, but if on top of that you use a paradise as the background, people are goingto root for Oscar.
1427;A beautiful and powerful movie.
1428;Heath and Jake and Michelle and Anne do a beautiful job.
1429;Love it and loved the ground it broke, love is love no matter what.
1430;Thought the subject matter was dealt with in deep respect.
1431;Maybe director Ang Lee's approach is a little too detached for this material and also the writing had too many questions unanswered for me to fully enjoy this film.
1432;Sorry but Crash though not a perfect film really deserved the Best Picture Oscar.
1433;The love sence is tasteful and respectful.
1434;This movie is truly a tear jerker
1435;average movie but not worthy of best picture.
1436;A second rate love story that has gained notroiety by being about gay love.
1437;So many people that I know have stopped themselves from seeing this movie because of the hot.
1438;button issue it presents to its viewers.
1439;This is such a beautifully done movie, from the transcription of the short story to the silver screen to the expansive shots.
1440;Their acting is absolutely superb, and came completely from the heart.
1441;i felt like I was right there with them, experiencing what they felt.
1442;It's heartbreaking, it's wonderful, and it's impossible to live without, and this movie shows that rollercoaster ride perfectly.
1443;i enjoy watching westerns too, and I don't think that this destroyed any of the wonderful history that westerns have.
1444;i have a new respect for how tough real cowboys are, after seeing the work these two ranch hands had to accomplish for practically no pay!
1445;all in all, this is a heart warming story that's wonderfully told and done.
1446;while I thought the story was good, I never thought it could be retold this well on the silver screen.
1447;Honestly one of the best book.
1448;Great casting, believable acting and breathtaking shots.
1449;This obviously came from a simple minded man who believe that men are superior than women, and that men should become those alien creatures with no emotions we see everyday!
1450;Just because this film shows spirituality does not mean that these people are mommie's boys, and if they are, I think a world full of these people will be better than a world full of you!
1451;What I like best about this movie is that I can see the story played out thousands of times in real life.
1452;Because the story is excellent.
1453;Because it shows the debth of what love can be.
1454;Because this is real life.
1455;From an artistic standpoint, it really delivers.
1456;But you're in for a real treat.
1457;Everything about this movie is perfect.
1458;the breathtaking cinematography, the touching,simple score that contrasts with the complex feelings of the characters, the brilliant acting, and the flawless script.
1459;What I love about this movie is that it is so so complex, the characters, including the wives, are so incredibly rich.
1460;Lee has truly created a GEM of a movie.
1461;I will say this however, I loved the movie even more the second time, I just noticed so many more things.
1462;the two men in this movie fall in love with each other in the purest form that the word can ever mean.
1463;we all wish for a love so deep and meaningful and some of us are lucky enough to find it once or twice in our lives.
1464;if you take anything from this film it is a new definition of the meaning of love and life and how short our time on Earth is.
1465;nice to see that Heath did eventually win an Oscar posthumously.
1466;This is a beautifully told love story with complex characters in a complex situation.
1467;Heath Ledger and Jake Gyllenhaal are just brilliant as Ang Lee's telling of the story and David Campbell's haunting music.
1468;while the love story is the at the core, what I got from BBM was the lesson of dreams denied.
1469;This movie has caused me to delve deep within myself and rediscover my dreams, and it has set me on a path to pursue those dreams and to become true.
1470;For that, I thank all involved with this wonderful, deeply touching story.
1471;the acting in this movie was gobsmackingly fantastic.
1472;his performance was achingly wonderful.
1473;Jake Gyllenhaal was the perfect balance of exuberance and dreamer.
1474;his portrayal of Jack's firm belief of the ability of his and Ennis' love to triumph if just given the chance was heartbreaking.
1475;Anne Hathaway was the perfect Texas wife .
1476;i'm a Wyoming native, born and raised, and though just a bit younger than the characters of the movie, I did grow up in 1960's .
1477;1980's Wyoming (the era of the story) and I grew up with those types of people .
1478;the grand vistas of Wyoming (yeah, I know it was filmed in Alberta, Canada, but it was set in Wyoming), especially of Brokeback Mountain (which I interpret as being in the Big Horn Mountains), formed the perfect backdrop for the heart of the love story.
1479;it lives on its own in the majestic bosom of the mountains .
1480;the pull of those mountains is strong.
1481;it lasts a lifetime .
1482;but into the mountains, where the beauty of that world shone a soft, safe light on their relationship.
1483;but in the mountains, they could hold it close and keep it safe.
1484;Moral of the story: ~Be true to yourself.
1485;be true to your dreams.
1486;The real power of the story is that this love came from the unlikeliest source
1487;I have never been so moved by anything, either on film or in the written word as I was by this story.
1488;It would seem the best talent in the industry went into its making.
1489;, Jake Gyllenhaal (also astounding), Michelle Williams and the haunting score to name a few.
1490;Probably the most poignant scene I have ever seen in a movie is the scene where Jack (Jake) is standing at a campfire, hands in his pockets, Ennis (Heath) walks up and wraps his arms around him from behind, just holding him and gently rocking, their eyes closed.
1491;Brokeback Mountain is a masterpiece.
1492;In a beautifully crafted run.
1493;In the film it's easy to see how everyone thought they were returning every year when Jack, in an argument with Ennis at their last meeting, gestured behind him and said 'all we have is Brokeback Mountain'.
1494;After that summer they both moved on to marriages, children and in Jack's case, other men (which was probably the start of his downfall in Texas, word getting out in the rodeo circuit).
1495;There was a light that shone from Jack that's heartbreaking to watch each time his hopes were dashed.
1496;Ennis always loved him deeply and didn't fully realize that depth until he found the 2 shirts from their Brokeback Mountain days carefully hidden by Jack years ago in his boyhood home.
1497;he now knew Jack was the love of his life.
1498;I really appreciated it as a work of art and social commentary.
1499;It tells a great story without having to say a whole lot.
1500;In my opinion, this is where the movie shines most.
1501;The acting is very good.
1502;The love affair transcends decades despite no communication between them except for a few words on a post card to setup a trip together.
1503;Unfortuenately this needless bickering overshadows the story of the film, which is a story of love, longing, and raw human passion.
1504;That one love that creeps into your life and blindsides you, completely unexpected.
1505;The whole scene is shot with such authenticity on the part of the actors that you feel like the characters do.
1506;She is more about what is true grit, hard life, pure human emotion rather it is wrong or right and often the wrong and right are very blurred in her stories.
1507;I feel that Ang Lee did great justice to the original story by being able to visually blur those same lines.
1508;the acting in the movie is superb.
1509;coated sense of just what love is.
1510;He's a man of few words, and even less emotion.
1511;Ledger's performance as Ennis is spot on.
1512;His quiet but rough nature is perfectly conveyed, especially in the reunion kiss scene between he and Gyllenhaal.
1513;You get a real sense of the character emotion that carries throughout the movie.
1514;I found myself empathizing with Ennis's you.
1515;That kind of audience empathy speaks volumes for Ledger's portrayal.
1516;jack Twist is a more emotionally charged character.
1517;He knows he loves Ennis, and is happy for it.
1518;Jake Gyllenhaal embodies the rugged showman that is Jack.
1519;Gyllenhaal puts the perfect spin on this character dynamic.
1520;He's funny, emotional, loving, yet rough and antagonistic.
1521;To genuinely portray such a multifaceted character is an attribute to Mr. Gyllenhaal's acting abilities.
1522;Jake and Heath reach that level with ease in this movie.
1523;i would recommend this movie to anyone, even my boss who swears that this movie has made John Wayne turn in his grave.
1524;I think as an actor and an artist, and most of all as a human being, even good ol' Mr. Wayne would know the brilliance of this movie.
1525;This movie awakened a part of my soul that had been sleeping for a while, and for that I am eternally grateful to Annie Prolux for putting it out there on paper, to Larry McMurtry and Diana Ossana for so genuinely rewriting it so it could hit the big screen, to Ang Lee for his brilliant vision and insight into human passion, and of course to the actors for bringing all of Prolux's rough.
1526;fantastic film with great acting by two guys I typically can't stand.
1527;besides, ALL cowboy movies are gay, this one is just honest about it.
1528;I felt this movie right to my core .
1529;Jake Gyllenhall was outstanding as Jack twist and brought his character to life with such emotion , those eyes of his really impacted the character, he has such soulful, loving eyes.
1530;The story itself is quite a journey, and if you can open your heart and empathize just a tiny bit you'll find it both devistating and captivating.
1531;but beyond the story itself, this movie has so many layers of meaning and subtlety that Ang Lee and the incredible cast have added to the amazing screenplay.
1532;For Ennis, love is a post traumatic stress disorder.
1533;freshly enough killed that Dad might have been a material witness, at least.
1534;Mom lets Ennis take the package, sending her son's loving soul home with Ennis.
1535;He has an address, so he must exist!
1536;Both of these reviewers know the two men in Brokeback Mountain are in love, and that it is an incredible love story.
1537;This is a incredible movie, and we all know it.
1538;Warm, touching and inspiring, Brokeback shares many similarities to last years masterpiece Million Dollar Baby.
1539;They just move you in a profound way while showing you two people are capable of changing each others lives.
1540;in Million dollar baby, Frankie and Maggie have nothing, no family, nothing, but together they form a wonderful father daughter relationship which changes each others lives.
1541;Frankie doesn't just turn Maggie into a great boxer, but Maggie revives Frankie's ability to connect with someone.
1542;they both help each other psychically and emotionally.
1543;Two people can make life worth living and both masterpieces have taught me that.
1544;I have now made a connection with a wonderful girl at my school thanks to these two masterpieces.
1545;I have seen the light of human connection.
1546;i'm glad my favorite movie of 05 has made it's mark on so many people.
1547;The best film of 05 and perhaps this century.
1548;No stars can justify my love for this film.
1549;Having read the original short story by Proulx a few years ago, I was surprised by how well a tale of love between two cowboys set against a panaromic Wyoming backdrop was told.
1550;The truth is, Brokeback Mountain is just a very simple tale of arduous love and anyone with an ounce of emotion should watch.
1551;the union of director Lee Ang, scriptwriters Larry McMurtry and Diana Ossana, and the cast results in one of the most exquisite and endearing films made in the last few years.
1552;He pays attention to almost every aspect from simple small gestures to complex emotional strifes set against the magnificent mountain view.
1553;the assembled cast is the third link which leads the film to flight.
1554;jake Gyllenhaal is the hopeful companion who prays for the day that the union could yield the type of permanence he so craved for instead of a couple of high.
1555;shattering and ultimately heartbreaking kiss shared between Ennis and Jack after 4 years of separation.
1556;Williams' acting powress is certainly validated by the expression she showed at the instance of that unexpected kiss and the heartwrenching exchange with Ledger.
1557;Given her short screentime, her change from a brash rich rodeo queen to a high.
1558;society career woman and finally a emotionless and grieving widow expands her acting abilities beyond her impish Princess Diary.
