id;spiegazione
2627;The message is that love comes in many forms and if you are ever lucky enough to find a love so deep and strong, you must hang onto it regardless of all other outside factors.
2628;It is an honest look at love and how two people who have the world against them try to follow their hearts but succumb to the pressures of a society that doesn't understand that love must transcend all.
2629;But this is how I see it: Yes, they were both gay and they were both in love, not in lust, with eachother.
2630;If you have love to give, give it freely and to whomever you wish.
2631;This is one of the most beautiful, emotionally honest, and heartbreaking films I've ever seen.
2632;That this film played in Peoria as well as to sold out crowds in San Francisco is a tribute to its artistry and powerfully universal message: that real love transcends emotional conflict, bigotry, and even death.
2633;the church, the Pilgrims, Columbus, George Washington, sports heroes, American business, the American military, the police, the President, Dead White Males, etc etc.
2634;The Cowboy, the strong, self.
2635;confident yet humble, physically and mentally tough Cowboy.
2636;He faced down the elements, wild animals, Indian attacks, and outlaws
2637;OK, let's see, let's make him gay!
2638;Now, make this into a seemingly intelligent, compelling and artful movie, so the critics have less reason to put it down, and there it is .
2639;SO that's what this movie is all about.
2640;Destroy America's cultural icons, and you can manipulate Americans.
2641;(See my review of American Beauty for another example.)
2642;But I give the movie 3 stars because much as you might HATE the agenda, the story is entertaining.
2643;Brokeback Mountain is that rarest of things.
2644;a quiet movie that seems very traditional that is actually quite revolutionary.
2645;It tells a simple story that is actaully very complicated.
2646;It looks like a simple movie yet is filled with subtle brilliance.
2647;Watch it for how a place can become a character.
2648;Watch for how many parallels exist between acts and situations throughout this wonderful film.
2649;It is a joy to have in the classics of cinema.
2650;Ang Lee beautifully captures the Wyoming countryside.
2651;When the action moves into town, the sight of man's raunchy trailers and houses set against the backdrop of the majestic mountains makes a convincing argument for nature over civilization.
2652;Ang Lee beautifully captures the Wyoming countryside.
2653;When the action moves into town, the sight of man's raunchy trailers and houses set against the backdrop of the majestic mountains makes a convincing argument for nature over civilization.
2654;A hundred years from now, when cinema is being discussed, Brokeback Mountain will be loved, degraded, re.
2655;And that is the mark of a truly great film.
2656;I am still befuddled that the Oscar voting swayed the best film award of 2005 to Crash, and even more perplexed by its backhanded honor to Jake Gyllenhaal with a best supporting actor nomination, when clearly, he not only gave an astonishing performance in a leading role, but was impetus behind the entire storyline.
2657;time Hollywood racial theme, Brokeback Mountain opened up a whole new can of beans.
2658;Seeing this movie is an emotional watershed, an epiphany.
2659;It confirms that art can be life.
2660;the most astonishing thing about Brokeback Mountain is the acting by Heath Ledger and Jake Gyllenhaal.
2661;Imagine: two men in a love story, giving performances that up to now had only come from the likes of Gable and Lombard, Tracy and Hepburn, Streisand and Redford.
2662;I love it that there are so many diverse thoughts and feelings about Brokeback.
2663;acting homosexuals they actually knew until they were reminded by Jack and Ennis.
2664;I myself find it interesting that while Jack initiates, Ennis then takes the reigns, and Jack willingly succumbs to him.
2665;Throughout the movie, Jack and Ennis trade roles, so to speak.
2666;It's also fascinating that despite Ennis supposed innocence and naivte, when push comes to shove, he instantly knows exactly how to respond to Jack's advances.
2667;Not having to deal with AIDS, crowded gay dance clubs, gyms, and high fashion, Brokeback is able to maintain a beautiful simplicity.
2668;one of the most touching realities presented in Brokeback Mountain is the importance of holding on to a loved one's possessions, in this case, Ennis' blood.
2669;So much emphasis is placed on the sexual aspects occurring between men, which is a actually a tiny percentage of what homosexuality is really all about.
2670;Like Jack and Ennis, anyone can determine to bed a woman, produce children, and successfully live a lie.
2671;there is another element in this film that is as universal as its love story, the element of choice, of being true to yourself.
2672;He makes an easy choice, and the result is tragic.
2673;up man
2674;brokeback Mountain a powerful, insightful look at the glory and tragedy of love.
2675;it is a movie that will stay with you for days, years, possibly a lifetime.
2676;i encourage any fan of the ART of film to see this masterpiece.
2677;I bought a new compaq 2630 for viewing movies.
2678;bM was perfect for this project.
2679;Wide screen worked very well.
2680;No drop outs, full sound and excellent color.
2681;Jake G. and Heath L. were amazing.
2682;It's a Lifetime movie at best.
2683;It seems to address forbiden, but factual issue of today, hopefully it will help some of those who are confussed.
2684;This is the best movie I have ever seen bar none.
2685;Any filmmaker who shows me the kind of joy that these two displayed when they were together will bring me to the box office over and over again.
2686;In fact, the more wonderful it is, the sooner and more painful the ending has to be.
2687;If this movie has a flaw it is the heart stopping abruptness of the post card with DECEASED stamped across it.
2688;To all the movie producers out there, show me the joy of loving another human being and I will make your movie a hit.
2689;The acting is excellent and the scenery is beautiful.
2690;I thought tonight I was going to see the best movie of the year.
2691;With a year with amazing films like walk the line, capote, syriana, and Good night, and good luck.
2692;brokeback mountain is simply just a decent movie, but not a good one.
2693;I was so overwhelmed by the beauty of this film.
2694;Ang Lee brought a simple story and made a romantic,sad,touching film.
2695;Heath and Jake were so convincing that you forget they are actors.
2696;Michelle Williams is an actress to watch in the future.
2697;She has found a place in film history.
2698;In my eyes, Brokeback has won Best Picture.
2699;There are so many levels of this brilliant movie.
2700;Jake Gyllenhaal is brilliant as man who is trapped in a love that is not enough and too weak to accept what there is.
2701;Michele Williams' innocence is so fragile.
2702;the conversion to Blu Ray is beautiful.
2703;The vistas of mountains are so beautiful.
2704;what the heck was I expecting!The opening scene is among the most humbly beautiful things I've seen in movies and really sets the scene for the time and place, which is Wyoming 1963.
2705;The tension and attraction between the characters Ennis Del Mar and Jack Twist is developed so realistically
2706;ennis Del Mar and Jack Twist take up a job together one summer herding sheep up on Brokeback Mountain.
2707;the story of Brokeback Mountain unfolds before you with great subtlety
2708;top, outrageous or try to push a view onto anyone, and for that, I admire.
2709;It is gentle and satisfying, yet deeply tragic.
2710;nothing prepares you for this achingly beautiful, honest and profound movie that surpasses being a movie, and to be frank, becomes a life force that will embed itself forever into your memory.
2711;Movies this good don't come along often.
2712;The movie is a cinematic masterpiece.
2713;Previous reviews will give you a rundown on the story line, and masterful direction of Ang Lee.
2714;On a rating of 1 to 5 I'd give it a 6.
2715;I will start by saying Ang Lee's directing is another subject, as it is one of the most stunningly filmed movies I have ever seen.
2716;I do believe, however, that one is brave in watching it.
2717;If you have ever loved someone in your life, or let a feeling pass by without its communication .
2718;By the end of this movie, every one of those moments will come heaping down upon you, and you will understand the magic of the story.
2719;Watch this movie, and you will find yourself in one of the characters.
2720;Watch it and it will tell you something about yourself.
2721;it is a love story, but this time it is not impossible.
2722;There is a lot of gushing by the 5.
2723;Rural guys in this area really do act like those in the movies.
2724;The initial sex scene was very believable.
2725;The pacing of the story fits the rural pace of life.
2726;But that often is how life is.
2727;Thank you to everyone involved.
2728;Thank you to everyone involved.
2729;What can I say?Ang Lee did a great job, portraying these two guys in love.
2730;He did it so masterfully that I totally forgot that the two leadings are men.
2731;Ang Lee is simply a genius.
2732;the acting is another strength of this movie.
2733;Roberta Maxwell as Jake's mother is perfect.
2734;You can see her pain, when Ennis leaves, because she knows that another part of her son is gone now forever.
2735;ledger did most challenging job and he was definitely the right one to do it.
2736;He played this Ennis del Mar so perfectly and nuanced that you actually think he IS Ennis del Mar!
2737;bokeback Mountain is one the saddest but at the same time one the most beautiful movies I have seen in my life.
2738;If you see it and like it, I encourage you to watch it twice.
2739;This movie has touched my heart in every way its a real epic and I think that heath ledger should've won that oscar cuz his acting was superb
2740;I wholeheartedly agree with the general consensus of the reviewers of this film.
2741;I saw this movie last night, and I still feel affected by it.
2742;The performances by the two male leads were so convincing and heartfelt, that when the ending came, I was actually unhappy about what had happened with these characters.
2743;All the reviews are sort of funny.
2744;I rate movies on their entertainment value.
2745;That fact that this film is met with as much fear and hatred as it is with love and acceptance is to me a testament to its impact.
2746;Perhaps this film is not for everyone, but I found it to be exquisitely articulated and by far one of the finest films I have ever seen.
2747;This film depicts true love.
2748;Heath Ledger and Jake Gyllenhaal were absolutely phenomenal!!!
2749;These two amazing gentlemen captured human emotions and feelings so fantastically I cannot explain.
2750;Heath was exceptional as Ennis!
2751;He just brought the character to life and made us understand where he was coming from and how difficult it was for him to accept what he was feeling, wanting, and going through.
2752;One of my favorite scenes is when he and Jake say goodbye and Jake's looking at him walk away through the car side mirror.
2753;The kissing scenes and the scenes of them lying down together were magnificent.
2754;Although the scenes had something to do with sexuality they also had to do with human release and being at peace and ease with another human soul.
2755;There was so much art and beauty shown in this film that you can't help but watch it again and again.
2756;The maturity and depth shown in this movie is outstanding.
2757;I give both Jake and Heath props for their incredible portrayal of two human souls in the most beautiful and realistic way.
2758;This film has made me an even bigger fan of both Heath and Jake.
2759;I respect them and their talent so much now.
2760;But also because they portrayed the male species in a more humanly beautiful way than I have ever seen on film.
2761;I really enjoyed this film because it was so mature and so real.
2762;I also loved Michelle Williams's portrayal of Ennis's devastated wife.
2763;She was right on the money in every scene.
2764;I also loved Anne Hathaway as Jack's wife.
2765;All and all the actors were great.
2766;The feel of the film was so real and intense.
2767;This will probably be one of my favorite films for a long time to come!
2768;If you are open minded, then I can tell you that you will love this movie.
2769;In fact, I loved it ever since the first time I seen it, and have recommended everyone I know to watch it ever since.
2770;BBM is a true masterpiece
2771;disc collector's edition is worth watching again and again.
2772;The bonus features are so good.
2773;I always cry each time I see it.
2774;The performances of Heath (sigh) as Ennis and Jake as Jack, along of course w/Ang Lee's masterful direction, are terrific.
2775;The screenplay by Mr. McMurtry and Ms. Ossana is perfect.
2776;All in all, what a great film!!
2777;Heath was definitely robbed of best actor, as Jake was of best supporting actor,.
2778;The beautiful cinematography was not rewarded also.
2779;This movie is amazing for a couple.
2780;Two, it is a good story, and makes you feel all emotions possible.
2781;I found this movie to be very much a love story.
2782;To span over two decades, they are simply two human beings in love.
2783;Very moving and the scenery was beautiful.
2784;I was overcome with emotion.
2785;But I was pleasantly surprise by the touching, tender portrayal of this movie.
2786;I must rate this as THE BEST LOVE STORY I have ever watched on a screen.
2787;Because they understood each other so completely.
2788;lonely, and also incredibly joyous that such a connection could be possible.
2789;Strong dramatic performances from all and a great tribute to Heath Ledger's work.
2790;Ang Lee tackles the subject of two gay men falling in love in the rural 60's and how things actually were back then with tenderness and brutal honesty.
2791;A great, and in my humble option, much needed, piece of work.
2792;written, beautifully acted, perfectly directed masterpiece.
2793;I have rarely been so moved by a movie and would recommend it to anyone who enjoys a film that completely absorbs you and makes your heart ache for the characters.
2794;This was the best movie i have ever seen.
2795;The story is amazing, the scenery is amazing, the acting is fantastic.
2796;Whether it is about a gay couple or not, it was an amazing love story.
2797;Some are (involuntarily) funny, some are spectacular, some scary.
2798;And interestingly, the ones that touch us the most, are the ones that don't happen.
2799;My list of all time favourite Hollywood couples: Rick and Ilsa, Karen von Blixen and Denys Finch Hatton and of course Rose and Jack .
2800;Brokeback Mountain, better known as the gay Western, is really a love story.
2801;The end of the summer also seems to be the end of their romance.
2802;Actually, the intense performance by Ledger and Gyllenhaal makes you forget that this is a same sex relationship.
2803;The longing and pain they show are so immediate, they become universal.
2804;But despite all obstacles, the two cowboys share a few moments of happiness and thanks to Ang Lee's divine direction, we get to share them, too.
2805;I just saw this movie today with my sister and I can't believe I waited so long to see it.
2806;Thank you very much to everyone who opened themselves up to a firestorm in order to do a wonderful, heart.
2807;opening personal experience
2808;rare especially in broader 'market cinema'.
2809;Many condemn these movies as a knee.
2810;This has been a great year for movies, with many making very important points (which in my world means moviemaking at its best
2811;Munich and Good Night and Good Luck and perhaps Crash certainly deserve more awards.
2812;and people came out thoughtful and moved.
2813;And that right there is a testament to how we're FINALLY, if slowly, growing as a society.
2814;lewis and Stowe's Last of the Mohicans.
2815;I love you, still unspoken.
2816;but now able to cry, and promise Jack what he could not in life.
2817;A movie with a message that, like the protestations of love that so many feel are necessary to *portray* love, connection, loss.
2818;challenging
2819;Them I respect, despite my reservations about the lifestyle.
2820;i've gotten a bit far afield here, but I'll come back to the beginning long enough to thank everyone in here once more for their willingness to stick it out there.
2821;With discussion comes learning
2822;to learn from each other and in that way find greater Understanding and Love.
2823;May love and wonder work within us ALL.
2824;MOVIE: When a movie has generated as much public interest as this one has, it's hard to go into the film with an open mind.
2825;The story is genuine and it works on every level.
2826;After spending lots of time alone in the wilderness a friendship is born that leads to a passion for one another.
2827;What Ang Lee does with this film is bring an immense appreciation for the setting and the surroundings.
2828;Cinematography is a sure win come Oscar night for Brokeback Mountain.
2829;Ang Lee takes the time to stop and look at the beauty of nature and how it envelopes the characters in this paradise from the rest of civilization and the rest of their lives.
2830;This forbidden love soon starts to work against them when word gets out.
2831;Relationships with their wives are shattered, and society shuns them, which leads to the very emotional ending.
2832;aCTING: Heath Ledger and Jake Gyllenhaal give great performances, but I don't think it's going to win them any Oscar gold.
2833;Michelle Williams gives an amazing performance as Ledger's outcast wife, who ultimately uncovers his secret life.
2834;The acting is top notch, all of them do fine work.
2835;The characters are fleshed out and they feel real, and that is what may make this the frontrunner for Oscar's Best Picture.
2836;on th e upside, the cinematography and scenery were quite beautiful.
2837;minded convention and show this great film.
2838;Both Ledger and Gyllenhaal gave superb performances.
2839;aged cinephile I'm saying a lot when I say that this is the most moving and most wonderful film that I have ever seen.
2840;Exceptionally good performances all round .
2841;fantastic direction, writing and music.
2842;It was robbed of the best movie Oscar .
2843;but it's in very good company there.
2844;watch it and, if you allow it to, it could do what only the most powerful works of art can do .
2845;I was so excited to watch this film.
2846;The 3 Academy Awards it won, the love story, the gorgeous mountain scenery, the incredible acting.
2847;I continue to be Heath and Jake's fan, but not from this one!
2848;I cried during and after the movie.
2849;recalls many of my relationships from the past and renews me with feelings of love.
2850;It is so true that Heath Ledger is truly incredible here as Ennis, and Jake Gyllenhaal will break your heart as Jack.
2851;It seems to flow easier with each viewing, and you catch a little more of what you missed each time.
2852;At least BAFTA recognized Jake Gyllenhaal's outstanding performance as Jack Twist.
2853;Regardless of what we are born with, we make of life what we can and we play the cards we are dealt.
2854;Thats what makes Brokeback Mountain timeless .
2855;Growth comes slowly and emotional growth is fraught with pain.
2856;All of us can look back at choices made and regretted.
2857;She did, but like all great art it was predicated on an underlying truth: love is a force of nature.
2858;Ang Lee, Diana Ossana, Larry McMurtry and everyone who worked on this movie transformed a New Yorker short story into one of the centuries' epic morality tales.
2859;its moral is love or die, and the corollary to that moral is God gives you no choice in whom you love because we are commanded to love everyone as yourself.
2860;It is worth seeing over and over and over again.
2861;This movie will be on the 100 best list for centuries.
2862;This is a very good movie.
2863;It is a masterpiece all around.
2864;For the acting, Heath Ledger and Jake Gyllenhaal have perfect acting for this movie.
2865;Others are also good in this particular movie.
2866;For the direction, it is perfect, Ang Lee.
2867;I know that this movie maybe quite ambitious, but it turns out to be good.
2868;So, it is a good one.
2869;It is about touching love and romance, so it is kind of not applicable here.
2870;For the music, I feel so enjoyable as I hear the music in the middle of the scenes because they are so relaxing.
2871;For the sound effects, it is good too.
2872;Therefore, this movie is recommended all the time.
2873;both by the powerful content and the stunning delivery.
2874;otherwise, the natural scenery is unbelievable, beautiful mountains, animals, rivers, men (!)
2875;Not only did he stayed true to the story, he enhanced the emotions, and the essence to the story for the readers.
2876;The master filmtography, the extraordinary music, and the fantastic actors in this movie further enhances what this movie brings to its viewers, which is a true demonstration of humanity.
2877;this movie deserves all the honors it received.
2878;In fact, I will even give this movie the honor of the best movie of the year, and a true art masterpiece.
2879;tell you that it is infinitely more than that.
2880;Jack Twist is the sensitive and optimistic one.
2881;His evocation of Ennis Del Mar are spectacular.
2882;While it is too early in this young actors career to go too far out on a limb, I predict that when all is said and done, this may be the role he is known for!
2883;It is obivous that he knows this character well.
2884;fit performance as Jack Twist.
2885;The shots of the Wyoming (actually, Canadian) landscape are awesome, and match the film's emotional beauty with physical beauty.
2886;as said, this film is about a 20 year love affair that tests its characters to their limits.
2887;It is love story that is (unlike every other love story) not at all cliche as it adds this extra dimension.Yes, the film is a character film and as such, it moves slow.
2888;this is time well spent.
2889;Every minute of this film is there for a reason
2890;Everything culminates into these three lines.
2891;the story allows people a peak into the hidden, but ugly side of society that still exist today.
2892;Yet even through the tragedy, it portrayed love to its finest.
2893;definitely a film worth watching.
2894;So I was quite surprised when I saw two major Western Movie stars acting out a movie that is so delicate.
2895;This movie, obviously, moved my very spirit, but I was more surprised to find that the western society is able to produce a movie with such degrees of beauty.
2896;the acting is stellar from all.
2897;The story is excellent and carried out very well on screen.
2898;The cinematography is breathtaking at times and the music truly reflects the mood.
2899;the basic theme of this movie is that love will strike in it's own time, and with whomever it deems is 'the one'.
2900;The love that struck the two main characters here was taboo and they do the best they can to quell the fire within them.
2901;an unlikely forerunner in the award category, this movie is destined to be a classic.
2902;It has all the right elements.
2903;It has a lot to say about life and love.
2904;Every year the world gets at least one controversial film that is hailed by critics, and usually wins a lot of awards.
2905;but maybe the critics are right in this case.
2906;I went into the movie with an open mind, ready to have my beliefs challenged.
2907;Through the years Ennis and Jack spend continue with their real lives, with those few days a year they can see each other when they are in total bliss.
2908;some people see this movie as a great tradgedy because these two men love each other but can't be together.
2909;The fact that these two characters are hurting their loved one's doesn't seem to matter much to the people praising this film.
2910;i will admit that the acting is good, and the cinatography is beautiful, but I can't in all honesty recommend a movie where the main characters seem to okay with hurting people they care about, with very few consequences.
2911;This film is wonderful in every sense of the word.
2912;the scenery, the acting, the story.
2913;It's beautiful and heartbreaking in such a profound way.
2914;This is a love story.
2915;Looking beyond the fact that this is a story about two cowboys that fall in love is a feat within itself.
2916;it really goes to the core of what it must be like to outwardly deny that love that you want the world to see.
2917;Their love (the word love is introduced at the end of the movie) is thwarted because of internalized social norms.
2918;The internalized social norms are played brilliantly by Heath Ledger and Jake Gyllenhaal.
2919;great acting by all other actors and actresses to the extent that you can see the story through any randomly selected character in the movie.
2920;it gets you thinking: if our social norms when internalized, as all are inevitably, may deny us happiness, what is the meaning of them, are we actually opressed and not even realizing it?I'm giving it a 5 star review because this is the only movie which made me think in years.
2921;ledger does an amazing job as Ennis a man torn between his own wants and what others expect of him.
2922;sexuality for personal or religious reasons will NOT see the movie.
2923;All in all if you like simple romances and expect a simple movie/with simple concepts than you will enjoy this movie.
2924;hopeful this is just a drop in the bucket for future films/the country.
2925;I had to travel over 3 years one way to see it firsthand.
2926;The film is a whole world of emotions.
2927;The story is very very real.
2928;i know the story by heart having lived most of it.
