id;spiegazione
3968;I went into this film with the mindset that it was going to be moving and interesting and an overall great film.
3969;I would have liked to see more of the emotions that compelled these two reluctant men to form a relationship.
3970;I can see that there was a good story to be told within, but it was just not explored.
3971;Obviously it found its fallowing, as there are 100s of wonderful reviews out there.
3972;eyed, and thought I'll just watch the first few minutes yeah, right.
3973;An absolutely classic, heartbreaking, work of art.
3974;The second disc gives good info about the soundtrack.
3975;First class script, Master Directing, Fantastic Actors/Actresses, What more can you ask for?Brokeback Mountain is a love story that will truly change who you are, and how you view the world.
3976;This is a move you have to see.
3977;The Ledger character, in particular, is held back by his childhood traumas from allowing himself intimacy.
3978;The Ledger character, in particular, is held back by his childhood traumas from allowing himself intimacy.
3979;This is a perfect film.
3980;The short story by Annie Proulx is heart wrenching, the screenplay by Larry McMurtry and Dianna Ossana is sensitively developed into a complex exploration of self damage and collateral damage as a result of repression and isolation and Ang Lee brings that screeplay to life never pulling any punches.
3981;The actors, Health Ledger, Jake Gyllenhall, Anne Hathaway and Michelle Williams, perfectly embody their characters and make them real
3982;Brokeback Mountain is an accurate depiction of the terror and heartbreak of gay love as a result of society's mores and the unavoidable result of self hate and its consequences.
3983;This film will go down in film history as one of the best films ever made.
3984;I have always enjoyed watching this movie.
3985;Its not a very complex story but the message is simple and meaningful.
3986;I also recommend reading the story, short but enjoyable too.
3987;I cried my eyes out watching this scenic epic drama, so full of love and life, much of which we can all relate to at some level and at some time in our lives.
3988;Toro: (crying) Hey Pancho, this wonderful movie Brokeback Mountain is as magnificent as other Westerns.
3989;Pancho: Si Toro, this movie is the Best I have ever seen.
3990;Seeing two wonderful played cowboys falling in love with each other is touching.
3991;Toro: Pancho, that fabulous gringo Heath Ledger and Jake Gyllenhall are a very well.
3992;Pancho: Si Toro, like other good cowboys, John Wayne, Steve McQueen, Burt Lancaster and Sam Peckinpah and they are very proud in their resting graves.
3993;Toro: Even the legendary Clint Eastwood love the motion picture.
3994;I am so proud and happy that this movie was released.
3995;That Love really exists between two men.
3996;I adore it and it's definitely more than just a gay cowboy love story
3997;Sorry Brokeback Mountain, but Crash should win best picture this year.
3998;The story is a story of love and infatuation and of infidelity, but at the same time it brings issues of prejudice and the boundaries of love into question.
3999;See this movie if you are willing to think outside of your standard framework.
4000;The greatest reviews for this film are, in a sense, the many thoughtful reactions of people on the Ultimate Brokeback Forum: [.]
4001;Many people have reflected on their lives and begun important changes as a result.
4002;I must say that normally I don't go for Heath Ledger, but his character showed a strength and roughly caring side for Jack that I liked.
4003;Its message goes way beyond the two men in the lead roles.
4004;Love is limitless, love is infinite, love is boundless.
4005;Love is a force, and however you find it, hold onto it.
4006;The fact that movies like this are drawing an average of 4.5 stars (out of 5) from over 750 reviewers is a definately positive sign .
4007;proof that we, the human race, are growing more open minded over time.
4008;So, without going into the details of the script, acting and cinematography, all of which are top.
4009;Of course, their actions create a domino effect, with the lives of their wives and families being affected as well.
4010;Moving, complicated and heartfelt, this is a film that you won't soon forget.
4011;A classic in the making.
4012;Both actors really got into their roles and made the audience believe that they were observing a relationship with it's ups and downs.
4013;This was a wonderful love story!!
4014;It will have you crying by the end.
4015;acted and beautiful cinematography and music.
4016;My favorite movie of all time.
4017;All that truly need be said of the film is that it is one of the most powerful and moving film experiences I have ever had.
4018;I was blown away by the raw power of the film, the depth of the characters, the beautiful score and cinematography.
4019;And the performances are amazing.
4020;A melancholy air runs through the film and the end is heart.
4021;It is simply a story of love forbidden and the lives it irreversibly scars.
4022;Hands down, the best movie of '05.
4023;Wow, i defintely got more than i bargained for with this movie.
4024;It's great that they effectively show how this one subject impacts so many people's lives for such a period.
4025;I'm glad i finally got to see that it lives up to all the press.
4026;As An Lee revealed in a interview, he just wanted to protray love in its purest form, without intention, calculation, procreation, or recreation.
4027;The movie makes us think what are important in our short lives.
4028;That is why this movie is a success, no matter what the box office indicates.
4029;Some lovely cinematography and an instantly riveting character study from Heath Ledger had us straight into watching a new classic mode.
4030;cowboy physicality turning sexual in what is conveyed, with lyrical toughness, as undeniably, perfectly natural in this wild, beautiful location.
4031;from the compelling opening, the affair matures and gathers poignancy, evolving from sweet infatuation to tragic separation, as the smitten pair struggle to make conventional family lives work after they leave the lovely eponymous setting of their first meeting.
4032;The film has enough generosity to portray these doomed normal lives with dignity, too, evoking equal sympathy for the sensitively.
4033;You find yourself longing for the beauty and poignancy of John Voight's glorious Joe Buck in Midnight Cowboy.
4034;eyes (with, of course, a cool mouth.
4035;Our Jake has gone unchallenged for too long, now: his reputation is the sum of great parts, rather than performances .
4036;Instead, as a nice deep focus window.
4037;change led swiftly into levity and undermined a lot of the decent efforts before, a feeling of Well, if you can't be bothered to let us hear what could have been a poignant anti.
4038;And far better, more complete films.
4039;brokeback Mountain is certainly worth a viewing
4040;What Reviewer (above) likes to call contravesry (sic) is the essence of healthy exchange.
4041;I repeat that I found the (homo)sexuality conveyed, with lyrical toughness, as undeniably, perfectly natural in this wild, beautiful location, and admired the film's generosity to the cowboys' doomed heterosexual partners.
4042;I'll even repeat: Brokeback Mountain is certainly worth a viewing.
4043;reviewer is clearly a big fan of Brokeback.
4044;rather more in keeping with the spirit of the film than his own less than charitable, pejorative outburst.
4045;it's a slow, but beautiful build.
4046;up to their relationship, and then once it gets its momentum and finally starts moving, the film just gets better and better.
4047;it's a good conceit, and a good theme, and tales of forbidden love and social commentary are great too.
4048;Thus it is, in its own way, quite an acheivement.
4049;Even nice little touches like the fireworks behind Ennis when he gets angry at the bikers and some rather abstract shots in the beginning keep this film engaging enough to ask us, gently, to have patience with it until it gets to where it's been meaning to go.
4050;This movie permitted people to see that being gay is normal and loving and acceptible.
4051;I have to say Brokeback Mountain was a really good movie.
4052;Brokeback Mountain has garnered up many awards and nominations in the past few months.
4053;Many people have a problem with the film simply because it is what they call a gay love story.
4054;I highly recommend this movie and encourage anyone with an open mind to check it out.
4055;Brokeback Mountain is a movie about 2 people who fall in love and despite what labels people may give it thats truly what this amazing film is about.
4056;Heath Ledger and Jake Gyllenhaal give amazing performances especially Heath.
4057;I believe that true love, when it is discovered, is unescapable.
4058;I also feel the same about great movies.
4059;Regardless it's content a deeply moving experience will forever rest inside the individuals soul, as will Ennis' love for Jack and this movie will for me.
4060;'Brokeback Mountain' is one of the finest American love stories I have encountered in some time.
4061;It's passion is intense and palpable.
4062;The character's of Ennis and Jack, as portrayed brilliantly by Heath Ledger and Jake Gyllenhaal, are caring, passionate, loyal, and tortured souls.
4063;I recommend any one interested to see for themselves.
4064;'Brokeback Mountain' is one of the most moving and haunting films of the past few years.
4065;It's a true work of beauty about love, loss, and the human spirit.
4066;Most of all it is an unescapable example of a love void of boundaries.
4067;But both actors are indeed great masters of the art of drama.
4068;They perform with full aplomb, their explosive rendition of raw emotions do not seem contrived or artificial.
4069;The director has done a superb job
4070;Of course the most impressive of all actors is Heath Ledger.
4071;Enhanced by a superb screenplay, mind.
4072;Annie's style is of clipped sentences, disjointed words that produce a remarkable semblance of intense empathy for her characters.
4073;The sexual content of this story is highly sensual and seem terrifyingly real as if the scenes leap out from the pages of the book.
4074;She is a highly stylized writer and commands a unique mastery over the usage of language that in a way creates a league of which she is the sole owner.
4075;Her finely etched characters seem so absolutely real that you feel a surge of pain when Jack Twist dies.
4076;she exhibits explosive finesse towards the end as the main protagonist Ennis enters a twilight zone, bereft of friends, family and most importantly his soul mate Jack Twist.
4077;You're assured that it is the end of the line for Ennis.
4078;This is real melodrama
4079;this is a remarkable gift that this writer possesses for this is not a story but an almost unwanted intrusion into your own life.
4080;This shows the caliber of the writer.
4081;Absolutely riveting, a dazzling piece of work, exquisite execution and rendition akin to a beautiful song .
4082;I think it will move anyone who's ever felt the pain that so often comes with the joy of love.
4083;If that's you, you will thoroughly enjoy this movie.
4084;My response is: big deal?This movie crossed the boundaries many viewers place on themselves about how human beings should behave.
4085;In fact, I am sure that many female viewers of this movie understand more about the attraction and love that made and destroyed these two characters better than most men do.
4086;But putting all that aside, I think all of us can agree that this movie has many extraordinary values, and if we can accept these values, or even appreciate these values for the true messages this movie delivers, then doesn't it just make sense that, whatever your viewpoint is, this is still a movie worth watching?Great job hollywood, keep up the good work.
4087;This reminds me of my literature professor a few years back when he said that the greatest works in literature can only be appreciated by the intelligent.
4088;The soft touch of the acoustic guitar triggers a bitter sweet feeling, and expressed the scenery as if the music itself is painting a picture.
4089;Obviously, the characters of this movie demand that the actors and actresses these qualities, which is very well done.
4090;If you enjoy nothing else about Brokeback Mountain, the breath taking cinematography alone is worth the price of the video.
4091;Heath and Jake give stellar performances in this movie and they deserve every award they received even if they didn't receive the oscar.
4092;It takes true actors to pull off a role like this and these guys more than deliver.
4093;This scene sets the tone for the entire movie.
4094;For instance neither Jack nor Ennis ever say the words I love you.
4095;But it has existed since the beginning of time and will continue to exist forever.
4096;You don't nessesarily have to agree with the subject and contents of a movie to enjoy it.
4097;I for one can enjoy a movie for what it is.
4098;I am proud to have this film as a part of my video collection and you will too.
4099;Anyone with half a heart and an ounce of compassion will be moved by this piece of cinema.
4100;I felt this would have given the movie an ever more powerful emotional impact.
4101;Despite these minor technicalities the movie is still worth seeing.
4102;Give Brokeback Mountain a chance and I guarantee by the end of the film, after wiping away tears, the only word you will be able to utter is Beautiful.
4103;This was a gift, They loved it and that's all that matters to me.
4104;From what i heard it was a great movie.
4105;layered and subtle, as well as brave, that I don't see how he missed an Oscar for it.
4106;An extremely touching and beautiful movie, but sad and a little difficult to watch for that reason.
4107;The music was appropriate, the cinematography was breathtaking, and the acting and directing was superb.
4108;The best thing about this movie is that the it really doesn't hit you during the film, it hits you really hard right after.
4109;I watched the film a third time with a friend of mine who said she enjoed it.
4110;The next day, she told me that she kept thinking about the film and it had affected her later.
4111;That to me is the mark of a great film, not only is it good when you watch it but it gets better afterwards.
4112;Brokeback Mountain is one of those rare films that grabs and haunts you for weeks into months.
4113;Told in spare, elegant sequences.
4114;At night, they wake up in a tent, and start having passionate sex with each other.
4115;After four years, they finally meet again and have 'fun' with each other.
4116;stories, you'll love BROKEBACK MOUNTAIN!!!
4117;made miracle of a movie ever made.
4118;It is a story that every person on earth can relate to .
4119;the story is so real, you will relate to it immediately, no matter who you are.
4120;We have all known these characters, and as a result, we know that what we are seeing is real.
4121;What we are seeing is actually every day life .
4122;which is why the tragedy of the story has such a tremendous impact upon everyone who sees it.
4123;i recommend that you see this film at LEAST twice.
4124;Ang Lee has packed so many details into every frame that it is impossible to pick up on everyone in one viewing.
4125;There is THAT MUCH brilliance put into it.
4126;work in the final scene between Jack and Ennis, the stunning scene in which Ennis discovers the shirts in Jack's bedroom, and so much more will be written about and studied for decades to come.
4127;see also for at least 7 of the most brilliant acting performances ever put on film.
4128;Heath Ledger's career and life will be transformed forever by the unforgettable brilliance of his portrayal of Ennis.
4129;Jake Gyllenhaal and Michelle Williams also moved into the Big Leagues of Acting with their brilliant performances, which will delight and haunt you.
4130;Anne Hathaway is superb as the beautiful gal who becomes more blonde and stilted with every year of her loveless marriage.
4131;the film is very true to the story.
4132;I highly recommend that you read the story before seeing the film.
4133;It will greatly enhance your understanding of what takes place.
4134;Prepare for an unforgettable experience.
4135;I assured him that if he decided to see the film that it must be on the big screen.
4136;My partner of nearly 40 years was moved more than either of us would have imagined.
4137;I am thrilled that we were able to share the experience, and it continues to spur much, soulful conversation between us.
4138;a tear at a time, alternating eyes.
4139;this film not only made me proud to be a writer and gave me a deeper understanding of my beloved gay friends from my theatre days, but has restored my faith in humanity.
4140;It is a visual masterpiece.
4141;A hauntingly beautiful love story that expands and enlivens the heart.
4142;They just weren't very intersting and in a movie the characters have to be interesting in order for the audience to care about them.
4143;And I've even found myself agreeing with some of them.
4144;Though I will say the 2nd tent scene, when Ennis gets up and goes into Jack was pretty tender and loving.
4145;Painting these guys as promiscuous users is totally unfair to their characters, and the realities each dealt with.
4146;Well my friends, we do have happiness in our lives, and we do love, and we are often broken (just as you are), and sometimes more broken because of your cruelty.
4147;A really good review was posted on February 9th by Billy Bob.
4148;All you straight guys, close your eyes and imagine that you live on a planet where the majority was homosexual.
4149;Anyone with attractions to women were considered inferior and a spiritual abomination.
4150;It's a movie about cheating on your spouse, regardless of the time period it's placed in.
4151;Gee, I thought I was.
4152;Do you really think that your views are so right that you have to tell everyone else to wake up and agree with you?
4153;I doubt Brokeback will win best film.
4154;The acting is inspired
4155;Set in beautiful Wyoming, this film captures what love really means.
4156;A friend and I watched this late at night and had to go to a 24.
4157;it's just so heart wrenching .
4158;I own it because it's so real, the same reason I own Gibson's We Were Soldiers.
4159;Its open, unforced depiction of love between two men made Brokeback an instant cultural touchstone, for both good and bad, as it was tagged derisively as the gay cowboy movie, but also heralded as a breakthrough for mainstream cinema
4160;This film was raw and powerful, blew me away!The vast gorgeous scenery, the way the love scenes were done and the Heath Ledger's performance was breataking.
4161;he is going to go on and do some amazing things!
4162;As someone who has seen many movies in the last few weeks, I can say without a doubt that Brokeback Mountain is one of the best films to come out this holiday season.
4163;Heath Ledger does an amazing job, but so do Jake Gyllenhaal, Michelle Williams, Anne Hathaway, and all of the other actors who aren't getting quite as much buzz.
4164;acted and incredibly moving film.
4165;conceived notions as it relates to this film, but it turned out to be a well done movie.
4166;thats the best you can do?
4167;go ahead, keep raising the price.
4168;As I type these words, Brokeback Mountain just won four Golden Globe awards including Best Drama.
4169;ennis is a taciturn, reserved and shy man.
4170;Jack is a charmer, a dreamer, a risk.
4171;Something deep inside stirs up a hornet's nest.
4172;ledger (Casanova) is extraordinary with his portrayal of Ennis Del Mar, a man who has few words in his vocabulary, a man so repressed that he doesn't know how to express himself or go for what he wants.
4173;He's transformed himself realistically into a man that is so unlike the actor himself, who has mostly been known for his fluffy, light performances in the past.
4174;In contrast, Gyllenhaal (Proof) has the more lively role.
4175;Jack's longing for the man he loves is evident in Gyllenhaal's stellar performance.
4176;The men also share immense chemistry together.
4177;while one can argue that it's a character study of two men and their relationship, the women in the story add an immense appeal to the film.
4178;Williams (The Station Agent) is amazing with her heartbreaking performance as Ennis's long.
4179;When she witnesses something about her husband that she doesn't fully understand, her reaction is incredibly real and painful to watch.
4180;But her final scene is mesmerizing .
4181;Hathaway has matured into a fine actress.
4182;While the plot is simplistic, the acting is exceptional and there is so much going on at the thematic and emotional levels that one can't help but feel spellbound by the story.
4183;The dialogue is real and to the point .
4184;Mostly episodic, there are many fine moments in the film that are emotionally raw and powerful.
4185;The ending will haunt you.
4186;lee's direction is masterful, and it clearly demonstrates his versatility as a director.
4187;It's even more impressive when you consider Lee's heritage as a Chinese immigrant, and how he so deftly captures Americana in Brokeback Mountains.
4188;The cinematography by Rodgrigo Prieto (21 Grams) is breathtaking.
4189;I say this is a story about love and betrayal and life.
4190;the heterosexual aspects of the story are just as strong.
4191;If you have ever loved and lost before, you will feel the impact of this story.
4192;The film is like fine wine .
4193;it delicately lingers on your palate and seeps into your vein.
4194;Brokeback Mountain is destined to become an American classic.
4195;what can i say about a movie i've seen several dozen times, best love story ever, great acting jake was at top form.
4196;just saw zodiac another great performance by jake g. brokeback mountain just great all around and will stand the test of time
4197;That's is what I got from the movie.
4198;the movie will keep your tears in until the last moment.
4199;New classical American love story!
4200;But nothing in it really strikes me as great, even with its novelty of subject matter.
4201;situated buddies has a full and natural potential for finding romance of the kind not seen among the straight.
4202;all the actors in this movie are pained in some way and all express it beautifully, in their own unique way.
4203;it's easy to see it for what it is after viewing this movie.
4204;love like any other love.
4205;the scenery is rugged, romantic, outstanding .
4206;the haunting soundtrack compliments it perfectly.
4207;Brokeback Mountain is the film shows this example.
4208;brokeback Mountain is worthy of any high accolades because it follows in the similar footsteps as other legendary Hollywood films that possess epic qualities.
4209;the film's photography and soundtrack is effective throughout the film.
4210;The main themes as well as the piece Snow shows the tranquility of each scene in which it is played (the opening chords and melody plays similar to The Beatles' Blackbird).
4211;The main premise of Brokeback Mountain involves requited love and the relationship between two people that spans twenty years.
4212;That is the way I first found the short story.
4213;I knew nothing, had only read Accordion Crimes and Shipping News, and loved them both.
4214;Fast forward and I hear Ang Lee is making it into a movie, with two good actors to boot.
4215;Also Heath's,Ennis's wife, Michelle Williams as Alma, was perfect, both as a choice and her portrayal, and talk about a sympathetic role!
4216;That is the way I first found the short story.
4217;I knew nothing, had only read Accordion Crimes and Shipping News, and loved them both.
4218;Fast forward and I hear Ang Lee is making it into a movie, with two good actors to boot.
4219;Also Heath's,Ennis's wife, Michelle Williams as Alma, was perfect, both as a choice and her portrayal, and talk about a sympathetic role!
4220;I really was moved by Brokeback Mountain.
4221;It is a sad and often touching film, that should be seen at least once by anyone interested in cinema.
4222;The direction by Ang Lee is flawless in almost every frame.
4223;It is best for the viewer to think what they want about it.
4224;a student will find writing a thesis on the story, the film or book a great challenge.
4225;If you want to know what I am talking about, see the film again.
4226;brokeback Mountain is a wonderfully sad and disturbing film.
4227;This film is about love, lust and life.
4228;Heath Ledger is heart wrenchingly pure in his performance, as Ennis.
4229;The bittersweet original score sets the tone of the film perfectly and plucks my heartstrings every time I hear it.
4230;And the poignant memory of the shirts comforts me still.
4231;The movie talks about contraversy in racism, but where's the depth, the emotional connection, the spiritual value?
4232;This is absolutely the best movie you will ever see, as long as you are smart and have depth.
4233;This was the first movie I have watched that is a genuine love story between 2 men.
4234;Ennis and Jack share something special, but they can never reveal it to the world or even let on.
4235;This is 1963 and the heart of middle America, and you don't dare come out of the closet.
4236;It is a very good look at forbidden love.
4237;Well acted all the way around, with an interesting story.
4238;I would have enjoyed more of a buildup.
4239;Other than that, this was well crafted and worth a watch.
4240;It took me a few days to contemplate the remarkable film, and I can only say the it's the biggest feather in Ang Lee's hat.
4241;Mr. Lee's sensitivity never ceases to amaze me, from the hysterically funny The Wedding Banquet (another gay.
