id;spiegazione
1;A couple years ago I was staying with family that has digital cable.
2;ANYWAY, this is a very good movie, plain and simple.
3;And I made a point to tell friends.
4;It bothered me that I felt even slightly funny about telling people I know that I liked the movie.
5;seeing Ledger in this role it was perfectly clear to me at the time that Ledger was going to be one of his generation's finest actors.
6;I've heard from fanboys a million times over how awesome Ledger's performance as The Joker is and it really is an amazing performance and I completely agree.
7;I knew well before ever even seeing a clip of him as The Joker he was going to be great as The Joker solely based on his performance in this film and that THE DARK KNIGHT would make him a star.
8;i'd also add that BROKEBACK MOUNTAIN is a much better pictire than CRASH which won for Best Picture that year.
9;Ang Lee is a truly great drama film director.
10;ICE STORM and RIDE WITH THE DEVIL are also great and unique films.
11;The tribute below is touching and I think perfectly articulates what so many have thought and felt.
12;___________________________________________________________________Ledger's magnificent performance is an acting miracle.
13;He seems to tear it from his insides.
14;rare is the performance that can honestly be called a revelation, but that's what it felt like to watch Heath Ledger in Brokeback Mountain.
15;the astonishing revelation of a suddenly, fully developed actor whose juvenile efforts scarcely hinted he'd be capable of such moving depth and clarity.
16;only two years after he received his first Oscar nomination for this iconic, star.
17;outstanding film critic Jim Emerson.
18;that said: gosh, I love it
19;but it plucked a strong chord with me.
20;in any event I can't deny that I loved it.
21;Without a doubt it is the most beautifully crafted film I have seen (It's reasonable to say I haven't seen that many good movies).
22;The story is artfully told.
23;You really saw the torment he put himself through trying to deny his love for Jack Twist (Jake Gyllenhaal) and present an honest, straight, normal persona to his world.
24;The acting and direction is so spectacular that you see all the emotion and unspoken words play across each character as clear as if it was spoon.
25;wrenching tale of unspoken love, denial and human struggle for personal acceptance.
26;It's wonderful and deserves all it's praise for being what it is.
27;The best word for it is 'Honest'.
28;the stories is about Heath and Jake's characters over a certain time period.
29;the story jumps to Heath and he has a daughter who is practically the same age as he is in the movie.
30;This is a superbly haunting film, one so affecting that I woke up in the middle of the night thinking about it.
31;Beautifully acted, directed, scored, shot, located and heart.
32;wrenching, Brokeback Mountain is likely the Best Picture of 2005.
33;He uses the contrasts of stunning wide open space and isolation, physical and internal isolation.
34;The attempt to mask and repress the heart with tradition, denying the rebel.
35;There is also much metaphor to express the opposing natures of men and women.
36;Ennis is the romantic and the pragmatic of the two, and tortured by a true love he can't accept.
37;While Jack is the flamboyant and hopeful one, who's sexuality he learns to embrace.
38;Director Ang Lee eases into a topic as touchy as Iraq with a gentle approach.
39;A 60s setting, some gorgeous scenery, a methodical, patient pace, yet half way through the movie, you realize that not only are you watching two guys kissing (when was the last time you saw that?
40;Girls: it takes a real man to see this movie.
41;Despite all of these political and sexual asides, this is an awesome movie.
42;unpronounceable do a wonderful job.
43;There is more emotion here than Crash.
44;This was the best movie of the year.
45;, this movie makes it real, tangible, tender and poignant.
46;It is story writing, telling and acting at its best.
47;If you like Unforgiven or Million Dollar Baby, you will like this movie.
48;Glorious cinematography, exceptional score plus spare, first rate screenplay add up to a remarkable film.
49;A milestone film that packs a wallop.
50;My title gives you a hint of what you will feel after seeing this movie for the first time.
51;Watch it again and you will notice things you didn't see the first time.
52;Again, please watch it and cherish those you love and rejoice in the fact you can be with them.
53;Truly, truly, truly: this is a fine, a superb, and a great movie to watch with your friends, your loved ones, your spouse or partner, or by yourself.
54;Truly, the scenery is spectacular, and the story moves along at a nice pace, just like a good horse .
55;or so I believe would be true with a good horse.
56;LOVE is the theme, the core, and the basis for an exploration of humanity and what can or cannot be accomplished.
57;Truly, truly, I highly recommend this film for everyone, whether you are straight, gay, or otherwise.
58;Wow: this film is a keeper.
59;While Ang Lee films are always artful and beautiful, this particular film was worth the watching for the breathtaking cinematography alone.
60;The romantic landscape is inexorably intertwined with the love story, which is dramatic, poignant and yes, quite romantic.
61;In the changing world of the 1960s, they work hard to remain working cowboys, a life they love.
62;The story spans a period of twenty or so years, depicting the secrecy with which the men, both of whom marry and raise families, must lead double lives.
63;If you have ever had a love that can never be made public or a love never fully realized, you identify with this film.
64;known `The Bridges of Madison County' for the portrayal of a life.
65;But this is the point here, that is why Brokeback Mountain is a great movie.
66;brokeback Mountain is how life it is, how real life is.
67;You have a chance to free yourself, to make love a force of nature, you don't take it, you have to take the consequences.
68;the philosophy of the movie is just great, first class, at the level of the great literature.
69;The important thing about this movie the substance within, the consistence, the groundbreaking attitude of the filmmakers, the great, great attitude of the actors.
70;All I have to say is that you must have patience and an open mind to understand the story and the struggle between these two gay characters, in love with each other .
71;The cinemetography was great and acting dynamite.
72;Brokeback Mountain has to be one of the best made and thoughtout films of its time.
73;For this decade, i believe this film should on that list for best film made.
74;it was timeless and classic.
75;brokeback mountain is an eye opener film to show the public that love is love and that the homophobic sentiments we flame our society ruins love.
76;jake and heath did a great job acting wise and making every secene realistic.
77;i do believe that they should had won best picture and also nominating a love that will never grow old for best song should have also been instead of giving the award to a rap duo.
78;you deserve best picture from every award show this year.
79;This film stays with you, you can't help but think about it, it is that powerful.
80;Heath Ledger is so good in this film that i almost forgot this is the same actor who made his acting debut in 10 things i hate about you.
81;Jake Gylenhaal is wonderful as well, i loved him in the good girl and october sky.
82;Their love for each other is so real and passionate, that i believed in this story from the getgo.
83;Two actors pretending to be in love, they sure pulled it off effortlessly.
84;Ang Lee's direction is so beautiful with the sheeps, it looks like a cloud floating in one swing.
85;Gorgeous, intense, and courageous acting is what you will get when you engross yourself in this oscar.
86;I think it should have won best picture but some of the best films of all time never win.
87;Brokeback Mountain is a love story that cuts across lines of gender and sexuality, gripping the viewer with a dreadful sorrow that the deep and passionate devotion that these two lovers feel for each other is forbidden to them, on sentence of death.
88;whether we be gay or straight, male or female, rural or urban, we are all capable of loving the same way.
89;But most of all, above and beyond its controversial topic, Brokeback Mountain is one of the finest examples of filmmaking I've ever seen.
90;I will make a point of seeing it again before it leaves the theaters.
91;Brokeback Mountain is a love story that cuts across lines of gender and sexuality, gripping the viewer with a dreadful sorrow that the deep and passionate devotion that these two lovers feel for each other is forbidden to them, on sentence of death.
92;whether we be gay or straight, male or female, rural or urban, we are all capable of loving the same way.
93;But most of all, above and beyond its controversial topic, Brokeback Mountain is one of the finest examples of filmmaking I've ever seen.
94;I think he did a terrific job.
95;This scene was supposed to be abrupt, and it certainly accomplished the goal.
96;well, you have a recipe for pretty much everything that was in the movie.
97;I feel the depiction of the character, and Ledger's performance of this role, were right on target.
98;I think what some have found disturbing, is the sudden passion, and aggression shown, which is explained above.
99;Michelle Williams on the other hand, did a perfect job.
100;Her portrayal of a confused/angry and fearful (of the truth) wife, was excellent.
101;Simply put, this is the most important American film of the past twenty.
102;It is provocative, it is breathtakingly beautiful, and it is flawlessly acted, but it is also a movie with a heart, and I defy anyone with the sensitivity of a snail not to be moved by Jack and Ennis' tragic love story.
103;The movie has received its share of criticism, but bear in mind that most of that has come from people who refuse to see the film.
104;It has won fourteen Best Picture awards that I know of, beginning with the Vienna Film Festival Award and including the recent GLAAD Award for best picture.
105;It is a film that will continue to be viewed and studied, both for pleasure and for pure love of cinema for decades to come.
106;one of the great love stories of all time.
107;The short story and the film are indisputable masterpieces.
108;The beauty of this short story turned into a beautiful cinamatic masterpiece has indeed made this important and thoughtful film, forever a landmark movie.
109;it's stunningly true to life portrayal of unexpexted love and it's danger and doom of society's grim mentality for gay men in love, illustrates how thousands of people have to live closeted in tortured despair.
110;Hollywood is famously closeted and scared of such honest tell tales.
111;It's out, it's about and it's still a moving love story.
112;The acting is subtle and superb
113;She may have lost the Oscar for Best Supporting Actress, but her work remains powerfully passionate and potent, an essential reminder that love .
114;I'm glad I bought this movie, and I have recommended my friends see it.
115;Ang Lee, you are very good, Heath and Jake are simply AMAZING
116;This is a film for open.
117;Bigots and their ilk should stay away from it.
118;Weeks after seeing it, this film is still haunting me and will continue to do so for as long as I live.
119;In the years since I've seen this film I have held a quiet dislike for it that was hard for me to voice, particularly due to the fact that so many of my friends admire it.
120;It has much to like, I think: the acting, the pacing, the themes, cinematography, great story, etc.
121;when two people love each other, and when that love is a great love, like the one depicted in this film, that love gives courage and enables the lovers to overcome certain obstacles, like fear.
122;I thought, well, if their love is that great and strong, they'll find a way.
123;One of the most common ways of doing so is by going into business.
124;Men in such a partnership can hope to enjoy a high degree of marital closeness, even though they have to be discreet about it.
125;Watching this film, I remember having the expectation that at some point the lovers would go into business together and manage to stay close to each other that way.
126;sacrifice for the social order and a nebulous greater good.
127;You must admit, the characters possessed a great reluctance and fear to upset society.
128;The whole idea of a great love that existed but was not known nor acknowledged by anyone outside of the two lovers, is a concept that is very Asian.
129;the lovers who cannot consummate their love because society forbids it, and that there is something spiritually beautiful in that abnegation of their love.
130;Because the fact is that every single day, human beings have to find ways to subvert the social order in order to snatch some of the rewards of life for themselves, and they are also often successful in doing just that.
131;It is worth noting here that the lovers in the film are not cowboys by mere accident.
132;lovers are real men, and that it is the love between two real men that the story is about.
133;i resent this movie because it represents a great put.
134;This movie shows you that despite what the world thinks is right or wrong, it's about loving someone.
135;That love can survive alot of things.
136;It is very deservant of the attention and nominations it is receiving.
137;Hats off to the two actors in their portral of such a touching story.
138;This is a superb film .
139;rate acting, enthralling simple story without special effects or melodrama.
140;Ang Lee's director award is well.
141;It will be a classic of its kind in 10 years.
142;A nice score or memorable theme song would help attract more audience at the box office .
143;It is a great film as it stands.
144;brokeback Mountain is a love story, specifically a story of forbidden love, and the horrifying emotional toll such a situation takes.
145;As with Legends Of The Fall, the real hero is Wyoming, Ang Lee has given us a loving, idyllic vision of the American West that seems to glow with purity and splendor.
146;That's the spirit, Annie!Ledger's performance is haunting
147;Gyllenhaal, a terrific actor with a name that's hard to spell, is also outstanding, although his western twang does seem suspect at times.
148;Great supporting work by the wives.
149;Michelle Williams, as Alma Del Mar, is every bit as injured and silent as her husband, trapped and very sympathetic.
150;Anne Hathaway, as the Texas heavy equipment Princess, is perfection
151;Viewers who are able to put their homophobia in park for a couple of hours will discover a masterfully crafted film about two individual human beings attempting to find love in a world exquisitely designed to deny them access to it.
152;After a few months of honest reflection I ended the relationship and went on my way to live my life as intended.
153;Just read the above and tell me honestly who really has the agenda.
154;Thank you E. Annie Proulx, Ang Lee and all those with the courage to be involved with this project.
155;Thank you for exposing the truth and wreckage.
156;It is possible to be gay, in love and happy.
157;I see lots of movies that get great reviews and sometimes they're deserved and sometimes not.
158;I admit I didn't immediately see how great this movie was at first.
159;This time the true greatness of the movie really hit me and I cried a lot.
160;I think this is really a rare case where all the stars aligned in terms of story, directing, acting, music, cinematography, etc.
161;When asked what drew Ennis and Jack together, Heath Ledger said in an interview that he felt that Ennis' soul fell in love with another soul, and that soul came in the form of a man.
162;I admit the first time I saw this movie the love between them wasn't so obvious and the first tent scene mostly seemed to come out of nowhere, but after repeated viewings and paying close attention the love is very clear.
163;I hope they release the rest of the score and some of the other music mentioned in the credits.
164;BROKEBACK MOUNTAIN is one of the outstanding films of 2005, a year full of outstanding films.
165;The early scenes between the two men are idyllic and gracious, lovely and passionate, and I doubt Wyoming from its mountains to its Big Sky country has ever been better photographed for a film.
166;Jack himself, while riding the rodeo circuit, meets a beautiful and charming young woman whose father happens to be rich
167;**For all its heartbreak, BROKEBACK MOUNTAIN is a lean movie whose stunning vistas are matched only by flawless performances, including not only Ledger and Gyllenhall but Randy Quaid as the men's intolerant boss and Ann Hathaway (she of ELLA ENCHANTED!)
168;The two men roughhouse and nuzzle, skinny.
169;dip and cuddle, and generally show their affection in both tough and tender ways.
170;In other words, they acted like men.
171;Ladies and gents, this is not the action of a peeved youth upset because he needs a new source of nookie
172;this is a movie to recommend not just to people who like good movies but to the occasional soul who asks me or my friends, Why make such a big deal about being gay?
173;Much of the homophobia in this film still exists today, but thank God it isn't still 1963!
174;clearly, this was an Oscar favorite for good reason.
175;Its directing and cinematography are flawless, and the acting could not be better.
176;And if you read the original writing of Annie Proux, you will see that this film stays true to the original story (which any good movie should, when it is based on a writing piece).
177;and Ang Lee did an excellent job of portraying real people, in real life, falling in love.
178;for me, this was the best movie of 2005 even if it lost to Crash for the Oscars.
179;It made a powerful statement about humanity and intolerance that still echoes in our society today.
180;This movie is sure to be a classic, and a must.
181;What a beautiful movie .
182;the scenery, the characters, the love story.
183;It's really sticking with me and I want to watch it again.
184;I highly recommend it, especially to those on the fence about seeing it .
185;Like other reviewers, I found the characters in this film invading my life.
186;but Jake Gyllenhaal also did a superb job portraying his personal difficulty and ambivalence.
187;wins the Oscar for Best Picture Of The Year with such a masterpiece (indeed it's a work of Art) like Brokeback Mountain???
188;Crash is a movie about day life problems!
189;Brokeback Mountain is an intemporal and universal Love story!
190;Brilliantly filmed, played with such a deep meaningfull that you don't see that often in the movies!
191;Brokeback Mountain was a breakthrough in mainstream American cinema.
192;It's the first (relatively) mainstream movie to address gay issues, and to treat a gay romance the same way as a straight one.
193;Unlike Titanic,however,Brokeback brings up important issues,has great depth,and is emotionally moving.
194;There,he meets Jack Twist (Jake Gyllenhaal),and there's a spark between them.
195;For a time,they enjoy a pastoral and amorous idyll.
196;They reunite every summer, their time together bittersweet.
197;Jack carries on an affair with another cowboy,and also has a one night stand with a Mexican prostitute.
198;Anne Hathaway is amazingly sympathetic as Jack's heartbroken wife.
199;the positive aspects of the movie are the performances of the leads,the powerful soundtrack (Gustavo Santoalalla is great),its beautiful scenery.
200;Brokeback Mountain takes on new,poignant resonance in light of Heath Ledger's tragic,untimely death.
201;Ennis was his breakthrough role,showing his promise as a subtle,powerful actor.
202;Spain, the second most roman.
203;Just about anything I can say about this wonderful movie seems woefully superfluous at this point, and yet it seems fair to point out that I'm yet another person taken in by this tragic and touching movie.
204;i'm not usually a big fan of romances and tear.
205;The writing is simply superb, the acting is quite possibly the best I've ever seen, and the plot is both simple and straightforward (forbidden love) while still being incredibly complicated and thought.
206;it's hard to say what I liked most about this movie.
207;i also greatly appreciated the tenderness with which the movie approaches Ennis' wife and her feelings towards her husband's affair.
208;like pretty much everyone else on earth, it seems, I deeply recommend Brokeback Mountain for a tragic and touching tale of love and loss.
209;This is such a great film.
210;Well directed, acted, scored and the cinematography was sensational!
211;It speaks to the human experience.
212;this film will remain forever as one of the greatest pictures ever made.
213;the material in this movie is incredibly compressed, like really good poetry.
214;And also, like good poetry, it gives away more and more and more upon successive viewings.
215;see this movie more than once.
216;MANY TIMES more than once!
217;Other reviewers have already stated, much more eloquently than I could, why this is such a wonderful movie.
218;Very few movies make me care, and that is certainly worth $20.
219;Finally on the big screen a real love story between two men.
220;I grew up in the country and always dreamed of this.
221;I find that it tells the story of Human love and the fact when that love is forbidden how it affects not only the people in love but all those around them.
222;This movie is important to see by as many people as possible because I think it moves you to a place deep within your emotions that people need to fill.
223;The charecters are so inspiring to make you want to do more to better not only yourself and the world around you, but it also has a deeper meaning one I'm still working on exploring.
224;I just want everyone to experience this movie one time.
225;The movie is beautifully shot and very well acted.
226;Heath Ledger's performance was so powerful that I felt his pain of being in love and not being able to realize the relationship fully and openly.
227;At the end of the day, this was a deeply moving love story and the characters just happened to be gay.
228;I encourage people on the fence about seeing this film to take the leap and go and see it and I am certain there will be no disappointment.
229;No doubt Ang Lee is a master of the Tragedy.
230;Ang is the best story.
231;teller around who can actually make us feel for his protaganists.
232;As a student of mass media it is amazing to watch.
233;its what provides us with energy and power.
234;(Sorry folks MUNICH is the best film of the year period.
235;saving Private Ryan kicked Shakespere in Love) It is amazing that not too long ago this very Academy made the Catholic Apologist film A Man for All Seasons and the excellent Chariots of Fire best pictures films.
236;anyways, Brokeback has great cinematogrophy, a great score and good acting.
237;Are we enlightened beings because Will and Grace has something meaningful, wise, and substantive to offer?
238;Its amazing thought to contemplate.
239;That reality is of equal relevance to the reality of homosexuality and deserves an equal amount of respect.
240;Hopefully we can treat each other with respect whilst this experiment which was ignited in the sixities plays out until its bitter end.
241;It will be interesting to watch Hollywood push their little agenda at the oscars.
242;when Munich is the best film of the year.
243;But this movie got to be good, I thought, since everyone loves it.
244;This movie demonstrate true power!
245;You will be deeply moved, emotionally, to the messages this movie conveys, and become magnetized to live out a better existence.
246;Yet, when I went to see Brokeback Mountain last night, I found myself one of the last moviegoers to find a seat in a theatre overflowing with people from all walks of life.
247;For what this movie provides is a heart wrenching tale of two thoroughly complex men, struggling with societal pressures and their desire to be themselves.
248;Ennis rarely speaks, and when he does, his words are simple.
249;Jack, on the other hand, is more outgoing in nature.
250;At this time, his spirit seems playful, yet experienced, making for a sharp contrast with that of Ennis.
251;Both characters marry andestablish families before they meet again.
252;When they find each other four years after their work on Brokeback Mountain, they are instantly drawn together again and establish a relationship where they meet a few times a year, for fishing trips where no fish is ever caught.
253;Their story spans 20 years, culminating in a hauntingly tragic ending.
254;His portrayal of Ennis Del Marr is heartbreaking.
255;With few words, he was able to reveal a array of emotions.
256;In supporting roles, Michelle Williams (as Alma), Anne Hathaway (as Lureen), and Jake Gyllenhaal all do incredible jobs as well, each bringing an intense believability to the roles in which they portrayed.
257;The melancholy nature with which this film concludes, does so, in part because of the exquisite changes each actor brings to their character.
258;This is a movie with heart, compassion and lose.
259;The acting was magnificent, especially Heath Ledger.
260;When he and Jack were first reunited after 4 years, the smile on his face and his excitement at seeing his old fishing buddy was the cutest thing I have ever seen.
261;I had to cross state lines to see this film (community standards prevented it from being played where I live)and the ride, toll, and exorbitant ticket price were all worth it.
