id;spiegazione
540;But here the relentlessness of insurance investigator Barton Keyes, the sexuality of Phyllis and Walter, the mean spiritedness and hidden agenda of Phyllis, is all understated in the tradition of the '40's and '50's.
541;Double Indemnity was the 1944 film noir classic from director Billy Wilder that finally explained how insurance worked to millions of Americans.
542;babes) is a bit of a shock.
543;Neff is a smooth talking insurance salesman who more than meets his match in the seductive Mrs. Dietrichson.
544;But the course of true love never goes smoothly, especially when you throw murder into the mix.
545;They're stuck with each other and they've got to ride all the way to the end of the line and it's a one.
546;It sounds crazy, Keyes, but it's true, so help me.
547;The story is well crafted as is the scheme to commit the murder.
548;Everything goes well until fate weaves a mysterious path of intervention.
549;black and white aids to create the noir shadows and the best noir film ever from Billy Wilder.
550;the film is set in a California city and really matters little against the moment to moment drama of this great film.
551;boiled dialogue, Stanwyck's, MacMurray's and Robinson's acting, Billy Wilder's direction, and everything else meshes together beautifully.
552;Pulp writer James M. Cain also deserves a special mention for writing the book the movie is based on.
553;This movie has received considerable praise by most all movie critics.
554;This is an all time great entertainment.
555;Theirs is a sadomasochistic love, filled with passionate embraces and rude retorts.
556;I adore film noir movies, and this one is definitely a classic.
557;Phyllis Dietrichson is a beautiful blonde dame who talks insurance agent Walter Neff into helping her murder her husband.
558;And then there are twists and turns, emotions and intrigues, as the house of cards tumbles around them all.
559;the dialogue is amazingly fast and snappy.
560;The filming is gorgeous, with the costumes bringing the scenes to life.
561;This ties everything together in a neat package.
562;this movie is over 50 years old now and it still is just as powerful as when it was filmed.
563;We loved watching it, and I highly recommend it.
564;this has always been one of my favorites of the NOIR genre.
565;barbara Stanwyck at her best .
566;They carry it off, and it looks like all will go well .
567;Edward G. Robinson steals this movie as he usually does.
568;and did I mention great acting!Love this film .
569;one of Billy Wilder's greatest movies (in my opinion).
570;One of the best film noir movies there is.
571;Fred Macmurray said it was his favorite movie he did.
572;Stanwyck is stunning as usual.
573;If your a fan of film nior, this is a must see.
574;is a good item to get if you like all the movies a have fum and enjoy your self etc.
575;Few film noirs from the 40's are as somber and dark in tone as this classic adaptation of the James M. cain novel written for the screen by Billy Wilder and Raymond Chandler.
576;One look at her sexy ankle chain and he's hooked.
577;She's murdered before and she's a tramp to boot.
578;The performances in Double Indemnity are so natural that it seems almost contemporary.
579;Robinson is superb as Keyes.
580;MacMurray is miles away from his good guy image in My Three Sons on TV.
581;Stanwyck is sultry and sexy (in a blonde wig) as Phyllis with her lips and eyes glistening with wicked deceit.
582;It is SO worth it.
583;Double Indemnity is a classic example of film noir.
584;"woody Allen once called ""Double Indemnity"" the finest American movie ever made."
585;He is a historian, a listener, a writer and a supreme judge of movies.
586;"wickedly brilliant, fun to watch, dramatic, darkly comical, superbly written and flawlessly directed, ""Double Indemnity"" is one of those movies that should be embraced by all fans of the national and international cinema."
587;That year they also had Going My Way in the Oscar race.
588;As you watch this film just compare Fred Macmurray's performance with Bing Crosby who won best Actor for GMW, while FM wasn't even nominated!
589;What makes it truly remarkable to me is that it never seems to age.
590;one of its strong points is that two of its three stars are cast against type.
591;core insurance salesman Walter Neff, while Edward G. Robinson, usually cast as the villain, is Barton Keyes, an eccentric, compassionate insurance claims investigator.
592;As femme fatale Phyllis Dietrichson, Barbara Stanwyck plays the kind of woman she is often associated with, but this still is one of her greatest performances.
593;the more you view the movie, the more you see how densely layered it is.
594;Instead, it makes it more fascinating.
595;Despite this knowledge, the movie turns out to be one of the most intense thrillers ever made.
596;It's filled with `hold your breath' scenes, some of which have since been imitated in scores of films.
597;The Academy chose for Best Picture the well.
598;If you see one film noir film in your life this very well may be the one to see.
599;Stanwyck is good, MacMurray is great (baby!)
600;The creative team behind the film doesn't get any better either with the powerhouse noir team of James M. Cain's original novel, adapted for the screen by Raymond Chandler and directed by the peerless Billy Wilder.
601;The 4 categories would be noir movies, those directed by Billy Wilder, films that unfold in flashback and pictures shot in beautiful black and white.
602;Granted that DI might not represent the cream of each of those species, but it is highly representative of the best they can put on the silver screen.
603;Even though the viewer senses that MacMurray is deep in trouble, the suspense actually builds!
604;an unfaithful wife and wicked stepmother .
605;She has TROUBLE stamped all over her!
606;That old SP drumhead is a wonderful touch!)
607;He dares Stanwyck to actually collect!
608;It certainly closes the circle!
609;It's safe to bet most viewers will believe that the eventual ending fits the plot more appropriately.
610;DI was nominated for 4 Oscars: Best Movie, Director, Screenplay and Actress.
611;a vastly more sympathetic part to say the least!
612;"This is one of my all time favorite movies
613;This edition looks and sounds great.
614;Double Indemnity is considered one of the best film noir movies ever made but after viewing Universal's superb new Blu.
615;ray presentation in honor of it's 70th Anniversary, I think it's one of the greatest films ever.
616;This murder gone wrong story from James M. Cain's novel of the same name is nearly perfect due in no small part by the tight and suspenseful screenplay by Billy Wilder and Raymond Chandler.
617;This is movie making at it's best and credit should go not only to Wilder but the three principle actors as well.
618;Grays and whites are vivid and even objects in background scenes are more pronounced.
619;But after finally viewing it in all it's Blu.
620;ray glory you can finally see what Wilder was telling the audience.
621;The light coming through the blinds at all angles is more striking on Blu.
622;Double Indemnity arrives in a solid Blu.
623;ray limited edition of Double Indemnity is essential to every film collectors library and come highly recommended.
624;Offhand, can you think of a wittier, more satisfying, more fatalistic and doom.
625;Wilder was the only director to discover and exploit the insinuating dark side of Fred MacMurray, and he certainly exploited Barbara Stanwyck's sultry sexuality for all it was worth.
626;out wonderful as a witty, tough insurance investigator"
627;Double Indemnity is a cynical masterpiece that serves notice of the long string of cynical masterpieces Wilder produced during his career.
628;This is one of the best film noir examples of all time!
629;both in terms of story and attitudes of the characters, but the movie is an excellent example of film noir and should be viewed by any fan of gritty crime dramas or noir fans.
630;This is another big favorite of mine.
631;Once again, there is excellent casting in this film with Fred MacMurray and Barbara Stanwyck.
632;They do a wonderful job of drawing you into the film, making you a part of it.
633;Fred MacMurray gives a surprisingly great performance as a semi.
634;Stanwyck is cold, calculating, clever, and incredibly sexy, in a trampy sort of way.
635;The dialogue is fast, sharp, and, frankly, amazing.
636;And Edgar G. Robinson's character, Keyes, is equally brilliant.
637;Seldom have I seen a movie as total, as complete, and as well crafted as this one is.
638;The stepdaughter, representing innocence and morality .
639;A great Billy Wilder film right up there with Mr. Wilder's magnificent Sunset Boulevard and The Apartment!
640;Barbara Stanwyck is spectacular as the femme fatale with ice water running through her veins and deserved the Oscar.
641;It is truly her pinnacle performance in a career that spanned decades.
642;it is the best piece of work Fred McMurray ever did!
643;Whether in a lead role or a supporting role the man was truly a giant in films!
644;This is tense, gritty film noir at it's best, what more is there to say?
645;A superb plot, directing, screenplay and a sterling cast.
646;For the times, it's a wonderful production.
647;Great direction and the acting is above par for most of the cast.
648;Robinson and Stanwyck were wonderful and easily stole every scene they were in against MacMurray and there is still a high level of suspense even though you pretty much know how everything is gonna play out.
649;Overall, for classic film lovers this is definitely a must see.
650;It's incredible to think that Double Indemnity was only Billy Wilder's second film as a director.
651;He exerts an astonishingly smooth control over all the story elements, not only the screenplay (which he co. authored with Raymond Chandler, no less) but also the witty and diabolical tone and the stylized performances by Barbara Stanwyck and Fred MacMurray.
652;edged and pitiless vision of the world, one that contrasted sharply with World War Two.
653;era jingoism and the popular sentimentality of mainstream films like the Andy Hardy series, for example.
654;For all his tough talk, Walter Neff is one of the greatest fools in the history of American cinema.
655;Double Indemnity is very sly, very funny.
656;The Bottom Line:Though I still maintain that the framing device marrs Billy Wilder's otherwise flawless noir, Double Indemnity is a clever film and worthy classic that should be seen by anyone who enjoys film or the notion of a perfect murder.
657;"I got this about a year ago as a present
658;Both Fred MacMurray and Barbara Stanwyck are at their best, this time in their careers"
659;I have always liked that actors like him could show that they could play a variety of roles, which makes them more exciting to watch.
660;At long last, and after an absence of many years, the greatest of the Noirs is available again on the shiny disc format!!!
661;"maiden, looking for a way to get out of a loveless marriage, played by Barbara Stanwyk, ""Walter Neff,"" a happy."
662;"One of the real joys of the film is the dialogue
663;stop with Phyllis whilst delivering his insurance sales.
664;(He laughs and heads for the door.)
665;The sexual chemistry between the two stars practically oozes off the screen, and the above scene is a wonderful example, just one of many.
666;Edward G. Robinson is excellent as Barton Keyes, a cigar.
667;chomping blusterer, who's gruff exterior hides a razor sharp mind and a, """"Heart as big as a house."""""""
668;But the film belongs, from first frame to last, to Barbara Stanwyk as Phyllis Dietrichson, the Femme Fatale from Hell.
669;"As she brushes past him to get her coat there's a fleeting look of panic that passes over her face, she knows that THIS is IT, but she still doesn't know what Walter's decision will be, and even though WE know the answer the scene is still incredibly tense
670;that the characters can sometimes only be seen by their outlines"
671;"The casting, the performances, the story, the dialogue, the direction and cinematography is flawless
672;I'm in love baby, I'm in love but good!
673;Her anklet, perfume, and manner enthrall Neff, and before long, she gets him to sell her husband accident insurance.
674;this film is pure classic!
675;This is a fun film noir with a great femme fatale played by Barbara Stanwyck (who could elsewhere do comedy, too), a likeable narrator played by Fred MacMurray as an insurance investigator, and a loveable mentor of the investigator played by Edward G. Robinson.
676;Billy Wilder directs what is a classic in the genre of shadow and doubt.
677;His love of his """"son"""" is an interesting plot device (though some cynical fans may call it corny)."""
678;great film great price great deliver.
679;the familiar storyline of a corruptible man drawn into nefarious activities by an alluring femme fatale and kept from escaping by his obsession with her rarely was executed as brilliantly as in this film.
680;Despite their contentious relationship, Wilder and Chandler crafted a fascinating and taut script that dripped with the sharp dialogue, such as the line above, which was Chandlers trademark.
681;a fabulous cast brought Wilder and Chandlers vision to life.
682;Wilder wore him down until MacMurray finally signed on and turned in an excellent performance as Walter Neff, who records the tale of his downfall on a dictating machine in his office at All.
683;Edward G. Robinsons portrayal of wily insurance investigator Barton Keyes was a tour de force.
684;A mainstay at Paramount since the days of silent film legend Rudolph Valentino, Seitz was a master of the shadows and light that was prevalent in later films noir.
685;This masterpiece of noir suspense is faithful to James M. Cain's (Postman Always Rings Twice, Mildred Pierce) novel, and the casting and cinematography enhance the story.
686;Maybe Chandler added dialogue, but all the best lines are Cain's.
687;the plot is classic film noir .
688;naturally the story has some dated elements (it was made in 1943) but it still holds up pretty well as entertainment for a modern audience.
689;macMurray is excellent in his role as a heel making a change from his usual nice guy roles.
690;He helps make the character sympathetic whereas Stanwycks role has few redeeming features .
691;The great Edward G. Robinson steals every scene he's in as the tenacious investigator who has a soft spot for Neff.
692;it just provides great entertainment aimed at adults.
693;It also marks a growing shift in the 1940s towards more maturity in Hollywood film.
694;"This is not only the greatest film noir ever made
695;It ranks with Citizen Kane as having the most impact on the way films were shot and structured.
696;The extras and commentaries on this set are fine.
697;but the film itself is the real star.
698;This film does not only benefit form a great script but also from the excellent cast selection.
699;Fred MacMurray, Barbara Stanwyck and Edward G. Robinson give stunning perfomances and provide the viewer with almost two hours of suspense.
700;The atmosphere is there and the dialogue very clever.
701;The director makes a fine use of shadows and lighting conditions.
702;ray is worth the wait.
703;The print is beautifully restored and the cleanest I have ever seen it, with a crystal.
704;This movie was a best.
705;guy and does a good job.
706;there is a good moral to the story, which is eloquently stated by Edward G. Robinson's character.
707;It is best not to tell you more, because you cannot tell more without giving away the plot.
708;Barbara Stanwyck is the pretty, scheming, wife of an insurance.
709;This film is a classic.
710;This film hits the screen like a well trained Olympic runner with comfortable shoes who can feel the gold around his neck before his heels are even in the blocks.
711;Oh, sure, he knows it now"
712;yeah, that's right it was an insurance scam, see, and a good one too.
713;He knows the whole layout, from top to bottom and side to side because he wrote the script along with another guy you might have heard about, Raymond Chandler, another member of the club who just happens to know his way around the block and back again.
714;"This film will give you the kind of ride a Six Flags park could only dream of, and that's what makes ""Double Indemnity"" one you're going to remember like a first kiss on a warm night in summer."
715;"Wilder got his first of many deserved Oscar nominations for this early foray into the realm of ""noir""."
716;Indeed, Stanwyck was amazing (Oscar nominated) and Fred MacMurray held his own against her strong performance.
717;Also, cast against type, was the great Edward G. Robinson (also never nominated) in another reliably solid role.
718;(At least HE received a Lifetime award).
719;up toward this end is utterly fascinating.
720;This, to me, is artistry and real talent.
721;which is a three star value.
722;we've got a classic movie.
723;i'll give Universal a bit of credit.
724;the film itself does seem a bit improved over the initial out of print release.
725;but closer scrutiny of the two would be necessary and I've got a life so I'll leave that to others.
726;"and then they take other films and run the package to two discs for no other reason than to make it ""seem"" important and packed with extras."
727;"Fortunately they don't have near the number of ""must haves"" that Warner Brothers (who are first class all the way in their releases , particularly legacy films)or MGM or Columbia have!its a great movie."
728;if you haven't seen it you are in for a rare treat!
729;the Blu Ray looks spectacular!
730;Double Indemnity is a truly classic film noir and it achieves this status with its tight, simple script and its marvelously efficient and effective direction.
731;Both Barbara Stanwyck and Fred MacMurray give their best performances here and that is part of the charm.
732;Edward G. Robinson was note perfect all the way through without breaking a sweat and, as an actor and a character in the movie, one knew he had it all over the scheming pair.
733;Billy Wilder took away some of the needless, and often silly, twists, turns and complications of some film noir and boiled it down to its essence and what bubbled up was a classic both in the genre of film noir and beyond it into movies in general.
734;The movie holds up wonderfully.
735;who wrote the film adaptation here with Billy Wilder), James M. Cain never really returned to the prominence he enjoyed during the early part of the last century.
736;In fact, between 1943 and 1947, at least one movie now considered a classic was made form a Cain novel.
737;'43 brought us Ossessione, directed by the great Luchino Visconti and based on The Postman Always Rings Twice, adapted in America in 1946.
738;1947 gave us one of the definitive noir films, Jacques Tourneur's Out of the Past.
739;Billy Wilder, arguably the greatest director in American history, helmed an adaptation of Wilder's best novel, Double Indemnity.
740;According to the AFI, the result is the twenty.
741;ninth greatest movie in American history.
742;She wants to get rid of her husband, and Neff knows the loopholes to get her the maximum from his insurance policies.
743;class America here, and what a fine piece it is.
744;if pressed to name my favorite noir film, the one that always comes to mind first in Sunset Blvd., but when you're trying to decide whether it or Double Indemnity (or a handful of others) is better, you're really splitting hairs.
745;All of them really are just that good.
746;Double Indemnity, sixty years later, is still one for the ages.
747;It unwinds at an agonizing pace and is painful to watch, but fascinating and engaging all the same.
748;"tHere are many original twists in this, in particular the wonderful character of Edward G. Robinson, an insurance investigator who has a ""gut feeling"" when something is a fraud that will cost the insurance company unjustly."
749;I also loved the way the tension built between Stanwyck and Fred, as he comes to understand that their complicity links them for the rest of their lives.
750;She is the most subtle character in the whole thing, I think.
751;It is very fun and allows one to step out of oneself for nearly 2 hours, a kind of reservoir of the way I saw the world through TV from the age of 7 or so.
752;This is one of the best of the genre.
753;Instead, film noir embraces a number of themes and techniques to produce a unique kind of film.
754;Film noir typically features stark black and white photography, with sometimes alarming, garish bright surfaces contrasted with pitch black shadows.
755;film noir is also characterized by profound moral ambiguity.
756;Barbara Stanwyck is my favorite actress, but what I like most about her is her amazing versatility.
757;She excelled in just about any part she undertook, and was as great in comedy as she was in drama.
758;But while a great comedienne, other actresses could match her in comedic performances.
759;But absolutely no one can touch Barbara Stanwyck in film noir.
760;Part of the reason is the powerful combination of great passion, emotional complexity, unclear loyalties, and enormous intelligence that she communicates.
761;billy Wilder did a magnificent job directing this film, and many of the scenes as he filmed them are classic.
762;Another is the wonderful blocking of the scene where Edward G. Robinson's character comes to visit Fred MacMurray and leaves just as Barbara Stanwyck comes up to the latter's door, forcing her to hide between the wall and the open door while the other two finish their conversation.
763;One fascinating aspect of Billy Wilder's career is that he produced perhaps the three greatest films that in any way dealt with insurance companies: this film, THE FORTUNE COOKIE, and THE APARTMENT.
764;I don't know if this was coincidence or reflects some deep personal concern Wilder had with the insurance industry.
765;"best of all was Wilder's ""Double Identity."""
766;point tension was reached and sustained in the passion of an insurance salesman and a passionately sensual femme fatale .
767;Cold blooded and cunning, this film is truly a classic dark thriller.
768;The first Stanwyck/MacMurray scene is better than most movies (even really good ones!)
769;And, to give full credit, it was based on a novel by James M. Cain.
770;If anyone cares, the Wikipedia entry on Double Indemnity's script writing is very illuminating.
771;Although this film may seem clich d today, as many thrillers since have offered similar plot lines, rarely has the story been told so well.
772;Although the movie is predictable (both for the genre and because the movie starts at the conclusion) it is still a fun ride.
773;Highlights: great writing and the actor's chemistry and understanding of their parts, also the lovely Barbara Stanwyck.
774;make of the 1944 classic.
775;However on second thought, I considered that viewing the re.
776;Comparing it with the original and analyzing exactly how this re.
777;There might be valuable life.
778;fiddle to their vividly glossy settings.
779;seat to all their shiny techno surroundings.
780;These extras include two separate commentaries, both of which are worthwhile.
781;viewing the MacMurray/Stanwyck original as background to the commentaries.
782;The few interjections he manages are interesting and intelligent.
783;the commentators generally agree about how to interpret the film's plot and on the fact that the real heart of the film, its real love story, is the affection between the insurance salesman played by MacMurray and the insurance investigator played by Edward G. Robinson.
784;listening to these two extras, you'll also learn a lot about James Cain, the author of the original serialized novella on which this story is based, as well a lot about Raymond Chandler, who co. wrote the screenplay.
785;From the James M. Cain novel this is the finest film of its genre under the masterful of Billy Wilder and an absolute must.
786;see for any devote of film noir.
787;Edward G. Robinson is fine as the insurance investigator who goes by his hunch that there's more than meets the eye than just a simple suicide.
788;with a brilliant script (the double entendres when Stanwyck fobs off the attentions of Mac Murray are a gem!)
789;Double Indemnity stands as a towering achievement in cinema when a brilliant script, superb acting and excellent art direction and lighting are under the hands of a master.
790;Possibly the greatest film noir of all time, this Wilder classic is something I can watch over and over again.
791;Simmering sex appeal and Hitchcock worthy suspense build from the first scene.
792;Wilder's decision to focus on the villains and putting the husband in only two scenes forces us to root for them, and greatly increases the tension.
793;Double Indemnity is a stylish piece of film noir with all of the typical ingredients.
794;Walter Neff(MacMurray) is an insurance salesman.
795;He is incredibly likable, a bulldog with a soft heart.
796;this movie has great pacing thanks to director Billy Wilder's masterful touch.
797;It is an intense thrill ride, even though we know what is going to happen.
798;MacMurray's flashback narrative is excellent, and it is no wonder this movie gave his career a rebirth.
799;The role also inspired other 30s male actors to reinvent themselves in the genre.
800;The movie is in black and white, classic to film noir.
801;gray case of 1927, DOUBLE INDEMNITY is terrific fun to watch.
802;A starkly realistic film noir that is truly remarkable on all levels.
803;a dark masterpiece of murder.
804;Stanwyck is astonishing in her playing of the seductive, rotten.
