id;spiegazione
1;This movie is a perfect A film noir.
2;It has a compelling narrative, a sympathetic anti hero, a sinister femme fatale, and wonderful banter dialogue between Barbara Stanwyck and Fred MacMurray.
3;(See the film you'll understand.)
4;It is here that he first meets Phyllis.
5;of course, the sexual sparks fly and Phyllis ends up convincing Walter to help her take out a life insurance policy on her older husband without his knowledge, and then help her murder him in order to collect the double indemnity.
6;with starkly realistic in its exteriors and carefully foreboding interiors, Double Indemnity is a triumph of psychological suspence with John Seitz's glorious black.
7;double Indemnity is nothing short of a masterpiece, beautifully capturing all the elements of forties film noir.
8;Full of energy and compulsion, these actors effectively propel the taught story forward, and make the film a truly compelling classic piece of work.
9;Deep down Walter really is a nice guy .
10;constantly telling Keyes that he loves him .
11;Double Indemnity is truly a great film, and stands as an all round grand American classic.
12;but the movie also stands as a fascinating portrait of two flawed individuals who are so unhappy with their lives that they succumb to their human failings and decide to take the easy way out.
13;The actuarial tables are cited to show the encyclopedic knowledge of insurance companies.
14;Daughter Lola meets Neff and tells him some old facts, and some new ones!
15;There is now great danger for Phyllis and Neff.
16;One important part of this story is the background of life in 1944 Los Angeles.
17;I like film noir movies in general and this is one of the better ones.
18;This is probably Fred MacMurray's best performance.
19;top in this one, or perhaps MacMurray and Robinson got the best lines.
20;A great adaptation of James M. Cain's novel of murder and betrayal.
21;this legendary thriller is one of the greatest and most influential and most imitated films in motion picture history.
22;the dialogue is intelligent, the plot is engrossing and the cast stellar.
23;the picture is very grainy through most of the film.
24;it is certainly among those films that deserved the special treatment but appears as though the distributers and studio used the first negative available for the transfer.
25;nominated gem tells the twisted tale of a scheming black widow (played by Barbara Stanwyck) who draws a smooth.
26;This is the first time that I have watched DOUBLE INDEMNITY 70TH ANNIVERSARY EDITION and it looks great on Blu.
27;The transfer is fantastic with sharp image resolution and dark blacks, which is really important since light and shadow play such a HUGE role in the way the film was made and also to punctuate the storyline.
28;Turner Classic Movie (TCM) host and film historian Robert Osborne provides an intro to the movie and gives some insight.
29;It also discusses the film noir genre, casting the movie, cinematography, and locations etc., and was very entertaining, as well as informative.
30;Now that sadly the world of cinema has lost the great Billy Wilder all we can do is marvel at the man's films who proved to be one of the most talented and versatile directors of his day.
31;And, to me, it is one of the most perfectly constructed films ever.
32;"based on James M. Cain's novel (he also wrote ""The Postman Always Rings Twice"", another one of the great noir films) and brought to screen by Wilder and Raymond Chandler ( Chandler too wrote some of the best noir stories ever, ""The Big Sleep"", ""The Long Goodbye"", and his first script ""The Blue Dahlia"")""Double Indemnity"" tells the story of what seems to be the perfect crime."
33;An investigator who has 26 years of experience.
34;As far the rest, well, just watch the movie and see what happens.
35;"Double Indemnity has that ""classic"" noir look we expect from films in the 40's."
36;And the beautiful cinematography by John Seitz is wonderful to look at.
37;it's amazing that for a film that is well over 60's years old, Wilder managed to create a film that still seems fresh and is actually smarter then some of the films we have being released today!
38;That was and always will be what made Billy Wilder one of the all.
39;Double Indemnity fits very comfortably into that mix.
40;The plot line is familar.
41;You know it is a modern morality play, after all.
42;Fred MacMurray before he became father knows best.
43;Double Indemnity is one of Billy Wilder's best films.
44;It is a classic film noir and it contains all the trimmings to make it what it is.
45;Billy Wilder did an excellent job making this film one of my favorites full of dark, spooky, and eerie film with a plot full of suspense.
46;He finds that when he arrives Mr. Dietrichson isn't present, and the only one who is present is the wife, Phyllis Dietrichson, who Walter finds very attractive.
47;He visits he again, and soon they have a growing relationship.
48;I would recommend this film to anyone and everyone who loves to sit and watch movies especially if they like movies with crimes, murder, a plot full of suspense and drama, and even love.
49;The youth of today will never understand what really good Film.
50;making is until they see a film that has a solid story, genuinely inspired direction, and nothing short of tour de force acting by the likes of more than mere stars like Robinson, Stanwyck, and MacMurray.
51;"MacMurray is remarkable here
52;This is the most fascinating must.
53;see film of a lifetime.
54;this 1944 classic centers on insurance salesman Walter Neff as he is conned into committing a heinous crime by the beautiful and intoxicating Phyllis Dietrichson.
55;Phyllis proposes that Walter sign her husband up for accident insurance without his knowledge so that he can have an `accident' and she can collect the insurance payout.
56;Walter catches on to her game and is initially put off, but his infatuation with Phyllis, and her cries of unfair treatment from her husband, cause him to change his mind and soon he is conning the very company for which he works.
57;with sharp dialog and a plot filled with believable and dastardly twists, `Double Indemnity' is a brilliantly crafted film noir that stands firm as one of the best of the breed, and quite possibly one of the best in any breed come to think of it.
58;The acting is superb and the direction is flawless.
59;Fred MacMurray wonderfully sinks into his character, exposing his raw naivety when it comes to the advances of a cunning woman, and his guilt ridden core is masterfully blinded by his own desire for everything to be as he planned.
60;watching a film like `Double Indemnity' makes me wish that every film were as complete and satisfying as these films of old.
61;The stories were all so well thought out and elaborate, tightly woven to entice all of our senses.
62;Double Indemnity is my first experience in traditional film noir and i quite enjoyed it.
63;The film stood out to me in a number of ways, mostly the unique story and the look of the film.
64;ok this is one of the best films noirs of allt ime and one of the best films OVERALL of all time.
65;its really suspenseful especialyl the part at the train,it keeps you wondering what will happen.
66;A famous candid photo of Snyder's 1928 electrocution appeared in the NY Daily News.)
67;A really, really good movie.
68;macMurray abandons his good guy persona in this film, having a staccato delivery, while Robinson abandons his bad guy persona.
69;My only complaint is the baddies proclaiming their love for one another after just a short period of time rang false, but, hey, the film is still good.
70;This is one of my favorite movies with Barbara Stanwyck.
71;fast paced, and intriguing movie.
72;It's a very good film noir with a great femme fatale in Barbara Stanwyck's character.
73;Fred MacMurray does his part very well.
74;Something I hadn't noticed enough the first time is that how well he delivered his lines with a straight face.
75;There is a bit of a playful repartee between him and her that seems to have sealed the deal what Double Indemnity is going to be all about.
76;That being written, all the credit goes to Billy Wilder and Raymond Chandler for penning a witty script.
77;It's really the writing that makes the characters and the setting to come alive.
78;Edward G. Robinson, as great as he is in so many films, is not nominated for his superb performance.
79;He always makes it sound so fascinating.1973 VersionViewed: 9/13Rate: 39/13: Richard Crenna sure mailed it in in the first fifteen minutes of the unnecessary remake of Double Indemnity.
80;Remember in the original that there was a good repartee between Fred MacMurray and Barbara Stanwyck's characters, something to do with the speeding limit.
81;Exceptional plot and acting in the great Hollywood tradition.
82;in addition to the great plot and suspense, the film doesn't waste its time with sloppy physical scenes, just the classic embrace and cut to cigarette smoking.
83;the movie speeds along drawing the viewer into its inevitable conclusion with a great supporting role by Edward G Robinson.
84;The original Double Indemnity is excellent.
85;But having just watched it after watching the original (and each commentary track), I love the original all the more.
86;so the contrast of the two versions of this classic made my experience of the original all the richer.
87;It was stunning gorgeous imagery (think the 2.
88;disc special edition of Casablanca which came out last year).
89;The hint throughout this beautifully plotted film is that Keyes is on to Walter's guilt right from the beginning.
90;At the same time he subtly indicates to Walter that he has it all figured out.
91;The screenplay and direction are first.
92;rate and the story and plotline are tighter and more absorbing than the Cain novel.
93;Without question, a top ten American movie classic.
94;One of the best film noir movies you can see!
95;It has all the classic elements to keep you on the edge of your seat.
96;An absolute knockout film noir masterpiece.
97;The dialogue is brilliant (Raymond Chandler wrote it with dircetor Billy Wilder)"
98;And it's all done in dark and shadows, the perfect film noir atmosphere.
99;Understandably many noir fans feel this movie is the best of its genre.
100;it is definitely in my top 10, maybe top 5.
101;no matter though, because it is a great movie, although I would have liked to see Dick Powell in this role instead of Fred McMurray.
102;This is one of the greatest Black and White Movies that was made in the 40's.
103;discussed genre of film, a uniquely American style of highly stylized thriller.
104;If you love film noir or if you want to start watching some film noir films, this is the one.
105;this is beautiful shot in black and white by the great Billy Wilder.
106;fred MacMurray and Barbara Stanwyck both give great performances in this film.
107;Barbara is one of the best femme fatales in the history of cinema.
108;The dialogue between MacMurray and Stanwyck is well written and very well spoken.
109;The documentary included as a bonus feature on this double.
110;wilder, working with cinematographer Joseph Seitz, also emphasizes the location, in this case, Los Angeles, more than Huston did, and casts darker shadows.
111;MacMurray, in a rare dramatic role, is good, and perfectly cast since Stanwyck admits in the end that she never really loved him, but manipulated him to get what she wanted.
112;It's brightly lit and is distinguished only by Billy Goldenberg's music score, itself routine for the era, but appropriately suspenseful.
113;The script, which gives credit to Chandler and Wilder's original, is so faithful that it seems less rewritten than dusted off.
114;Movie itself is well played and original classic.
115;Great movie, one of the all.
116;time best, must be seen by all humans on planet Earth, we all agree, okay.
117;Pause and take a close look at this man, and then take a look at a picture of Raymond Chandler.
118;so that astonishing revelation aside, this is just simply a fantastic movie, as fun and thrilling to watch the 121st time, in 2008, as it was the 1st time, in 1944.
119;The acting by the three leads is superb, the direction and lighting are expressive to the point of Hitchcock, and the dialogue is, well, it makes you want to bust out crying that anybody was ever that good, and why can't anybody be that good today?
120;This is one of the greatest movies ever made.
121;This is one of Billy Wilder's best.
122;He has many, but this is really the one.
123;First off the movie arrived in a prompt manner, the packaging was easy to open and protected the movie.
124;I enjoy this great murder mystery.
125;This is the best film noir I have ever seen.
126;the actors are wonderful, especially E. g. Robinson, who plays Neff's boss and close friend, Keyes.
127;It's full of Billy Wilder's wonderful banter.
128;My favorite part in the whole movie is when Neff first meets Phyllis.
129;I wonder if you wonder.
130;This is just one example of Wilder's genius, but I could name many more.
131;This movie is just wonderful from begining to end, and I think everyone should see it!
132;Stanwyk, McMurray and Robinson all turn in brilliant performances.
133;This movie will keep you on the edge of your seat.
134;A must see for all movie buffs who love a good story!!
135;First off: I absolutely love this movie.
136;There's so much to revel in .
137;the film gels with clockwork precision, and the suspense is genuinely nailbiting.
138;What contributes to its effectiveness is the casting against type of good guy MacMurray as a killer.
139;Beyond a doubt, this is just about as deliciously dark that film noir can possibly get.
140;ray edition of DOUBLE INDEMNITY from Universal is gorgeous .
141;Clarity of the black and white image is exceptional, and the mono audio track is crystal clear.
142;The bonus features include an intro by TCM host Robert Osborne, a documentary on the making of the movie, commentaries by historians Richard Schickel, Lem Dobbs and Nick Redman, the theatrical trailer, and the 1973 made for TV feature based on the original film.
143;It's what film classics are all about.
144;This is one of my favorites of hers.
145;Barbara is riveting on the silver screen.
146;The story is great too.
147;Boy they knew how to make a suspense film back in the day.
148;This was probably the best film I have seen this year.
149;This is a very classic film noir that deserves all the accolades it has received.
150;Fred MacMurray does an excellent job of his role and Edward G. Robinson is especially stellar.
151;Barbara Stanwyck does an excellent job of the acting, although, I personally don't think she has the classic face of a femme fatale.
152;The plot is complex and the plan intricate.
153;It all makes for an intriguing and intresting film.
154;This classic stands up superbly and remains one of the first and best of the Hollywood films noirs.
155;crossing still packs a wallop.
156;The witty dialogue is top calibre.
157;Up till this film MacMurray had played heroes and light comedy.
158;macMurray personna makes it all the more chilling and here Stanwyck matches him with intensity.
159;in this film Robinson delivers one of those great solo routines in the office with boss Richard Gaines( Mr. Norton) along with Neff and Dietrichson) .
160;This is an excellent film.
161;Stanwyck is an extraordinary actress who has the ability to convey the sex appeal, power, and vulnerability of the femme fatale who sets this murder plot in motion.
162;Robinson is also truly great at making the honest claims adjuster utterly convincing.
163;His relationship with MacMurray is, ironically enough, the real love story of the movie.
164;Fred MacMurray does a good job, but unlike Robinson and Stanwyck, he can't breath enough life into this role to make it utterly convincing.
165;This film is a classic for good reason.
166;Not only is the acting superb, but the movie is proof that Billy Wilder can do a great variety of genres, noir, comedy, drama.
167;I love terse, suspenseful scripts, and this story doesn't have a wasted moment.
168;This masterpiece of casting , writing and directing(imho),is a 5 star noir special.
169;This is one of the best.
170;liked classic films of all time and I am among that large group of fans as well.
171;Now, the film finally looks great.
172;few movies have ever had dialog this entertaining.
173;This is one of the rare times when the movie was far better than the book.
174;Stanwyck, MacMurray and Edward G. Robinson, are what make this so good.
175;The latter is almost mesmerizing in his performance, the way he delivers his lines.
176;He can even make a speech about something as boring as insurance and still keep you riveted to the screen.
177;stanwyck was no sex symbol (at least to me) but she looked great here in the most seductive of 1940s clothing and, like Robinson, has a distinctive voice and accent that keeps your attention.
178;told mostly in flashback the film holds your attention throughout with its crackling dialogue, impeccable acting from the principals and a plot full of suspense.
179;This was the film that first brought director Billy Wilder to my attention and I made a point not to miss any of his future films .
180;He gave a powerful performance and I was surprised that he never even received an Oscar nomination for his work in this film.
181;Edward G. Robinson as the insurance investigator Barton Keyes was absolutely brilliant and dominated every scene he was in.
182;Barbara Stanwyck as Phyllis Dietrichson was breathtaking and this was without doubt one of her best roles ever.
183;Double Indemnity had a particularly strong supporting cast including Porter Hall, Richard Gaines, Tom Powers, Jean Heather, Byron Barr and Fortunio Bonanova.
184;"some favourite lines from the film:Fred MacMurray: ""Walter Neff."
185;"we're sunk and we'll have to pay through the nose, and you know it!"""
186;If you haven't seen the original you are in for a treat and if you have seen it then you know this is a film worth many repeat viewings.
187;"a real ""film noir"" classic."
188;Double indemnity is a Film Noir classic.
189;Director Billy Wilder gives the film the classic Noir look, with dark shadows and a twisted murder plot.
190;Neff an insurance salesman is coaxed into a murder/fraud scheme by a beautiful woman.
191;Stanwyck's performance is superb, she plays a cold.
192;blooded woman with a mindset of taking what she believes belongs to her.
193;Dietrichson is nonchalant, and methodical when it comes to her femme fatale characteristics.
194;Jean Heather playing Lola does an excellent job of selling her character as an innocent and meek teenager wary of her stepmother's actions.
195;this was a great film going to great lengths to please the viewer.
196;This Film not only leans towards the serious side but also has some comic relief mainly in the use of the word baby, and the endless search for one mans matches.
197;A great work of art Double Indemnity should be on everyone's list of movies to see soon.
198;It will not only keep you wrapped up but also will keep you on the edge of your seat waiting for the next plot twist.
199;Finally a first class transfer of this great Billy Wilder classic.
200;This was definitely money well spent.
201;Very few movies have captured such intense suspense and drama highlighted by a clever scheme of murder that is in turn countered with brilliant detective work.
202;Not only is this one of the greatest noir movies, it's one of the greatest movies of any genre.
203;Great casting of Fred MacMurray against type as the eventual bad guy.
204;Barbara Stanwyck is great as the fiery ice goddess that makes Fred MacMurray give his life up.
205;Edward G. Robinson is great as the dogged insurance investigator that works with Fred MacMurray.
206;The plot is tightly wound with moments of reral thrills.
207;features except for the scene access (Thank you very much !)
208;It doesn't matter, I will keep it my library until the day Criterion will release a special edition of DOUBLE INDEMNITY.
209;let's back to this movie whose glorious fathers are James Cain, Raymond Chandler and Billy Wilder.
210;Witty dialogs and Edward G. Robinson, one of Hollywood giants.
211;One of my favourite classics!
212;Barbara Stanwyck and Fred MacMurray give great performances of a bad girl and the guy she pulls into her web of evil.
213;The photography, the sharp dialogue, the tense direction, and the fine acting all lead to a very satisfying film.
214;The scenes between MacMurray and Edward G. Robinson, as the insurance investigator who closes in on MacMurray and Stanwyck, are the highlights of this excellent film.
215;Excellent example of Film Noir with three outstanding actors at their best.
216;Plot twists keep your head spinning throughout but worth seeing again just for the acting and dialog.
217;If you love old movies, this is one of the best.
218;How wise of him to take a smaller role and make the film even better.
219;I love black and white movies and this one an all.
220;Great screenplay and Billy Wilder's direction superb.
221;And when he says he'll help her kill her husband youknow you are in for a treat.
222;"Stanwyck and McMurrayaare great together and Edward G. Robinson is great as Keyes,the insurance inspector whose ""little man"" inside tells him howto spot a phony claim."
223;This is a terrific movie, beautifully directed by Billy Wilder, one of his better films, and he made some very good ones.
224;"Note the range: a psychological mystery, a prisoners of war movie, a comedy with song and dance, and a ""sophisticated"" comedy."
225;He had a knack for getting the best out of the players and he never forgot his audience.
226;"hearted fare, e. g., The Shaggy Dog (1959)
227;Barbara Stanwyck, whose career spanned six decades, was also excellent as the sociopathic Phyllis Dietrickson.
228;Edward G. Robinson, who practically defined the Hollywood gangster from the thirties and forties, switches type and does an outstanding job as Barton Keyes, a sleuthful insurance claims manager.
229;At any rate that's the way Wilder played it, and it worked big time.
230;In fact the movie is significantly better than the novel, which isn't usually the case.
231;one of the things I was thinking while watching this was that it was actually as """"perfect"""" a murder scheme as you'll see on the silver screen, although everything had to go just right."""
232;time best film noir and a jewel in the crown of Billy Wilder, one of filmland's greatest directors.
233;I believe it is, perhaps, the finest of the genre, Film Noir, which was not something planned or thought up, by those guys in Hollywood.
234;It kind of evolved, from many,many, factors, one being the time period of pre.
235;Double Indemnity stars Hollywood's finest actress, Barbara Stanwyck and Fred MacMurray.
236;Mr. MacMurray is a pleasant surprise for this genre, as I could never have pictured him, in a film noir type movie.
237;He shines and is finally out of that gangster role, he played so well.
238;This movie is one that I can certainly watch at least, once a week and never tire of it.
239;screenwriter Billy Wilder's flair with suspense and black humor works so perfectly with James M. Cain's novel about adulterous lovers plotting to murder the woman's husband and scam the man's insurance company, it even improves on the book.
240;Back then, he was best known to my generation as a Disney movie star and the lovable dad of TV's MY THREE SONS, so it was quite a revelation to me when I saw him playing underhanded types in DI, THE APARTMENT, and THE CAINE MUTINY.
241;MacMurray had more range than he got credit for!)
242;stealing Robinson, though the Academy was smart enough not to overlook the mesmerizing Stanwyck.
243;"DI boasts plenty of wonderful character bits, too
244;Among other things, we learn about the censorship issues in bringing Cain's juicy, lurid tales to the big screen.
245;the original film and cool featurettes and other extras are on Disc 1.
246;Still, both versions are worth a look for completists, like me!
247;Because, underneath all the deceits, betrayals and ironies lies a lighted match and one of the odder and more touching father.
248;pretty much giving the customer every possible media format to choose from.
249;It's very impressive and very much appreciated).
250;What a perfect way for Universal to introduce us digital snobs to the 100's of gems we've never seen just becuase they're black and white or were filmed in 35mm celluloid.
251;It's a great way to give up digital nerds a lesson in prior greatness.
252;Just please don't take away one of the best marketing campaigns we're seen anywhere over the last 5 years.
253;DOUBLE INDEMNITY, a 1944 film by Billy Wilder, is one of the most definitive and beautiful examples of early film noir (literally, """"black film"""") at its best."""
254;For those of you unfamiliar with the genre of film noir, this was a type of film made popular in the 1940s and 1950s, features very dark cinematography (plenty of shadows intermixed with light), as well as equally dark subject matter.
255;Common themes are murders, affairs and grizzly illegal activity.
256;DOUBLE INDEMNITY is a great example of this style at its best.
257;fred MacMurray plays wily insurance man Walter Neff, who finds himself drawn to a beautiful, married woman, Phyllis Dietrichsen, played by the lovely Barbara Stanwyck.
258;this film is beautifully acted, directed with great zest, and very, very engaging.
259;Even though some of the dialogue is (delightfully) dated, you are still going to have a great time watching DOUBLE INDEMNITY.
260;There is no question that this is an example of filmmaking, at its best.
261;Wonderful film in all ways.
262;To me that is worth the price of admission.:+)
263;It's still a tense and enthralling film noir masterpiece.
