id;spiegazione
264;Extremely shoddy treatment of such a wonderful film.
265;I'd like to see a special edition of this film produced as soon as possible, and done right!
266;"Double Indemnity is one of 5 films that helped launch the ""film noir"" genre."
267;"I din't get the money, or the girl"" This is as good as it gets to explain what ""film noir"" is all about."
268;Many people think this film was MacMurray's finest performance.
269;"She won 3 Emmys (""The Barbara Stanwyck Show"", ""Big Valley"")."
270;Robinson does a good job as the Insurance inspector, but it's hardly among his best performances.
271;"Along the way he was nominated as Best Director 8 times and for Best Writer 12 times, and he won for Best Picture (""The Apartment"")."
272;Double Indemnity is true film noir.
273;By today's standards it's a little slow, but it has all the noir elements and its true value is historical .
274;one of the earliest and truest examples of the genre.
275;filled, plausible plot, and expertly acted.
276;Fred MacMurray is handsome, cool and plays the gullible insurance salesman.
277;Barbara Stanwyck is cunning, alluring, beautiful, whose performance as the seductress is perhaps one of her best roles.
278;Walter Neff is a sharp, quick witted, slick insurance salesman who finds himself consumed with thoughts of Phyllis Dietrichson played by Barbara Stanwyck.
279;It was a good story that was fun to watch and I really enjoyed it.
280;i liked this movie and and would suggest it to anyone into noir films.
281;The original picture is as crisp and sharp as the day it was made, the sound is just as good.
282;It is a fine story, and this is one movie that one can watch over and over again.
283;I have, and it's great each time.
284;Billy Wilder gives it the pace and rhythm of a comedy, but it's a thrillingly entertaining trip to Hell.
285;He embodies Neff's horny shallowness perfectly.
286;there are two commentary tracks here and one has some interesting first.
287;good to have your service available for us here in Australiathe old movies have spunk and a story line too
288;smart dialogue provided by master film auteur Billy Wilder and supreme crime novelist Raymond Chandler is what makes this 1944 film noir such a timeless classic, certainly among the very best of the genre.
289;The man isn't home but his lethally cool wife Phyllis is, and the sexual combustion between them is palpable from the moment they meet.
290;it certainly helps that Wilder cast three actors who turn in exemplary performances.
291;"It's easily his best screen work at least until Wilder cast him as the immoral, adulterous office boss in another classic, ""The Apartment"", sixteen years later."
292;boiled dame with a brilliant turn as Phyllis.
293;She is the role model for all femme fatales that came after her .
294;But there is no love between these two .
295;She's just a conquest to him, and he's a pawn to her.
296;As the most decent person of an unseemly lot, Edward G. Robinson portrays Barton Keyes, a wily insurance investigator who likes Walter in spite of himself and the revelations about him.
297;It all ends the way you would expect but in such a darkly humorous way that it's enjoyable just to see how.
298;Double Indemnity is a film noir masterpiece .
299;chilling, dark, and very suspenseful.
300;It features a great script with many memorable lines (for instance .
301;, an interesting plot with many good twists, and fantastic performances from two classic stars (especially Stanwyck, who won an Oscar for her portrayal of the evil wife).
302;brilliant insurance salesman, Walter Neff(Fred MacMurray), who falls for a beautiful married woman (Barbara Stanwyck) who wants to use him to get rid of her husband for the insurance money (hence the title, Double Indemnity).
303;double Indemnity is a great film .
304;the idea behind it, interesting in itself, was brilliantly executed by the legendary director Billy Wilder.
305;Consequently, Indemnity is a true film noir classic and must.
306;This movie has an exceptionally good plot .
307;lots of twists and turns.
308;Also enjoyed seeing how Los Angeles looked in the late 1940s.
309;The newer version included was interesting and not so great.
310;This movie confirms that Barbara Stanwyk was one of the most talented actresses of her generation.
311;The character of Phyllis Dietrichson is always fully developed, believable, likeable and detestable.
312;Along with the rest of the talented cast, Stanwyk brings this intense story to life.
313;The script is taught and well developed, the cinematography is great and the music is perfect.
314;Clearly and without a doubt, the finest example of film noir.
315;"Fred MacMurray, the beloved dad in ""My Three Sons"" made a powerful impression on me when he took on the role of ""Walter Neff"", the insurance salesman with a pronounced dark side."
316;Combine that with the enormous talent of Edward G. Robinson as the sharp, intuitive investigator who we wonder if whether or not he knew of the murderous scheme.
317;Double Indemnity is an excellent example of American film noir.
318;The stars (especially Barbara Stanwyck, Fred Macmurray) are great in their roles.
319;The last scenes of the movie are poignant and extremely well written and acted.
320;The script is one of the best, too.
321;Billy Wilder did a great job directing the film.
322;This item arrived really soon after ordering, and I love it.
323;Double Indemnity is a classic film noir involving an insurance salesman, an eager.
324;Fred MacMurray is Walter Neff, a successful insurance man who falls hard for the icey Phyllis Dietrichson, played wonderfully by Barbara Stanwyck.
325;Their eventual union gives birth to an intricate plot to kill Mr. Dietrichson and collect the insurance money.
326;Walter Neff, however, is intelligent and confident.
327;"Raymond Chandler, who wrote another film noir ""The Big Sleep,"" adapted the James M. Cain novel, adding dialogue that was both shocking and funny
328;And the great Billy Wilder here early in his career has created an essential American Film.
329;screen, the characters kiss very, very passionately to make up for it!
330;If the Maltese Falcon was the first great film.
331;noir then this film has to be a refining and improvement of the genre.
332;Billy Wilder put together a crime film that is still intriguing today with its femme fatale and other techniques in storytelling and cinematography.
333;Starring Fred MacMurray, Barbara Stanwyck, and Edward G. Robinson, this is a classic film.
334;This movie was definitely full of suspense as well as great characters.
335;Director Wilder utilizes the voice over with flashback very effectively to tell the story.
336;If there is a better made movie of this genre I would love to see it.
337;This one is juicy and taut and fires on all cylinders.
338;Enjoy a masterpiece of the classic era!
339;This is an excellent film with an excellent screenplay, great acting and exquisite play with lighting to tell a story.
340;Fred MacMurray, Barbara Stanwyck and Edward G. Robinson are perfectly cast in their roles and you only realise this when you compare the film to the tv remake on disc two to see the big difference.
341;this movie is a true classic and holds up very well to repeated viewing.
342;Author James M. Cain virtually created a new genre with his extra.
343;and they were so successful with the public that not even 1940s Hollywood could resist.
344;possibly due to the story's truly psychotic edge, which is given full life by Barbara Stanwyck in one of her most celebrated performances.
345;but MacMurray's performance is exceptionally good here, and all the more effective because it so completely unexpected.
346;Stanwyck is truly memorable here, and gives us a woman who seems at once sexed.
347;up and completely frigid, at once completely natural and absolutely artificial.
348;It is a remarkable and often disturbing effect.
349;beat performances that drive the action.
350;this was one of director Billy Wilder's first major hits, and he deserves considerable credit for making the weird elements of the story work as a whole, keeping the film smartly paced, and heaping it up with atmosphere.
351;The film noir genre is full of elements that comedians love to pantomime: The way characters seem to stop whatever they are doing to reveal their private thoughts to the audience.
352;Some had truly frightful moments and heightened drama.
353;ups, and eventual treachery is well.
354;Enjoy the suspense and especially the cutting dialogue.
355;Great storey , weill cast with seasoned professional actors.
356;be slick insurance salesman Fred MacMurray.
357;Must see if you like crime or caper movies!
358;I remember this from long ago and that I liked it alot.
359;So I got it after 30 years and it still holds up as a great plot and unexpected things that I forgot.
360;If you look up the definition of Film Noir anywhere, this movie is what you will be directed to watch.
361;If you saw and enjoyed the movie Body Heat , Kathleen Turner and William Hurt.
362;Yes, this is one suspenseful film, but most of the suspense is found waiting for the absolutely awful story line to unravel.
363;which is good, because it seems he's the only good guy in the film.Yet, if you're one of those people like me, familiar enough with Los Angeles to recognize it in movies, and you watch older movies to see what's going on in the background, and where it might have been shot, then you'll like this one.
364;Double Indemnity is a classic movie, a giant in film noir.
365;The rating here is for the original.
366;the two versions are nearly identical, so much so it's a wonder that a writing credit was given for the newer version.
367;fred MacMurray is Walter Neff, an insurance salesman.
368;He pays the Dietrichson household a visit to update some automobile insurance.
369;Phylis, quite simply, is a black widow, she wants to do away with her husband.
370;Neff goes along with it and knows a way to get a double payment, the double indemnity clause.
371;It's a very tense movie that deserves to be watched more than once.
372;If you can get the original without the tv version you'll probably be more satisfied.
373;Despite its genre roots and Fred MacMurray's stiffness, DOUBLE INDEMNITY is still one of the greatest films from the 40s as well as an exemplary noir.
374;The film is a sly, incisive indictment of rampant capitalism and the title, an insurance.
375;Babara Stanwyck plays her black widow role with slimy gusto and sex appeal (Wannabe Sharon Stone should take a lesson or two).
376;Love it and have for years,worthy of a five star rating and what a cast with Fred MacMurray,Eddie Robinson and Barbara Stanwyck.
377;Under the direction of Billy Wilder the film has great twist and turns and plenty of stars to go around with great performances by this superb cast.
378;com and well worth the price.
379;This work may be well considered as the masterpiece of Biily Wilder .
380;The fate intersections and the soul darkness emerge to prevail on your behavior .
381;famous adaptation of James Cain 's novel and screenplay of Raymond Chandler .
382;Add besides the Edward G Robinson and Barbara Stanwick presence and you will obtain a classic sample of one of the top films of the forties .
383;One of the greatest films of all time starring my favorite actress, the original Barbara, and Fred mcMurray ( who knew) .
384;love everything she did especially the sexual role reversal of It happened one night.
385;Take, for instance, the delicious exchange of double.
386;Needles to say, it is a dream, fiction, and a masochistic dream at that, because he dreams about being exploited by a woman.
387;This is sublime piece of cinema .
388;perhaps one of the best Hollywood has ever created.
389;Double Indemnity is a GREAT movie!
390;Having been so impressed with other restorations in the series, I trusted and bought this edition.
391;I always appreciate smart dialogue, and this film is full of it courtesy of Billy Wilder and Raymond Chandler.
392;The exchanges between Barbara Stanwyck and Fred MacMurray are classic.
393;But the script is also well constructed, using an effective shift between present and past as well as MacMurray's voice over to move the winding plot along.
394;Stanwyck, such a versatile actress, easily gives one of her best performances as Phyllis, the woman who lures an insurance salesman into a scheme of murder and greed.
395;As the salesman Walter, MacMurray is surprisingly good in a role unlike the usual likeable guy he played.
396;He should have played more shady characters in his film career.
397;Edward G. Robinson delivers a fun performance as MacMurray's friend and insurance claim inspector.
398;Billy Wilder's intelligent direction uses all of the elements of film noir and puts them together in one of the best examples of the genre.
399;Phyllis and Walter may not be the most likeable people, but it is fascinating to watch them lead each other into trouble.
400;Fans of classic films, film noir, the director, or any of the actors should make sure to add this film to their viewing list.
401;The plot moves along with the same tension that readers' found in Raymond Chandler's novels, and that's saying a lot!Barbara Stanwick is sexy and manipulative, all the while seeming somehow clean and innocent.
402;The duplicity is frightening to behold.
403;edward G. Robinson is a claims investagator, and his performance is top.
404;it's one of the top films of all time, and the actors are all brilliant.
405;This is a classsic,tried and true!!!
406;Absolute classic film noir brilliantly acted and directed!!!
407;Includes the classic film,wondefully restored,a nice documentary,two audio commentaries,a trailer,and the 1973 remake!!!
408;The first disc is worth the entire price anyways.
409;This is movie is an excellent retelling of a wonderfully written novel, rich with literary elements and meaning.
410;Plus, it's interesting, for those who think all black and white movies are boring.
411;not your average crime story, this movie takes you from the perspective of the murderers, an insurance salesman played by Fred MacMurray and rich tycoon's wife played flawlessly by Barbara Stanwyck (who actually got an Oscar nomination for this role).
412;Now it may be dangerous to take a story from the perspective of two people who you can never like"
413;The murderous characters are also contrasted by Edward Robinson's character, a small role that lights up the movie.
414;notch acting, and a well.
415;Did I mention that the grand master Raymond Chandler is one of the screenwriters.
416;Wilder is a master of light and shadow and deserves the very best restoration.
417;There are many fine Wilder films available (his director's filmography includes Some Like It Hot , The Apartment , Sunset Boulevard , a. m. o.) and this ranks at the top of his artistic achievement.
418;Billy Wilder's film, Double Indemnity is a masterpiece filled with devious schemes, lustfuldesires and financial gain.
419;He believes that Phyllis is his wayto fulfill that urge.
420;An exciting relationship develops between these characters as theybegin creating a devious plan for the murder Mr. Dietrichson, which would includecollecting double indemnity off his accidental death insurance policy.
421;Simply the greatest film, in my opinion ever made.
422;Nothing can compare to this perfectly constructed film.
423;Every shot, angle and every piece of dialogue is so carefully mastered.
424;The performance from Barbara Stanwyck (as well as all overs) is fantastic.
425;How brilliant that twisted look in her eyes when.
426;This film is so perfect, and the music just sweeps the film along, as well as the viewer, and you progress through the often nightmarish world of the main caracter.
427;The suspense lies in finding out how.
428;the device of using the dictaphone is a clever idea to keep the film rushing along and on track.
429;This improved on the book version where Walter makes a written confession.
430;Neff's sharing his story with us also adds to the general tension.
431;He's getting closer and closer though.
432;And Walter is always on hand to provide the lit match.
433;As Keyes lights up, the solution is right there under his very nose.
434;I know there is and has been a lot of hype about this movie and it is good film noir but certainly not the best I've ever seen.
435;This film just has to have B&W and this is beautifully filmed with great lights and shadows.
436;Beautiful enough but she can't act her way out of a wet paper bag.
437;Barbara Stanwyck was perfect in this role and I don't even particularly care for Barbara Stanwyck.
438;This is not one of my favorite B&W movies but it is very well done and holds up well.
439;Edward G. Robinson is wonderful.
440;The grand daddy of them all.
441;If you can get over the (intentionally) cheap wig worn by Barbara Stanwyck, there is no disputing this is one of the best of the Film Noir genre.
442;This is one of the very best of the Film Noir movies of the 40s.
443;Edward G. Robinson steals the show each time he is on screen.
444;The Blu Ray disc looks marvelous.
445;Great bonus features compliment this great movie.
446;Amazon you must do better with your product descriptions!
447;Now the transfer is OK at best lots of issues and I am sure there will be a great transfer made at some point but this isn't it.
448;This movie is easy to recommend.
449;It's a near perfect film: cinematography, dialogue, stellar performances.
450;Must confess, I didn't care for the first 5 minutes too much but this movie is among the best, if the not the best of this genre.
451;An easy movie to watch again and again .
452;and, very quotable dialogue as you can see from all the reviewers here.
453;The supplemental materials, described here by others, is just so.
454;A few films have been marked as a classic and this is one of them.
455;Twists and turns and a film that tells you a story without explosions.
456;"One of the quintessential noir films, Billy Wilder's ""Double Indemnity"" is a masterpiece of stark atmosphere and carefully stylized suspense."
457;boiled repartee and the great Edward G. Robinson is aces as always as the dogged investigator hot on the lovers' trail.
458;"Sinister, tense, and cynical, Wilder's ""Indemnity"" is riveting film suspense."
459;is an excellent, professional actress.
460;I like her more with every movie I see and she made a lot.
461;In the hands of director Billy Wilder, this novel by Raymond Chandler is a masterpiece.
462;The moment you see that lovely ankle of Phyllis, (Stanwyk) on the staircase, you know she's trouble.
463;Fred McMurray is taking a holiday from comedy to play oily insurance salesman, Walter.
464;They are also very interesting, including Edward G. Robinson as Keyes, the obsessive insurance investigator and colleague of Walter.
465;It must look like an accident and their plan is a good one though complicated.
466;If not, it is still a superior thriller.
467;Without a doubt one of the best of its genre, this movie still holds up after all of this time.
468;MacMurray, Edward G. Robinson and Barbara Stanwyck are all sensational.
469;Director Billy Wilder may be better known for other movies (Some Like it Hot, Sunset Boulevard) but this one still packs his best punch.
470;This is one of the best films I have ever seen.
471;This is noir at its very best.
472;Sunset Boulevard comes out on blu ray next week and is also a classic.
473;The blu ray looks terrific, although you need a region free player to view it since it is locked to region B (Europe).
474;Simply put, this is one of the finest films noir ever produced and clearly Fred MacMurray's finest hour.
475;Stanwyck's great, too, as is Edward G. Robinson, but the bottom line is the film itself, the story it tells, and the suspenseful web it casts.
476;I've watched this one many times and will watch it many times again.
477;Director Billy Wilder (Sunset Boulevard) along with writer Raymond Chandler (The Long Goodbye) brings Fred MacMurray, Barbara Stanwyck, and Edward G. Robinson into a great film noir.
478;Walter Neff (Fred MacMurray) is a successful insurance salesman.
479;This wonderful plot in Double Indemnity has many twists and turns in it.
480;They have to time everything just right and this keeps you on the edge of your seat.
481;There are so many moments in the film where you think the whole scheme is about to collapse.
482;Neff and Dietrichson are such witty characters that they seem to have the right thing to say or do at the right time.
483;Neff is even surprised how good the plan is working out.
484;I highly recommend this movie for people of all ages.
485;The film really kept me on the edge of my seat the entire second half.
486;I believe the true test of any film is to be able to watch it time after time after time and still enjoy it, which I have done.
487;I love the feel of this film, particularly the shots in the insurance office where one gets to see a workplace as it appeared 70 years ago, the bowling alley, etc.
488;He is probably my favorite actor and he is at his best here, takng a back seat to MacMurray and Stanwyck billing.
489;wise and stealing just about every scene he appears in.
490;would you hide in the back seat of a car and subsequently strangle (!)
491;It's a legendary film, it holds a spot on The American Film Institute's Top 100 (#38) and has inspired countless other movies (i. e., 'Body Heat').
492;For a movie that was released in 1944, it still works perfectly and hasn't dated a bit (except for little things like the Dictaphone and the fact that the main character walks through supermarkets smoking).
493;He arrives at her house to see her husband, so that he can renew his auto insurance.
494;The movie kicks into first gear when Phyllis asks Neff about insurance.
495;So, Neff and Phyllis come up with a great plan.
496;Some classic Billy Wilder movies (Some Like It Hot, Sunset Boulevard, etc.) end with a great line of dialogue.
497;Double Indemnity ends with a great line (although it's the simplicity that makes it great) and a great action.
498;This is a great movie, a great film.
499;noir, a Billy Wilder triumph.
500;Double Indemnity is considered to be the quintessential film noir.
501;Every aspect of this film is pure movie perfection.
502;a blonde Barbara Stanwyck is absolutely seductive as the impeccable femme fatale Phyllis Dietrichson who lures the naive insurance man Walter Neff (played amazingly by a cast.
503;Billy Wilder's classic touches are present throughout making the film all the more enjoyable to watch.
504;with a script so biting, so fierce that it should be the basis for all aspiring screenwriters, Double Indemnity packs quite a wallop.
505;"A masterpiece of film noir, Billy Wilder's Double Indemnity is a wonderful picture, with the original ""touch"" of its author all around."
506;Brilliant movie with brilliant actors and actresses!
507;"It's the best crime mystery film I ever saw
508;This is a fantastic movie.
509;the most intriguing part of Double Indemnity was the way that it gently toyed with the audience by giving them a satisfying but original non.
510;There is no happy ending for anyone.
511;This was a good old movie.
512;This is the best movie, the movie has everything murder, twists, great acting.
513;barbara Stanwyck plays her best roll ever, so does Fred McMurray,great extra features also GET IT !!!
514;from casting to the technical brilliance of Wilder's direction.
515;the film is a textbook case of successfully casting a star """"against type""""."""
516;edward G. Robinson, in a supporting role, is absolutely superb as Barton Keyes.
517;"he had always received top billing since ""Little Caesar"" made in the 30's, should have received an Oscar for his portrayal as the dogged claims investigator."
518;"The following year, Eddie G. would receive star billing opposite Orson Welles in ""The Stranger"" a well."
519;acted and highly enjoyable noir thiller directed by Welles, but seemingly panned by most critics.
520;Other remarkable touches are abound in this cinematically rich film.
521;the snappy dialogue, courtesy of Raymond Chandler, who collaborated with Wilder on the script (the two actually hated each other) based on the James Cain novel, is an improvement on the book as is the story told in flashback by the dying protagonist helps amplify the personal relationship between Keyes and Neff to the film's advantage.
522;this set is presented full.
523;frame, nicely restored, and includes a rather laughable 1973 made.
524;tV movie based on the original film.
525;(I did recognize that the beautiful Spanish.
526;That's perfectly fine with me, being a Queens man myself, but I think they should have just made her character from New York instead of California b/c it wasn't essential to the plot anyway.
527;A true classic noir, fully deserving it's reputation.
528;All the actors give their best performances.
529;The dialog is all memorable, and quickly but subtly sets the mood.
530;The special features are the best.
531;She deserved a better wig!!!
532;Boy, this movie was full of deceit.
533;It was a good one.
534;It crackles with Raymond Chandler's sharp wit (he's the other screen writer) as well as Billy Wilder's, well, sharp wit, and that masterful knack Wilder had for a perfectly polished script.
535;This one's just a suspenseful ride from beginning to end.
536;And unlike most noir films, it actually makes sense!
537;One of the greatest movies ever made.
538;The obvious reason is Billy Wilder, the genius of film noir '40's.
539;this movie is great because it sizzles in a manner respecting the impediments of censorship of the first half of the twentieth century.
