id;spiegazione
805;"MacMurray is terrific in a very untypical role and although Stanwyck's blonde wig is quite obvious and slightly bothersome, she gives us a performance well worth mulling over
806;As Barton Keyes, Edward G. gives a nicely crafted performance and Tom Powers is appropriately boorish in his characterization of the unfortunate Mr. Dietrichson.
807;The music score is by the famed Miklos Rozsa and the excellent cinematography is by John F. Seitz.
808;It cemented Bily Wilders career as a great director and was responsible for many movies of its kind since.
809;Others tell the basic story.
810;The train scenes, with Ins.
811;And the later scenes with the train witness brought in to see E. g. Robinson's inquisitive insurance investigator are deviously hilarious, something that Wilder embellished thru just about all his later films.
812;A great film starting with the insurance man's attempts to sell insurance to the late Ms. Stanwyck's devious unhappy spouse.
813;macMurray, usually the genial good guy and later best remembered for his television roles, gives Walter just enough edginess to make him both sympathetic and convincing as an insurance salesman who is willing to get shady to make the sale and get the dame.
814;barbara Stanwyck excels as the sultry Phyllis who, from the moment she enters the frame and you see her ankle bracelet, you know is trouble.
815;Double Indemnity (referring to the double indemnity of Mr. Diedrichson's insurance policy) is classic film noir at its best.
816;The writing is crisp and catchy, the dialogue is peppered with great lines and phrases and the acting is stellar.
817;and that makes the movie good.
818;a real feast for the noir fan.
819;Fred McMurray and Barbara Stanwick are at the top of their game in this Film Noir treasure.
820;Fred McMurray was a fine serious actor and well as a TV star.
821;He founded a fine winery in California too.
822;the fast talking banter back and forth is just so funny and campy.
823;Everyone does a great job, especially Edward G. Robinson as the insurance company investigator.
824;There's a lot of complexity in this movie and you may have to watch it a couple of times to get it all.
825;It is the middle of the night in downtown Los Angeles, luscious film noir land brilliantly photographed by John Seitz in high gloss and grippingly scored by Miklos Rozsa.
826;but Wilder and co. writer/novelist Raymond Chandler make both men complex and curiously sympathetic.
827;The climax is gripping and curiously erotic, with """"Tangerine"""" playing on a radio up the street earlier that evening."""
828;DOUBLE INDEMNITY is a film noir masterpiece and an almost perfect movie that even allegedly pleased Wilder.
829;Starting with an amazing cast and a great plot, this film lives up to anyone's expectations.
830;I don't want to give much more away, but, even if you are not a film noir fan, you will find this to be a tightly written, wonderfully acted drama.
831;This classic is well worth owning.
832;Walter Neff is an insurance salesman at the top of his game.
833;assured, confident and when he meets the lonely, sexy housewife of a man he's trying to get to renew an auto.
834;"And so, Walter plans the ""perfect"" crime."
835;A nearly flawless film and one that really defines the genre.
836;In the process, he loses his career, friend, a woman who really loved him and ultimately his life.
837;the main plot of the story is the external one: to get away with the perfect murder in order to be with the woman he loves.
838;But our hero chooses to redeem himself at the end.
839;This minor plotline of Lola and her boyfriend's love is crucial to the hero's redemption.
840;double Indemnity is a very tight story.
841;Each character plays roles on multiple plotlines and each scene provides turning points of expanding stakes and meaning.
842;It absolutely proves the idea that even a small loss of morality will lead to the ultimate destruction.
843;I enjoy an old movie occasionally.
844;For one thing, the simplicity that used to exist in film is refreshing if the plot is good, and this one is.
845;"In fact, I thought it one of the best, right up there with ""Strangers on a Train."""
846;A trip back in time reminds us that astounding special effects are not absolutely required of good film artistry.
847;fred McMurray did a very respectable job in the role of the insurance salesman, Walter Neff .
848;"He is perfect for what she needs, and she immediately goes to work on him
849;it's everything in between that mesmerizes"
850;"A suspenseful ""almost caught"" scene or two."
851;"The ""Columbo"" type insurance investigator, Keyes, played to the hilt by Edward G. Robinson, adds spice to the mix."
852;This film is a must for any serious cinema buff, and it was long overdue for a special edition, and this does not disappoint.
853;One of the indisputable masterpieces of cinema.
854;The documentary is a huge plus.
855;tV remake is worth a look at for its value in sheer eye rape.
856;An essential film noir, Edward G. Robinson's character is outstanding.
857;But it all works together, and again I credit Robinson for the being the stabilizing factor.
858;Every aspect of this pioneering film noir is perfect, in its seedy, monochrome portrayal of L. a. in the forties.
859;Cinematograpahy, music, editing and direction are of the highest standard.
860;Scripting is superior (credit goes to Billy Wilder and Raymond Chandler) and the dialogue bristles with innuendo, wit and extremely eloquent exchanges, though it may seem campy by today's standards.
861;The performances of Barbara Sranwyck as the adulteress and Fred MacMurray (a light actor who nevertheless provides a powerful contribution as her love.
862;Great performances and a great script.
863;This is as good as it gets in 1944.
864;Career performances by Barbara Stanwyck, Fred MacMurray and Edward G Robinson guided by the brilliant direction of Billy Wilder make this one of the best films ever to come out of Hollywood.
865;the screenplay explodes with just the right dialogue.
866;if you like film, you will love Double Indemnity.
867;It was such a refreshing change from all the modern crappy films today that it inspired me to watch more black and white films.
868;It wasn't about the action, the high tech scenes, just character develop and sit back and enjoy the ride.
869;Although the picture is very sharp it has many scratches on it.
870;Thank you, Universal, for *finally* releasing this Special Edition of the greatest noir film ever.
871;And the sublime Edward G. Robinson, in a signature performance, is MacMurray's wily boss at the insurance company, who's putting two and two together.
872;letter words of the later film, this 1944 classic is actually sexier.
873;She is the ultimate femme fatale.
874;There are at least four encounters between her and MacMurray that are among the most provocative scenes ever performed by two actors with all their clothes on.
875;Instead, Neff meets Mrs. Deitrichson and believes he finds a lonely housewife eager for his charms.
876;dOUBLE INDEMNITY is as fine a film, not just a film noir, that was made inside the studio system of the wartime forties, one to watch and watch again.
877;so if your trolly is equiped with a video replay system, this is one that you'll likely watch until the end of the line.
878;Edward G. Robinson fares better in a part that relies more on fast.
879;talking statistics than especially good dialog (there are far fewer gems here than in probably any other Wilder film), but his character still feels more like a plot device than a person at times, only really delivering some genuine humanity in his last couple of scenes.
880;Don't get me wrong, it's an okay film .
881;just not in any way an outstanding one.
882;Great script, snappy dialogue and a killer femme fatale.
883;ray) looks and sounds better than ever.
884;master and corrections is the kind of thing that can draw new viewers to appreciate this groundbreaking work in film!
885;This movie is one of the defining films of the noir genre.
886;All the great ingredients combined in a tense, well.
887;acted film make this an all.
888;There really is so much to like about this film.
889;Initially all goes well, but slowly cracks start to appear, both in the coverup and in the relationship.
890;She is now widely remembered for her role as the matriarch in the 60s Western The Big Valley, and largely underrated (and forgotten) by the modern generation, but she played a great range of roles through her career.
891;This was certainly one of her best.
892;There are thousands of subtle details that make this film outstanding, a real classic of cinematography.
893;Even Stanwyck's wig was carefully selected to make her look like a tramp!
894;time classic film that is definitely worth adding to your collection if you have any interest in film noir.
895;noir masterpieceand a classic of American cinema.
896;The true life crime behind this film noir masterpiece isthat no otherwise worthy studio (ie.
897;Today, the few remaining original, factory.
898;Will my fellowcinephiles, please lobby Amazon to lobby Universal??
899;i was so impressed with even at that age.
900;Double Indemnity is a superb story about an insurance salesman who gets involved with a woman married to a husband she doesn't care for.
901;The murder of her husband is planned perfectly and brilliantly, but it all comes crashing down.
902;Neff is very successful at what he does (He's been at it for eleven years).
903;Meanwhile, Walter finds himself getting involved with her step.
904;one of the most memorable performances in the movie is Edward G. Robinson's Barton Keyes, the claims manager, a brilliant fellow who is by hunches when a claim doesn't seem right.
905;I did it for the money and for a woman.
906;I love films that are centered on the conversations, innuendos, accusations, etc.
907;The result was one of the greatest screenplays ever penned and one of the most memorable film noir suspense movies ever made.
908;the dialogue crackles sharply throughout, and never more notably than in the first meeting between Fred MacMurray and Barbara Stanwyck in the latter's home in the Los Feliz section of Los Angeles.
909;The insurance pro decides on a policy with a double indemnity clause for a larger payoff, assuring her that the plan will work since he is professional enough to carry it off.
910;while Stanwyck and MacMurray provide stellar performances as the conspirators and ultimately murderers, Edward G. Robinson provides a performance on par with his brilliant effort in Little Caesar, which skyrocketed him to stardom.
911;for gripping suspense, superb acting, and brilliant dialogue one cannot hope to top Double Indemnity.
912;It deserves the celebrated masterpiece label which it has been accorded.
913;The use of voice over is brilliant and the two stars have never been better.
914;Billy Wilder's was a master story teller.
915;Wrap these characters in moody, bleakly beautiful black and white cinematography, give them a witty, scathing script by Raymond Chandler, and you've got a sordid masterpiece about small.
916;I can't recommend this film highly enough!
917;to end the film?In general the story is very well.
