id;spiegazione
272;The characters talk like they are in a film noir.
273;But that's precisely why it works.
274;It creates a whole new world that you have never seen and it doesn't back down for a second in presenting this world to you in all its gritty detail.
275;this film works and yet it knows that you are suspending a lot of disbelief and throws in a couple scenes to let you know that it is ok to laugh if you want to.
276;There is a great scene where the private eye and the pin meet at the dining room table of the pin's house and his mother serves them lemonade.
277;the actors are all top notch.
278;The camera work is great.
279;The plot is twisty and unpredictable.
280;Overall this was a very engaging and fun cinematic experience.
281;side note: If you are a fan of Film Noir see if you can pick up two direct references to The Maltese Falcon
282;Each frame is carefully orchestrated and composed to perfection.
283;The dialogue is metered and spoken with a contemporary Shakespearean beat.
284;Writer/Director Rian Johnson has created poetry with his first feature length film.
285;hard and piercing, yet on the verge of tears.
286;He stays low, nose clean, until an old love brings him into her world as it's spiraling out of control.
287;Johnson has flipped the genre on its head to brilliant effect.
288;Brendan, our medium into the story, is played to perfection by Joseph Gordon.
289;teacher conference, are delivered with straight faces and a piercing confidence.
290;The wit is there and you will laugh to the seeming absurdity, but the weight of the story holds strong.
291;placed humor helps you realize the gravity of everything even more.
292;levitt shines in the role and proves to be the best up.
293;perfect turns as a violent teen in the wonderful Manic and as a teenage hustler, vagrant in Gregg Araki's disturbing yet unforgettable Mysterious Skin, Levitt is making bold choices and continues a great run with Brick.
294;Also, the accompanying score of piano and brass jazz fits perfectly to the atmosphere, especially on a late scene close.
295;Brick is a stylish modern day noir which uniquely uses high school students as its main stars (although students aren't exactly going to class that much).
296;They keep the mood of a hard.
297;i. e. I've got knives in my eyes.
298;i really liked the effort that Brick makes to be a fresh take on the noir film, but over all, it was just so.
299;Brick is a daring piece of crime cinema that revolves around a certain subculture at a high school.
300;Beyond the school grounds, much of the story transpires in and around a few houses.
301;All in all, I enjoyed the movie.
302;while it might be hard to apply accept the premise, accept the bit to this film, its far.
303;on and cast of characters were nevertheless a joy to experience.
304;Brick is a refreshing entry into the murder.
305;It is stylish, very dark, and even funny sometimes.
306;Watching all the young actors playing noir archetypes talking the talk and walking the walk was amusing.
307;I liked a lot Joseph Gordon.
308;up Lucas Haas stars as a powerful drug lord who still lives with his mom.
309;not so sure but it was fun to watch.
310;Brick is very much a genre piece.
311;If you have a open mind, or at least realize what you're getting in to, you will discover a creative spin on a stagnant genre, some excellent performances (particularly Joseph Gordon.
312;levitt), and one of the best films in recent years.
313;this is a very well made movie.
314;a film noir mystery set at a modern day highschool.
315;the acting is excellent, the cinematography is great.
316;what i particularly loved was the banter.
317;levitt gives a great performance, playing the resourceful highschool rebel.
318;i would recommend this film to almost anyone, especially someone who appreciates film as an artform.
319;What more can you say than that this is the best, most masterfully executed translation of the classic noir genre into any other period?The script is breathtakingly smooth in its fully and unapologetically stylized manner.
320;The characters play their characters gorgeously, and the few moments where the noir facade is broken to point out that these are, theoretically, teenagers (when the mob boss' mother serves the protagonist a glass of milk before they get down to talking the business of drugs, crime, and espionage) work wonderfully to complement the mood.
321;It is completely and utterly stylized.
322;A classic I'm sure I'll re.
323;watch countless times as I make sure all my best friends have seen it.
324;this is a good movie other then the fact that there all in high schoolthis is way too much drama for high school, but thats what makes this movie funny.
325;This is a great film, very entertaining.
326;Any fan of film noir will get a kick out of this mixture of Dawson's Creek and The Big Sleep.
327;brick is one amazing film due to its heavy use of tough.
328;you laugh at the funny parts and are on the edge of your seat at the tense parts.
329;i give high praise to the director and the cast of Brick.
330;This film has a nonchalant style of its own, it has a pretty good plot setting start and from then on, I was utterly bamboozled and I don't even use the word.
331;The best thing about this confusing ride was the end.
332;For whatever strange reason, the artificiality of the dialogue and farcical nature of the proceedings works quite well once you give in to the conceit.
333;detective style and there are all the usual archetypes and manipulations.
334;Somehow they seem sort of fresh in the setting of high school.
335;And since most of us tended to discover detective novels in our teen years, it seems perfectly fitting to project their tropes out into that world, to imagine that high school is a microcosm of all the things one read about in pulp fiction.
336;so I'll take sides with the pro.
337;brick crowd
338;The characters were well written and acted.
339;Completely enjoyable and nice ending.
340;The acting was superb, the story was awesome and engaging, I couldn't keep my eyes off the screen the entire time, and it is filmed and directed with care, which is rare in films these days.
341;While the film was obviously influenced by class Film Noir genre movies, Cache, Veronica Mars, and, yes, many mafia films, Brick is clearly an original piece, which is a great change from all of these Bread and Circus films that are plaguing mainstream cinemas as we speak.
342;cutter flashy trash that most young directors seem to grasp hold of, is truly refreshing and amazing to behold.
343;The plot itself is a bit of Hammett's Red Harvest (possibly his greatest work) and Chandler's The Big Sleep.
344;It's tense, a little convoluted, but breathtaking to behold.
345;The performances are all spot.
346;And being aware, you're already in on it and you take the ride and enjoy every minute of it.
347;Brick is a very ambitious attempt at hybrid yet derivitive indy type film making.
348;Such attempts can yield incredible results as in Slingblade, Pulp Fiction or Blair Witch Project.
349;It's a fairly original concept.
350;I'll even allow that the right treatment of Brick very well could have worked to some degree.
351;There is a machine gun cadence to the dialogue delivery that, at times is unintentionally funny.
352;It's a good thing people in the real world don't talk the way noir characters do.
353;I appreciate this aspect of the noir genre and have enjoyed it when done well in classic noir films.
354;His adversary (aside from the entire world) is a highly intelligent yet amoral and calculating crime boss with a gaggle of lesser minded goons in tow.
355;I am confident when I say that my divulging of these details does not in anyway constitute a spoiler.
356;the noir genre by definition is hinged upon extreme melodrama, quirky and intense dialogue and extreme machismo.
357;When depicted with a backdrop of plausible characters the formula can work very well.
358;The director and writer aimed high and should be commended for that.
359;This movie is just great, the characters are very intense and the story is a real pleasure for all thrillers and film noir aficionados.
360;It's an intriguing murder mystery with false turns, and an ending that, while you were kind of expecting it, was beautifully done.
361;The film is appropriately sparse given that the main character is a teenage boy, and shot wonderfully.
362;This movie was surprisingly good.
363;It's the type of film that you'd catch on cable.
364;The movie brings to life a genre which has all but disappeared from mainstream cinema, but also brings a refreshing feeling of originality through its use of unconventional characters.
365;Joseph G. leavitt was great in this film he has taken a lot of risks in the roles he plays .
366;Snappy dialogue, delivered at a rapid fire pace and flowery turn of phrases that you have to pay attention to decipher.
367;As a 1940's noir type film, it has the standard archetypes: the hero who is seeking justice, his brainy sidekick, the femme fatale, the gal with the heart of gold, the larger than life villain (played by Lukas Haas) and his dunderhead henchman.
368;At first, hearing these young.
369;this film is daring, brutal and at times actually fun.
370;What it turned out to be was wonderful neo.
371;It was as terse and well.
372;acted as anything of this genre that I've seen .
373;with several delightful twists I didn't see coming.
374;talking to him like he was a kid (which he was) while he is having a meeting with The Pin at the kitchen table .
375;the juxtaposition is hilarious, clever, and a needed moment of comic relief.
376;This movie is great because it can be watched repeatedly, and each time the viewer will learn something new!
377;It has an excellent dark mood, and it is fascinating how the filmmakers updated the film noir genre to a modern day high school.
378;I loved the way the characters talked in this film.
379;I recommend watching this movie once without subtitles to focus on the action and once with subtitles to uncover all the secret, twisting dialogue.
380;This movie will leave you with a lot to ponder for a week or two!
381;The movie has a great pace and a really interesting feel.
382;levitt, who has blossomed as an actor siince his time on 3rd Rock, did a spectacular job of taking the audience through the dark world of drugs and super hip and smart players as he tries to find a killer.
383;the dialogue takes a few minutes to adjust to but once you start emersing yourself into what the director has created you become part of it.
384;Because it is an alternate world.
385;But it was a lot of fun to visit.
386;Johnson's screenplay is consistent, superbly delivered and adds immeasurably to the uniquely strange atmosphere of BRICK, as we are eased into something more abstract than the ususal mainstream screenplays written for people who want to be spoon.
387;speak in that classic book/movie and no complaints worth a moment's notice.
388;G. vanSant's MY OWN PRIVATE IDAHO with Shakespeare to boot, hailed as a masterpiece .
389;A clever concept: film noir in a contemporary L. a setting.
390;A for effort, less so for execution but definitely worth seeing.
391;Best film noir in years.
392;sharp tense story with a fantastic cast and beautiful locations and great music.
393;levitts best film and a triumph for writer/director Rian Johnson
394;boiled noir movies of the forties, and a cast of high.
395;mystery set at a Los Angeles high school is pure movie fancy.
396;But what a clever, fascinating ruse he's devised.
397;the plot itself is a mind twister worthy of Kiss Me Deadly.
398;And the acting, like the dialogue, is utterly sincere, even at its most outrageously hip.
399;Great support from Haas, Noah Fleiss, and Norah Zehetner give this Brick extra heft.
400;Good writing and good acting can't revive it.
401;I think you have to take teenagers a lot more seriously than I do in order to enjoy this movie.
402;This is a movie that I have been watching over and over again, everything about it is great.
403;noir, detective movie that is incredibly elabortate, surreal, and filled with really good.30s like dialogue.
404;The story jumps back two days and we see this same girls hand slip a note inside a locker.
405;The locker belongs to Brendan of course and the note gives him direction to go to a certain payphone and wait.
406;but it's a lot more elaborate than that.
407;Making a whodunit movie nowadays is hard
408;What happens as Brendan tries to figure out what's going on is actually really entertaining to.
409;This movie is very elaborate, so pay close attention to it.
410;If you like suspense, and mystery this is your movie.
411;The dialogue is hard to follow if you aren't familiar with the slang, but the cinematography, sound and music, coupled with some of the best indie acting I've ever seen, make for an experience that will change the way you look at movies.
412;Which was great in my oppinion.
413;don't see any Oscars here, but an entertaining and fulfilling flick for a Saturday afternoon .
414;when I first saw previews for this film I was entranced, the camera shots, style, jargon, and characters were spot on.
415;I don't quite know how to describe the genuis of the film, but it takes a somewhat novel if not seemingly misguided idea and twists it into one of the greatest Noir detective stories I've ever had the pleasure of viewing.
416;I had a lot of fun also picking up dialogue tidbits from other films.
417;There are at least a dozen more.
418;This is just as much about the love of cinema in general as it is an homage to one genre in particular.
419;This is a review of the well.
420;Smart acting and mental fencing.3.
421;smart dialogue and tension games.
422;It is one of my favorite modern films.
423;If you can transpose yourself into the realm presented, you will love it.
424;I'd also recommend The Big Sleep for those who haven't seen it (original with Bogart and Bacall).
425;cover edition has some excellent production commentary including expanded and deleted scenes, which was surprisingly good viewing.
426;(It can be viewed here on Amazon.
427;The online transfer is good with a clear and intelligible soundtrack .
428;The deleted scenes are good, and the two screen tests are ok.
429;The term is also sometimes used to describe a person who is very easily controlled, such as a yes man.
430;In the case of Brick both definitions are cleverly combined.
431;A ride in a car (as in pick.
432;To wield (as with a weapon)
433;An ace is the highest playing card, meaning 'high.
434;When Brendan strips Kara and says I'm showing your ace, he is saying that Kara's most valuable asset is her beauty, which she uses to manipulate people with (e. g. lap dogs, Dode, etc).
435;The deleted scenes are great, and the introductions are pretty good
436;Although this movie is one of the best films I've ever seen, and an auspicious debut akin again to Kevin Smith's Clerks.
437;This film begs for a good special edition.
438;The language, the dramatic flair, the perfect perversion of noir.
439;I do, however, feel compelled to offer a few thoughts.
440;i recommend the film with absolutely no hesitation.
441;The script is smart and engaging, the actors appealing and the conceit of staging a classic noir in a modern, brightly.
442;lit high school actually works.
443;it is absolutely the movie it wants to be, with no apology.
444;And trust me, I certainly know a couple of people who simply didn't get it.
445;as a lover of film, however, I love filmmakers that show a real knowledge and appreciation of the genres they work in.
446;I thought this was a decent movie.
447;I laughed out loud at the scene in the vice principals office, as if a vice principal and a student would actually act the way they did.
448;She dropped him when she started hanging out with the popular kids, and now she's missing.
449;They speak in a teen/drug code that is so unique I actually had to turn on the subtitles to understand it.
450;Once I figured out what the slang meant, it was a fascinating new language.
451;levitt has matured a lot since he was in3rd Rock From the Sun.
452;He carries the movie with his James Dean.
453;Lukas Haas gives a subtle, eerie performance as a club.
454;This is a moody, intense, and unflinching look at the teen drug world (and it's interesting that there are no curse words, no drugs are mentioned by name, and no drugs are taken on camera.)
455;the best movie i've seen all year, and probably the best i'll see all year.
456;It's just really interesting how the dialogue is throughout the film.
457;levitt plays Brendan, who is a high.
458;the dialogues throughout is just what made the film interesting.
459;Plus, the suspense factor helped.
460;The background music was wonderful and surely helped the buildup of suspense.
461;I'm sure some will find this movie interesting.
462;But that weird little experiment was not half bad and Brick is a lot more successful in trying to pull this off and is a lot closer to Sin City than to Bugsy Malone.
463;Brick won the Sundance Film Festival's Special Jury Prize for Originality of Vision, and you have to grant writer.
464;The other half is listening to what these characters have to say, because the rhythms are Hammet's, but the glossary is often idiosyncratic and the dynamic is pure high school (My favorite is when Brendan is engaged in a conversation that has descended down to both parties saying Yeah a lot and he finally shoots back, There's a thesaurus in the library.
465;while for the most part this movie takes place in a Charlie Brown world where adults are absent, there are a few notable exceptions.
466;The illusion of this strange reality is maintained from start to finish, when Brendan confronts the guilty party in the middle of a high school football field.
467;At that point Johnson most clearly invites comparisons to The Maltese Falcon because at this point he knows that you have either bought the game plan here and will enjoy the more overt homage, or this would be the final nail in the coffin.
468;For me the results are certainly enough to warrant rounding up on this 2005 film and to hope that Johnson can find something equally creative for his next venture.
469;This movie is gripping and intelligent.
470;Joseph Gordon Levitt is amazing and I would recommend this movie to anyone who enjoys a good murder mystery.
471;Brick is an edgy, roughly cut film, shot on a shoestring.
472;Johnson's screenplay won awards from Central Ohio Film Critics Association and San Francisco Film Critics Circle.
473;Johnson was nominated as a promising director by the Chicago Film Critics Association Awards and by the Sitges.
474;The film won a special Jury Prize at the Sundance Film Festival.
475;joseph Gordon Levitt was excellent in bothStop.
476;For those of us who laughed hard at TV's Third Rock from the Sun, it's wonderful to see his growth as an actor, perhaps poised to become a major star with the right film.
477;As Brendan, he carried his love on his sleeve as he seeks to find out the truth behind his girlfriend's murder.
478;She goes with a football star to enhance her status.
479;As Rian Johnson creates the role, we are always interested to see what face will next emerge.
480;It is a very interesting performance and treatment of the character.
481;noah Fleiss turns in an excellent performance as Tugger.
482;As Dode, Segun brings a childlike charm to a goth exterior.
483;His banter with Brendan is as bouncy as ping.
484;Meagan Good has nice moments as Kara, a stage chanteuse who enjoys Asian makeup.
485;in the beginning of the film, I found the fast.
486;As the film unwinds, we acclimate to a hip lingo that is often a cool shorthand that provides the missing pieces of the puzzle.
487;For example, he talks about having to re.
488;I enjoyed the film, appreciating how Johnson gives free reign to his supporting characters to shine.
489;This is worth an evening's entertainment.
490;This unique mixture of contemporary teen.
491;angst and classic noir sensibility is priceless and wonderful.
492;All the young actors rise to the occasion beautifully .
493;and it all works beautifully and with occasional well.
494;they're all there and entirely compelling.
495;It's a surreal and haunting work of art: the lighting, the faces, the music, editing, the Hammett.
496;Renews my believe in film as Art.
497;See it once, see it twice.
498;This will happen again, with BRICK.
499;In fact, Brick stayed in the top ten in the UK for weeks this spring/summer.
500;I suppose, given the concept and direction, they all do a pretty good job.
501;levitt does a fine impression of a teen.
502;In a way, the super.
503;While most teens in real life are a balance between cool and self.
504;conscious awkwardness, in Brick everyone exhibits flawless film version sang.
505;I heard about this movie from a friend who RAVED up and down about how deep, hardcore, and heart wrenching this film was.
506;I had seen the preview and was quite intrigued, this looked fresh and unique!Sadly, this film tried way too hard to be all the things my friend said it was.
507;I feel that the only people who will really enjoy this movie are indie high school kids who think very highly of their intellect.
508;levitt gets better all the time.
509;This was an interesting take on a murder investigation by high school student.
510;The hard boiled detective angle was excellent.
511;Brick is a fantastic detective story full of twists and turns and will keep you entertained the whole time.
512;levitt is phenomenal and amazing to watch.
513;Rian Johnson is a great director and writer.
514;Brick is like old film noir with a new twist.
515;With some great performances (including a slyer than ever Joseph Gordon Levitt) and slickly witty slang dialogue, Johnson takes a seemingly simple premise and adds some innovative flavor to create a deadly original yarn.
516;featuring crisp dialogue, atmospheric cinematography, organicly sparse music, and a downright cool style, Brick is a force to be reckoned with, and a refreshingly original take on the neo.
517;Focus Features has a way with making all of their products very well.
518;I think it provides a good look into the underworld that exists in many middle class American high schools.
519;However if you grew up in a high school with drug prevalence it will really resonate with you.
520;I felt that I could really relate to the movie.
521;The main character brilliantly brings down everyone who was involved in his ex.
522;The best revenge I've ever seen in a movie.
523;Ok, I really wanted to like this movie because I saw the previews on another movie and it looked very interesting.
524;The only reason that I gave this movie 2 stars was for the acting which was very good.
525;I think such critics are engaging in a subtle hypocrisy.
526;Thus even the literalists among us can enjoy the classics of film noir.
527;Mr. Johnson is challenging us to enjoy it despite its absurdity, and indeed, to enjoy it because it is absurd.
528;It is both at the same time
529;But it is also subversive because it is poking fun at the audience and our expectations.
530;This movie has a dark tone to it.
531;The characters, especially the main character, Brendan, and his friend and confidant, Brain, use a very strange slang to communicate.
532;There grows a feeling of urgency in Brendan's situation, although we're not exactly sure what that is just yet.
533;it must be something important.
534;It was somewhat suspenseful and interesting enough to keep me watching.
535;The characters are also fairly interesting, even if only in their mysteriousness.
536;this is a pretty good flick.
537;I enjoyed the plot and how it all played out.
538;The female lead is intoxicating, however.
539;If you like either, though, you're in for a real treat.
540;Hammett would be proud, especially since some of the slang is encased in some truly witty dialogue.You have to like this sort of thing, of course, but if you do, it's surprisingly well.
541;highly recommended for fans of this sort of thing.
542;This is an interesting film, it tells the story of a college kid investigating the death of his ex.
543;What makes it stand out is that the film is presented in the style of film noir, with the teenager in the role of a gumshoe detective.
544;It's a nice idea and follows a similar plot to the investigations with a few twists and turns along the way.
545;everyone does a good job in their roles, in particular the lead.
546;Without the style gimmick it's a solid enough film, everyone plays their part and the story unfolds at a decent pace.
547;The style does set it apart, but also proves it undoing.
548;It's well filmed which does set it up a step higher than that, but still the impression remains.
549;While it does present an interesting juxtaposition it did hamper my enjoyment somewhat.
550;that leaves it as a film that's a bit tricky to rate, it's a decent enough film, but not as entertaining as it might have been.
551;Still it's not a bad watch by any means and it does stand apart from many other teen movies, so worth checking out.
552;it works like this:Think of a well used phrase (e. g.
553;Well, at least that has the Ramones in it!
554;Now That's some good writing!
555;levitt (so very good in Mysterious Skin) as a teenage Sam Spade with strong overtones of Dirty Harry and equally strong low tones of Holden Caulfield.
556;first time director Rian Johnson exhibits a strong sense of style and an amazing finesse with his young cast: they all come off as caring, thoughtful, emotionally stable or not human beings.
557;levitt's Brendan are refreshing, daring and astringent creations and as such are not to be missed by anyone interested in contemporary American movies.
558;I have to say it, Brick is probably the best movie I have seen this year so far, and I don't think I'll see another that will top it.
