id;spiegazione
840;The dialogue is interesting because it has sort of a 40s feel to it.
841;A few scenes are very funny, but mostly its a pretty intense drama.
842;Definitely worth seeing for anyone open.
843;After they broke up, Emily started eating lunch with a more popular, yet mysterious crowd (The Upper.
844;As he delves into their world, he finds a sickening subculture of drugs, double.
845;the movie is set in Orange County (San Clemente), and the movie's big hook is that it's an update of those terrific film noirs of the 1940s and 1950s.
846;The dialogue is full of clever pithy lines and slang that went out with Eisenhower (Beautiful woman: Do you trust me now?
847;The directing is also terrific .
848;levitt makes a likeable protagonist amidst the crazy proceedings and characters, including a rather magnetic Lukas Haas as The Pin.
849;Although making the film in noir style is essentially a stunt, the tone helps make the movie deeper, more satisfying .
850;easily one of the most intricate teen dramas ever made.
851;Highly recommended for fans of film noir or sophisticated teen dramas.
852;What Brick brings to the table is perhaps the most refreshing look at the genre of Film Noir in years.
853;Rian Johnson is able to take the critical elements of the genre and transpose them on a fresh new locale.
854;The use of a Southern California highschool as the backdrop is beautifully done.
855;What is most amazing is how surprisingly real the film seems, despite the fact that yes .
856;Yet somehow Johnson brings in elements of real.
857;life high school drug culture, real.
858;life Southern California, and most of all real.
859;life fantasies about how to act when you are part of these cultures.
860;this was the best film I've seen in years, to be honest.
861;emergence of Film Noir, arguably one of the most interesting and conflicted genres of film (in my opinion).
862;Yes, there is action and violence, but the movie has a very intricate dialouge to follow, many words.
863;Very unique way of presenting a film, I believe pulled of nicely, with some great camera work as well.
864;A great independent film, if you like the Movie Kids, Requium for a Dream, or Spun, than this movie might interest you to see.
865;The movie was great and am very happy to have a copy.
866;Very intense dense plot with twists pulling attention.
867;among the best movies i have ever seen.
868;solid acting weaved into a modern version of the old detective movies.
869;this movie is great, beautifully written and well put together.
870;It is artistic and stylish without taking away from the movie and very well rounded.
871;I really enjoyed this movie and it grabbed me within the first few minutes.
872;top, but I saw this as being part of the parody.
873;Brick is a bit surreal, a bit noir, and a bit high school drama.
874;What makes the film interesting and gives it its twist, is that the story feels as if it was written for a cast in their thirties.
875;appropriate cast, though, it would have been more of a cliche whodunit mystery.
876;Instead, it plays out in an interestingly unique way.
877;He's still a strong actor and helps carry the film's emotional core.
878;Each character substitution for the classic detective story is here, and each one is well played.
879;the film wraps up cleanly and leaves the viewer satisfied.
880;Brick is definitely worth checking out, though.
