id;spiegazione
297;You'll be crying with Helen Hunt, laughing hysterically at Jack Nicholson's antics and will feel amazingly fulfilled when the beautiful ending rolls around.
298;As Good As It Gets is a modern classic.
299;It is funny and family friendly.
300;I would recommend viewing it to my friends and family.
301;The '97 release 'As Good As It Gets' is an immensely entertaining and touching comedy romance with the rare ability to make you cry and laugh simultaneously.
302;The storyline will hold your attention from beginning to end, the dialoque is crisp and original with a mulitude of memorable lines and Jack Nicholson, Helen Hunt and Greg Kinnear all deliver superb performances.
303;There are a lot of funny lines in this movie
304;As Good As It Gets is a classic in my mind.
305;hunt is excellent dealing with her life living with her Mother and Son, chronically ill withasthma type illness.
306;Very good off beat comedy.
307;The wife and I enjoyed it very much.
308;helen Hunt is outstanding in her role.
309;One of the best films ever!
310;The dialogue is witty, you care about the characters, and its fun, funny, sad and touching.
311;I loved this story, revisit it , if you've seen it, it's better!
312;Jack rocks in it, of course, as the other actors.
313;This is one of the best movies I have ever seen.
314;I had seen it before, but I love this movie and consider it a classic.
315;It's funny, sad, romantic .
316;If you haven't seen it yet, I recommend you do.
317;Magnificent performances by Hunt, Nicholson Kinnear.
318;Laughed until I nearly cried best thing is .
319;I loved seeing Jack Nicholson's character from start to finish.
320;I also loved seeing the way the characters interact with each other, which was definately a primary point of the movie.
321;I highly recomend this movie, especially to those who like movies that make you think about your own life, or that has a lot to do with the characters.
322;Jack nicholson is a good actor and I am sure it is a good movie
323;At any rate, if you saw it years ago, I recommend seeing it again.
324;I think this is very compassionate film.
325;The relationship between human and dog are very funny.
326;Good movie with good acting and a good storyline.
327;Jack Nicholson is much better in Something's Gotta Give but this is still a good, solid flick.
328;Jack Nicholson and Helen Hunt are great in this movie.
329;great performance from both stars.
330;i enjoy watching this movie.
331;this movie passes all these messages in a very eloquent way, and I higly recommend it.
332;I laughed so hard, so many times during this movie.
333;I have to really like it to do that.
334;I think everyone will love this.
335;he was so funny in this movie.
336;the whole cast worked perfectly together.
337;it's a movie with a message, but also some great laughs.
338;If you haven't seen it, this is a great movie, another must have for me.
339;But those are the top 2 signs of a simply fantastic movie.
340;Something that makes us feel.
341;And feel good about having the hard, ever surprising, magical gift of life.
342;As always Nicholson pulls off a masterful job of playing a wacko.
343;And that my friends is a rarity.
344;I'm new to the 'As Good as it Gets' fanclub sort.
345;I've also always enjoyed Hunt and Kinnear so it's a shoe.
346;in for me to enjoy this film right?
347;Right off the bat Nicholson is at his best playing the grumpy old man, but he always adds just the right amount of class and confidence to lift him from Walter Matthau status and place him in the Michael Caine league.
348;Unexpectedly Melvin forms an attachment to the dog and is somehow changed by his experience and moved to be a nicer, better person.
349;Carol and Melvin and Simon throughout the remander of the film form a bond that is both unexpected and remarkably beautiful.
350;Helen Hunt is wonderful in this film, as is Kinnear, but it's Nicholson's show and there isn't a better man for the show.
351;I have never watched a performance that made me more anxious then watching Nicholson say the WRONG thing everytime, but as Carol realizes, he has his moments, and those moments are about as good as it gets.
352;This a rare film about people learning to be with each other, coming together and recognizing each other's humanity and putting aside trivial differences.
353;Jack Nicholson and Helen Hunt, with help from Greg Kinnear, write true movie magic about helping each other, and how things should be.
354;type guy learns how to treat people with compassion.
355;He starts out hating, of course, gays, people of color, and women, but we see a tender transformation happen and it is remarkable.
356;Put them together and an amazing film comes out the end.
357;Recommended to anyone who is looking for laughs and chemistry between two people.
358;This is truly Jack Nicholson at his best.
359;You feel that saddness because you know you will no longer be able to enjoy any more of their work.
360;Luckily when that person has made some films you can look back at them at the prime of their careers.
361;It was our favorite half hour of the week for years.
362;But if you want to see the true mark of this man's sweetness there are two small roles in other peoples pictures that I love.
363;In Knocked Up he plays the perfect dad to his son Seth Rogan showing him that despite his screw ups he is still very much loved.
364;And in the movie here As Good As It Gets he plays the gift Doctor who changes the life of a sick childs family.
365;When he appears at their apartment you feel vicariously their relief and happiness.
366;Ramis perfectly portrays a man who is shy and embarassed by the attention but you trust he will make their lives much better from now on.
367;It was a perfect role for him because he made our lives much better bringing laughter into the life of millions.
368;I would highly recommend this film to all who are missing Ramis who passed away this week.
369;As Good As It Gets is one of the best comedies released in 1997.
370;Such comedy combines well with drama at the right places to give it the added flavor.
371;It combines attitude, laughter, romance, and family.
372;This movie rightfully earned seven Oscar nominations including Best Picture.
373;Nicholson's role has the intensity that gives this film the added comedy.
374;His research into his character's disease and his characteristics showcase very well.
375;As always, no words can express how terrific his acting is.
376;Her performance is enough to make an audience cry.
377;Greg Kinnear's Oscar nominated role as a depressed gay man is one of the best performances of his career.
378;All the other actors also performed wonderfully: Jamie Kennedy, Skeet Ulrich, Cuba Gooding Jr., and many more(even the dog).
379;As Good As It Gets is a great movie for those who are looking for a unique comedy.
380;I also bring this up because Nicholson won the Oscar for this role when he didn't bring home the gold for better work, but that's the nature of the beast.
381;Helen Hunt, on the other hand, gave the best screen performance of her career as the struggling waitress who relunctantly allows herself to fall in love with Nicholson's headcase.
382;It should also be noted that good work is delivered by Greg Kinnear as a gay artist, a change of pace for him from the usual cads he plays as well as Cuba Gooding Jr. as an art dealer.
383;This is a very good film but in retrospect I'm not sure it is worthy of the best picture nomination it snagged in 1997.
384;this was an okay movie.
385;it had some funny parts in it, but other than that it was okay.
386;We've watched this one several times and we love it.
387;In reviewing this movie, it's important to note the fine performance by Jack Nicholson for which he won an academy award.
388;The issue is whether Jack Nicholson is best actor or whether the award is for best performance by an actor.
389;the award is, in fact given for best performance.
390;With Jack Nicholson, you get the same person in every movie but wow, he sure plays that person well.
391;What I mean is that John Wayne played a certain type of personality, so did James Stewart and many others.
392;So to with Nicholson, you are always aware that it is Nicholson playing the role and, in effect, he is bigger than the role he is playing.
393;Anyway, Nicholson is great as Melvin.
394;Nicholson is perfect for the role and there's the rub.
395;Just as John Wayne was perfect for the role of a gunslinger out west, so to Nicholson is perfect for this offbeat role.
396;Nicholson won a previous best actor Oscar for One Flew Over the Cukoo's Nest.
397;As incredibly good as he is in his roles, does he deserve a second Oscar for playing his persona spectacularly well yet again?
398;I have no answer but, I recommend this fine movie and ask that you consider this question.
399;One of my all time favorite movies.
400;Nicholson is at his obnoxious but lovable best, Helen Hunt is a treasure and Greg Kinnear gives a touching performance.
401;This is a very entertaining movie and Jack Nicholson and Helen Hunt are terrific in their parts.
402;Jack is in his glory as an eccentric, which he plays well.
403;this is a funny film, with some of the greatest lines ever written for jack nicholson.
404;and he has had some great ones.
405;Jack Nicholson gives a great performance in this film and so does Greg Kinnear.
406;Helan Hunt also gave a good performance but not in my opinion an Oscer winning one.
407;This starts a topsy turvey love story.
408;Nicholson has some very funny lines in this movie which makes it a very funny movie who everyone should enjoy.
409;Jack Nicholson is great as an obsessive compulsive nutcase in this movie.
410;His attachment with his neighbors dog calms him down, and portrays that this type of person can be helped in our society.
411;It combines everyday people with everyday problems with a little love added to it.
412;I highly recommend watching it.
413;The role that Jack Nicholson plays is classic Jack and well suited for him .
414;Irreverant, witty, cocky, quirky and sometimes introspective.
415;It deserved all the awards and accolades the film received.
416;Brilliantly written, brilliantly acted and cleanly directed, this strange and wonderful tale is one of the best romantic comedies ever to hit the silver screen.
417;Jack Nicholson, as a weird and mean obsessive/compulsive writer named Melvin Udall, is even better than he usually is, and he is one of the great actors of our time, and even Greg Kinnear in a supporting role as the sensitive gay guy next door is outstanding.
418;of course I love impossible love, unrequited love, love that takes decades to culmination.
419;This is a case of impossible love come true.
420;Eat your heart out Nora Ephron!
421;james L. Brooks, who directed and who, along with Mark Andrus (from his story) wrote the script, is to be highly commended.
422;And a patient and caring, under.
423;appreciated Manhattan waitress in a house dress, finding not just love but somebody who really knows who she is and what she's worth is also just wonderful.
424;A wonderful movie to lift the spirit.
425;But As Good As It Gets is more than that.
426;The dialogue is sharp and witty and big.
427;city sophisticated and sometimes laugh out loud funny.
428;The underlying statements about relationships and love in urban America are subtle and thought.
429;In fact everything works in this movie, from the adorable little dog whom Melvin loves ( A dog.
430;[who has captured his heart] he tells us in amazement), to Greg Kinnear's character's friend (Cuba Gooding) trying to act tough, to Shirley Knight in a bit part as Helen Hunt's character's mother, to the cute little boy with asthma.
431;This is a wonderful movie, although perhaps not for those who are homophobic or 13.
432;This movie is absolutely one of the best movies to come around in a long time.
433;It goes down to the deepest levels of the human spirit, and triumphs.
434;Jack Nicholson gives his best performance since One Flew Over The Cuckoo's Nest and really shows us that anybody can become a better person.
435;(Kinnear gives an outstanding performance and should have won the Oscar for best supporting actor that year) He plays a man who after a brutal attack directed at him must come to grips with himself again and regain his self.
436;Also featured is Helen Hunt, who gives a wonderful performance as the waitress who waits on Nicholson at his favorite diner.
437;The character development grows between Nicholson and Hunt and Kinnear and Nicholson until eventually all three story lines intersect.
438;good movie, with rich, detailed characters portrayed by actors who fit into the roles like a glove.
439;This movie was nominated for many oscars, but this was the Year of Titanic, and pulled away with best actor and actress nods for Nicholson and Hunt.
440;When you watch this movie, you actually feel for these 3 people, and you want them to be happy with their lives, which is what's missing from many movies these days.
441;James L. Brooks, who is at his finest, co. wrote and directed this movie with such spirit.
442;This film is a triumph, on many levels.
443;love comes in a strange way.
444;It has a very happy ending.
445;It's one to watch over and over!
446;I think you will enjoy it!
447;Jack Nicholson continues his trend of being the best actor in Hollywood with the brilliant story by James Brooks (the Cheers guy) and superb performances by Helen Hunt and Greg Kinnear to aid him.
448;Nicholson is grand as an obsessive.
449;Just love film As Good As It Gets.
450;Jack Nickelson great actor, and movie is a wonderful escapist movie for me.
451;This movie stars Jack Nicholson, Helen Hunt, Greg Kinnear and Cuba Gooding Jr.
452;He is well known in Manhattan.
453;OMG Between Nicholson falling in love with the dog, and Helen Hunt who is a waitress that is nice to him helps Nicholson back into the human race.
454;There is so much more going on in this movie, fantastic comedy/drama.
455;Best actress went to Hunt Best actor went to NicholsonYou can not go wrong on this movie.
456;Good chemistry, lots of every.
457;day issues handled with reason, brings tears and laughter while tugging at heart strings.
458;Not a Jack Nicholas fan, but really enjoyed this movie.
459;Loved that it was a Prime Amazon gift.
460;it was a movie I would recommend to mature adults that love Jack Nicholson and have a good sense of humour.
461;Over the years I have been amazed at the ability of Jack Nicholson to successfully play such a wide range of characters.
462;at the start we find Melvin, a highly reclusive though extremely successful author, living alone in an apartment.
463;over time Melvin finds himself increasingly attracted to Carol, and when she leaves her job at the cafe he tracks her down.
464;although the movie is billed as a comedy and does have its funny moments, it is far more profound and poignant than is the typical comedy.
465;She did an incredible job in AGAIG.
466;Nicholson is a hoot as always.
467;One of the best actors ever.
468;blooded american guys like me who are crazy about Helen, that certainly was a nice and unexpected surprise.
469;Fantastic, looks and sounds awesome and by far the best looking this movie could be.
470;time favorite actor, and I have only seen one movie with him in it that was less than stellar, and that was Wolf.
471;As far as I'm concerned, this is probably his FUNNIEST and best movie yet!
472;He built it into one of his many monologues so that ultimately it moved from the oral to the written tradition in what we think of as Ancient Greece.
473;Having plenty of cash available, Brooks and his backers were willing to insure success by giving a great deal of it to Jack Nicholson and lesser amounts to his co. stars and the remainder of the cast.
474;The result: a first rate romantic comedy likely to make its two hours and twenty minutes seem but a few minutes of pleasure.
475;This is a good one likely to entertain most people
476;The surround sound and especially the dialogue very satisfactory.
477;A movie that relates to issues experienced by many people/families daily, and well portrayed through the movie.
478;The speed of ordering and shipping was exceptional.
479;esque character was the most entertaining part of the movie for me.
480;in with a penchant for saying exactly what's on his mind.
481;this movie renders some of the more classic lines in cinematic history, including Sell crazy some place else.
482;It was very well done and very smart in the delivery of a moral that's all about accepting the differences of those around us and living in a world where love and respect for said differences truly can conquer all.
483;Fully dramatic, heartfelt and genuine.
484;accepts that life is worth living .
485;as good as it gets.
486;helen Hunt is absolutely radiant in the role as the corner shop waitress who's forced to deal with Nicholson's habits .
487;and, much to her surprise and the audience, she begins to experience true emotion for the man.
488;He has bouts of great self.
489;esteem countered by comic moments of heightened anxiety, and the subtlety he brings to his portrayal is may be all.
490;hollywood but is surprisingly human.
491;a perfect mix, this film is about AS GOOD AS IT GETS.
492;This is a wonderful movie for anyone seeking to appreciate how challenges open new windows into ourselves.
493;The performances are outstanding and the chemistry between the actors elicits a full range of emotions from the viewer.
494;it is A great romantic comedy and showing Jack Nickelson at his prime
495;It's one you will want to re.
496;It's a classic for a video library.
497;it's a romance at its heart, yes.
498;But it's got at least 2 more subplots that are deeply moving, and not romance.
499;rich woman, or a gay, this movie has something to reward you.
500;If you're none of these types, you'll still deeply enjoy the comedy and pathos.
501;it's quintissential Jack Nicholson, and enjoyable for that.
502;Yet, they're deeply dignified, heartbreakingly engaging and believable.
503;there she is, doing well in that role, despite her obvious assets.
504;You'll feel the angst and dignity in each and every character in this film, and cheer for them.
505;liners, will stay with you for weeks.
506;I remember seeing this back in 1997.
507;I was pleasantly surprised when, watching it 15 years later with my wife, that it's just as good as I remember.
508;As Good As It Gets is about characters.
509;It'll make you laugh and cry at the same time.
510;I suspect part of what makes the movie so great is that there's a great cast of actors, including Jack Nicholson, Helen Hunt, and Greg Kinear.
511;This is one of the most memorable performances for all three actors.
512;i guess the best thing I can say about this is that it rises far above the romantic comedy genre.
513;This is a movie anybody and everybody can enjoy.
514;But this is gooddespite the comedy.
515;Thi movie is a feel good in mankind type of movie.
516;i loughed so hard, Jack Nicholoson is superb on this one.
517;His looks and his actions are very convincing.
518;He really strugles hard to make a compliment.
519;And Jack Nickolson offers us a great performance.
520;it's a must see for women and men alike.
521;He lives at an apartment in new york city.
522;There is also is neigbhor who gets mocked and made fun of by melvin almost everyday.
523;Until the day when his neighbhor gets beaten up and his waitress is at home taking care of her sick boy.
524;Could there be love in store for melvin?Filled with heartwarming moments, funny snappy dialogue, comedic moments, and good old jack nicholson atittude.
525;this is one story that answers the all time question:What if this is as good as it gets?
526;Well, as a movie buff, I sure hope so.
527;This movie has got just about everything.
528;She realizes this is As good as it gets, and has to make a choice.
529;So very many subplots, and contemporary statements made in this movie.
530;A great cast delivers moments of random charmed exchanges of humanity.
531;There are some really romantic scenes that I'd never expect from Jack.
532;This story is about a torturous and funny road to fulfillment and Jack's facial features carry the story from event to event.
533;Having two such characters in the same film is a treat.
534;This is a great film that has been around for more than 15 years.
535;The sound is also greatly improved.
536;What is also nice about this limited edition is that it contains a brief booklet.
537;It is full of stills from the film itself and contains a nice and informative article about this film written by Julie Kirgo.
538;Helen Hunt did a wonderful job playing off Jack's cranky character.
539;I enjoy watching this one over and over again.
540;A deeply troubled man and a harried single mother find peace and happiness in an unlikely relationship.
541;Nicholson is artful in his role as usual.
542;watched this movie and loved it again.
543;There is so much humor and that adorable dog in the movie.
544;It was great to see a great ensemble cast and how Jack Nicholson turns his life around.
545;This has to be one of the best movies I've ever seen.
546;All the actors did an amazing job bringing their characters to life.
547;And the chemistry between the three main characters is extraordinary and is constantly evolving.
548;The supporting cast enhances these dynamics.
549;The story is very easy to understand and adorable.
550;Nicholson once again steals the show.
551;And the ending is sheer perfection.
552;Thoroughly enjoyable and highly recommended, though not for the younger crowd.
553;I loved it and I'm confident you will as well.
554;This is an extraordinary romantic comedy that can be seen again and again with pure delight.
555;Nicholson stars in one of his best 5 roles of all time.
556;In spite of this fact, Nicholson is almost overshadowed by great performances by Hunt and Kinnear, especially Hunt.
557;the movie gives the viewer so much.
558;It is wonderful and amazing.
559;Seeing Nicholson's Melvin soften and melt with the dog and his gay neighbor is just terrific.
560;The film showcases Hunt's acting ability and her stunning beauty.
561;the movie is warm, witty, romantic, funny and very engaging.
562;This is one of the best romantic comedies I have ever watched with a lot of good life lessons in it.
563;This is one of the most best comedy to grace hollywood and the world.
564;i loved this movie and i'm sure you will too.
565;Its a six time oscar winner and eight time nommenee including best supporing actor (cuba gooding,jr).
566;This is my higest rated movie and its a gurantee that you will love it too.
567;It is a story of human relationships, of love and friendship, of new beginnings, and of how people can conquer their fears, how people can change.
568;mouthed and successful author
569;out waitress whose life literally revolves around her devastatingly allergic son
570;How these people meet, connect and react to each other is a stroke of screenwriting genius, producing a hilarious and touching story that I feel should have won best picture over Titanic.
571;Nicholson and Hunt readily deserved their Oscars for their exceptional performances, and I believe that Kinnear also deserved a win.
572;Watch for Cuba Gooding Jr. in a strong and witty performance as Simon's art dealer.
573;The last 15 minutes or so of this film contain the best ending that anyone could hope for outside of the Shawshank Redemption.
574;Check it out and enjoy!
575;One of the best love stories I've ever seen.
576;It has so much emotion and truth in it.
577;The story is conveyed very well and displays some of the best actinf I've ever seen.
578;A sensitive look at the locked in nature of Obsessive Compulsive Disorder with a feel.
579;Great acting from three major stars.
580;This is a great movie.
581;It is sad/dramatic at times but overall it is pretty amusing.
582;I think the best actor in the entire movie is the dog.
583;The dog is just amazing.
584;I absolutely love this movie and have watched it over a dozen times.
585;I can watch this movie over and over, is one of the great movies ever.
586;Jack Kicholson is just perfect on his performance, you cannot lose any movement or dialogue of this character.
587;I enjoyed reading the book and found the movie to be just as entertaining.
588;It is a great story and very realistic.
589;This is a touching story loaded with reality and laughter.
590;Jack Nicholson is superb in his role actually so too is the entire cast.
591;I would say it is a wonderful film for the entire family and especially entertaining to be sure.
592;There aren't many movies that you can watch several times, but this is one of those rare ones.
593;Jack Nicholson, Helen Hunt and the rest of the cast turn in a memorable performance.
594;inside this normal selfishness, the daily encounter with this single but very worried woman will become a real breakthrough in his values code.
595;through a smart script that includes a set of funny vignettes, the power of love will gradually loom and dictate finally the expected bliss.
596;Helen Hunt `s performance is impeccable
597;Cuban Gooding Jr is magnificent too in his brief but well reminded appearance, radiant, freshness and spontaneous humor.
598;And the breathtaking revelation of Greg Kinnear in his very difficult role, making to date his best achievement on the screen.
599;and for this lovable pet, a sonorous applause, one of the best dog performances ever made.
600;Dazzling direction and memorable artistic direction.
601;I believe that love is the best of things.
602;If you love and are loved, then you have hope that the world will become a better place.
603;His world opens up when he meets Carol, a gorgeous woman who is on the South side of a bad marriage.
604;Throw in a neighbour who is a rising artist in need, Jack's personality and an adorable little bow.
