id;spiegazione
1;This film is finally getting the treatment it deserves, a double.
2;discovered and newly discovered by Cronenberg and Criterion fans alike.
3;It's the organic nature of Cronenberg's style that sets him apart from everyone, period.
4;Because it's on and is certainly more entertaining than The Beachcombers, Magnum P. e. i. or any other Canadian television programming circa 1982.
5;office success, Videodrome (1982) marks the first time that Cronenberg creates a story revolving around a single character.
6;This is one of my favorites.
7;Basically, with this film you'll either love it and see it as visionary or hate it and think it's excessive.
8;with that said, the interface/menu on this is one of the best Criterion has done on any title, past or present.
9;There is, however, a nice set of vintage trailers which is probably NOT how you'd expect them to market Videodrome (though to Universal's credit, this would be tough to market today as well).
10;bucks for this great great film.
11;Combined with local favorite James Woods, it entertains you in a macabra way and is often compelling to watch though the movie itself is clearly a 'B' grade movie at best.
12;but for those into wierdness like yours truly this movie really fits the bill.
13;Even if there wasn't it makes for wonderful fantasy thoughts!I will admit that as a male fasinated with Debra Harry this movie is a perfect vehicle for alot of my fantasies about her.
14;Sardonic, visionary tale of an over stimulated society being transformed by its appetite.
15;Wow, now there's a dream job.
16;Father Brian O'Blivion is the funniest CEO since Burnbridge Waters in Champagne for Caesar.
17;I love that Sure, sure.
18;Icky special effects, sequences and a need to read between the lines makes this a hard ride to take but if you have the stomach and curiousity to make this ride you will be rewarded with one of the hundred greatest movies ever made and one that gets better and better with repeated viewings.
19;Nice cover and booklet, but that's all.
20;Debbie Harry gives an interesting performance, and James Woods does the same hyper.
21;Well im not quite sure, but believe me that it's a wild ride.
22;If you allow yourself to be taken in by the bizzare plot, you will enjoy yourself much more.
23;As in eXistenZ, the ending will provoke varied reaction, and much discussion)
24;The characters are far from sympathetic, the plot is often confusing and contradictory, and some of the dialogue is unintentionally hilarious.
25;Yet on the level of images and ideas, VIDEODROME is a rich, compelling experience which will take root in your brain long after the film is over.
26;Cronenberg's imagery, realized by FX genius Rick Baker, is incredibly sensual and powerful, using all the resources of the cinema to suggest multiple levels of reality and hallucination.
27;Harry's incredible charisma and style lend the role of Nicki just the right touch of simultaneous allure and wierdness (she is first introduced as an image on a TV screen, and actually spends most of her time in the film in scenes where she is clearly a hyperreal hallucination instead of a person.
28;She and Woods have a very believable chemistry and should have had more scenes together .
29;visual technologies since then have only underscored the seriousness and ambition of Cronenberg's vision.
30;Is the television screen now truly the retina of the mind's eye?
31;As previously I was impressed by the intriguing progression of the story (in its first incarnation .
32;The main character's vested interest in sado.
33;The intimation that our macabre obsession and media manipulation could ever contribute to the edification of anything remotely resembling Videodrome is both a strenuously unnerving and uncomfortably hilarious thought .
34;But despite this small failure, Videodrome is a remarkable film with an impressive commentary.
35;moving on to the supplemental material is another matter entirely.
36;one culminating the disparate talents of Mr. Cronenberg, John I made one good film then died into self.
37;abject torpor Carpenter, and John Landis into a discussion of film
38;A film that is as undercooked as Videodrome may seem tedious, but the social commentary grants it the impunity that will keep it on video store shelves everywhere for years to come.
39;David Cronenberg is obsessed with technology and body modification .
40;The performances are outstanding including James Woods at his most likeable, and Debbie Harry as a distant emotionally cold woman who is turned on by the atrocity that is VIDEODROME.
41;And now I finally boght it on Blu.
42;Cable's (& now internet and satalite TV) pushing the envelope with their programming.
43;And lots of other little extras that film lovers like me just love.
44;I have bought from them before this, and will do so again.
45;Great testament to the fear that rival underground factions will develop an undetectable means of controlling and mutating people in order to get the edge in their games.
46;The best expression of my opinion comes from Woods' supposed technical assistant when the truth about his role in things is revealed.
47;David Cronenberg is one of the greatest horror film directors to come on the scene.
48;His stylish mix of science fiction and horror gives us surreal films easily compared to directors like David Lynch amoung others.
49;Max Renn, played wonderfully by James Woods, has people go out and find new footage for the network to play.
50;an incredible film, with amazing performances from Debrah Harry, singer for the band Blondie, and Woods.
51;The film gives a surreal look at how what we see on television can control our lives.
52;I recommend it to anyone who loves Sci.
53;This movie is amazing in just about every way.
54;this movie is really weird, but great.
55;While some aspects of this movie don't age well (the focus on cable TV, video tapes), there are some themes about humanities relationship with technology that still ring true.
56;The SFX are pretty good for the time, and have a nice, organic feel.
57;James woods gives a tense performance, always seeming like he's on the edge of making something happen.
58;This film is an amazing weirdlook at how television can change your mind.
59;Im not a Cronenburg Fan but what he portrays is a techno mind twister that will keep you at your wits end.
60;Although people say its weird and disgusting, the whole idea and story is pretty incredible!
61;The image is crisp, clean, and debri free!
62;Sound is crystal clear, and takes you into the strange world of Videodrome!
63;James Woods is an extrodianary actor and fits the film well.
64;rittled bodies,a uniquely erotic sex.
65;Guess you'll have to see it.
66;This is Croneberg's best film (and that's really saying something).
67;Filled with intriguing ideas, slick direction, fine acting, and special effects that are just cool.
68;This (along with Brazil, Robocop, and Full Metal Jacket) is one of the best movies of the 80's.
69;There's a whole lot of stuff here that some people might not want to see.
70;This will change us as a society, as a civilization, even as a species.
71;I will give away part of the movie here.
72;i do recommend this movie.
73;Better to take a nap.
74;Better to watch an unplugged tv for that matter.
75;Contains lots of extras and looks great.
76;In the competitive market of cable programming, he fills a niche, and makes a profit.
77;It's definitely a puzzle, and all the pieces are there, it's just a matter of putting it together.
78;There is a fair bit of gore and surreal imagery, including the extra bit when Covex shows his 'new flesh' after a dramatic encounter with Renn.
79;Now, I knew I'd like it because I liked it before, but seeing it again after all these years, I think I understand it better now.
80;In most movies with hallucinations, you see what's really happening.
81;In Videodrome, much like Max, you have to discern what is truly real.
82;Canadian filmmaker David Cronenberg was fresh from the success of Scanners and this film would continue his fascination with blurring the boundaries between man and technology.
83;The folks at Criterion have now given it their deluxe treatment with a beautiful transfer of the uncut version and an impressive collection of extras for fans to enjoy.
84;It is a nice touch that enhances the experience of watching the movie.
85;The first is by director David Cronenberg and the film's director of photography, Mark Irwin.
86;This is a fascinating, thoughtful track as both men speak eloquently about their craft and the movie itself.
87;Woods, always the animated talker, not surprisingly dominates this track with his insight and entertaining comments.
88;The second disc starts off with a superb 27.
89;Effects Men is an audio interview with legendary make.
90;Fear on Film is a 26.
91;This is a wonderful extra for anyone who grew up watching horror films in the `80s.
92;videodrome arguably best represents Cronenberg's on.
93;going obsession with the merging of man and technology, flesh and electricity.
94;In this respect, it was very influential as evident with the same kind of ominous presence and effects of electricity as in David Lynch's Twin Peaks: Fire Walk With Me.
95;driven to clearly express the themes worked into the heart of the film.
96;It's easy to read a lot into this film, but that's as much of a credit to the viewer as it is to the filmmakers.
97;still, Videodrome is certainly a fascinating, unique film that compels the viewer to contrast the interplay between video and real life in our increasingly technological age.
98;TV defined the news, fashion, the latest fads, etc.
99;At least in my case, this robbed this otherwise perversely fascinating film of much of its power.
100;It's a world you have to accept first in order to enjoy the movies of this canadian director.
101;vIDEODROME is a very ambitious movie about mass manipulation through television images.
102;sterile perfect, but you knew that already: James Woods is seamy, desultory, wicked, precise.
103;Deborah Harry was born for this role.
104;always a visionary cartographer of the boundaries between the mind, the flesh, the Id, and high technology.
105;knows where he wants to take it
106;Soon our unenviable Mr. renn illustrates an entirely new meaning of Plug and Play.
107;The transfer is clean and crisp, which is precisely what you want in a flick where Deborah Harry's lips get plastered across the telescreen.
108;Cronenberg's commentaries are always intriguing, chiefly because he knows to fill in a few gaps with nuggets of information (like telling us that one of the Japanese porn producers in the film later went on to become Canada's Minister of Culture.
109;Best of all, this tasty special edition is served up like an old VHS Cassette with Videodrome 'hand.
110;in the final analysis, Videodrome is a film 20 years before its time.
111;it's good, don't get me wrong, just that it's one of those movies that messes with your head.
112;VIDEODROME is one of David Cronenberg's finest films.
113;While not for everyone, it is sure to provoke some interesting reactions.
114;the new transfer looks amazing, this is the best I have ever seen this film look.
115;The first is with Cronenberg and his D. p. Mark Irwin.
116;It's a very informative track.
117;Cronenberg always gives great insights into the workings of his films, while at the same time leaving just enough for the viewer to still have some questions to be answered alone.
118;The second track is with the films stars James Woods and Deborah Harry.
119;Woods is great while Harry doesn't really have much to say.
120;Still it is well worth a listen.
121;This 6 minute piece is amazing, thought provoking, creepy and even a little funny.
122;It is an excellent companion piece to Videodrome.
123;A must see for fans!DISC 2.
124;They are all very interesting for fans of the film and for those interested in special effects in general.
125;While not the most exciting convo fans of the three will enjoy it.
126;This disc also has stills from the set and lots of behind the scenes stuff as well.
127;The film is amazing and the extras are a lot of fun.
128;For sci fi fans, Cronenberg fans and those who like intelligent cinema this is a must have.
129;david Cronenberg is a consistently interesting filmmaker and his major themes are on display here.
130;the question of identity and the ways, both physical and psychological, that man is transformed by his technology.
131;Videodrome is prescient in the way it forecasted the ever.
132;increasing levels of depravity and sensation that has become available in the media.
133;All the pieces fit together.
134;Surreal experience and Cronenberg's best film.
135;James woods is awesome as always.
136;This was the film that opened up the very strange but fascinating world of David Cronenberg to me.
137;I have seen nearly all his films since then, and this remains one of his boldest and his best.
138;there are some jaw dropping visuals here, from breathing VCR tapes to melting body parts.
139;he always uses his gore as symbolism or as punctuation to tell us we have hit a major segment of his film.
140;Let me add Cronenberg got strong performances from the reliable James Woods and to everyone's surprise Deborah Harry from the rock group Blondie.
141;Cronenberg's interest in exploring the relationship between male and female, both within and outside a sexual framework is never fully formed.
142;Cronenberg's suggestion that viewers' demand for more unbridled sex and violence on television is leading humanity to a very dark place is his most consistent point throughout.
143;But it is in entertaining film if taken for what it could have been.
144;The movie has captivated me since I was a teenager.
145;esque world portrayed here by Cronenberg is dark and stark, providing the perfect ambience for this sinister story.
146;brilliantly brought to life by James Woods as a low.
147;Deborah Harry is perfect as the hot.
148;blooded and kinky Nikki Brand, a thrill.
149;The topic of media control of the mind is always relevant, and explored very creatively within the frames of this film.
150;This movie was a lot better than I had expected, and definately stands amongst Cronenberg's best films.
151;If you enjoy dark psychological science fiction, you will love this movie.
152;I've seen a lot, however Videodrome still manages to give me chills.
153;It's a genuinely creepy movie, and the weirdo special effects are something to behold.
154;Who could forget the images of the breathing videotapes or the cassette slot opening in James Woods' stomach?Videodrome is highly recommended for fans of bizarre, twisted films and especially David Cronenberg fans.
155;This is a chilling tale of what the future of TV could do and one man's descent into fantasy world by watching a 50 second clip of a snuff movie .
156;It is a complicated enough journey into seeing where reality lies and where fantasy begins .
157;As always with most Cronenberg films there is a lot of gorey parts to keep you satisfied .
158;As for the ending ( which I don't want to give away ), it leaves a permanent mark in your mind and leaves you wanting more
159;Part of me wants to give this movie 5 stars, but I can't quite make myself do it.
160;This film has strong performances, some very original and intriguing effects and some interesting ideas, but the plot falters a bit towards the end.
161;But, what is there is very good, so it's certainly far from a total loss.
162;One of his employees catches a portion of a new broadcast: Videodrome.
163;james Woods is one of the great strengths of this film.
164;He plays Max as a total sleazebag, and he's both very convincing, and kinda charming and likable in spite of his nature.
165;Though these themes are interesting to consider, they're more interesting in the way they are portrayed on the film, allowing for some interesting visual ideas.
166;Suffice to say, these visual ideas are some of the most intriguing parts of the film, and 'Videodrome' deserves to be recognized alongside 'Blade Runner' and 'The Thing' as visionary films which display practical special effects at their best.
167;it's generally more entertaining than the first 2/3.
168;The picture looks great, multitudes better than on the cheap one, and the packaging in very cool and classy.
169;somewhat flawed, but innovative and distinctive film making.
170;Watching this film in the context of our modern reality brings a whole new dimension to this film, above that which writer/director David Cronenberg probably originally intended, and because of that, I did find myself appreciating aspects of this film.
171;comings make it unlikely that I will ever watch it again.
172;I'm a Canadian myself and his later work is compelling.
173;cGI, their effects hold up over time while Videodrome's just look a bit silly.
174;Much in the same way that movies about the internet at the beginning of its arrival seem hilarious in their perspectives about what the net could be used for, Videodrome is a consideration of what mysteries lay behind analog video.
175;Criterion's print is beautiful and the colors are crisp and clear.
176;Extras are interesting, and the packaging is made to look like an analog tape from the era .
177;i recommend Videodrome for people who are compelled to watch ALL the Criterion films, fans of Cronenberg, and special effects junkies.
178;It's worthwhile primarily because of its position in time and in Cronenberg's career.
179;David Cronenberg had set a standard for creativity and will continue to spark inspiration for future filmmakers, years to come.
180;There were no problems with the product when i recieved it, i got it right on time, and overall i was very satisfied.
181;Cronenberg is able to do such a good job at making the most salacious sado.
182;He also makes a naked Deborah Harry about as sexy as a dishrag.
183;does this film make a statement, well yes, but the real question is: Is it worth listening to the message?Zeb Kantrowitz
184;It came in excellent condition brand new fully wrapped in plastic wrap.
185;VIDEODROME is finally getting some respect after all these years.
186;True, it is extremely bizarre and one viewing will never answer all the questions that it puts forth, but it is an incredibly ground breaking film that deserves multiple viewings.
187;And what better way to get back to the movie than with this stunning 2 disc release.
188;Even with that complaint, I assure any one interested in this set that it is worth every penny.
189;The extras that you do get are amazing.
190;For all of you rare people that are unfamiliar with David Croenberg, he is the maker of the new A History of Violence.
191;This is one of his most famous movies and rightfully so.
192;It is a masterpiece, a visionary experience from 1983.
193;even though it came then, it has absolutely unbelievable special effects.
194;The special effects notably found in the hallucination sequences are magnificent and stunning.
195;this is James Wood's best movie who gives a good performance playing, Max, the owner of channel 83, hard core stuff.
196;he is a perverted man, and he has a bizarre relationship with his girlfriend.
197;He realizes that this trully is real.
198;This program called Videodrome has a spell on him and causes him to hallcinate in very original and very well made sequences.
199;But can Max overcome this posessing power.
200;the movie combines lots of fantasy elements along with science fiction and is definitely out of the ordinary.
201;It is hard to understand at times and very creative.
202;Sawing people up in GTA!And that is the genius of this movie.
203;This movie is in all fairness a critique of thesociety but it does it in such a cool and creative way that it's hard not to love it.
204;videodrome is a piece of genius, Croenberg's best, and one of my favorite movies.
205;It is brilliant, disturbing and creepy.
206;The world we live in is trully a scary place and this movie shows that.
207;The visual effects are jaw dropping (1983!
208;it is a masterpiece, a chilling tale, a true tale, a fascinating tale.
209;It's so creative and the hallucinations will have you fully engaged.
210;Croenberg (writer + director of this movie) is definitely a very creative man and I applaud him and praise this masterpiece.
211;Another Cronenberg film that indelibly etched haunting images into my brain.
212;This film is more true today than it was when made, considering the internet and its unlimited access to such prurient material.
213;If any film deserves to be called a modern classic, it is definitely Videodrome.
214;The cast is brilliant, and Cronerberg seems to get his normal sleepy performances from everyone involved, including Woods and Deborah Harry, lead singer of 80's band Blondie.
215;This is an abosolutely outstanding film that touches on a subject that is still hush hush in today's soceity.
216;It is a movie for everyone.
217;This movie opens up a world that was startling 30 years ago, and is astounding now.
218;The most original concept to actually see production in the last 50 years.
219;This is a superb film, presented impeccably by Criterion Collection.
220;One of David Cronenberg's most transgressive and daring films.
221;Good special effects, too, which remind us of how many weird and fascinating effects can be accomplished without the use of CGI.
222;Bought this for a friend of mine who is a HUGE fan of Videodrome, and in a word she described it as perfect!
223;james woods and deborah harry give great perfomances in this highly stylish thriller.
224;It certainly inspired the concept of the RING series.
225;harry's character is a kinky radio personality who finds a new form of life in videodrome.
226;this film makes you think, and every time I watch it, it gives more space for interpretation.
227;it is a great movie to watch while under the influence of psychedelics.
228;After more than 20 years it is still one of the most daring and original sci.
229;Cronenberg strikes a perfect balance between sensuality and depravity, hallucinations and reality, ideas and imagery.
230;James Woods is perfectly cast as the oily Max Renn, Debbie Harry brings a vacant sexuality to Nikki Brand and the effects, while somewhat dated, are still quite distrubing.
231;As you watch this film .
232;and it is one that truly benefits from multiple viewings .
233;you will actually see the moment where a filmmaker hits his stride, and it's a wonder to behold.
234;This is the definitive Cronenberg movie.
235;after watching this I thought that this was a very Cronenberg film.
236;the acting is very good
237;The rest of the cast was fairly unknown to me, but they delivered a good enough effort considering the material they were presenting.
238;The double ending was well thought of by the way.
239;A remake should be made of this movie every twenty or so years to keep it fresh.
240;A virtual entity wants to become one with the original technology, that of the human body.
241;Videodrome is one of Cronenberg's finest films.
242;It's sick, twisted, and superb.
243;The last scene where him and his brother have a scan off, his transformation was very intense.
244;But this release for like 8 or 10 bucks is well worth it, especially for Cronenberg fans.
245;my favorite Cronenberg, in order is.
246;james Woods is good in almost all he's done.
247;Debbie Harry sexy and exotic as the masochistic Nikki.
248;This review is more about why this is one of the greatest films of all time.
249;age human with a body that mutates via hallucination.
250;Cronenberg gathered many parts of a script and ideas together to create a near avant.
251;This movie sets the thriller basis for which The Matrix and The Ring would so heavily borrow from.
252;The commentary from Cronengerg and James Woods is particulary interesting.
253;The extras on Disc two feature excellent interviews with the special effects team, and a TV interview show from Canadian TV with John Carpenter, John Landis, and Cronenberg.
254;The making of film is good and the actual torture and porn videos shot especially for the film are just bizzare to see, and they are provied with commentary.
255;I love this movie, I always have.
256;In fact, the dating of the effects adds significance to the visionary horror concept itself, light years ahead of its time.
257;This is Cronenberg's masterpiece and everyone associated with it can consider themselves lucky.
258;Cronenberg at the top of his game.
259;An amazing director, that all the world will hail a genius when he is gone.
260;This film is really impressive when you consider what Cronenberg was doing with special effects in 1983!
261;I recommend watching this movie in the dark and late at night .
262;Leave it to Canadian horror maven Cronenberg to concoct a bizarre but intelligent paranoid chiller involving televisual mind.
263;Woods is impeccable playing a man whose fetishes and voyeuristic tendencies in some ways mirror our own.
264;Blondie singer Deborah Harry is also surprisingly strong as Renn's kinky girlfriend.
265;This brutal Cronenburg film began with an intriguing story.
266;The hallucinating effects are brilliant, as is James Woods performance.
267;This film, like many of Cronenberg's, was way ahead its time.
268;This film really deserves Criterion treatment.
269;all it is is just something that flows and weaves, flows and weaves.
270;This has been a popular criticism of Cronenberg's as well (in this movie and others), since Cronenberg often avoids conventional plot structure.
271;This film is interesting, it is thrilling (Woods' performance is electric).
272;Videodrome is the better of the two.
273;It is rawer, cheesier, more visceral.
274;and again, Woods is terrific.
275;The nervous energy that is seen in all of his work suits this material perfectly.
276;This film is labeled as science.
277;Deborah Harry's sultry performance is one.
