id;spiegazione
278;She looks pretty good as a redhead too.
279;As many reviewers have already noted, David Cronenberg's 1983 film, Videodrome, is both grotesque and intriguing.
280;While I am not a horror fan by any means, and this movie has frequently been described as a thinking man's horror film, I found it engrossing.
281;I would highly recommend this film to anyone who is willing to take a dark, hallucinatory journey into the world were biology and technology quite literally become one.
282;fi classic that is far better received (and understood) today than it was during its initial release.
283;the picture is crisp and the best it's ever looked, the special features are interesting and probably the best the fans have gotten or will ever get.
284;However this is easily one of the ones I'll be eager to show off and it's one I'm proud to have in my collection.
285;an amazing disc for an amazing movie.
286;Was really impressed by this along with the condition.
287;James Woods can make the best of any script, Deborah Harry didn't embarrass herself, and we can take comfort in the fact that Rick Baker's visual effects will improve considerably from these rough forms seen in the movie (yuk).
288;Max's job is to search and find programs that keep pushing the aggressive nature of the network and can keep the viewer numbers up.
289;This shadow land draws the audience into a paranoid cinematic experience where the threat is located directly in front of them, the television.
290;The exceptional special effects are a big part of creating the bizarre atmosphere, which are startling with the breathing video tapes, open stomachs, and a sensually moving television.
291;When Videodrome's end credits roll over the screen the audience will have experienced a truly unique film, which will cause much room for debate and pondering.
292;Debbie Harry does a great performance as a kinky talk.
293;she and Woods have great chemistry together, and it was too bad they didn't have more scenes together.
294;The footage looks realistic enough for him to suspect it may actually be snuff, so he starts to investigate further.
295;one, including the viewer, is quite sure what's real.
296;this movie is really bizarre, even for David Cronenberg, but his movies are always really cool, original, and fascinating (with the exception of Crash, which I actually dozed off during).
297;Rick Baker's FX are great, there's all kinds of funky bio.
298;The answer: because it is absolutely mesmerizing.
299;Barry Convex is actually a very well placed pun.
300;In any case, the movie, while extreme, is definitely worth seeing if you can take the violence and the lurid atmosphere.
301;David Cronenberg's VIDEODROME, his 6th movie, was the first of his great films.
302;Fans of cronenberg a must!
303;David Cronenberg directed this bizarre masterpiece about a man who is losing his grip on reality after watching a snuff film over a pirate broadcast.
304;The film is very unique because it shows you almost exclusively what Woods himself sees and experiences.
305;While a few ideas are dated (especially the size of the televisions shown and betamax tapes) this is one of the more original films you will ever see.
306;ray has held its value.
307;with the knowledge I'll be sounding like a pervert, I got this movie just to see the whole clip and then on the way, I was cast into a Twilight Zone typical movie that made me wonder just what was real and what wasn't.
308;It's an interesting movie in which Wood's character is showing soft to hard pornography on his channels.
309;there are a lot of positive aspects to be extracted from this movie, and being a huge fan of Cronenberg I was expecting to be as enthusiastic as everyone else about this one.
310;on the positive side, Videodrome IS a bit of a sly satire on television that's still relevant today.
311;Cronenberg's script is stuffed with issues of social and political importance, so much that it takes a few viewings to completely observe his intentions (the mark of a good film).
312;david Cronenberg is one of the most talented directors working today, and Videodrome IS a good movie, but.
313;What can one say about David Croneneberg's Videodrome?Just that it's one of his most interesting films.
314;Cronenberg's filmography is truely unique and strange.
315;I recomend watching this masterpiece of the 80s, and especially the Criterion Collection edition.
316;masochistic by nature, you might enjoy it.
317;His modern movie scores are much better.
318;Max Renn (masterfully underplayed by a top.
319;edge shows (most of which involve pornography and violence).
320;like most of Cronenberg's films, Videodrome is a viscerally dizzying experience, and one that is bound to leave you scratching your head.
321;For its time, the special effects are well done: televisions pulse like living blocks of veined flesh, guns graft themselves to hands with bone.
322;Videodrome is, most obviously, an unabashed critique of the culture of mass media (and, yes, the movie is aware of the hyper.
323;In some ways, this is what makes the flick a wonderful thing to watch .
324;Cronenberg takes pains to blend his motives within his films.
325;The carrot, in this case, is the promise of meaning and cognizance.
326;didacticism, especially when it is dressed with this kind of throbbing, unsettling flesh, can be distasteful for some, and it goes without saying that, for most, Cronenberg is an acquired taste.
327;But beyond the validity of any point he is trying to make with Videodrome, it must be said that the way he makes that point is certainly compelling.
328;great fx and fun stroy, and like Dr. Oblivion, as a public access cable producer myself.
329;It's my personal favorite of Cronenberg's films.
330;radio host Debbie Harry into the other world of Videodrome.
331;He manages to track down it's source and discovers the ultimate takeover using the new flesh.
332;Incredible special effects and in one scene hand gun takes on an all new meaning.
333;Just watch it and judge for yourself but be aware this is an intense and graphic film.
334;Fascinating viewing and absolutely bizarre.
335;This is one of those films you absorb rather than follow.
336;This is a frightening Acid Trip through bizarro reality with cool and gruesome special effects and an atmposphere that's imposing and engrossing.
337;Great transfer, solid extras, commentary, but no surround sound?
338;Cronenberg explores a wide range of issues and combines intellect with imagination to create something special, from the philosophies of Prof. Brian O'Blivion to Max Renn's concerns about his exposure to a satellite TV station that seems to transmit nothing but snuff movies.
339;Soon, all of us will have special names .
340;Rick Baker's special effects are great.
341;Overall, the movie is unsettling, complex, and stands as an exemplar of David Cronenberg's best work.
342;It is complex, but viewers of Videodrome are supported by the material to a greater degree than is the case with many of David Lynch's movies.
343;Everything in my opinion is absolutely perfect, from facial expressions, to hand movements, to dioluge, is just perfect in every way possible, and I could not ask for anything more.
344;the special effects are mind.
345;this Criteion print is, for lack of a better word, beautiful.
346;Featuretes on the special effects of Videodrome, and my favorite feature, a roundtable discussion with directors John Carpenter, Mick Garris, John Landis, and David Cronenburg from 1982 discussing horror films in general.
347;One of my favorite movies with John Hurt, John Woods and Deborah Harry.
348;A group working with a media philosopher (a nice parody of Marshall McCluhan) has created a signal that can be superimposed on a video program that will, quite literally, mutate the brain.
349;videodrome is a wonderfully original movie that mixes a well crafted script with some novel (for the time) special effects and a marvelous darkly comic sensibility.
350;Puns abound
351;integrated into society by providing them with exposure to television.
352;All in all, a compelling and original film that will delight any fan of cult films and erotic horror.
353;This is one of those movies that can suck you into it it's story waiting to see what happens next, and then literally shoots itself in the head in the end.
354;He soon finds he is in over his head when he begins to discover the mysteries of these broadcasts, and the effects they when you view it.
355;It's effects are decent for the time.
356;I must say tho, Jack Creley had a decent performance.
357;I actually thought he was Vincent Price, and i'm sure he was impersonating him.
358;He did a pretty good job of that.
359;I see this more as just a cult favorite of those into the directer/producers work or fans of the time who hadn't seen something like it before.
360;or a bigger one than it did.
361;One of the best movies ever made.
362;Cronenberg hit top form and top weirdness with this one.
363;The best way to watch this film is to have very little knowledge of what it is about before seeing it.
364;Other reviewers here have eloquently described all the fine points of this movie.
365;Like Cronenberg's other films, there is a method to the madness, with links and themes to the media and a scathing social commentary on the media run world we live in.
366;Television and video games draw us into alternate worlds and perhaps lodge into our sense of what is real more than we realize.
367;The greatest visionary of our age, and a genius of the screen.
368;The new flesh has come, go back in time and be reminded of the days when it had just been born with Videodrome.
369;The Criterion Edition of this film is a very nice edition to any collection.
370;Much nicer and pleasant to enjoy.
371;Lots of slimy special effects including a man who turns inside out after being shot and a pistol that fuses to Woods's hand.
372;Overall, a highly enjoyable and yet somewhat confusing film from the great master of biological horror.
373;James Woods is excellent as Max Renn, the cable station programmer who's violent program lineup provides an outlet for the viewers frustrations.
374;He believes his search for the perfect show is complete when he accidentally taps into a program called 'Videodrome' on a pirate satellite.
375;Cronenberg is a director unlike any other.
376;The subtlety of the plot makes each scene more abrasive in its aim to shock the viewer and the special effects really set the bar to the era this film was made.
377;Also the developement of Max Renn's character is convincing as he is becoming more and more desensitized to The Videodrome until the boundaries between the two subjects become blurred and Max inevitably becomes a monster as a result of his exposure to it.
378;By interpreting it in such a creative and entertaing way do I rate Cronenberg as being of the greatest science fiction storytellers of late, portraying the plight of human existence in the realm of technological overstimulation.
379;A must for any modern science fiction or post.
380;Given the rise in cable TV and reality programming of 2001, this now 20 year old film is like an eerie glimpse into the seedy side of modern entertainment.
381;Great f/x, fantastic kinky scene where Woods' pierces Harry's ears while they make love.
382;addict role that he plays so well, is a television producer for an underground station.
383;There is something Videodrome has that you dont have.
384;If you catch yourself sliding into a hallucinatory trance, just sit back and enjoy it.
385;This is one of Cronenbergs best films to date, also one of his most odd.
386;This movie is great and this criterion version is stunning!
387;after it was over, we just sat there and thought What the !
388;truly memorable (She was the hottest punk rocker at the time.)
389;The unrated director's cut is the way to go .
390;the included items and features are about as good as it gets for an old movie.
391;It's quite complete and well done.
392;Definitely a cult film and by far, one of the best Criterion releases (cover art, features, booklet, etc)This movie is bizarre, gory, provocative, insane and surreal.
393;His hallucinations eventually begin to transform his body, and he peels back the mystery of what Videodrome actually is.
394;this is a great film.
395;I loved it, and I'm a general fan of the Criterion Collection's library of films.
396;It has a beautifully designed case, and essays, and pleant of extras, as you would expect from a Criterion release.
397;overall, I'd say that the Criterion version of the film is worth it.
398;Over twenty years have passed since the release of this movie, and it still continues to amaze, confuse, disgust, and genuinely entertain viewers.
399;David Cronenberg struck us with ideas that are still frightening to this day, and we love him for it.
400;If you like your movies clean cut and wrapped up nice and neat, do not attempt to watch this.
401;Though not as out there as a David Lynch movie, this will surely have you questioning what happened several times.
402;The best version of Videodrome to be released.
403;One of the best psychological horror movies ever.
404;Without the technology of today he still produced great effects
405;James Woods gives a good performance as the main character who takes the next step and is transformed into the new flesh.
406;David Cronenberg made this film way back in 1983, back when t. v. was still somewhat good.
407;needless to say, this movie is incredible.
408;Add to his performance an incredible performance by a beautiful (and naked) Deborah Harry (singer for Blondie), and you've got one of the scariest, yet most thought provoking movies of all time.
409;this movie also wins my award for the finest ending in a movie I have ever seen.
410;James Woods says his final line with such conviction that it just adds a huge level of Wow to the movie.
411;David Cronenberg is a unique filmmaker whose vision of the world is somewhat skewed as compared with the rest of us.
412;Well that is one possible interpretation of this film, in fact he could equally just be pushing the boundaries a bit further himself.
413;He discovers Videodrome, or is a duped into discovering it, and from that point on starts to hallucinate.
414;Cronenberg is Canadian and this is a Canadian film.
415;provoking and strangely entertaining movie that I look forward to watching again.
416;It has a dystopian flavor to it, and, as phantasamagorical as it is, it commands your silent attention.
417;An adventurous film, one filled with strangely compelling sounds and images .
418;more than worthy of the praise it receives here.
419;It fits like a glove and demonstrates the kind of creative brilliance that exposes today's big.
420;It is more of a look at perception and the drug like manifestations of technology on the mind.
421;One of Cronenbergs best and most startling movies .
422;'videodrome' will have you very wary of computers, television, and technology long after you thought you shook away the Kafka like anxiety of modern times.
423;All of Cronenberg's movies confront some aspect of hallucination and perception .
424;Funny and disgusting, and certainly a cult classic.
425;Inviting extremes of response from disdain one of the least entertaining films ever made ) to academic euphoria, it's the kind of film that is simultaneously sickening and seemingly devoid of humanity, but also blessed with provocative ideas and a compelling subtext of social commentary.
426;giving yet another powerful and disturbing performance, James Woods stars as the operator of a low.
427;A potent treatise on the effects of total immersion into our mass.
428;media culture, Videodrome is also (to the delight of Cronenberg's loyal fans) a showcase for obsessions manifested in the tangible world of the flesh.
429;It's a hallucinogenic world in which a television set seems to breathe with a life of its own, and where the body itself can become a VCR repository for disturbing imagery.
430;unsettling, intelligent, and decidedly not for every taste.
431;videodrome is a really original film with plot elements which I think are likely inspirations for the Matrix films and The Ring.
432;the film has some very interesting scenes and special effects including a gun that comes out of the TV that can best be described by seeing it yourself.
433;Disc 2 contains a new documentary on the film's makeup effects titled Forging New Flesh, an audio interview with the film's special makeup effects creator and the video effects supervisor, a 26 minute scene from a Canadian talk show that has talks with David Cronenberg, John Carpenter, John Landis, and Mick Garris.
434;That is all I have to say.
435;james Woods does a great job asthe thrill seeking cable programmer.
436;Debbie Harry makes herdaybue, and plays James love interest.
437;All well and good, but they COULD have included an alternate 5.1/DTS track.
438;A lot has been said and written about Videodrome's influence on modern horror cyber.
439;criterion continues to deliver the ultimate package of movies that matter.
440;Being an avid David Cronenberg movie fan, I've come to appreciate the suttle details in his motion pictures that contribute to the macabre horror in his creations.
441;Videodriome is a movie I've been a fan of for years.
442;The best part of the film is that any day now Fox will greenlight a reality TV show where twenty.
443;When he finds this fettish show called Videodrome he figures he wants more so he can place it on his network.
444;But it's the sexual undertones that rreally set this apart.
445;Okay, so i got nothing better to do on a friday night, so i take out the VIDEODROME tape (out.
446;It's so unique, and even though you wanna turn off the VCR and watch CLERKS or something, you keep watching, because it keeps getting more and more intriging.
447;David Cronenberg's Videodrome has become something of a cult classic since it was released in the 1982.
448;Criterion has done a superb job of creating the ultimate edition of this film.
449;There's a nice, pleasing noticeable level of fine grain and I doubt the film has ever looked this good.
450;the print is the version that Cronenberg submitted to the MPAA prior to additional trimming to bring the film in line to what the MPAA considered an R rated film.
451;the audio soundtrack sounds extremely good with a 24 bit transfer.
452;Dialogue is crisp and clear and Howard Shore's creepy sythesizer based score sounds marvelous here.
453;the first features Cronenberg and his DP Mark Irwin discussing everything from the themes of the film and how the photography embodies them to technical challenges they faced in shooting the film.
454;Woods is quite talkative providing considerable insight into his role in the film and what attracted him to working with Cronenberg.
455;It compliments Videodrome perfectly almost like an extension of some of the themes from the film.
456;we also get a very good documentary Forging the New Flesh that examines Videodrome within the context of its time and its relevance today.
457;There's also Effects Men an audio interview as well as the complete footage from the Samurai dream sequence.
458;fans of the movie know the rest of the important plot points and discussing anything else would be major spoilers but if you've seen any of Cronenberg's other films you'll get a sense of the general direction of THIS film.
459;Videodrome is a rare jewel which could easily have been made in the 21st century with modern effects, but being an older film relies on the basic most important ingredient.
460;Cronenberg is a genius, period.
461;Great cast and genuinely original idea.
462;The best movie of the early 80's, for it's vision, for it's philosophy, for it's images and ideas, Videodrome is my favourite David Cronenberg movie, along with Crash and Naked Lunch.
