id;spiegazione
280;Impromptu is a delightful historical romance about the long, tumultuous love affair between composer Frederick Chopin and novelist George Sand.
281;None of this much matters, though, because the movie doesn't pretend to be strictly accurate historically and because it does a good job of capturing the spirit of the times and of its characters.
282;judy Davis is marvelous as George Sand, a brilliant, eccentric woman who eschewed the social mores of her time.
283;Both Sand and Peters have substantial supporting roles, as do Emma Thompson and Mandy Patinkin.
284;The cast alone makes Impromptu worth seeing.
285;Also enjoyable is the soundtrack, almost all of which is taken from Chopin's works.
286;As entertainment, it's first rate.
287;Truly amazing characterizations and reall beauty to tge music
288;Davis, Grant and Sand were at the top of their game.
289;A very well produced movie.
290;James Lapine is best known as a playwright and director.
291;He is most famous for his collaborations with Stephen Sondheim including Sunday in the Park with George, Passion and Into the Woods.
292;He brings this talent to the big screen.
293;george Sand was a great French writer.
294;She wrote under a man's name and dressed like a man.
295;She treated men as playthings.
296;this is a brilliant romantic comedy with a cast of up and coming actors.
297;This is another great meaty role for Judy and she eats it up.
298;Hugh Grant was a relative unknown when this film was made but this film would be the first of the quintessential Hugh Grant characters.
299;if you are looking for something witty and intelligent, Impromptu is definitely the film to watch.
300;This is an ok movie.
301;love the genre, love the actors, didn't like this movie.
302;I'm a pianist and fan of Chopin and loved peeking into his life.
303;The story was full of eccentric, artsy characters all played by well know actors and actresses.
304;I know they had to have fun doing this movie.
305;If you don't know much about Chopin or the artists of that time period you would still enjoy this movie.
306;You have a great cast, admirable production and producer/directors of note.
307;Have read book about Chopin and not quite sure this movie is totally accurate.
308;in any case, the film was wonderfully written, acted, directed, photographed, etc.
309;I enjoyed the acting and the way it was presented.
310;Definitely not worth the time used to watch.
311;I enjoyed the story and the actors were good.
312;Scenery, set design and costuming were proper for the period and believable.
313;NOTHING like the normal period drama I love.
314;A fun and imaginative movie about the relationship between Chopin and George Sand (Aurora Dupin).
315;Not historically accurate but it is a comic romance so who cares?
316;Wonderful performances by all involved.
317;The cinematography was worth watching the movie for as the film was made in France on location.
318;I love horses and that detail made my day.
319;I was so inspired by this movie I have since read two of George Sand's novels and have always loved Chopin's music.
320;BTW the movie is filled with Chopin's music.
321;Pretty fanciful in a lot of areas as well.
322;It also affected some the musical passages.
323;A light and frothy, inconsequential but enjoyable romantic comedy about the romance between Frederic Chopin and George Sand.
324;The narrative is somewhat undisciplined, but there a number of comic episodes and the performances are good.
325;Truly a delight for the eyes and ears, even if it won't stay with you long after finishing it.
326;Hugh Grant is a fine actor and Mz.
327;This 1991 movie directed by James Lepine is an absolute charm.
328;It's a romantic comedy, it's a historical piece and a colorful introduction to the music of Frederic Chopin, Franz Liszt and the life and writings of Madame George Sand Aurore Dudevant.
329;The romantic comedy is well.
330;notch performances and the music is heaven.
331;I don't know yet if there is a soundtrack but it's likely there is and it must be beautiful.
332;She had many lovers, including Alfred De Musset (who is played in this film by Mandy Patinkin)and her most famous lover, Frederic Chopin.
333;It is their love story that this movie focues on.
334;judi Davis is doing an Oscar winning performance as George Sand, who is ultimately a woman who belongs to no one and who lives life to the fullest.
335;She has raised children to be as creative as she is and taken full responsibility for her children as well as for her elderly mother.
336;lover of Sand shows up.
337;While she is free, intense, devil.
338;care and very healthy, Chopin is reserved, emotional, sensitive, refined and suffering of bad health with tubercolosis.
339;Bernadette Peters delivers a terrific performance as well as the scheming and bitter Marie D'Agoult, whose own marriage to Franz Liszt after having many children with him, including Cosima who later marries Richard Wagner, but that's another story and even another movie.
340;done movie with lots of charm and witty scenes.
341;She pursued him like a man pursues a woman.
342;I truly enjoyed this movie.
343;I am a fan of the music of Frederic Chopin and I have seen other movies that tell his story.
344;Although this is not a true story it is a fun movie to watch.
345;I enjoy the music that is played throughout.
346;The casting for Franz Listz (Julian Sands) was the best.
347;A look at the sinful, corrupt ways of the French Aristocracy, This portrayal of the social atmosphere surrounding Chopin and frank Litz is interesting.
348;I enjoy these period time movies.
349;I love the musical score as well.
350;Loved the cinematography and beautiful sets.
351;Ohhhhhh and the music and the art and the love!!!!!!
352;Not one of Grants or Davis' better movies, but a pleasant enough little movie for a diversion.
353;And it is spiced with the music of Chopin.
354;Chopin and Sand made a brief appearance.
355;I was 13 and I was inspired, I loved the music.
356;Impromptu also has many lovely piano pieces, but the people are much more engaged and realistic,especially the women.
357;pregnant countess mistress of Liszt, were amazing women living unusual lives.
358;The cast is wonderful, though I think Hugh Grant is weak as Chopin.
359;I like Chopin and I love Hugh Grant, but Judy Davis was the captivator in this one.
360;What spunk and daring, but also what romantic depth!
361;It was a great story, and they portrayed the social norms of the day as well as a nice expo of the relationships between the amazing musicians of this era .
362;their friendships, their rivalries, and their personalities.
363;He plays a significant role in Chopin's music and social life.
364;I learned a lot and enjoyed it all!
365;I like how he brings a sense of humor into the story line and this movie did not disappoint.
366;The acting is very good, but the storyline was hard to follow.
367;It is delightful to see such a refreshingly witty and playful film.
368;Judy Davis is wonderful as the tomboyish George Sand (though slightly over the top at times) and gives the role quite a bit of depth and comedy.
369;Her performance alone makes this film worth watching.
370;all in all, a film worth watching, and, while it is not meticulously.
371;crafted, is still great fun for the performances and sheer comedic power.
372;This is will have you in stitches many times throughout.
373;Interesting and fun to see stars before they were big names.
374;thought it was well written and acted,would recommend it for a lazy afternoon.
375;George and her group of hedonistic friends are great fun to watch.
376;Wonderful performances by everyone, especially Emma Thompson and Mandy Patinkin.
377;While taking some liberties with the real course of events, Impromptu does portray their relationship up to their departure for Majorca, as well as the story's backdrop in 19th century Paris and rural France, with an admirably light touch and in loving detail
378;Judy Davis and a deliciously young and fragile Hugh Grant are the perfect embodiment of Sand and her Chopinet .
379;You must win him as a man wins a woman.
380;If anyone can do it, you can.
381;be lovers, Chopin and de Musset and Chopin and Marie
382;Chopin and Sand eventually become friends and .
383;They both will live forever in their works .
384;and this movie, which unfortunately went virtually undiscovered upon its 1991 release, is a wonderful, gentle reminder of the wealth of creativity and emotion they had to share.
385;not even a good romance story line to speak of.
386;I loved the period scenery and clothing, but it moved so slowly and seemed very shallow.
387;I have it on my i. pad and I expect I'll watch it again.
388;I liked the story
389;i am extremely selective with romances and even more so with romantic comedies.
390;but the sensitivity that Grant brings to his films is evident especially in this one.
391;He is perfection as Chopin.
392;Judy Davis was very enjoyable.
393;Emma Thompson was a hilarious!
394;i felt the role was fun, yet challenging.
395;She was the perfect balance between annoying and endearing.
396;i just loved this movie.
397;but I feel imperfection is perfection.
398;This is a nicely done period movie depicting the life and loves of the controversial 19th century French writer George Sand.
399;As a writer Sand took on the flaws of society in her characters and scolded the public in her subtle but effective way.
400;As a woman Sand was far from beautiful but she had numerous affairs of the heart with many famous and powerful men.
401;She managed to thrill her lovers with her mind and her ever present need to be free from constraints, preferring to set her lovers free yet they always came running back for more or went crazy doing so.
402;Needless to say Sand is an extraordinarily interesting subject but to really know her one must read about her because she is far too limited by film.
403;this film is wonderful but incomplete.
404;Judy Davis plays the great George Sand about as perfectly as she can be played on film.
405;Davis takes on the famous characteristics of Sand, the tomboyish walk, her bold feministic approach and her enduring passion for life and love.
406;The film is actually quite entertaining although much of the history involved in these famous relationships is lost in the effort.
407;Hugh Grant is convincingly fragile and helpless as Chopin.
408;Bernadette Peters is great as the backstabbing and snide social climber, Marie D'Agoult.
409;Her work influenced many other authors and artists of the day.
410;I STRONGLY recommend Impromptu to anyone who wants to enjoy an evening of inspiration, history (as an entertaining mix of fact and fiction), romance, and comedy.
411;Judy Davis does an exquisite job of playing Sand as a confident, practical, strong woman who is also exquisitely sensitive, affectionate, and sometimes downright vulnerable.
412;It has inspired me to read as much of George Sand's work as I can, and to learn more about the life of this remarkable, passionate, courageous and talented woman!
413;Hugh Grant, the biggest star at the center of this film, is vulnerable and feminine, and the rest of the cast arranges itself around him.
414;handed
415;I had seen this movie at the theater when it first came out and I enjoyed it very much.
416;This is an excellent film.
417;The acting is wonderful and the French countryside is beautiful.
418;This film will not appeal to everyone, but anyone who is interested in period films, life in the 19th century, Chopin, or George Sand will enjoy it.
419;It is very humorous, although in a sophisticated way.
420;To understand the film best it would help to have some knowledge of George Sand and her life and times, yet perhaps viewing the film would inspire people who do not know much about George Sand to learn more.
421;Judy Davis is fantastic as George Sand and Hugh Grant plays the shy Chopin perfectly.
422;Well done and the cinematography was well done.
423;I think it is a combination of romance and psychology.

