id;spiegazione
1;British period pieces all carry the same themes.
2;Two kindred hearts fight either for or against each other throughout the entire film until finally one succumbs and we are left with the clich happy ending.
3;Either way, even with the greatest players having fun with their roles, Impromptu slowly flushes itself down the period.
4;Impromptu kept me awake and excited about what would happen next entirely due to the characters.
5;Some may laugh at the portrayal of Chopin by Hugh Grant, but he contains himself well and shows that he may have some acting chops under that flopsy hair of his (even with his fading German accent).
6;Judy Davis did well with her character, I just have trouble with her I need to win an Oscar with every role type performance that Davis is notorious for giving us with every film.
7;When all of these actors are together on screen, especially during their sinister performance at Thompson's house, one cannot help but be pulled into their world.
8;Excitement, humor, and an aura of charisma surround these characters, alas
9;She has amazing characters, funny situations, and socially challenged themes
10;From the beginning it is established that these are some of the greatest minds in British history together on screen, so why did we have to pace through the film as if they were also the oldest characters in history.
11;Here we have the amazing opportunity to witness a great author and the rarity of cross.
12;Not a screamingly successful film.
13;Impromptu is one of those films that you hear about.
14;an underground following, and an incredible good time.
15;judy Davis shines (as always) as authoress George Sand, a masculine woman writer who falls in love with the feminine pianist Chopin (played by Hugh Grant).
16;Some fabulous writing here, and a chance for Judy Davis to let herself go and have fun.
17;The script wouldn't exactly be Oscar nominated, but it is cleverly written, and the charactors are just too much fun.
18;each offering their own unique talents to keeping the film together.
19;It was fun to see so many serious actors playing comedic roles.
20;A very young Hugh Grant plays a pretty good Chopin.
21;On the one hand, the actors played their roles perfectly, IMO.
22;A film I adore, which captures a period of time when literature and art were revered.
23;The actors are superb, from Emma Thompson as the rich country baroness to Judy Davis as George Eliot.
24;Mandy Panikin was amusing and so adroit playing the part of her rejected lover.
25;Because the title suggests energy and abruptness, the movie itself laughs along its way.
26;Nice performances for all the characters not mentioned here.
27;All in all, an entertaining period piece with a heroine who goes after her man.
28;This was much more enlightening .
29;And Chopin was equally fascinating.
30;this is a sweet movie keeps you interested.
31;I like Hugh Grant and I recommend it to all.
32;My grandchild likes it too
33;I really loved this love story and I love romantic period music.
34;George Sands is delightfully rakish and I love her pursuit of Chopin.
35;Lush scenery, clever character dialogue, exquisite music.
36;It was from this movie that my love for George Sand's writing came to be.
37;In the movie, the quote from her love letter to Chopin is actually from her novel Mauprat.
38;It is a superb read.
39;while the screenplay takes quite a bit of poetic license, this all.
40;star ensemble absolutely nails it!If you have any interest in period pieces, Chopin or Sand.
41;do yourself a favor and watch this movie.
42;I loved every minute of this movie.
43;Her soul is revived, however, upon hearing the beautiful music of the young composer, Chopin.
44;The dialogue is lovely, the storyline and plot have an excellent flow, and not only is the entire thing romantic, funny, and interesting, it's ridiculously sexy.
45;this movie has everything from jilted lovers and true loves, to undertones of feminism and brilliant artists.
46;Impromptu is one of my favourite films because it has an excellent cast, beautiful period costumes, great cinematography, and I can't leave out the exceptionally beautiful soundtrack!
47;Chopin and Liszt music flow throughout the scenes and Hugh Grant pulls off a believable Chopin.
48;If you enjoy period dramas, history, historical fiction and romantic classical music .
49;Playing a neurotic, brilliant hypochondriac with a Chopinian accent is right up his alley in this film.
50;Judy Davis as the famous popular woman writer of the time period, George Sand, is also fabulous.
51;As is Mandy Patinkin, who Princess Bride fans will know as the sword.
52;carried out, and if you think you'd enjoy watching a film about all that can go wrong (and right) amid a commune of writers and artists, this is a film you want to see as soon as possible!
53;This movie is one of my top 10 favorites.
54;It is funny, funny, funny, but in a crisp and understated way that makes each viewing funnier than the last.
55;It shows the foibles of the characters with amusement, but without quite wandering into satire.
56;The love scenes are squirm.
57;Soundtrack is a winner with music by Chopin and Liszt.
58;It's not much of a comedy but it's a beautiful, light movie about George Sand and Chopin.
59;You'll see many beautiful scenes and you'll enjoy lots of good music.
60;The acting is fantastic, I enjoyed every second of it.
61;Yes, and they're all worthy, but Judy Davis steals the show and then some.
62;hearted take on the romance between George Sand and Chopin, it has many wonderful moments but shares some of its characters' mean.
63;And while not consistently engaging, Hugh is quite amusing and Judy is magnificent as the romantic, high.
64;This movie should be good.
65;I enjoyed the performances by Emma Thompson and Bernadette Peters more than those of the lead characters.
66;James Lepine's Impromptu (1991) retells the story of Chopin (Hugh Grant) and George Sand (a terrific, intense Judy Davis) and how they met.
67;Filmed on location in France, it seems more realistic.
68;The surprise is Hugh Grant, who is a dandy Chopin.
69;The acting is great and scenery is wonderful.
70;A delightful movie on the affair between George Sand and Frederick Chopin that is very entertaining.
71;The cast was good, story, not so much.
72;Impromptu is a amusing and clever portrayal of the 19th century love affair between composer Frederic Chopin and French romance author George Sand, the pen name of baroness Aurore Dudevant.
73;Eventually, he becomes as captivated with her gift of prose as she is with his music, and they fall in love.
74;She completely domintaes the relationship, but is nevertheless proves herself a loyal and loving companion.
75;chomping personality she is so well known for.
76;impromptu is a tender love story laden with slapstick.
77;Everything about this movie is pure, unadulterated fun .
78;the characters, their madness, and the antics of George Sand as she seeks to secure Chopin's affection.
79;Have fun with this one.
80;good movie, but not excellent.
81;All is kept light and airy by a tremendous cast that includes Judy Davis, Hugh Grant, Mandy Patinkin, Bernadette Peters and Emma Thompson.
82;Simply wonderful
83;Excellent account of the time and the people involved.
84;the movie is shot beutifully and the acting is superb.
85;Great performances by Hugh Grant and Emma Thompson.
86;I absolutely recommend you see it if you haven't already.
87;great acting on the part of Hugh Grant and Judy Davis!
88;I have never read the history regarding the relationship between George Sand and Chopin
89;The cast was superb, which doesn't always work with so many stars in one cast.
90;This is a good fun movie with humor that I recommend watching.
91;The best part of this film I think.
92;characters are beautiful and believable.
93;Some display all of the worst traits but they do it with style.
94;Just when I was mulling over the conundrum why there is no good film on Chopin's life, I ran into this title from 1991, with a well.
95;Both films are plausible, both films are interesting and offer music better than Bach's and Mozart's.
96;I feel that a certain dispense from the facts is acceptable, so far as they remain relevant, and conducive to the development of the story and in this case, the humour.
97;emma Thompson has proven time and again, her mastery of period drama and her multi.
98;judy Davis and Bernadette Peters are truly brilliant and entertaining in their convincing and riveting portrayals of Sand (whom you love to emphatize with) and D'Agoult (whom you love to hate), eventually placed at loggerheads.
99;The dialogue is much more hilarious than the original in English!
100;the soundtracks are strung together in a most admirable fashion, beginning most lightheartedly with Chopin's fleeting.
101;lush orchestrations have been mixed in certain parts with the original solo piano excerpts to enhance the dramatic flow.
102;overall, it is a film I would recommend without hesitation to lovers of classical music, historical drama and comedy.
103;and I usually love these types of films.
104;This movie, an embellished account of the romance between George Sand (a strong, independent woman before such a thing was fashionable) and Frederic Chopin (the famous but delicate and sickly composer) is truly witty, charming, wonderful and thoroughly entertaining!!
105;And the score, primarily Chopin and Liszt, is the icing on the cake.
106;i've seen it at least 20 times (to make sure all my friends and family could enjoy it as well) but my enjoyment never fades and the ideas and emotions expressed about art, propriety, love and the masculine/feminine still ring true.
107;A movie that does a good job of encapsulating the characters and fashion of Fredrik Chopin's time in 1800's Paris.
108;The dialog is witty and the pace of the movie is quick.
109;The movie is funny, the costumes lush and the music, of course heavenly.
110;I accept that a filmmaker will take considerable liberties in order to get his story across in less than two hours.
111;Judy Davis is amazing, while Hugh Grant performs competently.
112;Besides passion, there is abundant wit and humor.
113;This movie richly deserves being owned.
114;She takes Emma Thompson, who delivered a superb performance, to task.
115;This is a comedy, and the buffoonery is distributed irregardless of gender.
116;sand, the heroine, is depicted quite favorably by Impromptu, with pluck and daring.
117;The author disparages the wit of the movie, considering it unnecessary, but this is one of its charms.
118;There is not a single redundant character, and every character introduced entertains and instructs in their own way, despite being caricatures or buffoons.
119;This is a truly Romantic version of love which transcends the physical, much like Chopin himself, whose body was feeble (he was to die of tuberculosis in his thirties).
120;Listening to the dialogue once again confirms in my mind how well the movie captures the spirit of Romanticism, which Chopin and Sand both embodied in their own ways.
121;the central mistake the Amazonian reviewer made was to approach this movie with expectations about Hugh Grant, Hollywood's favorite, a good.
122;It is the best movie ever made to my knowledge.
123;It's a good thing it was free with Amazon Prime.
124;Some dialog is a bit out of character for the times but it is very well done.
125;Judy Davis is just what I always thought George Sand would be like.
126;Julian Sands is a perfect Franz Lizst and Bernadette Peters' acting is spot on for her character.
127;There are many laughable twist and turns as well as interesting points of calculated deception.
128;Impromptu is a very funny movie with a phenomenal cast.
129;liferomance between the writer George Sand, played by Judy Davis in mostly men's clothing,and Chopin, the composer.
130;I loved Judy Davis and Hugh Grant in this movie.
131;Using fairly accurate historical material, this thoroughly modern take on some of the nineteenth century's most colorful authors, painters and musicians is touching, very funny and insightful.
132;Impromptu is my favorite all time movie.
133;It well written, well acted by a flock of fine performers and it's funny plus being historically accurateand filled with beautiful music.
134;Together they make a great pair of movies for a weekend.
135;Very enjoyable period romance/biotic/dramedy based on the real events, portrays truly famous, and even legendary figures of 19th Century culture such as George Sand, nee Aurora Dupin, Frederick Chopin, Franz Listz, Eugene Delacroix, and Alfred De Musset.
136;The main heroine (or the hero) of the film is George Sand, who is equally known for her Romantic novels and her quite scandalous at the time way of life.
137;class society, to leave her husband, take two children with her, make a living with her writing, and especially to show up in public wearing men clothing and openly smocking .
138;Her contemporary, the Russian ex.
139;patriot, famous novelist Ivan Turgenev said about her What a brave man she was, and what a good woman.
140;It tells the story of the romance between strong and full of life George Sand and very talented romantic composer, Frederic Chopin whose music made her fall in love with him even before they met in person.
141;Hugh Grant in one of his earlier roles as young Polish composer and virtuoso piano.
142;needless to say that the film is filled with the captivating music, charming costumes, and gorgeous locations.
143;It is a hidden treasure and I am glad to have finally discovered it.4/5
144;This movie is a perfect study on the subject.
145;There are few movies about human condition and being in that moment that there is so much talk about, that are true pieces of art at the same time, like Impromptu.
146;The chemistry between the two is remarkable.
147;Emma Thompson has a small role and does it to perfection.
148;The piano playing, mostly dubbed by Emmanuel Ax, is wonderful.
149;Most surprising of all, the story was actually pretty accurate, though the role of Liszt's mistress may have been overplayed.
150;One of the best movies I've seen lately.
151;It wasn't the best movie, but it was very funny, great early Hugh Grant in the role of Frydyryk Chopin, Judy Davis, Bernadette Peters, and Emma Thompson are always fantastic.
152;Julian Sands as Franz Lizst was a treat as well.
153;I know it was fictionalised but it was nice to see the developing relationship between the composer and the novelist, George Sand.
154;Overall, I recommend it to anyone who loves classical music and period dramas, with a sense of humour.
155;It's an entertaining film .
156;the camera is a real peeping Tom which allows the viewer to know the most intimate details in the social life 
157;the double moral 
158;jules Davis made an incredible performance as George Sand and Hugh Grant made a Chopin with certain peaks and lows .
159;Julian Sand is splendid as the handsome and outrageous hungarian musician.
160;wonderful locations in France and excellent artistic direction.
161;This has to be one of my all time favorites.
162;It is a wonderful, funny, romantic look at the beginning of the relationship between Chopin and Georges Sand.
163;Judy Davis is a marvel as Sand, conniving, volatile, loving.
164;Hugh Grant at the beginning of his career invests Chopin with an otherworldly charm that is unforgettable.
165;The whole cast is marvelous.
166;Do yourself a favor and watch this wonderful film.
167;It will take you to another world for a few hours.
168;I really enjoyed this movie, largely due to the performance of the not.yet.
169;The movie gives a sense of the times and the relationship between the characters.
170;Like I said, this a great period piece with terrific music.
171;It was not too heavy and it was enjoyable.
172;Not a lot of plot, but very pretty with beautiful music.
173;Some good actors (Hugh Grant is absurdly young) having a wonderful time hamming it up in period costumes.
174;The movie was well acted.
175;I am a fan of Chopin and My wife is madly in love with Hugh Grant.
176;If so, it is worth watching for its historical viewpoint.
177;Enjoyed the music,costuming and scenery.
178;I loved all the jane austen movies and this was in that same genre loved it!
179;And i love hugh grant :)
180;Impromptu is truly one of the great little.
181;end is the beginning of the famous Sand.
182;It is more fantasy than fact, but it is hilariousy funny, wonderfully romantic, and beautifully filmed.
183;Directed by James Lapine with the gorgeous music of Chopin and Liszt.
184;Mr. Grant is perfection as Chopin, and Miss Davis matches him all the way.
185;Miss Peters is at her zany best.
186;This film is truly a treasure.
187;I love period pieces so I thought I'd give this one a whirl.
188;Probably due to all the infidelity.
189;This is an excellent film which depicts with some humor and intrigue the life of Chopin.
190;Hugh Grant and Judy Davis play fantastic parts.
191;One actually gets a feel for the era in which Chopin lived.
192;The music is stupendous and invites an even greater appreciation for Chopin's talents.
193;(And i'm a big Mandy Patinkin fan by the way)A very non.
194;I went into this movie not expecting much but was treated to a funny and reasonably well done movie.
195;the move led me to wanting to learn more about the real people the actors portrayed.
196;Not that all historically accurate, but still a great entertaining movie!
197;like the majority of European sellers do when an American order is received !
198;Works as a date movie, but it's really just a good movie in general.
199;It would take some research to determine how much of this story is history and how much is wild imagination.
200;It is a good setting to listen to a lot of good Chopin music.
201;also, this movie covers a very short period of time, like possibly couple of years, in the life of George Sand, from the time she meets Chopin and hears his music to the time they travel to Majorca together with her children.
202;but, still i loved this movie.
203;however, i will keep my ears and eyes open for that great movie about the great one and only.
204;chopin, who in my mind deserves so much more.
205;I love period historical dramas!
206;Just watch it for what it is.
207;Lots of fun, acting ranges from subtle to scenery chewing yet it all works as an ensemble costume drama with many comic moments.
208;Although its a bit dated, the movie has wonderful costumes and gives an interesting version of composer Chopin and author Gerge Sands.
209;Impromptu is well acted and an interesting piece of history.
210;Fascinating interplay between Chopin, a brilliant, passionate but delicate man, and George Sand, a brilliant, passionate and indelicate woman.
211;I love period piece movies.
212;This one had a great untold story of Chopin.
213;This is a wonderful film about Frederic Chopin and George Sands.
214;Hugh Grant is a rather handsome Chopin, overall a most enjoyable film.
215;I love this kind of filmsWonderful acting, in particular the two protagonist.
216;I appreciate we can enjoy this kind of films trough Amazon Prime
217;wit, grace, charm, and granted yes, somewhat affected performances, but still a sweetness manages to come through.
218;love music, eternal muses, are showcased in their manic, most evocative forms here are captured in all their energy wit of an era of change, challenge growth culturally.
219;I bought this movie to see Hugh Grant as Chopin and was surprised with it.
220;absolutely sublime music was it self the main character.
221;if you know that era and the characters who made real difference in the arts, you will enjoy watching this.
222;This Masterpiece Theater production of the love story between novelist George Sand and composer Frederic Chopin is funny, well.
223;It is played out in this film mostly for fun.
224;His retrenchment at Sand's initial overtures is done tastefully and with powerful historic accuracy.
225;the supporting cast is wonderful in this film.
226;Bernadette Peters is in fine form as mother to Lizst's children with her own agenda on Chopin.
227;Mandy Patinkin steals scenes regularly in his portrayl as Sands' lover and father of her children, while Ralph Brown does good work as Chopin's real life friend, the French revolutionary artist Eugene Delacroix.
228;Emma Thompson also plays a very funny role in the cast.
229;movies about classical musicians are never based in humor and are rarely as successful as this one.
230;people that love classical music and/or 19th century period reenactments, and people that enjoy subtle humor, will all get a kick from this movie.
231;Watched this movie twice, and it captured my heart.
232;Grant played an incredible leading role in this one.
233;This film centers around the bold and controversial nineteenth century author, George Sand, an unconventional woman who dressed as a man and flouted the social and sexual mores of her day.
234;It is a wickedly funny film: sharp, biting, and clever.
235;Leaving a trail of outraged lovers in her wake, she devotes herself, heart and soul, to making Chopin her lover.
236;This makes for some wickedly madcap moments.
237;As her quarry makes Ms. Sand pull out all the stops, the viewer will be delightfully entertained by their antics.
238;judy Davis is sublime as the controversial Ms. Sand, infusing the role with intelligence and charm.
239;Hugh Grant is perfect in the role of Chopin, who is overwhelmed by the persistent Ms. Sand.
240;Emma Thompson, in one of her earlier roles, is absolutely hilarious as the Duchess D'Artan, the patroness of the arts, playing her character with complete comedic relish.
241;The rest of the supporting ensemble also provide stellar performances.
242;All in all, this is a very enjoyable and unusual period piece.
243;It is witty and humorous with a great cast.
244;This movie was surprisingly funny and very interesting.
245;If you like period pieces then this is a movie for you.
246;Hugh Grant gave a superb performance as Chopin and the banter between him and Judy Davis was very entertaining.
247;This is a fun movie.
248;Good story line, great music.
249;I enjoyed this, a little bit of action, little bit of romance, all in the time period I love.
250;I highly recommend this movie.
251;Not the best movie but if you are interested in Chopin and the relationship between artists of his time then it is worth watching.
252;With such great acting, outrageously funny plot and exquisite music, no matter that it's only remotely historical.
253;And with all its silliness, it also has some interesting character revelations.
254;Set around the 1830's, Impromptu is an interesting story of the bold and witty authoress, George Sands (Judy Davis)and her relationship with Chopin.
255;George is a strong woman with much character, which attracts many lovers.
256;She often dresses up as a man and smokes cigars.
257;She knows what she wants out of life and is not afraid to get it.
258;Hugh Grant plays Chopin, her love interest, his piano pieces stir her soul like nothing else has done in her life.
259;despite that, overall Impromptu is an entertaining romp and period piece.
260;Allow me to begin this review by stating that this film is absolutely superb.
261;It portrays the greatest artists of 19th Century France (George Sand, De Musset, Chopin, Delacroix, and Liszt), yet it does not take itself too seriously (read: it is not pretentious, in spite of the great historical and artistic characters it depicts).
262;hearted, charming, and positively delightful.
263;Judy Davis is sensational in the role of George Sand, the great and wonderfully unusual literary heroine of 19th Century France
264;Hugh Grant is such a great actor when he adopts roles which are worthy of his talent (read: not the tepid and trivial roles which he plays in Nine Months or Four Weddings and a Funeral), and he displays his remarkable talent in portraying the fragile and finicky Chopin.
265;All of the actors turn in outstanding performances, especially Julian Sands as Liszt, and Bernadette Peters, as his mistress and a close friend of Sand's, Marie d'Agoult, a tempestuous and difficult woman who ultimately betrays Sand.
266;And fall in love they do, after a series of mishaps and fiascos (some of them quite humorous). . . George Sand was an extremely straightforward and impassioned woman in regard to love, and she actively pursued Chopin.
267;At first, Chopin is unnerved by Sand's unabashed romantic advances (for he is an individual of great delicacy and piety), but ultimately he comes to view Sand as the truly remarkable woman that she is.
268;He was the greatest love of her life (as biographies on Sand maintain, and indeed she says so in her own autobiography, Story of My Life), and she remained by his side until he succumbed to tuberculosis.
269;Impromptu ends with their well.
270;known trip to Majorca, with a memorable scene in which she opens the windows to the carriage that is carrying them away, in spite of his coughing (Someone has to teach you how to breathe!
271;Impromptu is a gorgeous film, with breathtaking cinematography, and it pays remarkable homage (and again, without pretention) to the artists whose lives it portrays.
272;Yes, THE Chopin, the classical music genius.
273;Anyway, it was a delightful film and at times a bit slow.
274;Loved the fact it was shot mostly in France and at times it had its funny moments.
275;Watch this film on a drizzly Sunday afternoon with a bowl of popcorn.
276;This movie was well done and pretty faithful to the biographical information of Chopin I had read.
277;It was well developed and while not covering his life to the last, it was indeed entertaining and enlightening.
278;I am a Hugh Grant fan, so I was drawn to watch just because of him.
279;I like period movies, as well, so that was another draw.
