id;spiegazione
1;`Blood Diamond' is an excellent adventure.
2;stopping violence and the tender timeouts are testaments to fine timing and storytelling.
3;Archer meets her and finds she can assist him with reuniting Solomon's family.
4;It's a complex, yet captivating trade.
5;`Blood Diamond' may not always surprise, but it is filled with riveting adventure and harrowing battle scenes.
6;Urgent situations, anguishing details, and a connected plot construct a solid movie experience.
7;Pointedly, the film is meaningful.
8;The movie makes expert connections from the battles to the diamond trade to the jewelry store.
9;It also aligns the characters well.
10;Sometimes a few coincidences play too neatly into the hand of circumstance, but the exploitation and compelling chase scenes are presented genuinely enough.
11;DiCaprio's worthy Oscar nomination and fine supporting performances add to the cohesive story.
12;Even some of the cinematography is breathtaking enough to keep from taking the Third World for granted.
13;More than `Rambo' for liberals, `Blood Diamond' is a thoughtful and well.
14;crafted movie experience with an important story to tell.
15;Special features awesome, especially the documentary.
16;otherwise, SUPER performances from Di Caprio and Honsou, and the scenery (actually Mozambique) is a character in its own right.
17;Gritty, moving, and Di Caprio really is able to show his range and talent (which I think is still underestimated by many just because he started off as a soap star).
18;And Vosloo as the villain, perfect.
19;Wonderful action adventure film with deeper meaning, plus the power of love.
20;I originally thought it was an action movie with Leonardo DiCaprio.
21;The movie makes no excuses for the excessive violence since it was and is such a real issue in the world.
22;what happens then is an amazing story filled with action and suspense.
23;A journey that never stops and can only takes one breath away when they realize this is something that really happened.
24;It is a sad story but it is also a happy story.
25;ray version which was filled with a beautiful picture and wonderful sound.
26;It also had many extra features including a wonderful documentary about the smuggling business.
27;ray player I highly recommend this movie.
28;this is easily one of the best movies of the year.
29;With the lack of great movies this year it's great to have a diamond in the rough.
30;A story that is incredibly amazing and true.
31;Blood Diamond is a message film.
32;mill message films and actually be a good movie.
33;ironically, there is a good ninety.
34;buried deep inside Blood Diamond.
35;dah, this is a message film (TMF)!
36;The latter was chilling in its realism of the international politics connected with this genocide and excellent in portrayal of its characters.
37;The African father, in particular, should have been portrayed with a great deal more depth.
38;The best I can say of it is that there is plenty of action.
39;Great educative true life experiences film.
40;Gave meaning to my job and the impact getting it right brings along.
41;This movie is intense, cinematically beautiful, and exceptionally well acted.
42;DiCaprio has been churning out really good performances since his Oscar.
43;His performance in Blood Diamond should solidify his status as one of the greatest actors of his generations (and those muscles should make even more women swoon).
44;the subject matter of the movie is captivating and heart wrenching.
45;And Edward Zwick (The Last Samurai, Glory) does it justice in this film.
46;I love this movie because it really makes you wonder why we are willing to do so much for the things we want.
47;Blood Diamond is a good movie but on the whole rather mediocre in every aspect.
48;The most poignant scenes wonderfully avoid sentimentality but, as a kind of side effect, miss the real pathos too.
49;a great deal of the movie consists of violence under the form of shooting people as if they were made for target practice.
50;I understand this is an important part of modern Africa which must be told in all its brutality, and in this respect the movie serves its purpose very well, but I think less bloodshed and more substance would have been a better solution.
51;Watched the movie several times in the past and it is has a very exciting plot, I highly recommend this movie and can be watched over and over again.
52;Excellent subject matter, very good cast.
53;An inside look at the diamond business and how it affects the people in this country at any cost.
54;Djimon Hounsou intimidatingly genuine in his role as desperate father.
55;the movie opens with Solomon Vandy (damn good name, IMO) being kidnapped from his family to work in diamonds run by the Revolutionary United Front.
56;now that's new), shooting women and children, and enslaving able.
57;You get great shots of bazooka.
58;chilling new acronym, TIA, the meaning of which I'll leave it to you to find out.You get an unrealistic half.
59;how can the diamond trade be made to bring real development to their source.
60;a thriller with a strong human element.
61;DiCaprio gives an amazing performance.
62;truly one of his best roles I've seen yet.
63;i give Blood Diamond 4/5 stars.
64;I was looking for a movie similar to Syriana, and this movie is not really up to par with it, but it is still an excellent movie.
65;I'm not normally a fan of Leonardo di Caprio, but his acting was truly outstanding.
66;It is the ending that cheapens the movie somewhat.
67;If you ignore the last five minutes or so this is a compelling movie, which is well worth watching, and might even be educational.
68;This is a very good movie for what it is.
69;The entire cast does a good job.
70;The more I see of Leonardo DiCaprio, the more impressed I am with his acting ability.
71;He is who he is and Africa will always be in him.
72;Great acting by him (with accent) and his co. lead, Djimon Hounsou.
73;I even thought that Jennifer Connelly was good as well.
74;The story was delivered very nicely, awareness should be raised through this story.
75;An excellent rendition to help people understand the psychology behind all parties involved/effected by the diamond industry and it's ugly secrets.
76;I enjoyed this movie and am more glad than ever that im livingin the other part of the world, we dont know how good we have it.
77;When he is happy he smiles.
78;but he actually portrays the emotions correctly (and I was happy that he remained selfish throughout most of the film).
79;His scenes are a powerful testament to the darkness that engulfs this epidemic.
80;What a fantastic performance by Leo in this gritty, fast.
81;The story is extremely tight and brilliantly written invoking all kinds of emotions within audience members.
82;Symbolically this film runs deep with themes of greed, loyalty and compassion.
83;I took a lot away from it and it certainly gave a me a whole new perspective on diamond sale and trade.
84;Perhaps when considering a gem in the future I will opt for something else.
85;I hope they rerelease this picture one day and give it the proper treatment that it deserves.
86;Focus Points: Featurettes and Production Diaries.
87;It is a very entertaining film, for the fairly straightforward story.
88;I thought the acting was excellent.
89;made action/drama movie with a stellar cast and meaningful.
90;I finally put it on my gift list and got it.
91;Money well spent, and deeply moving.
92;Overall a good watch, but just a so.
93;As important as the topic is, I would like to see the topic getting handled in an important and serious way as well.
94;Everyone in the movie does well though.
95;Makes you open your eyes to the real problems of the world.
96;Great movis and I can watch it over and over again.
97;It is also very well done on that level, with Edward Zwick ably handling the pure adrenaline rush of the action.
98;i think the sorrow of the film is heightened by the natural beauty of the place, filmed wonderfully.
99;Leonardo DeCaprio is very good here.
100;Jennifer Connelly always embodies intelligence along with her beauty (and I don't know how she manages to get even better looking as time goes on, but she does).
101;a very fast and furious action film with a lot of other things on its mind, I found the film well worthwhile.
102;This is one of those movies that opens people's eyes to the truth behind diamonds.
103;this movie hits you pretty hard and after it if you think about the world you live in it helps to shatters the world that you might have grown up with and you begin to wonder about those who control diamonds, oil, technology, sugar, coffee, alcohol, and you begin to wonder at how society is controlled today.
104;This may be one of my favorite movies ever.
105;It certainly runs in the top ten.
106;I really enjoyed Leonardo DiCaprio's character and witnessing him develop and enact the character.
107;It is exciting, interesting, and innovative.
108;I really love this movie!
109;Real life events, excellent movie, edge of the seat suspense.
110;Not only a story of how actions in rich countries affect the lives of people in poor countries, but a gripping story of relationships between father and son, lovers, and greed versus the value of human life.
111;This film gets more indepth the setting across most of Africa during the civil wars that continue to rip the continent apart today.
112;Even if you don't like Leonardo Di Caprio you will like this, it's one of the best films I've ever seen.
113;It's gripping, relistic and based on a true story.
114;It's shocking, informative and intresting all at the same time.
115;It's well acted and has a brilliant storyline.
116;If you like action well this film should be good.
117;the story I found in many parts over the top.
118;having said that some of the scenes for example when the rebels took the town, killed, cut peoples hands off and took many into slavery, I thought were good.
119;the best film I've seen in two years.
120;LD is the actor of our generation.
121;He has come a long way since Titanic.
122;The press gets a good shake with high moral ground and a beautiful reporter.
123;The acting is superior, the cinematography is excellent.
124;I've never watched a film that was so captivating and exciting.
125;which is a good thing in my book.
126;And DiCaprio proved that he really is one of the finest actors of his era.
127;Incidentally an enthusiastic 2 will just have to do.
128;Not being a very big Leonardo DiCaprio fan in the past, this year I've had a growing amount of respect for this young man as he proves his acting chops again and again.
129;First it was within the excellent Scorsese film THE DEPARTED, and now he does another great job in BLOOD DIAMOND.
130;Many African actors lend their previously hidden talents to the film, giving it a bit more authenticity than The Departed.
131;Djimon plays the smart and tough Solomon as he races to find his family and his son.
132;After being imprisoned via slave labor by the rebels, Solomon finds a huge, rare, pink diamond and quickly buries it.
133;He meets up with Solomon and the two form a tenuous bond
134;part nonfiction, part fiction, Blood Diamond forces the viewer to realize that the rocks they wear on their fingers may have come at a very bloody cost.
135;a very compelling film with DiCaprio dominating the screen (and rightfully so).
136;His South African accent was spot.
137;One of the more clever lines uttered by Danny Archer (Leonardo DiCaprio) when aiming to summarize Sierra Leone's 1999 blood diamond situation to American photojournalist Maddy Bowen (Jennifer Connelly).
138;world type of gal (always looking fresh) who wants proof that diamonds are being used to fund the attempted overthrow of the government by the rebel group Revolutionary United Front (RUF).
139;vandy finds a clear 100.
140;He manages to bury it, but not without the ever watchful eye (bad pun for those who saw the movie) of the Captain lurking nearby.
141;All the stars are actually quite emotive despite their lines
142;The cinematography is often stunning, especially the long shots that claim to be Sierra Leone's countryside.
143;The action scenes, although overdone at times to the point of trivializing the true bloody story of Sierra Leone's civil war, are captivating.
144;It is a good movie to watch.
145;I watch Blood Diamond at least three times a year.
146;I don't know what it is about this movie but I just love it.
147;The acting is superb, the story mesmerizing and it's one of my movie icons.
148;This is a very intense, taut drama/action movie that goes at a very rapid pace.
149;Good performances by Leonard DiCaprio, Jennifer Connelly, and Dijimon Hounsou.
150;It's a movie everyone should watch at one point, it's really eye.
151;and I have to say something about DiCaprio's acting of course!
152;Blood Diamond is one of the best movies of the last 10 years, if not even longer.
153;The story is gripping, gruesome, heroic, heartfelt, and grand.
154;Especially Leonardo DiCaprio and Djimon Hounsou play their characters superbly.
155;DiCaprio as the white African mercenary who wants out of the industry, looks and breathes life into the character with a superb linguistic performance and a feel that makes you believe that there's a lot more hidden inside him than what one can see, smell and hear.
156;Hounsou as the good, caring and at times almost desperate father who wants nothing but to save his family caught in the civil war delivers a powerful and honest performance and has a very strong presence in all the scenes he's in.
157;also director Edward Zwick succeeds in making a fast paced, action packed, yet very emotional and hardbreaking story.
158;the story is also well written and well thought through, so kudos to Charles Leavitt aswell.
159;overall, the movie is great and raises some very valid questions about the exploitation of Africa by the USA and Europe.
160;a very good movie indeed.
161;Still, it can hold up to a viewing if you get it out of the library for free, as I did.
162;I enjoyed this entertaining and informative film.
163;The acting was done very well, and the characters were developed enough that you were pulled through the film's grittiest and most violent scenes.
164;I hope that people watch this film and takes its message about conflict diamonds to heart.
165;My system passed the screening (and always does), but I still had problems once I really got into the film and had to switch to the non.
166;This is a good movie, an important message and good acting with exotic scenery,culture, special effects, a little romance, all that a typical movie needs.
167;He does a very good Afrikaner accent and attitude.
168;there are good moments to the movie, some excellent acting by Hounsou and scenes as powerful as in Apocalypse Now.
169;`Blood Diamond' released in '06 is a taut, well executed action/adventure, drama starring two of the best actors in the business today, Leonardo DiCaprio and Djimon Housnsou.
170;Add to the mix the beautiful and talented Jennifer Connelly as journalist Maddy Bowen and you have an enjoyable evening of viewing ahead.
171;excellent story, excellent acting, perfect direction, pacing, score, you name it, it was done well.
172;an excellent film and a must see.
173;Blood Diamond has an amazing and unique story, which is hard to find in movies.
174;the movie also has great acting.
175;Dicaprio and Hansou were incredible.
176;I definitely recommend this movie!
177;I can't add much, except that this is a must see movie!The plot is great and captures you right into it right from the second it starts.
178;It's such a moving story that I can't even put it into words.
179;This movie will keep you on the edge of your chair.
180;It is a action movie and much fact finding was written into the script.
181;that leo di caprio is a handsome nice guy and i love his movies.
182;Very heart warming, intense movie, of course it's old so you can't expect a lot but for an old movie it is a very entertaining movie.
183;I have watched this movie several times, and have enjoyed it as much as the first time.
184;I could write volumes on each character, but you my friend should see this one, several times.
185;As usual Leonardo did a great job.
186;What a great movie with terrific actors.
187;The topic discussed in the movie blood diamonds is a real occurrence in time and worth watching to get an insight on what it is going on in the world.
188;Blood Diamond is another movie which showcases how great an actor DiCaprio is.
189;To me it was just a very good story.
190;Despite any shortcomings, this movie is worth it just to see DiCaprio and Hounsou .
191;both deliver stand out performances that are worth seeing and carry the movie.
192;America also dumps millions into this country and year and, well like they said, nothing changes.
193;I didn't think I'd like this movie but I really ended up enjoying it.
194;It didn't end the way I wanted it to, but the mark of a good movie is not delivering the ending people may want, while still garnering so many positive reviews.
195;A good story about the effects of diamond smuggling and outstanding acting by all participants.
196;Leonardo DiCaprio, once you get past his accent, is very good in this movie.
197;The storyline is interesting and the locations are just beautiful.
198;This movie was so real .
199;This movie was excellent and I was very pleased.
200;Blood Diamond is a brilliant and gripping movie and is by far the best film I have seen this year.
201;It's combination of realistic storytelling, spot on acting and all out action scenes is what makes this movie work so well.
202;I think he has done a brilliant job bringing this movie to the screen because he has managed to convey both the dramatic aspects of the story and the fanatstic action sequences without it leaning to one side.
203;This is what I believe will keep audiences gripped to the end, like it did with me.
204;Another aspect that kept me entertained throughout was the chemistry between the two lead characters and the way that DiCaprio's character `Archer', changes over the course of the film.
205;overall I think both DiCaprio and Hounsou have done a great job and both deserve oscar's for their performances.
206;Jennifer Conelly didn't have such a major role but she was also good in the film.
207;But mainly I would have to give credit to the writer and director, whom have manged to bring to the screen an intriguing and gripping movie.
208;What it does is effectively tell a compelling human story that's just as touching as it is ugly.
209;While digging up part of the riverbed, he finds a sizeable diamond chunk that has a slight pink tinge to it, something so rare and valuable that its sale could prolong the chaos.
210;She needs him in order to write a good story.
211;It's refreshing for a film like Blood Diamond to present them, especially since it can offer a way to learn about something consumers take for granted.
212;The three characters also have learning experiences, in one form or another.
213;Archer probably has the greatest one
214;While seeing this does little to diminish Archer's desire to possess the hidden diamond, that one moment of love and anguish still leaves an impression, one that enables a better understanding of Solomon's determination.
215;I distinctly remember one moment when Dia is blindfolded and handed a machine gun.
216;He's then obeys the order to pull the trigger.
217;There's a perfect balance at work here, informing the audience with a mixture of disturbing imagery and enlightening moments of compassion and understanding.
218;It makes one wonder whether or not they understood the power of their words, especially since they used them to encourage both acts of violence and undeserved loyalty.
219;Blood Diamond does a wonderful job of examining this complex belief system, something that for many years was the reality for the people of Sierra Leone.
220;I'm thankful for having seen this film
221;opening depiction of a real life crisis, one that a lot people have yet to learn about.
222;Leonardo DiCaprio, our best living actor, leads the charge in this strong, but flawed, offering from Edward Zwick.
223;Pumping out his second Oscar worthy performance this season DiCaprio tries to turn a $100 million monstrosity from Warner Brothers into a political screed.
224;Instead we are left with great storytelling that will entertain its intended middle brow audience so much that they won't even remember the message by the time they leave the theater.
225;Manohla Dargis made the clever point that DiCaprio's heartthrob status will get younger females, or the people that need to see this movie the most, into the theater.
226;The point is right on, however, as the American people are called out for their sick obsession over that while people in Sierra Leone are dying to feed their vanity.
227;That's us Americans, steadfastly believing that a few limbs is a small price to pay to make a rich princess feel a little bit more beautiful.
228;Maddy comes off as idealistic next to the hardened Danny, but she has that luxury, and so do we.
229;throughout the film I was thoroughly entertained.
230;But the reason behind it is pure and you can't expect a housewife to give up her love of diamonds AND children in one night.
231;So despite its problems I am recommending this film, as an act of bravery on Warner Brothers part, as an act of genius on DiCaprio's part, and as an act of great storytelling on Zwick's part.
232;There is a very emotional story between a father and his family and the quest to bring his son home after the boy is kidnapped by the RUF rebels and turned into a killer.
233;This backstory behind the history brings a dose of realism to the characters that we can sink an attachment into.
234;Leo DiCaprio does a masterful job with the dialect and acting, along with Djimon Hounsou and Jennifer Connelly.
235;This is a splendid screenplay that's well balanced, entertaining and at the same time complex in its description of just one of the many long struggles in Africa.
236;Blood Diamond is indeed a great story, very good performances with a fabulous ending, definitely 5 stars, a must have in your movie collections!
237;To start off let me go ahead and say that Blood Diamond is a excellent film and a must.
238;This was all around a great movie, the best of 2006 if you ask me.
239;The movie is overall very powerful, well casted, directed, written, and filmed.
240;Bottom line is if you liked Hotel Rwanda than you will like this.
241;It did me good to become more aware of going on in Africa and the suffering of those people.
242;Leo is awesome
243;Just notmy type of entertainment.
244;This is a great movie, I've seen it several times already, and each time, I learn something new.
245;Worth 2.5 hours of your time to see what it was like in Sierra Leone during the war.
246;paired up with great acting, and action!
247;Blood Diamond is a true story of how material objects, greed, and selfishness can get in the way of doing the right thing, having compassion and empathy.
248;Leonardo is very good and conviencing as a self.
249;centered, greedy guy with a conscience and a good heart.
250;But is it strong enough to make him do the right thing?
251;The other actors in this movie are believable as well in what their mission is and how they feel about the diamond trade business in African and killing for it.
252;It's the kind of movie that really gets you involved with what is happening to the characters and after the movie is over it sticks with you.
253;in your mind and heart.
254;drama, action, truth, and good acting and cinematography.
255;The acting in this movie is magnificent, the story is compelling, entertaining, and breath catching.
256;This movie is a very good drama about the illegal african diamond trading and it's effects on local economies and goverments.
257;The movie does a great job at showing the harsh and tough to face details of what may be occuring in the conflict countries such as Sierra Lion.
258;this is an action packed film with some nice twists, and overall eye opening drama to what is occuring even today.
259;And though he sets off to find Solomon's diamond, we also see whether he can unearth his humanity along the way.
260;Leo adds an amazing muscular menace and aged world.
261;driven drama (Glory, Courage Under Fire, The Last Samurai to name a few).
262;With Blood Diamond, he most successfully negotiates the territory between conventional action movie entertainment and more political, emotional, and darker material.
263;such a gorgeous land frames such unspeakably evil acts, which ultimately adds greater weight to the messages of the film.
264;is just one theme among many in this nuanced and layered work.
265;The film also manages to effortlessly examine other issues, such as: what is truly more valuable, material possessions or human empathy?
266;Great awareness and a reminder to what goes on in the world.
267;But, also, a great story.
268;Director Edward Zwick in his perturbing portrayal of a 1999 civil war in Sierra Leone gives overdue exposure to both the problems of the recruitment of child soldiers and the procurement of conflict based diamonds.
269;While incarcerated he gets wind of the discovery of a rare massive pink hued diamond by African fisherman Solomon Vanty played superbly by Djimon Hounsou.
270;This was a good movie, however I personally found all the graphic violenceto be over the top and definitely excessive.
271;The story itself was goodand interesting, acting wonderful.
272;This is a very powerful movie that wears its political views on its sleeve.
273;They simply did it and it worked.
274;He has lived by his wits and his ability to fight.
