id;spiegazione
816;The 3 main characters are a diamond smuggler, a simple fisherman, and a young journalist.
817;Yet they make more miraculous escapes than Superman, Rambo and Wonder Woman here.3.
818;The overall Let's Blame America tone of the movie.
819;Of course I didn't totally believe her then cause I was like 6 but after seeing this you come to see how valuable and beautiful Africa really is.
820;Everything starts with Solomon Vandy, a good man with a good family and his son is a good student.
821;while working the mines Vandy finds one of the largest and rarest diamonds ever.
822;It was so realistic and perfected that you had to feel his pain.
823;The scene at the end with when he tries to bring his brainwashed sons mind back was amazing.
824;I too have never really been a Leo fan but you can't deny that he has a great talent.
825;I'm not exactly sure how accurate this movie is with the history but overall it's a great film and is a must see.
826;I enjoyed this movie alot but it seems that they picked a nice safe topic to rant about.
827;I did like how they also brought up the topic of child soldiers.
828;BLOOD DIAMOND is an extremely important film from the informational standpoint.
829;
830;it is Vendy who has found the illusive 100.
831;all of these characters converge in a superb action.
832;the Thomas Newton Howard soundtrack is absolutely riveting as well as the excellent cinematography and smart editing.
833;two actors of such calibre deseved better than this.
834;i and my friends included!!!)
835;Where this film succeeds is in the information that the viewer gains about the continuing exploitation of the Africas and the civil unrest that exists among it's own people.
836;there is an excellent warning at the conclusion of the film for anyone who might be considering purchasing diamonds.
837;An African fisherman Solomon Vandy (Djimon Hounsou in a powerful performance) wants a better life for his son so he makes sure he gets to school every day, hopefully one day he will be a lawyer.
838;Danny Archer (Leonard DiCaprio stunningly good) is an ex.
839;soldier of fortune now a diamond smuggler with some pretty high connections in the diamond industry.
840;Director Edward Zwick pulls these two lives together in a powerful, sobering and riveting story.
841;But emotional core of the movie is Vandy's attempt to find his son who whe believes has been captured by the African rebels and his unblinding love for his family and attempts to find them and keep them together.
842;This movie might make you think twice before you put on that diamond necklace, it pulls no punches and will leave you stunned at times.
843;But great acting, a powerful story and superb directing make this a powerhouse of an action thriller.
844;This movie has got it all.
845;Leo DiCaprio and Djimon Hounsou deliver a powerful performance worthy of 5 Academy Award Nominations.
846;This movie portrays that civil war very well.
847;This is one of the most powerful movies I've seen since the turn of the century.
848;I remember a candy bar commercial that left a lasting impact on me.
849;He rushes to the local convenience store and see's that, to his great delight, there is only one more Kit.
850;There they raped the women, killed the men, and took the children with them to train them to be revolutionaries too.
851;She figures if she can learn about how diamonds are smuggled she can take a good first step, which is why she is particularly interested in Danny's form of work.
852;In most movies the human feelings are besides the point.
853;Also worth noting is the excellent acting.
854;Leonardo DiCaprio shows that he's come a long way since he made Romeo and Juliet and The Beach.
855;Sporting a very convincing Australian accent, DiCaprio not only sounds like a native from Africa, but his accent is consistent.
856;It's also worth noting that DiCaprio's performance is really the only performance there is to critique in the first place.
857;All the actors are so convincing in this movie that I forgot anyone was even acting in the first place.
858;What I want to laminate on is the excellent acting, spectacular action sequences, and heartbreaking ending.
859;Hey, I AM watching a movie as opposed to a documentary!
860;I think laminating on these things is worth doing after you see a good movie.
861;And Blood Diamond is a great movie.
862;the films they think have the best chance of grabbing Oscar gold.
863;These tend to be big budget affairs, with big stars, and often with serious or important themes.
864;Well, Blood Diamond arrives with just such expectations.
865;A well meaning and important film about exploitation and atrocities in Sierra Leone's diamond trade, Blood Diamond casts Leonardo DiCaprio, Jennifer Connelly, and Djimon Hounsou as the central characters in an exciting, and sometimes heartbreaking, look at the cost of commercialism in international trading.
866;edward Zwick (who has courted Oscar before with Glory and The Last Samurai) sets a very serious tone from the beginning.
867;i got wrapped up in it.
868;Well, it's a heck of an action picture and it boasts terrific performances.
869;All three are at the top of their game.
870;Hounsou is absolutely riveting in an emotional powerhouse of a performance.
871;DiCaprio acquits himself well with a Rhodesian accent and displays many layers to the morally questionable anti.
872;the film is technically impressive.
873;the cinematography and score earn high marks.
874;But it's the brutal and compelling action sequences that will stick with you.
875;Theses scenes are done with such precision, such excitement, and such realism.you almost forget that the film wants to teach you a lesson too.
876;it has the power to excite you and move you.
877;Far from a perfect film, it is eminently watchable.
878;top for my taste, as well, but by then I'd really enjoyed the journey.
879;A solid 3 1/2 star rating, I'm rounding up for the action set pieces.
880;It was entertaining, to say the least, and action.
881;packed and exciting the whole way through.
882;It also had a strong message, solid direction, and a great cast.
883;Blood Diamond attempts to shed light on an important issue, and it did so with elegance and precision.
884;It's message resonates, and will stay with you for days later.
885;I thought this movie was excellent.
886;It helps that this a very fine movie.
887;In telling the story of a country, there's a fine line between making it enjoyable for the person watching, and also making it realistic and accurate .
888;but after seeing it, I am happy to say that this movie measures up to both.
889;they did a very good job of making it.
890;they especially did a great job of portraying the nature and intentions of the RUF rebels, and their use of child soldiers, as well as the struggle that families had in staying together.
891;the attack on the capital city really surprised me .
892;it was so much like the real one that I wondered how they were able to do it, until I found out that an African journalist had helped them recreate it.
893;It's certainly compelling with good cinematography.
894;i can always see him acting.
895;This is a message movie, and while it IS an important message, the viewer is left both ultimately troubled and impotent.
896;This one takes sharp aim at the diamond industry, and comes off well.
897;Good script, decent pacing, lots of suspense, and solid performances.
898;the total diamond story has yet to be told, but this is a good start.
899;With fantastic performances by Leonardo DiCaprio and Djimon Hounsou as well as a riveting adventure and heartbreaking setting, Blood Diamond brings very real issues to the table and presents them masterfully.
900;I absolutely love this movie and highly recommend it.
901;The father in this movie was amazing.
902;He endured so much and what kept him going was the love of his family.
903;I love the video, it is packed with action.
904;The lead actors do a very good job of portraying the high risks of smuggling in Africa's continual civil wars.
905;He makes this film work along with the other supporting actors.
906;The movie is an interesting look at the diamond trade and how it can fund civil conflicts and create the opportunity for genocide.
907;very good movie watch it 3 timesyou will like this movie very good true storyand lots of action
908;it is also a film about human relations, hope and second chances, but most importantly about trust, love, and inner strength.
909;leonardo DiCaprio, Djimon Hounsou, Arnold Vosloo, and the rest of the cast, have truly outdone themselves with their performances, which are outstanding to say the least!
910;All the actors, without exceptions, give it their 100% and it really shows (the chemistry is AMAZING)!
911;Very well written and very well presented, the movie is without a doubt guaranteed to provide more than just a few thrills, not to mention a few tears.
912;An intense searing drama based on the stuff of real life, Blood Diamond is just as compelling and powerful now as it would have been at least 20 years ago or more.
913;show to be just as potent a source for them as South Africa.
914;And here we also find Maddie Bowen, an American female journalist played by Jennifer Connelly, whose own sense of humanity is tested in the face of horrendous eventsWhile a lot of the above may sound cliched, the combination of outstanding performances (Di Caprio has by now come so far from both Gangs of New York and Titanic that it is truly remarkable) and the unrelentingly brutal violence of greed.
915;The director, Edward Zwick, has crafted a powerful film that hits home like very few other cinematic works this season.
916;This is a film that everyone should see.
917;In the past you have always sent the correct zone for us
918;Leonardo Dicaprio is great in this.
919;djimon Hounsou, gave one of his best performances (deserved the Academy Award in my opinion), as the father whose son is stolen for war and finds the potential rarest diamond in the world, which he uses to find his son and reunite with his lost family.
920;Two stunning scenes: Djimon's character escapes from a place where people are forced and killed to mine diamonds, never seeing the finished product, to peer into a London jewelry shop window for the first time to see the finished product on sale and when his son is about to shot him and he reminds his son who he is, his origin, family roots and the love for his family!
921;wow, this was a new awakening movie.
922;It has all do with greed and take advantage of the human race.
923;worthy performance in the lead role as a selfish greedy guy who is altered in a positive way by an idealistic female journalist.
924;I didn't want to like this movie because it was violent and painful to watch but I admired many of the characters and the subtle change in the lead character was inspiring to watch.
925;Djimon Hounsou was amazing and DID win an Oscar for his portrayal of a simple man of principle who never wavers.
926;Beside being the sign of my Month, this a name of a brilliant actor in this movie.
927;He did one of the best job in his career.
928;Recommend everyone to watch this!
929;Finally a movie with great actors and story line to show the world a glimpse of the effects of supply in demand in places far away from the comfort.
930;Must see should impact the way you view diamonds.
931;Our hats off to him!Blood Diamond's director Edward Zwick did another fantastic job here.
932;We loved his The Last Samurai, with Tom Cruise.
933;Yet another fantastic thinking man's action flick.
934;blood Diamond also has the unusual unsappy love story, which is a much more realistic way to approach such things.
935;Beautiful cinemetography, savage tribes and warlords abound here, showing the mostly unknowledgeable viewing audience of such real.
936;life happenings in the world today.
937;With its superlative storytelling, strong performances, excellent action sequences, and differing locales of harsh living and lush beauty, Blood Diamond delivers on many levels.
938;that's just powerful movie making.
939;This is a Excellent Film!
940;As usually acting of De Caprio is marvelous!I strongly recommended this to others!
941;'Evil triumphs when the good people remain silent'.
942;I look forward to the day when the good people of Africa will stand up to them.
943;Leo DiCaprio is going to get a well.
944;He's so talented, believable, and puts himself fully into the character.
945;Gave 4 stars, because of the acting and because the point of the story is to wake us up from our slumber.
946;But I can say I woke up.
947;Worth stocking up for personal collection.
948;Leonardo DiCaprio's Performance: This film in my opinion features the best ever performance extracted from Leonardo DiCaprio on film.
949;He is flawless here as a South Africa white who needs to discover whether material wealth means more to him than human emotion and sentiment.
950;I have never been a huge fan of Leo (though yes, he was wonderful in What's Eating Gilbert Grape and The Beach) but this film alongwith The Departed really opened my eyes.
951;He is one actor who looks about 25 even though hes well past 40, and has an incredible range.
952;If you pay attention, you will actually see that he gets MORE screen time than Leo.3.
953;utilized actresses we have today, and the director doesn't do much with her here either, which is a pity.
954;The visuals are lush and evocative, and captures the mood of the era and environment perfectly.5.
955;Direction and Story : The director knew a good thing when he saw it.
956;it goes without saying that Leonardo DiCaprio carries this film on his capable shoulders and takes you through almost three gripping hours of it without making you look at your watch.
957;This is what real acting and filmmaking is all about.
958;to wrap it up, this is a must have 2.
959;These two films finally signal the true emergence of America's greatest living actor .
960;Rarely does a movie come along that is important and yet also works as a movie.
961;Blood Diamond is just such a rare gem.
962;They represent the three essential plot elements: a South African white diamond smuggler
963;and, by extension, the generation.
964;everything is well done in this movie.
965;This movie was a very powerful one that stirs the emotion.
966;It gave a realistic insight on what people will do to accquire a diamond.
967;I was brought to tears when I saw how people had no regards to their country men, women, and children in the name of money from the sale of illegal diamonds.
968;I pray for the people of Africa that one day they will be able to love and respect each other
969;The headline of this review basically sums it all up.
970;It's about as good as a movie you'll ever see.
971;Leo was fantastic as always, as was Djimon Hounsou.
972;It's powerful, gripping, compelling, and fascinating.
973;Will watch it many times.
974;Fast shipping and good service.
975;And DJimon Honshue is great in this.
976;Jennifer Connolly is excellent, also.
977;A story worth telling that includes the making of child soldiers from kidnapped boys.
978;This is one of the best political films I've ever seen.
979;thrilling action, wonderful acting, and stunning political implications.
980;The twist here, is that the rebels receive their guns by trading diamonds with the more powerful countries that thoughtlessly fuel the African diamond trade.
981;She is determined to document the diamond trade and unravel the tragedies of humanity within western Africa.
982;blowing intensity, and remarkable political relevance, BLOOD DIAMOND is one of the most gripping films of the year.
983;Watch it and you will be absolutely gripped, forced to rethink your philosophies about world connections and the masked corruption that exists in economic policy today.
984;Overall, it's rare to find films like that capture contemporary world history in a way that's also emotionally moving.
985;The movie was very very good.
986;I very highly recommend this intense action movie.
987;He really is a great actor.
988;This movie has everything, a touch of romance, lots of action, and shows the tragedy facing the poor in Africa for the sake of diamonds.
989;This movie is a must see and have for your video library.
990;The film that made me finally appreciate Leo as an actor and even look back upon his previous films and appreciate his immense talent.
991;the film is riddled with great performances from Djimon Hounsou, Jennifer Connelly, and the Mummy himself Arnold Vosloo.
992;An intense thriller with strong statements and emotional depth, I'd recommend this to anyone who loves a move that holds up as a thinking man's film, as well as some kick ass action scenes that only add to the film.
993;I had expectations before seeing this film from the reviews that it was going to be a good film .
994;how he did'nt get an Oscar beats me .
995;I will be a Leonardo fan from this moment on .
996;Instantly one of my top 5 movies of all time.
997;DiCaprio is near perfect as are his entire supporting cast.
998;The fact that this movie is based on a true story makes it even more compelling and enjoyable.
999;To say the least, I was riveted the entire time and felt immensely for the characters and what they were going through, especially towards the end.
1000;This has to be considered one of the greatest movies ever made and I thought it deserved the Oscar over 'The Departed', which was also very, very good.
1001;Seen it twice in theatre and bought it immediately
1002;zwick does go on and on in great detail, through practically every scene of the movie, talking about both the historical context and the 'art' of cinematography.
1003;It is these extra touches that give depth, making this movie more than 'just' an action movie.
1004;Blood diamond is well written, informing and brilliantly acted.
1005;I think it is Leonardo De Caprio's greatest role.
1006;it was amazing, Brilliant, and stunning.
1007;Its amazing how to us diamonds represent our ideals of beauty, eternal love and romance and also the very harsh and violent cultural and economic conditions that produce some of them, something that for the most part Americans are blind to.
1008;Leonardo DiCaprio was breathtaking , and continues to produce astounding movies.
1009;I do not usually watch movies like this, full of blood, violence, destruction of countries for profit, but I decided to give it a try and found it to be a provocative movie.
1010;I also found it interesting that the market for diamonds is kept artfically high by keeping them off the market.
1011;While I recognize this is a movie and may or may not have any truth to it I found it very thoughtful.
1012;I saw the movie last weekend with a friend.
1013;accentIt is a brilliant movie.
1014;Leo gives an amazing performance.
1015;it opens your eyes of what is happening in Africa (I cried a lot).
1016;i am very proud of Leo that he did this movie.
1017;But I am so happy that Leo got nominated.
1018;it is a really important movie (not just an action movie).
1019;Very compelling and well acted film showing all the corruption and suffering that go into producing the world's diamond supply.
1020;Leonardo DiCaprio was excellent as a corrupt adventurer who seeks out diamonds for some shady London businessmen.
1021;He comes across a man in prison who claims to have found a huge diamond.
1022;I really enjoyed this movie.
1023;Leonardo Dicaprio does a great job with a great story.
1024;thats why i loved this movie.
1025;an excellent movie for those interested in Africa and african issues.
1026;Difficult to watch but if you want a sense of what it is like in the many civil wars in Africa this gives you a good idea.
1027;Jennifer Connelly is passable as the magazine writer/journalist with good intentions and the nose for a good story who befriends DiCaprio and provides minimal romantic interest.
1028;flam of the latest leftist cause celebre, then BLOOD DIAMOND offers entertainment value as a rollickingly good action flick.
1029;wow this movie turned out to be one of the best I've ever seen.
1030;Great movie really worth the time have a seat with some popcorn with family and friends alike will enjoy this fil
1031;This movie is a good one.
1032;I love movies like this that open westerners eyes to the things that happen in other countries specifically Africa, which many say God has left.
1033;They're barely watchable, much less entertaining.
1034;Blood Diamond is a welcome exception.
1035;An action film with attractive, involving characters and memorable .
1036;djimon Hounsou is a powerful, empathetic presence throughout Blood Diamond, and Jennifer Connelly makes Maddy's sense of adventure, bravery, and commitment to her beliefs infectious.
1037;But it is Leonardo DiCaprio's portrayal of sharp, wounded, resourceful Danny Archer that pulls the audience into this film.
1038;Danny's unyielding determination to survive, his relentless motion in the direction of necessity is Blood Diamond's driving force.
1039;The extended sequence of the RUF's assault on Freetown is one of the most memorable depictions of war that I've seen on film.
1040;He does talk about the cultural connections between Sierra Leone and the Western world, the plight of the child soldiers, and how he approached depicting real events.
1041;Zwick also addresses the challenges of filming, cinematography, how he got the necessary exposition into the film, and filming on location in Mozambique and South Africa.
1042;Subtitles are available for the film in English, French, and Spanish.
1043;With recent outstanding performances in the Aviator, The Departed and in this movie DiCaprio is becoming a powerhouse on the big screen.
1044;Here he is fantastic and believable as Danny Archer, a mercenary from Zimbabwe.
1045;His true accent and mannerisms suggest he studied well for this part.
1046;Even in his use of inconsequential dialog he gets it right.
1047;In one of the many memorable scenes she forcefully expresses her frustration that her heartfelt stories and photos of suffering families will not be enough to make headlines outside of Africa.
1048;All three main characters move through a beautiful countryside marred by violence.
1049;Vandy, an honest and hard working fisherman knows his son has been caught up in this.
1050;He will do anything to get his son back.
1051;The cinematography is outstanding, the ending superb(with a little twist as to the destination and use of the smuggled diamonds).
1052;Greed is the dark heart of Blood Diamond, director Edward Zwick's (The Last Samurai) uncompromising look into the underground trafficking of illegally.
1053;He desires escape from Africa at any cost, yet secretly knows that his blood will someday mix with the earth of his homeland.
1054;He eventually agrees to help Archer.
1055;The pace of the movie is frenetic.
1056;The score is perfect throughout.
1057;The education of Vandy's son by the rebels is heart.
1058;Solomon's overarching belief that fatherhood trumps all initially feels nave, but is eventually revealed to be the singularly most powerful force in the entire movie.
1059;the realist mercenary who seems most capable of surviving, when compared to Vandy.
1060;shows the most evolution, shedding layers of the personality onion until an actual human appears.
1061;He is moved to reveal an element of his past to the beautiful American reporter (Jennifer Connelly), whose persistence and mutual survivorship cements a bond they both were too proud to admit from their first meeting.
1062;down Djimon's most impressive performance: I have never seen him better represent a character.
1063;that DiCaprio's accent is spot.
1064;In addition, he was utterly believable as heartless mercenary, and his later transformation was also quite convincing.
1065;easily one of my five favorite movies of 2006.
1066;Even though Archer is a fictional fortune hunter dashing arcoss Sierra Leone to cash in on the chaotic diamond trade, his revelations to crusading journalist Manny bowen (Jennifer Connelly) of greed and capitolism run amok are startling and they help lend moral resonance to a film that is otherwise a thrilling two and a half hour chase through the African bush.
1067;Vandy, who is played with immense passion by Houson, is a fisherman who lost track of his family when his village was raided by rebel soldiers, including child soldiers brandishing AK.47's bought from the illicit diamond trade.
1068;Vandy's wife and daughters escape to a refugee camp but his son is captured by rebel soldiers and indoctrinated into the army.
1069;the film's themes and imagery haunt because of the superb acting from the trio of leads (Dicaprio, Connelly and Houson) that carry the entire film.
1070;Dicaprio has the trickiest role of a rougish and amorous soldier of fortune willing to sell out anyone and anything to acheive his goals, and he tears into the role with a confidence and maturity that is worlds away from Titanic and even his early work with Martin Scorcese.
1071;He's charismatic, cunning and lethal, and perhaps this constitutes the finest work he has ever done.
1072;Houson is pure power and passion as a father pushed to edge, who will trek through the hellish countryside of Sierra Leone to find his family.
1073;Even the most uplifting aspects of the film are haunted by the chance that something like Sierra Leone may very well happen again.
1074;It is true that Blood Diamond is a dynamite chase film, and it is entertaining on that front, but it is the theme of global greed coldly manipulating nations and lives for profit and the imagery of savage total war and child soldiers that is impossible to shake.
1075;Vandy will lead Archer to the diamond in return for help finding his family.
1076;Its a really good movie.
1077;Leo DiCaprio puts out an amazing performance!!!
1078;This was the second time watching it and I still loved it.
