id;spiegazione
1079;Great acting, drama and full entertainment.
1080;Must see if you're an Leonardo fan.
1081;Order this some time ago but I just love the movie!!
1082;Leo is only in his early thirties and has the potential to be the best actor of his generation.
1083;Djimon Hounsou is great as well and deserved the Oscar nomination he got for his role here.
1084;The movie itself is more than just an action film, providing some food for thought.
1085;It is also paced rather well.
1086;Jennifer Connelly plays a journalist and does a great job of using her charm to help forget about the war that is going on, even if it is just for a moment.
1087;The best parts are the action scenes.
1088;It all leads to a very exciting ending.
1089;there is great drama, a great story, and marvelous acting from everybody, but the action sequences stood out the most to me.
1090;When they show up, expect to see some intense shoutouts.
1091;The 2 fight scenes are also good, mainly because Djimon Hounsou is such a superb actor.
1092;Dicaprio also gives an extraordinary performance.
1093;He may be better in this than he was in 'The Aviator'.
1094;this is the best movie I have seen in at least a couple months, and I am a hardcore movie junkie.
1095;My rating sums up how I feel the best.
1096;This movie gets a perfect 5/5 from me.
1097;I liked this movie, I had just come from Kenya when I saw it on Amazon and bought it along with other films about Africa so it was thrill to see it.
1098;Great story, great acting, superb director, unbeatable (for once)historic accuracy!
1099;this is the way movies handling conflict zones should be made!My highest regards and compliments to the director, the producers, the cast and the staff!!
1100;Was a little long and storyline dragged a bit but the acting was good and it's story that should be told.
1101;This movie is a must see!
1102;One of Leo's best films.
1103;Makes you think how much greed can sometimes get the best of you.
1104;Excellent movie, something orginial and thoughtfull, I would highly recommend this movie to anyone that loves good well thought out movies.
1105;Good movie that brings light to somewhat obscure geo.
1106;the acting in this movie is superb.
1107;This movie is like Hotel Rwanda meets Titanic: It offers a vivid and stomach wrenching portrayal of a modern human atrocity with a classic hollywood story smothered on top of it.
1108;There are numerous branching production videos that show how a particular scene was shot.
1109;picture commentary is fantastic too.
1110;Although it's not continuous video commentary (like Mission Impossible III), it's well worth watching.
1111;As with most modern movies on hi.
1112;def disc, the picture and sound is stellar.
1113;Excellent movie about the illegal diamond trade in Sierra Leone!
1114;The acting is superb and listening to DiCaprio's Afrikaner accent is a treat!
1115;This is one of those movies.
1116;Leonardo is superb and so is his co. star.
1117;Before you hit the final act, you can pretty much guess the Hollywood ending you're heading toward.
1118;BUT it's still a good film and worth seeing.
1119;the actors did a very good job.
1120;The movie got a good score from me, but the content gets a 2.
1121;So overal I'll give it a 3.
1122;the download was fast and the picture had no distortions the family enjoyed the movie big time.
1123;i will keep ordering more.
1124;A great action movie that attempts to reveal to the world the ugly side of the diamond trade and the human tragedy that was the civil war in Sierra Leone.
1125;it has great performances by Leonardo DiCaprio, particularly towards the end, and by Djimon Hounsou and Jennifer Connelly.
1126;I have no interest in diamonds whatsoever and have no view to express on their trade as a whole but it was very interesting to learn the long and complicated journey they can go sometimes, from the mine to the jewellery store.
1127;i also enjoyed the evolvement of the relationship between the DiCaprio and Hounsou characters.
1128;Deserving Oscar nominations have, alongside a couple of technical ones, gone to DiCaprio for Best Actor and to Hounsou for Best Supporting Actor.
1129;It's a thriller, with a multifaceted plot and, of course, love interests on many levels
1130;It's grandiose, has beautiful photography.
1131;It's deeply touching to see the power of love of a man for his son, and family.
1132;It's deeply moving, as much as any film I've ever seen.
1133;In this way it's an incredibly powerful film and story.
1134;Watch this film and if you're on the market for a diamond, you'll think twice.
1135;This movie was a action packed thriller.
1136;One of my new favorites!!!
1137;Leonardo DiCaprio is truly amazing, as is his supporting actor (sorry, cannot spell his name), but it should be well known to us as he was absolutely phenomenal.
1138;This movie is one of the great movies from the '06 year.
1139;Leonardo DiCaprios performance is as good as it gets as well as Dijmon Hounsou.
1140;Very powerful movie, very entertaining.
1141;Great story about as close as the diamond ind. goes .
1142;My Mother and her late husband traveled everywere But the Galopagoes islands and she says It,s the most beautiful place on earth.
1143;The simple diamond has become director Ed Zwick's latest interest, and here he explores this rock in such depth and detail, it is both amazing and scary.
1144;He comes upon a pink diamond, a large rock, one of the rarest in the world.
1145;Yes, I am using him and you are using me, and that's how it goes, Danny says.
1146;I'm guessing many adults were, too.
1147;I read many reviews criticizing Blood Diamond, saying that it felt like a documentary.
1148;The acting is top notch.
1149;Leonardo DiCaprio delivers a consistently great performance in every movie he's in and it's no exception here.
1150;He is unflinching as the ruthless Danny Archer.
1151;He always has an ulterior motive.
1152;One of my favorite lines from the movie is uttered here.
1153;Delivered with such emotion that it simply grabs you.
1154;A well deserved Oscar nomination for his role here.
1155;Soloman is a simple man, a family.
1156;He is overwhelmed with what is happening around him.
1157;She certainly feels it will and is unwavering in her mission to find out.
1158;Danny and Maddy had some great chemistry, and ultimately that connection between them plays a vital role in the end of the movie.
1159;other than this, many other factors contribute to the success of this movie.
1160;It depicts the civil war to an amazing level of realism.
1161;The music was also fantastic, infusing native sounds with orchestral elements to create a sweeping score of epic proportions.
1162;in the end, the true power of this movie transcends what can be seen on the screen.
1163;It really is more about what is felt upon watching this movie.
1164;And it certainly did do exactly that for me.
1165;Powerful, compelling and real would be some of the words I would choose to describe this awe.
1166;A superb effort and one the best pictures I have seen.
1167;My daughter watched this movie in school and said it is really good.
1168;I watched it with her and it is a really good movie.
1169;I have always enjoyed this film, from the story to the acting to the soundtrack.
1170;Blood Diamond highlights an important issue .
1171;the viewer is introduced to these issues via three characters .
1172;makers are to be commended for bringing an important issue to a mainstream film, however, they are all.
1173;This was a very interesting movie with a good topic and a great Story.
1174;Once again, Edward Zwick, the Director who has brought us Glory, Legends of the Fall, the Last Samurai brings us a very emotive movie that strikes all the right chords without becoming cliche oversentimental.
1175;Everyone has their own agendas and as we gradually dig beneath the surface, we find humanity that lurks within.
1176;Overall, the movie is very powerful and well.
1177;In Glory, there's Denzel Washington who's all proud and full of honour.
1178;Overall, this is a tour.
1179;force that keeps audience like myself thinking and something to be seen on the big screen.
1180;Gives you a really good insight into one of the many worlds we live in.
1181;Leonardo is spectacular in this movie.
1182;It deserved every award it got, and probably many it didn't.
1183;breaking and joyful, though mostly the former.
1184;It's fascinating to learn a little bit about Africa.
1185;Blood Diamond (2006) is an outstanding action movie, with a heavysentimental story running parallel, involving a mercenary and adiamond smuggler formerly of the South African army (played byLeonardo DiCaprio to perfection, including accent) with a variety ofindividuals, initially apart, but eventually interconnectedconsidering the extent of their interaction and the length of theactual movie.
1186;from a didactic point of view, the script is entirely successful, asit brings into focus the monumental scale of refugee camps, familypowerlessness, homelessness, poverty, anarchy and chaos found incivil wars in Africa.
1187;Connolly's approach is also interesting, from an eagerness inbeing sexier and more provocative than shy and reserved.
1188;from a soundtrack perspective, s fair bit is reminiscent of theworld music heard on Jean Luc Ponty's Tchokola, while thecinematography is flawless, sharp, never dull or boring except for anumber of quieter moments, bringing into focus time and again thebeauty of various landscapes in Western Africa, appealing to thesentimentality of viewers.
1189;the picture deserved a perfect score, with the only difference thatit forgot that it was an entertainment vehicle in its final moments,switching gears to a paternalistic, moralizing, and preaching tone,erasing the right of viewers to independent thought and opinion,suggesting they swallow the United Nations outlook hook, line andsinker concerning diamonds and arms trade.
1190;in sum, this is a remarkable and unique release, from the acting,scenes, music and entertainment value, and the humanity of thepeople that shines through despite the horrors of civil wars timeand again.
1191;I've seen it three times already and will probably watch it again.
1192;Great performances by Leonardo di Caprio (who did a great job with the Dutch accent by the way!)
1193;and Djimon Hounsou (who is so handsome).
1194;packed flick about Africa's corrupt diamond trade.
1195;It is the innocent farmers caught in between the fighting who pay the price.
1196;He educates his son for a better life.
1197;And then one day the rebels capture his son.
1198;Archer will help him find his wife and children for the diamond.
1199;The violence and the bloodshed are so real and caused me to close my eyes.
1200;Leonardo DiCaprio, has the most complete role.
1201;It's a solid performance from Leonardo DiCaprio, who has grown into this sort of gritty role and is more believable after having been seen dancing on the dark side in The Departed.
1202;He has discovered a measure of gravitas.
1203;The message, other than the sory of civil war and the diamond trade, is that Leonardo Di Caprio has found his measure.
1204;Both actors have good chemistry and worked well together.
1205;I give this movie 5 stars.
1206;The acting is great and the story brings home to America the price paid for one of our luxuries.
1207;Leonardo DiCaprio is at his best.
1208;life issues/events in the world and want to act accordingly.
1209;believe, these kinds of things can and do happen and it shakes you, changes you.
1210;The acting is fantastic, Leo and Djimon are truly outstanding in their roles and do the film's difficult subject matter justice.
1211;This movie had us talking about the issues, and that is when art is at its best, when it makes you think, question, debate, and maybe squirm a little.
1212;the movie also brings a sense of appreciation for people who survive in such places and especially for reporters who do not really need to be there except out of choice.
1213;This was a fantastic movie all the way through.
1214;It's a true story with a lot of action.
1215;The two main actors were great.
1216;Just think of the cast: Leonardo DiCaprio, Djimon Hounsou and beautiful Jennifer Connelly.
1217;It is a story of greed, fatherly love and love in all the wrong places.
1218;and also morality tale to about conflict that comes with beauty of the diamonds.
1219;Although difficult to watch at some moments, it is definitely a gem of a movie I have seen lately.
1220;A fantastic film, leo delivers a fantastic performance, i was shocked by how fantastic this film is.
1221;Good movie you have to watch it, very action packed and emotional.
1222;warm, and I avoided watching it until now, despite its 5 Oscar noms.
1223;It has action, and plenty of it.
1224;And it boasts excellent performances from di Caprio, Hounsou and Jennifer Connelly, who should have been nominated, too (along with the strength of her performance in Little Children).
1225;I was riveted from the beginning, and am so glad I finally saw this film.
1226;An added note: I recall that Mr. Hounsou's performance was regarded as one.
1227;note and hysterical all the time
1228;I thought he was centered and totally in touch with his character.
1229;And, was he really supporting.
1230;whatever the case, this movie is one of the best.
1231;The topic is fresh in movie world and the acting is first class.
1232;I truly enjoyed the acting, photography and the story, cruel and violent as it is, because it is well put together and it does not shy away from the hard reality.
1233;I definitly recommend the two disc set as the documentary on the second disc is the best I've seen to date that is about blood diamonds.
1234;Not even the National Geographic documentary is as insightful or entertaining.
1235;I believe this movie will have a surprising affect on most people whom see it.
1236;I've always been a fan of director Edward Zwick.
1237;Legends of the Fall, Glory, About Last Night and The Last Samurai are all very watchable.
1238;It works well at times, but at others it's hard to tell whether its a light.
1239;hearted romp or a political piece of film.
1240;I liked it though, and it's deinitely worth a look as it's fairly unique.
1241;Blood Diamond is absolutely one of the best movies you will ever see.
1242;This movie is very intense!
1243;This movie definitely deserved an Oscar alongside Leonardo DiCaprio.
1244;This movie shows how life really is for these poor people and captures the grittiness of what they go through just to live another day.
1245;I highly recommend this movie to everybody.
1246;Leo does it again, great acting awesome movie
1247;That includes ivory, rubber, gold.
1248;the story's hard to watch, but very real and worthwhile.
1249;James Newton Howard does an amazing job with the soundtrack, which touches the scene in just the right way to emphasize the director's point.
1250;morning movie serial, moving from one close call to another.
1251;Lots and lots of women and children callously cut down in the film.
1252;the action, if you will, is well staged and makes up for much of the rest.
1253;Edward Zwick, who did such a great job with GLORY and a pretty good job, I thought, with THE LAST SAMURAI, is clearly aiming for an important film here.
1254;The editing, cinematography, landscapes and especially the actors and the ACTION are all first.
1255;diCaprio is all the way back now as one of our great actors.
1256;But this year, with THE DEPARTED and BLOOD DIAMOND, there is no doubting anymore that he is an actor of considerable skill.
1257;seriously), he is first rate.
1258;He's really a bad guy with charm, and the fact that we feel mostly on his side through the film, even though he's killing people left and right, is a testament to his charm.
1259;jennifer Connelly, in a poorly written role, always looks great, and staring with roughly the middle of the film, her character begins to connect with the audience, and we start to like her.
1260;and Djimon Hounsou is always a mighty presence.
1261;He was great in AMISTAD, Oscar nominated for IN AMERICA, and truly in his element in BLOOD DIAMOND.
1262;He's an African born actor, and in this film he's truly in his element.
1263;He has a real sense of the pace and lifestyle of the region, and it comes across very well.
1264;so, overall I recommend the film.
1265;But if you want adult entertainment with lots of action and don't mind a sheen of message, you'll be pleased.
1266;And oddly, there's a sharp dividing line between the good and the bad, and that, of course, is Titanic.
1267;They weren't all brilliant by any stretch of the imagination (The Basketball Diaries, really), but he was always brilliant in them.
1268;Nothing can ever be easy.
1269;Hounsou has been nominated for Academy Awards both for this and for In America, but, really.
1270;Zwick, of course, is a director well.
1271;received upon release, has become an enduring favorite of Brad Pitt fans.
1272;Charles Leavitt's screenplay is both well.
1273;(I'll put it this way: it was good enough to get him tabbed as the cinematographer on Harry Potter and the Deathly Hallows.
1274;Maybe it'll change your mind, and let you see what the rest of us have known all along.
1275;Most amazing of all, in spite of the fact that Jennifer Connelly is simply too beautiful to be credible, it is never over the top, but realistic throughout.
1276;The acting is uniformly excellent, particularly Dicaprio, whom I have always thought is under.
1277;It follows the course of 2 men and is quite surprising .
1278;It is interesting and relevant, and this film provides an emotional backdrop to why we should concern ourselves.
1279;But it is moving and necessary.
1280;the leads, in my personal experience realistic, compared to all but 3.4 movies, mostly documentaries.
1281;rated, and needed to be seen.
1282;Blood Diamond was one of the better films of 2006.
1283;Dicaprio in a Oscar nominated performance is outstanding, and so are Hounsou and Connelly.
1284;Director Zwick hits the mark on this fine effort.
1285;Blood Diamond is the kind of action film that makes you think that 'a moment of love, even in a bad man, can give meaning to a life.
1286;believes this pink gem holds his ticket out of this godforsaken continent.
1287;has hided the enormous 100 carat diamond from his captors and buried it in a secret place within the jungle.
1288;danny makes a deal to help the noble fisherman find his family if Vandy will lead him to the diamond.
1289;leonard DiCaprio is both ruthless and charming as the cynical soldier of fortune who knows an opportunity when it presents itself.
1290;But he also is aggressive and selfish willing to do whatever it takes to get what he wants.
1291;He illustrates the black side of the dirty diamond trade.
1292;On his trek to find the stone, Archer's eyes are opened to some enduring values that surpass his own self.
1293;She thinks that with Archer's help she can get a unique story line surrounding the civil war but also revealing corporate malfeasance and cover.
1294;it is also good to mention Arnold Vosloo in the role of Colonel Coetzee, head of the army unit also trying to claim the diamond.
1295;He's a great character actor and remains a powerful presence and one of the screen's most efficient scene.
1296;nominated for five Oscars, Blood Diamond is an action, political adventure at its best!
1297;Just make sure she watch this movie.
1298;Carbon is one of the most plentiful elements on the Earth's surface.
1299;certain firms have control of the diamond trade world wide ( a cartel)and have driven the price artificially high.
1300;news has become the new weapon.
1301;This latest work by Edward Zwick tackles a serious social issue in the guise of popular entertainment, which turns out to be both the greatest weakness and the greatest strength of the film.
1302;Blood diamonds, also known as conflict diamonds, are those that are mined in war zones, then sold to finance those wars.
1303;with a screenplay by Charles Leavitt, based on a story by him and C. Gaby Mitchell, Zwick has fashioned a generally powerful film whose occasional dramatic contrivances can be easily forgiven in light of the salutary goal of the film.
1304;but the air of First World condescension is faintly evident nonetheless.
1305;miraculous dodging of bullets etc. .
1306;those negatives aside, Blood Diamond is, for the most part, an effective piece of serious commercial moviemaking, thanks, primarily, to Zwick's skill as a director and to the fine performances by DiCaprio, Connelly and, especially, Hounsou, whose quiet dignity and fierce determination do much to personalize the plight of the innocents caught in a hellhole of wanton slaughter and crass de.
1307;This moveie kept me on the edge of my seat throughout.
1308;An excpetionally well done movie.
1309;And a wonderful amalgam of all of the issues with this very disturbing political situation.
1310;Over the past year Leonardo Dicaprio has become one of my favorite actors.
1311;He has totally renewed his image and become pretty hardcore.
1312;He's like a thousand other guys in the South African army and for this authentic portrayal alone he deserves an Oscar.
1313;balance with the movie, but it's generally a good watch.
1314;dimensional qualities that make the character believable.
1315;His co. star is also believable and emotionally mature enough to make this film such a great viewing opportunity.
1316;Anyway, I saw it this weekend and it is actually excellent.
1317;This is a great story.
1318;DiCaprio does a great job as a menacing but very human South African mercenary (I think I was not sure this role would be a good match for him), there is lots of action and a moving story at the core.
1319;It's a lot of fun too.
1320;I really like this movie, it's one of the few I've enjoyed enough to consider watching more than once.
1321;I was skeptical because i dont really like DiCaprio, but he actually did really well.
1322;This movie is worth every penny.
1323;Blood Diamond is one of the finest films of the year.
1324;Featuring a well acted cast that includes Oscar Nominees Leonardo DiCarprio (Best Actor) and Djimon Hounsou (Best Supporting Actor) and also Oscar winner Jennifer Connelly.
1325;this is a great film, whether you get the single disc or the two disc edition.
1326;described soldier of fortune, is weary of this arrangement and willing to sell his story to an American political journalist named Maddy (Jennifer Connelly) after he snatches the gem.
1327;at its core, Blood Diamond is really an Adventure In The Bush!
1328;There are three significant action sequences, all well done, all convincingly played by the actors.
1329;he can crack a joke one breath, crack a skull the next .
1330;and DiCaprio gives the role the right kind of suave menace.
1331;and used it for costly, epic shoots.
1332;style look at the Japanese samurai culture, Blood Diamond is late to the topical party.
1333;But it has to be about more than that.
1334;Thought both leads did an excellent job of portraying the issues with Blood Diamonds.
1335;It was very informative about the diamond industry as a whole, historically as well as recently.
1336;This is a really good movie to watch.
1337;this is one movie that I would highly recommend this movie to anyone.
1338;Blood Diamond is an excellent drama, with great characters, and exciting action sequences.
1339;ray rendering of this movie, but also if there is a defining role for DiCaprio so far, this movie in my opinion is it.
1340;the cinematography and directing is outstanding and the BD rendering is wonderful.
1341;I found myself completely drawn into the action and story (even though the ending was predictable).
1342;ray, great directing, great acting and story.
1343;I think that this movie is the perfect blend of a documentary and an action.
1344;But instead of going for a factual film, the creators decided to throw together a group of great actors and a set of interesting sidelines to the story, polishing it into a magnificent jewel.
1345;solomon Vandy (Djimon Hounsou) is a fisherman that dreams of his son, Dia, becoming a doctor and moving on to better things.
1346;Luckily, Solomon's family escapes, but the RUF captures him and takes him to work on the diamond fields as a slave.
1347;the film definitely achieves its purpose of making people aware of the issues, and even though the story is gut.
1348;What I did not expect before watching this movie was the outstanding performances I was going to witness.
1349;This is definitely DiCaprio's best.
1350;He even altered his accent to make it sound like a local and he does this very well.
1351;But he also has to play a character with multiple facets and that goes through somewhat of a transformation, and his performance really helps to make this believable.
1352;Jennifer Connely is the one I expected the best from, and she did not disappoint, since she delivers a performance on par to the one she gave us on excellent The House of Sand and Fog.
1353;This is definitely one of the best releases of 2006, and if you can stomach the violence I believe you will agree.
1354;This movie for me was very powerful and tugged at a lot of my emotions.
1355;Djimon Hounsou is a fantastic actor who portrays such pain and fear but also such hope.
1356;He makes you feel what he feels.
1357;And Leo DiCaprio fit his role exceptionally well as a man who discovers what is really right just unfortunately too late for himself.
1358;This movie is heartwrenching and touching at a very deep level.
1359;Frankly, Im not the biggest DiCaprio fan, but i really liked him in this, he was very believable as a white Rhodisian, though his accent goes in and out, sometimes it is spot on and other times it is.
1360;the movie has a brisk pace and it very violent, but it always felt real and you really want the characters to succeed.
