841;It's a movie that you watch, but you still have questions about it.
842;It truly is a GREAT movie and everyone should watch it.
843;It is more than a movie, it is an intellectual masterpiece!!!
844;As a filmmaker, I found this to be one of the most original films of the last few years.
845;The film works it's way backword, while the black and white footage progresses forward.
846;The acting is great, and the character in the story is as confused as we are as to what's happening.
847;bones edition allows you to view the movie in chronological order of scenes should you wish or if you are still confused after the first viewing, but I recommend that you watch it the way it's intended first.
848;With some good haunting music for the film score.
849;This best part about this film was that it was low budget.
850;Mostly in the form of poloroid picture and very important notes are tattooed to his body.
851;He is on a mission of revenge.
852;It may sound confusing, but is actually quite e4asy to follow.
853;the acting is perfect and the cinematogrophy is perfect as well.
854;The music really fits the mood too.
855;Plus there is a twist at the end (or the beginning!)
856;Multiple viewings are required to really pick up on certain things that are definelty missed and will make the story have more sense and really uncover the conspiracy , if there really is one that is!The special features could be really good.
857;And that was all I was able to find.
858;That one gripe aside, everything is perfect.
859;This is truly an original film.
860;"anne Moss, Joe Pantoliano, and most notably the lead actor, Guy Pearce, whose role in ""L. a. Confidential"" began my personal respect for his talent."
861;It is true that the first time I saw this, by movie's end, I wanted to scream.
862;The director, Christopher Nolan, forces the audience to remember each previous scene in detail leading up to the end, thus making the audience identify with the main character who suffers from short.
863;This is a unique film, and I am proud to have it in my collection.
864;The plot twists and surprises that director Christopher Nolan employs in his energetic, frenetic script are intelligent to a fault, ones that tease the mind for hours after the film has ended.
865;There is more to keep up with, which makes it even more interesting.
866;The movie keeps this a secret even after its ending, inviting us to think on the subject, to ponder on the film's many turns and spins.
867;By the time we finish thinking about it, we're more concerned with who is on top rather than who killed Mrs. Shelby.
868;and that is precisely what makes this such a fascinating film.
869;the film has its share of effective performances that range from subtle mysterious to all.
870;Guy Pearce brings a hushed fervor to his character, embodying Leonard with an inner willpower that keeps the film at a fever pitch.
871;anne Moss is eerily mysterious as Natalie, whose intentions play a bigger role than you would first consider.
872;Joe Pantoliano gives his character just the right appearance, that which instills a great sense of suspicion for his character, Teddy, who uses Leonard's memory loss to his advantage.
873;Appearances can be deceiving, and this is a fine example of that.
874;Nolan's reversal device enhances rather than diminishes the movie's effects, perhaps because it allows us the chance to give serious thought to the events going on.
875;"I entered into this realm of filmmaking not knowing what to expect
876;Formalistic experiments in film can be a hit.
877;Memento writer/director Christopher Nolan flies out from among his competition by finding a story which by nature demands an unconventional narrative approach, making Memento the four.
878;the amazing thing is that Nolan makes you hang on to a story in which you find out the ultimate outcome of the plot in the very beginning.
879;Memento, however, makes you care about *how* something happened, the cause of the effects, and somehow manages to generate suspense even though you're watching events unfold backwards.
880;The actors do a terrific job .
881;Guy Pearce wisely holds himself back and delivers a low.
882;over job that are instantly winning"
883;anne Moss continues to make smart choices in edgy roles, not content to milk her sex.
884;"symbol status
885;term memory for fresh comedic moments, and this also helps keep your attention even if you might sometimes get lost in its complicated plot.
886;And of course, the bounty of story twists and revelations make this movie a terrific rewatch experience.
887;one of the best films of 2001, and certainly the most original.
888;This is the type of movie Alfred Hitchcock would produce today"
889;Contrary to popular belief, yes you do need to be a rocket scientist to figure out what the heck is going on.
890;This film really twists and turns, engaging you as the story unfolds, and the climax is something that you wouldn't believe!
891;This movie is a serious trip!
892;"Like Mulholland Drive in that you'll watch it several times and experience those ""Aha!"""
893;it's just kind of trippy).
894;I loved Joey Pants in this thing.
895;He did a great job.
896;This is a movie for movie fans.
897;the storyline is intriguing and will hold the attention of a movie lover as they too try to work out what is going on.
898;So just sit back and enjoy it.
899;I first saw Memento on Video and thought this movie rocks.
900;Its original and thats what makes a good movie, the way its told backwards is good.
901;It makes you confused but then the ending makes it clear, with a twist.
902;Definitely strange, interesting and fun!!!
903;Very unique idea for a film!!!
904;strangely enough, I got this movie the first time viewing it!!
905;"maybe better said as, ""The last scene/end of the movie is run forward first as the movie starts ."
906;New memories can never be formed and since he's decided to solve his wife's murder and his assault he has to write himself notes and other various extreme things so as to remember what he has discovered from day to day .
907;Even if the ending were extraordinarily mind.
908;For your sake, I hope you listen to the one voice of reason crying in the wilderness of mistaken notions of effective filmmaking.
909;Say what you will of its subtsance, that film, at least, contains, along with its flash, almost nonstop humor and an abundance of compelling character acting.
910;If you thought it was hard to write script with a suprise ending, how do you think it is to write one with a suprise beginning?It was an amazing movie, hard to follow, but amazing.
911;Great movie, excellent acting and a brilliant script.
912;One of his best performances.
913;I suspect this will also be true of some number of other potential viewers.
914;By me, so to speak, this is an art.
915;offBroadway, Dadaist, University experimental film.
916;Usually, when I put on a movie with which to relax after dinner, I want something straightforward to watch.
917;This is a deep psychological thriller based on the some of the freakiest elements of memories and revenge.
918;I'll tell you right now it's not the kind of movie everyone likes.
919;The plot is not easy to understand, but it is thoroughly amazing.
920;"except if you get it hang on for your life
921;It is one of the best pieces of literature produced in our age.
922;But once you have seen the movie, it is good fun to look through.
923;Momento is a great psychological thriller.
924;After seeing this movie you can appreciate that there are people out there you still want to create great movies.
925;Guy Pearce gives the performance of his life in what I think will go down as one of the greatest films ever made.
926;This could well be the greatest movie of all time.
927;A true cinematic gem, missed at the yawn awards.
928;Inventive, stylish, provocative and in a class all by it's self.
929;This is virtuosso film making at it's finest!
930;A true movie connoisseur's movie.
931;I am a big fan of Guy Pierce and his first movie, Priscilla Queen of the Desert is still my favorite performance of his so I was very happy that he was finally recognized with Memento (although it seems to have been his version of kd lang's Constant Craving where the public recognized at long last your talent and then ignores you.)
932;I love the Movie and Do watch it about every three months.
933;I like the fact that you can watch it in chronological order if you figure out the menus.
934;Great movie (which I already knew) that arrived in great condition!
935;I bough this as a christmas gift for someone and they loved it!!!!!
936;the movie will start from the credits to the beginning (showing the scenes in the right order, and you'll be able to watch the story as it happened.
937;Technically the picture is fine with no artifacts , and the dts track performs beatufully in a fine tuned system, watch the movie and solve the puzzle, you won't be dissapointed.
938;indulgent to allow that to happen.
939;To be fair, it had it's fair share of great moments.
940;The clever chase scene where he figures out he is being chased is cool.
941;The ending is surprising and interesting, it made me think about the movie a while afterwards.
942;It will be and already is a huge cult hit, so I guess I'm fighting a losing battle.
943;I really enjoyed this movie.
944;It's the kind of movie that you really need to pay attention to at all times.
945;it was a very interesting idea that was well crafted.
946;I think that Guy Pearce was amazing in this movie.
947;It has a few twists and turns that are well worth watcing.
948;it's a original film, and one of the better films I've seen this year.
949;Just watching the innovative style of the film, being played backwards, is enough to behold.
950;Though it's seems unnatural at first, the way director Christopher Nolan pieces the film together flows really well.
951;If the unique style wasn't enough, the plot and message of this indie film are both superb.
952;Here Nolan takes the mystery genre to a fresh level that has yet to be discovered.
953;purpose in life, the selfishness in mankind, trust, and memory.
954;i really gained a great respect for Christopher Nolan, this being his sophmore film.
955;I also recommend watching his first feature The Following.
956;All three are very believable and do a remarkable job.
957;This story keeps you glued to the story line to figure out who each of these characters and what are they doing to Leonard.
958;In Memento, Guy Pierce plays a former insurance investigator with a rare form of amnesia trying to track down his wifes murderer.
959;For the most part this works to great effect in creating an intriguing scenario and thickened suspense, although at times it neccessitates that the plot be overly simplified just so it's easier for the viewer to try to correctly piece everything together chronologically.
960;Understandably, this brings us closer to experiencing Pierce's feelings, but is ultimately detrimental.
961;With a whole world filled with remakes and clich s it feels great to come across a movie such as Momento.
962;When thrillers where really good?
963;Well here you have Memento, a real jewel which will grab you and keep you on the edge of your seat.
964;The film starts at the end and takes us trough his quest for vengance all the way to the begining.
965;write it on your fore head.
966;It is a realistic thriller with adult content in a crime setting.
967;I stunned at so many good reviews.
968;This movie starts at the end and goes backwards from there.
969;The main character (wonderfully acted by the talented Guy Pearce) has short.
970;anne Moss is simply brilliant in this movie.
971;anne Moss is sultrier than ever.
972;If ever there was a movie that Guy Pearce was destined to play in, Memento is it.
973;Don't get me wrong, L. a. Confidential was superb, but this is just amazing.
974;Shot in black and white and color and told in a reverse.
975;forward manner that will amaze you, Memento has everything going for it.
976;It's puzzling, but it certainly fits the movie.
977;It amazed me how not only this movie remained cohesive, but also offered intriguing characters, and still managed to throw in a twist ending (or should i say beginning)that was actually a good twist ending.
978;I have the special edition and watched the hidden version that takes place in actual chronological order (which should only be watched once youve seen it how it was meant to be watched) and it was still a good movie.
979;Please please please watch this movie.
980;Memento is well made, if nothing else.
981;Taughtly written, well directed, well acted, and once you get used to the backwards storytelling, surprisingly easy to follow.
982;The film is so relentlessly depressing, and disturbing that the ending, while clever, and satisfying on one level, brings its own sense of relief that you can get back to normal life.
983;this is one of the best movies ever.
984;The best and most underrated movie of last year.
985;I read an extremely detailed review, with explicit spoilers, before seeing this film.
986;It's the most original concept in film.
987;to give credit where credit is due.
988;dressing, and dialogue is extremely well done.
989;but DAMN, you'll have a fun time debating and puzzling over it.
990;this interesting use of editing and sequence lets us completely enter the confusing world of the main character, who's unable to form new memories, and so, can't remember anything for longer than 5 minutes.
991;It also helps to keep us guessing about major plot points.
992;Memento is a very good movie.
993;ray format presents the movie in a clean format but the extras and almost no subtitles makes it hard to share with everyone you want.
994;Although, is not a bad choice if you want to have it in the best digital format.
995;Wonderfully complex and original film by Christopher Nolan, who made the Batman/Dark Knight films and Inception.
996;I got Mememto for me and a friend to watch, and I found the movie to be VERY GOOD!
997;You have to think about what is going on, and just when you think you had it solve, there is another twist which makes it more interesting.
998;It is like a good detective story with great twists, and I recommend this movie who are interested in a good mystery.
999;The memory is also played in chronological reverse, turning a clever story into a brilliant movie.
1000;This is directory Christopher Nolan's 2nd movie, and beats out his brilliant first film, """"Following."""""""
1001;A great film to check out if you end up enjoying this one as much as I did.
1002;I have watched this movie 4 times now and I _think_ I get it.
1003;This is an awesome movie, a must.
1004;The film is a revolutionary concept.
1005;We actually travel backwards with Leonard until the startling conclusion.
1006;A sympathetic friend (Carrie Anne Moss) seems to be helping him.
1007;"Directed by Christopher Nolan, ""Memento"" is a Masterpiece of suspense."
1008;I highly recommend this film to all viewers.
1009;Moving along with the narrative, we see Leonard as an insurance investigator prior to his attack.
1010;And Sammy's story is important to the film.
1011;Teddy's character is very important in the film, and where Teddy's loyalties are, leave the viewer in suspense.
1012;writing, and it is thoroughly worth the watch.
1013;I highly recommend this film to all viewers.
1014;lots of subtlety in the film, well beyond just a great film.
1015;noir styled plot with an interesting backwards.
1016;existentialism vs. realism, personal identity, memory, self.
1017;ended about who leonard really is, which allows for some interesting speculation.
1018;clippings provide extra background details and clues, that may change what some think of the plot.
1019;story, which is worth a read, is available online at [.]
1020;additionally, he takes teddy's photo during the black white sequence, and he has this photo in his possession each time in the film that he meets teddy (including before he records Fact 6.)
1021;Its witty cinematography combined with the philosophical perception of reality made this movie a masterpiece in my mind .
1022;As has been well described in other reviews, it's a brilliant psychological thriller that keeps you guessing as you see each scene the way the main character would.
1023;Which is why the film is worth seeing again.
1024;That made each scene more significant and enjoyable.
1025;to put it another way, when you see the film the first time, you're mostly in the dark about what's really going on until the end.
1026;Seeing it again, each detail becomes richer in meaning, the film seems deeper, and I could appreciate it on another level.
1027;when you get past the superficial level of the plot mystery, what remains is a meditation on how we choose who we are in the world, and the role that memory plays.
1028;crafted illusion to create the world we want to live in.
1029;In that world, the meaning we bring to each new day is just a product of the memories we carry with us.
1030;This gripping revenge thriller will keep you guessing from beginning to end and keep you talking long after it is over.
1031;With it's unusual style and it's extremely complex plot, Memento will take you for a mesmerizing ride that you will not soon forget.
1032;He must assemble numerous clues for himself, some in the form of tattoos, others in the form of Polaroid pictures of people relating to his search.
1033;memento is a great movie to own because it is one of those rare movies that you will want to watch over and over again.
1034;With it's intricate plot and changing perceptions of characters throughout, there is always some missed hidden detail waiting to be discovered.
1035;It is a masterpiece that must be seen.
1036;quick plot synopsis: A psychological thriller about a man with short.
1037;It does an excellent view of putting the viewer on the same level as the main character by showing the movie in reverse.
1038;The first scene you see is the last one in the story.
1039;"disc set gives you everything you'd expect from a special edition: director's commentary
1040;all i can say is great price, the movie got to us super quick, cant complain at all!
1041;Great exercise for those who like to think about the films they watch.
1042;I like the people in this movie and mostly the pretty girl with the dark hairs.
1043;If you enjoy the challenge of mapping out the contents for yourself, more power to you, have a blast.
1044;ray and was able to compare.
1045;packaging of the original with more extras (all the extras from the 2.
1046;The picture is greatly improved (the original is 'soft' .
1047;the 10th anniversary edition shows much more detail).
1048;i did see the movie through hoping for some big twist and then it will all come together for me and I'd be somewhat entertained by the finale of it.
1049;Just brilliant enough to interest scores of stoned undergraduates.
1050;Then I watched it again after a month, and I stuck with my original opinion that this is in fact, a really good and original thriller.
1051;No, but it's still quite the classic and a must.
1052;It starts at the end, starts at the beginning, and alternates between the two until they meet in the middle, to which the movie is wrapped up.
1053;It works for the story, and keeps the viewers on their toes in keeping track of everything.
1054;Let me illustrate to you the brilliance in this presentation.
1055;She tells Guy Pearce that it was her boyfriend did it to her and that Guy needs to get rid of one of his associates.
1056;It's more or less brilliant and Nolan uses it to his advantage to spice up an already great story.
1057;The movie goes deep into the detail of how somebody with this condition would live.
1058;But hey, the reveal speech by Joe Pantoliano and Guy Pearce is great.
1059;And again, it's a 'Holy Crap' moment that will leave you satisfied on your first viewing.
1060;Still a classic, I really hope I never get that short.
1061;_Memento_ is a revenge/thriller that stars Guy Pearce, who turns in a very good performance, in the role of Leonard Shelby, a widower, who has completely lost the ability to make short.
1062;He relies primarily on Polaroids, notes and tattoos in order to help him remember the most important """"facts"""" he discovers."""
1063;Along the way, Shelby is befriended by Natalie, played by Carrie Anne Moss, and Lenny, who is brilliantly portrayed by Joe Pantoliano.
1064;_Memento_ offers a reasonably original screenplay that is well acted on the overall, and, considering that this is Nolan's second film, the directorial work is deserving of praise.
1065;It's definitely worth a single viewing, though I doubt I'll ever watch it a second time.
1066;Don't get me wrong, this is a good movie .
1067;Christopher Nolan's Memento is one of those films you may have to view several times to truly appreciate.
1068;What makes the film unique is simply the way it is told, using a non.
1069;It's a bit jarring at first, and difficult to follow, but it doesn't alienate the audience, and eventually the viewer is able to pick up on this type of narrative.
1070;Therefore, from Leonard's point of view, the line between friend and enemy is always indistinct.
1071;Memento somehow manages to mimic its storyline with its film techniques, with scattered clues here and there, and is a cerebral whodunit experience for the viewer to try to piece together.
1072;It is also a unique, stylish, film that has great pacing and building suspense, and finishes with a nice twist.
1073;If you want to know if you will enjoy the movie, the other raving reviews should help you.
1074;So, that's most definitely a steal.
1075;Oh, and it was plastic wrapped and in perfect condition.
1076;It's one of those movies you have to watch over and over again.
1077;It's captivating, thrilling and suspenseful.
1078;I love having it at home so I can watch it whenever I please.
1079;Memento eclipses everything which preceded it, and set the bar so high it may never be topped.
1080;director Nolan does a remarkable job of juggling the complex plot elements, but sabotages himself with some of his rather ordinary visual schemes.
1081;I refer you to the diner sequence in which characters portrayed by Guy Pearce and Joe Pantoliano converse over soup.
1082;Close ups work best when used judiciously and to provide emphasis.
1083;his accent is that authentic.
1084;"All of the performances are convincing and it's always fun to see ""Eve 6"" (Harriet Sansom Harris) from that great ""X. files"" episode."
1085;please watch this movie, it is very well.
1086;acted, and entertaining as well.
1087;it has a lot of clever and detail.
1088;"ridden ""reverse punchlines"" as well as suspense."
1089;It's better to let this movie take you on a backwards path from end to beginning.
1090;I watched this a couple months ago and the music stayed in my subconscious.
1091;Finally had to play the movie again, and I enjoyed it just as much as the first time, even after knowing all the twists and turns.
1092;There is actually a dual main menu, and you can access the secondary one by slipping into the audio selections and then returning to the main menu.
1093;More companies should be so innovative in bringing a fresh approach to creating unique menus.
1094;this is a great movie for thinking people to watch.
1095;It is one of the better.
1096;written and edited movies out there.
1097;And I know that most movie.
1098;I would have thought that people under 18 might not like it so much, but they are consistent with the overall score.
1099;memento is the most innovative and absorbing thriller to come out in years.
1100;christopher Nolan presents us with a thrilling and provocative noirish screenplay.
1101;There are many twists and turns as we're kept on our toes as Leonard searches for those who destroyed his life.
1102;"guy Pearce carries the film on his head and shoulders
1103;Pearce is backed up by strong supporting performances from Joe Pantoliano and Carrie.
1104;exhilarating and unsettling, Memento is a film you won't soon forget.
1105;Finally, the trend in hollywood has moved towards brain twisting clever thrillers.
1106;It's really something that you have to see to experience, but is done flawlessly.
1107;going to watch it again soon!
1108;christopher nolan is a great writer.
1109;guy pierce is the perfect actor for this film.
1110;Wow, this movie was awesome.
1111;Christopher Nolan finds a neat way to tell a story.
1112;backwards with cause and effect.
1113;Guy Pearce and Joe Pantalonio did a wonderful job but i didnt think Carrie Anne Moss did that good of a job, couldve been better.
1114;Christopher Nolan is now one of my favorite directors.
1115;The movie is engaging and it makes you wonder what's going to happen next.
1116;For a few reasons, one of which was Lenny's memory of giving his wife an insulin shot.
1117;I saw this movie my freshman year in college [5 years ago] and fell in love, but I wanted to watch it closer because it's one of those movies that make you think.
1118;I also wanted to share it with my boyfriend because I thought he'd enjoy it, and he did too!
1119;Still, on top of being a first.
1120;rate thriller (well, more or less a thriller anyway.)
1121;'Memento' has got a real human interest angle, and prods into some ideas with regards to reality and perception.
1122;As you would imagine, this can get pretty damn complicated.
1123;Still, clever and intriguing as the plot is, the character of Leonard is perhaps the most interesting part of the film.
1124;Personally, I find him to be a great, tragic and highly sympathetic figure.
1125;He's particularly compelling to me, as I find revenge to be a rather romantic notion.
1126;performances are all excellent, though special note goes, again, to Guy Pearce as Leonard.
