1;Maybe not everyone's cup of tea in terms of premise of film, but Memento is far and away the most inventive crime/thriller film of recent years.
2;naturally, the standout feature of this film is the reverse.
3;the two male leads receive the bulk of the screen time, with Australia's Guy Pearce handling Leonard Shelby in a particularly strong manner.
4;This performance certainly reaffirms his position as one of the better actors of today.
5;joe Pantoliano (of Matrix fame) is also superb as the shady Teddy, a man who clearly knows much more than he is letting on.
6;Pantoliano is charming enough in the early scenes to set himself up as the good guy, but (and this is far from revealing the plot) is also capable of presenting a very dark side to his character.
7;shelby, who often tells the story in an internal monologue (a definite nod to the noir classics), is a mordantly funny character.
8;One of the great moments of the film .
9;that, after all, is the mark of success of a film noir.
10;In the end, that is really up the viewer to decide.
11;It is also a particularly effective lesson in telling a story in an unconventional manner.
12;If you enjoy trying to work out who the good guy or the bad guy is so you can cheer for him, this is definitely for you.
13;If you love film, you have to see this movie.
14;So original, but what Christopher Nolan does best as well as in Insomnia, is immerse you in the main character.
15;It ruined the whole feel of a very well paced and intriguing movie.
16;I would have given it 5 stars for it's unique qualities and ability to draw you in, but the ending was anything but unique.
17;I would highly recommend everyone to watch this at least once.
18;It is very well done.
19;This film takes a certain level of attention and thought to watch.
20;I recommend it to most anyone.
21;Memento definitely performs in terms of keeping an intelligent and expectful viewer entertained and wondering what's next.
22;The acting is magnificent with the exception of Joe Pantolino who plays the greasy mugging role as usual.
23;The direction is great and Guy Pearce really captures the character without playing over the top at all.
24;wise and getting peanuts in return.
25;something several people keep asking.
26;the entertainment was 4 stars.
27;I love the way how the movie play backwards.
28;I watched it a second time and its still great,
29;There's a reason we do that.
30;the fact that the main character forgets his memory every day is totally clever.
31;hahathis whole move is laugh.
32;loud funny and ir ecommend it for the whole familyi hear d that the bad guy from the matrix was in this movie but ididnt see him.
33;maybe it was just a cameo, but the matrix is such a great movie.
34;Memento starring Guy Pearce is such a brainy and sophisticated movie.
35;I wasn't sure what to except when I watched it but I was completely fascinated by this little gem of a film.
36;The film is shot in black and white and color.
37;I highly recommend checking out Memento, I highly recommend checking out Memento.
38;Just a little short term memory loss humor for you, enjoy!
39;This movie is an example of Filmmaking.
40;This is a movie you will continue to talk about and recommend until everyone you know has seen it.
41;It's just very well done.
42;The performances are great and the unsequential order of the film made an interesting story even better.
43;I suggest everyone read the story as well to see how it all began.
44;I truly feel this movie should have got more Oscar Noms than it did perhaps for Best Picture.
45;Christopher Nolan has proven himself a true Director with this film and Isomnia but credit must also be given to the writer for this film and it's original short story.
46;Memento is a perfect thriller it has the twist and turns that are necessary to carry the viewer through the whole flick.
47;I just saw Memento and I have to say it is an great film.
48;Memento ends as it begins, and the ending you see, before the credits roll, is chronologically the middle point of the story you watch unfold before you on screen.
49;Christopher Nolan, his brother, wrote the script and directed the film, this being his second feature.
50;I read a few reviews, many better than the one you are reading now.
51;if you liked movies like Se7en, and Usual Suspects, than I definitely recommend the film.
52;Memento succeeds on many levels.
53;It is among the greatest noir films ever made.
54;It's got guns, cars, black humor, red herrings, and a femme fatale.
55;It outshines Psycho in engaging the audience on a subliminal basis.
56;Indeed, as a thriller, it ranks with Hitchcock's best.
57;Best of all, it poses a number of profound BIG questions concerning the nature of man, his morality, and the basis for his civilizations and religions in such a subtle way that it almost seems an afterthought.
58;Yes, this movie will really make you think.
59;And it will make you want to talk to others about it.
60;I recommend it to movie buffs.
61;The opening, where a Polaroid undevelops, is a classy lead.
62;"The plot is mostly told by ending the scene at the beginning of the prior scene
63;Every thing you witnessed since the first shot of the movie is seen in a new light, questions are answered, and new ones are posed"
64;all this: the style and substance, plot and gimick, performance and editing, together, adds up to one of the best, most distinctive films of 2001.
65;Memento is an addictive thriller from the beginning to the end.
66;The editing is just incredible and the movie becomes an addictive gem that will surely caught you.
67;Memento will become a classic thriller / mystery film.
68;Great idea and story from the man that will later on would give us the Batman Trilogy.
69;All the cast members give excellent performances, especially Guy Pearce as Leonard, the sufferer of short term memory loss who is investigating his wife's death.
70;the plotting is intricate and stylish with the audience put in Leonard's shoes as the story moves backwards, so most of the time we are as in the dark as he is.
71;Direction and editing (essential in this reverse storytelling) are very fine.
72;This picture is vivid and natural, really top notch in fact.
73;similarly the sound is excellent, with the atmospheric score coming across marvellously.
74;I reckon a Special Edition could come along eventually.
75;The director The Prestige and Batman Begins knows exactly how much information an audience can retain, and structures the film in reverse, slightly overlapping flashbacks.
76;it's really cool, and the ending (or beginning I should say) really caught me off guard.
77;beautifully executed, this concept, in Memento.
78;Brings a whole new meaning to the word suspense.
79;But the film is so layered, reverse accumulation.
80;guy Pierce turns out another stunning performance.
81;I highly reccomend this film.
82;Even though it plays out like so many other films do, it does it in such an innovative way when it comes to filmmaking.
83;A film of sheer beauty.
84;It achieves what so many films of this genre attempt to do, captivate its audience!
85;Easily one of the best films of its genre!
86;tHE PAIN, THE ANGER, THE FURY, THE SADNESS, AND MOST OF ALL THE REVENGE.
87;This movie will keep you guessing all the way through.
88;Memento builds itself upon one such tried.
89;The only difference is that instead of telling the story in an archetypical revenge tale structure, it is told through an inventive and effective cinematic approach.
90;"The way director Christopher Nolan conducts his film calls to mind the cinematic great Alfred Hitchcock's 1954 masterpiece, ""Rear Window""."
91;Because of the directors' skillful manipulations, the audiences in both films are able to experience exactly the same frustration, fear, and other mental processes as the protagonists.
92;As well, the ambiguous ending gives the film an almost Lynchian hue, which makes this interesting film even more thought provoking.
93;Ok, a friend of mine comes to me and lends me a copy of Memento saying that this is a movie you are going to love.
94;We know that there will be a special edition eventually with special features, an added scene and, hopefully, a director's commentary.
95;the movie deserves five stars
96;This was an awesome movie, by far one of the best I've ever seen.
97;Christopher Nolan really knew what he was doing.
98;The structure of the film itself by going in reverse order adds suspense and really makes you think.
99;The second time I watched it and took notes and it made more sense.
100;Teddy had Lenny kill people for him.
101;Part of me also believes that Lenny really believed that Teddy was the right guy.
102;In his head, he has served justice to his wife.
103;This is a real mind.
104;Excellent acting by the actors and actresses and a really mentally stimulating movie.
105;But hey, that's why I love it.
106;Guy Pearce perfectly plays Leonard Shelby, a man who has a rare form of amnesia that allows him to remember everything from his past right up until the incident that took his memory away, but makes him forget everything that happened just 15 minutes ago.
107;At the film's end, you may still feel bewildered and clueless, but that is what's so great about it .
108;Memento has become an instant classic, and was hands.
109;down the best film of 2001.
110;Once you see the movie, and you will, you'll know what I mean.
111;Leonard is driven by revenge .
112;His drive and discipline are perverted by Teddy (Pantoliano), by the beautiful Carrie.
113;so where does this leave Leonard?Oustanding performances and edge.
114;seat suspense spin Memento into a memorable experience.
115;the film had a interesting story.
116;is this film as good as most people say?four stars from me.
117;if you liked the movie you really need to own this version of it!
118;Don't have the time to do a proper review, but I do want to say this film is more than worth watching.
119;Christopher Nolan creates a tense and riveting atmosphere where the simple search for a writing utensil becomes a mans chance to find his own identity.
120;it is a film that resonates with the viewer long after the last reel has played.
121;I recommend watching several times to gain insights into the characters and plot.
122;"It is an incredibly awesome movie about a man
123;the movie starts at the end of the story and goes backward, well sort of.
124;do some incredibly interesting and awesome acting to help bring the story to life.
125;But we have supressed our memory of having done this!
126;And so we live our lives in noble """"amnesia."""""""
127;This is why this film is brilliant: because of its reverse chronological narrative we are suckered into our protagonists noble mission.
128;With all the movies out there that pretty much tell you what to think and feel, this movie is a great escape.
129;It's a great murder thriller, a wonderfully acted masterpiece, and a storyline worth your attention.
130;of course, the cast is excellent.
131;Almost everyone you're introduced to is important and helps the story along.
132;again, I highly recommend this movie to anyone who loves a good murder mystery, but isn't afraid to have the movie take you for a whirl before figuring it all out!
133;Film noir with a unique narrative device: the story is told starting at the end in short segments in which the story moves forward.
134;Nothing in his background makes this action believable.
135;tatoos are important in this film.
136;He has a tatoo that we've never seen before.
137;But ultimately it's a trip not worth taking.
138;creative, fresh, interesting, with as many twists and turns to keep you guessing and never for a minute regretting seeing this movie!
139;The acting is good, the directing is superior, and the plot keeps you on your toes.
140;i don't want to give anything any but the gist is the central character has a unique form of amnesia .
141;He has discovered some very creative ways with which to tell himself how the investigation is going.
142;the film is played out in an interesting way that can leave you dumbfounded at first, but once you get the hang of how the movie plays out it's easier to follow.
143;You may have to watch it twice before it all clicks into place!If you are a fan of twists and turns and an ending that mistifies .
144;this is one to see!
145;This is probably one of the greatest films in the past ten years, and definatly most original.
146;If you enjoy mystery, crime, or psychological thrillers, this is for you.
147;This film has one thing that makes it really, truly great .
148;"the end clears up the central plot completely and will surprise the audience (MAYBE you can figure the ""what"" but NEVER the ""why"" until the end) while leaving room for interpretation of subplots by the audience."
149;the central theme of this film is how we restructure our own past via our memories to make sense of our lives.
150;"there is absolutely no atmosphere at all in the main storyline, but the ""flashback"" sequences are stylized based on time, location and condition to help the viewer make sense of the film as a whole."
151;"Given some EFFORT, viewers will figure out what is ""true"" in the context of the film."
152;the story is told backward, each scene followed by the scene that precedes it chronologically, allowing the viewer to share the main characters disorientation.
153;"He keeps himself aware of his progress on the quest for his wifes' killer via scribbled notes, annotated Polaroids and tattoos of the most crucial ""facts"" in his quest."
154;It also makes the film hysterically and unexpectedly funny in places.
155;The acting is understated .
156;"Guy Pearce is perfect trying to convince everyone, himself included, that he ""knows"" what he's doing and has his ""facts"" straight."
157;the excellent short story on which the film is based .
158;The interview is very good, but the only extra worthy of the name.
159;First off, this is probably the best movie I have seen in years.
160;This movie will pull you in from the start, mystify you for 113 minutes, and will leave you stunned at the end.
161;Leonard (Pearce) is on a personal mission to discover the identity of the man who murdered his wife.
162;But to complicate matters, Leonard has a rare memory condition which he recieved the night his wife was killed.
163;the story is told in reverse order so the viewer can sympathize with his condition.
164;The suspenseful drama that unfolds is like no other you have ever seen.
165;It is a unique story in that you know how it ends, but you watch to find out how it began.
166;that will make you want to watch it again on the spot.
167;this is one of those movies about which you will discover something new each time you watch.
168;I watched this movie 4 times during the first week that I owned it, and then let someone borrow it.
169;It leaves a very lasting impression.
170;I am taking Psychology in college right now, and a chapter we are reading on Memory referred to this movie, so I thought I would check it out.
171;I highly recommend it, I know I will be watching it again!
172;Memento is an absolutely thrilling movie based on an original screenplay written by Christopher Nolan.
173;minute or so segments, exemplifies quiet brilliance in a completely innovative style that replicates the confusing sequences viewed from the perspective of the main character (Guy Pearce).
174;Critics rave over the astuteness demonstrated by this film as complex characters reveal new sides of their personality throughout the film.
175;the revelations shown in the final seconds weave the finale to the fascinating storyline that will inevitably catapult a chain of similar films to follow.
176;In retrospect, the audience can only follow so far as Leonard Shelby can and that's enough to keep you mesmerized in this film for a while to come.
177;i give it 3 stars because some parts were good and the concept was interesting.
178;really this was truly a unique film, and spellbinding.
179;It's so complex, you can't watch it only once.
180;You learn something new with every viewing.
181;That said, when caught from the very beginning `Memento' is also one of the most enjoyable and richly rewarding films to be watched.
182;It's a true stunner of a film, from plot to execution, and is one that will instigate lots of post.
183;The direction of the film is a thing of beauty really, and Christopher Nolan has pretty much established himself as one of our greatest new.
184;He truly gets into his material and delivers this masterful story in a very unique way which proves to be the grandest embellishment.
185;Teddy is, for the sake of discussion, the man who raped and murdered Leonard's wife.
186;What makes this direction so interesting is that the film gives you just enough information to keep you guessing.
187;It tells you just a little bit and then takes you back and fills you in, leaving new doors open for interpretation before taking you back again and filling you in.
188;It's truly a masterpiece of a film and executed so well it's a real shame the academy snubbed Nolan his directing nomination.
189;like I mentioned, Pearce is a spectacle in this film, but there are two other performances within `Memento' that deserve attention.
190;Moss surprised me here because I'm really not familiar with her work aside from `The Matrix' and a film like `The Matrix' doesn't really allow the actors to shine, but here she delves into the meat of her character and delivers a great performance.
191;The real star though, the actor that outshines them all, is Joe Pantoliano of `The Sopranos' fame (yes, that's Ralph).
192;As Teddy Joe is spot on and delivers an exciting, fresh and completely absorbing performance.
193;It's funny because my wife and I are HUGE `Sopranos' buffs and when we saw `Ralph' we just about died (since his character was one we loathed from start to his finish) but here he completely sheds his `Sopranos' persona and delivers a separate performance altogether and it paid off wonderfully for him.
194;`Memento' is a film for the ages.
195;There are so many films where one is advised to sit back and turn your mind off but here I'm telling you to sit up and turn your mind on because `Memento' is the type of film that will keep you thinking, keep you guessing, and in the process keep you completely entertained.
196;The end, or should I say the beginning, plays out in a wonderfully inventive way that is unexpected yet ultimately rewarding.
197;It packs a huge `wow' factor and I just love that about this film.
198;I don't want to say too much because I don't want to spoilt he surprise, but just be aware that it's not what you'd expect, and that's a beautiful thing!
199;Its packed full of extras but they're so hard to access that it makes the pain in looking for them out weigh any positives.
200;He lives by taking photos and keeping notes of his life.
201;So he has dedicated his new life to finding.
202;All he knows about the man are the few facts that he pulled from the police file from the accident: his name is either John or James, and his surname's initial is G (John or James G.).
203;The man has a connection to illegal drugs, and he has a license plate number.
204;"this is one of the few thrillers as of late that succeeds in it's mission statement
205;This movie came as a huge surprise on me in a very positive way.
206;Once in a while there are screenwriters and/or directors who really want to do something extraordinary to impress the viewers of their production.
207;As an example, Groundhog Day had the main character relive the same day over and over again for ages until he finally got the girl of his dreams in the end, and it worked.
208;a lot like the main character in """"Memento."""
209;The story is about insurance investigator Leonard, who suffers from short.
210;Leonard got injured after intervening on his wife's murder.
211;As much as I would give you some information about this, you really have to see the movie for yourself to actually understand what a gem this really is.
212;"The tension curve is always rising, with an ending so surprisingly good that this movie is up there with stunners like aforementioned ""The Usual Suspects"" and ""Fight Club."
213;A brilliant work of storytelling which immerses the viewer into the life of a man with a severe memory problem, called anterograde memory loss.
214;the disorientating method of the presentation of the movie sequences allows the viewer to experience first hand the challenges he faces.
215;this is a truly ingenious movie with rich characters, superb acting, and directorial excellence.
216;I recommend it to anyone with high expectations for a movie.
217;The idea behind the movie is amazing .
218;taking the whole story backwards.
219;and the part when the present and past (the backward story and the frontward story) connect is shown brilliantly.
220;and so he makes notes, tattoos his body, and uses polaroids to assist him.
221;And I re saw the movie the next day to understand it better.
222;it was more fun the second time .
223;how many movies can you see two times and say .
224;I'll make it simple: This is one of the most fascinating films to come around in recent times (perhaps ever?)
225;One of the few that I could describe as mind.
226;blowing with a straight face.
227;The script is snappy and the cast is top.
228;The backwards storytelling may be just a gimmick, but it's quite a clever one, especially in the context of this story.
229;This is the kind of movie that makes you feel like part of a secret club after watching it.
230;The kind you implore all your friends to see.
231;The kind that'll haunt you.
232;It's simply beautiful, flawless, confusing, scary, perfect,.
233;I love it when that happens!
234;"Pay attention to the tiny details
235;i recommend that you watch carefully and with patience"
236;A refreshing film that will restore your hope in modern film making and story writing.
237;Memento is a perfect film.
238;guy Pearce gives a most underrated performance as Leonard Shelby .
239;Probably the best movie of this year, there is no doubt in my mind that it's at least worthy of contention in that category.
240;It also has the standard trailers.
241;You go to a movie to be entertained.
242;a rare treat in today's market.
243;Guy Pearce is excellent, and Carrie Anne Moss is so cunningly evil in this picture.
244;while I highly recommend this picture to anyone, I'd hesitate in recommending it to those who watch pictures passively, those who look for a story .
245;a plot, to sustain their attention.
246;In any case, it's definitely worth watching at least once.
247;The film continues to astound and baffle its viewers with its complex structure and gripping storyline.
248;"the story of ""Memento"" revolves around its three main characters, Leonard, Natalie, and Teddy, who are played by Guy Pearce, Carrie."
249;Christopher Nolan uses this disability to his advantage, allowing him to play with ideas of constructed truth and uncertainties as the movie progresses.
250;the backward sequence of events is one of the film's most innovative elements and makes certain surprises even more astonishing to the audience.
251;It also forces the audience to rely on their own memory to make sense of the plot, which is a great parallelism that heightens the enjoyability of the movie.
252;"The use of ""memory"" is one of the film's most noteworthy innovations, but it is only second to the film's complex narrative structure and suggestive postmodern themes that truly set it apart from other films."
253;even though the film is very innovative, it can be easily viewed as regurgitated film noir with a new spin.
254;Memento fits these characteristics, as it concerns itself with this specific tone and mood.
255;good movies, you might want to sit this one out.
256;This will drive some of you insane, but for those of you that enjoy figuring out things for yourself and left with your own interpretations of the movie, then you should definitely watch this flick.
257;Although the movie breaks numerous movie norms, I found that it is the movie's obscurity that makes it such a beautiful and noteworthy accomplishment.
258;"fartsy, and so on
259;what it does, it does really well, and the performances of the stellar cast are nuanced, memorable, and overall quite excellent.
260;film school students: let your hair down and enjoy this one, it's actually very entertaining, very accessible, and at the same time difficult enough that you can admit you liked it.
261;Hollywood buffs: just once, pay close attention to a film .
262;Its got trailers and an interview with Christopher Nolan, but that's about it.
263;RegressionI picked this topic to speak on when I remembered laughing at myself the night my film class and I watched Memento, a movie based on Memento Mori, the name of the short story.
264;He is the main character of Memento.
265;By the time he got done with the movie, he was quite a unique individual.
266;movie critics are important to movies.
267;They make important decisions in front of viewers or readers everywhere.
268;They are so engaging, they occasionally get to be Roger Ebert and Leonard Maltin.
269;The best jigsaw puzzles are the ones with a few pieces missing.
270;All anyone has to do is tell a good story.
271;People have a motivation that's in the subconscious mind, and people understand by drawing conclusions in places where there are no real explanations.
272;i bought the movie because I'm a good student to my college course.
273;the order in which I put my story is important to the theme.
274;After all, when he found my diary, he thought it was his.
275;That'll never happen to Leonard because he developed a special system.
276;Such an amazing piece of film.
277;I love this movie and find myself always coming back to it every few months to watch again!
278;The fact is, this movie works on many levels.
