2250;what makes this movie really intriguing and keeps you on the edge of your seat is the fact that the story is told from the end backwards, each segment of the movie revealing a little bit more of what has previously happened.
2251;This is what keeps you interested, this what keeps you guessing.
2252;Despite the fact that it is undoubtedly excellently crafted and has top notch performances from Guy Pearce, Joe Pantoliano and Carrie Anne Moss, it's the intrigue that holds the movie together and hold it together it does very well, for this is an excellent, very intelligent movie.
2253;burn, complex, intelligent thrillers, this comes highly recommended and will hopefully bring Guy Pearce an Oscar nomination.
2254;My opinion is the less you know about this film the more enjoyable it is in solving the riddles.
2255;basically Lenny, with the help of Teddy , are building a mystery using the truth as model for their deceptions.
2256;the black and white scenes give the movie a truly nice touch that threw cleverly threw me off the scent.
2257;A must for all fans of this classic movie.
2258;For those who haven't seen Memento please watch this movie.
2259;I always recommend this movie as a must see.
2260;It is pure movie enjoyment.
2261;So few movies today actually engage your mind and emotions.
2262;Most merely stimulate your senses.
2263;This movie requires you to pay attention and it draws you into its interesting story using a bizzarre backwards narrative structure that puts you in the same state as the memory.
2264;Still, any movie that can actually be logical and consistent and still require the full attention of the viewer to comprehend is worthy of note.
2265;The most remarkable scene is the one where Carrie.
2266;anne Moss reveals her true nature and intentions to the hero, knowing he will forget in a few minutes.
2267;It is a fine piece of acting in a remarkable piece of filmmaking.
2268;This movie was extremely good.
2269;It starts from the end and goes to the beginning.
2270;It'll keep you gripped to you seat saying, Oh my God.
2271;This is easily one of the most unique and interesting movies that I've seen in a long time.
2272;The writing, direction, and acting performances by everyone in this film are all top notch stuff.
2273;the basic premise of the film is a narrative as told from the perspective of the main character, Leonard (played by Guy Pearce) who is an insurance claims investigator.
2274;there is a juicy twist, however.
2275;The other main characters are the crooked cop well played by Joe Pantolano, Carrie.
2276;This mirrors Leonard's own world and draws you into the character.
2277;But to anyone who enjoys a good Noir.
2278;Memento is a thrilling movie about Shelby Leonard, a widower who cannot form new memories.
2279;This is one of those movies you have to watch again when you finish it, understanding the little details which eluded you before.
2280;anne Moss and Joe Pantoliano give great performances
2281;This movie is certainly a very unusual type of film that plays both backwards and forwards revealing the plot in a very interesting narrative.
2282;Overall, it isn't a perfect film, but a great film and while it doesn't benefit largely from the Blu Ray format, it is a solid movie for anyone looking for something that will challenge your mind.
2283;This was the most incredibly well made movies i've seen in a long time.
2284;This movie has more twists than any other i've ever seen.
2285;The backwards story is great.
2286;This is a fantastic movie that will keep you guessing to the very end and anybody who didn't like this movie is just too stupid to understand it.
2287;Guy Pearce (L. a. Confidential) is outstanding in this hypnotic film noir that is simply one the best films of 2001.
2288;One of her best lines in the film is, You sad, sad freak.
2289;Joe Pantoliano (Bound) is equally compelling in his supporting role.
2290;Before Christopher Nolan would be tapped to direct a remake of 2002's Insomnia, he directed this modest budgeted thriller that sets bold new standards in mystery and suspense cinema.
2291;That alone is pretty much the plot, but what sets Memento apart from other revenge themed thrillers is the fact that the film moves backwards event wise.
2292;anne Moss (another Matrix alumnus) plays a sympathetic soul to Lenny's crisis while hiding ulterior motives, and she gives a knockout performance as well.
2293;Memento requires more than one viewing to fully understand the complex storyline, but once you do you'll be left with your jaw on the floor.
2294;This is definitely the type of movie you'd want to own.
2295;We constantly recommend this movie.
2296;"Christopher Nolan's ""Memento"" is a revenge story told backwards from the end to the beginning."
2297;when we first meet Leonard, he is well aware of his condition and knows pretty well how to deal with it.
2298;He is constantly on the look out for those that might want to take advantage of him and is not trusting of anyone.
2299;The rest of the movie goes backwards, explaining how Leonard came to the conclusion that the man he shoots at the start, was the second bandit involved in his wife's murder.
2300;this movie is exceptionally well shot on film and very captivating.
2301;This is a completly original concept, at least as far as I have ever seen and engages the viewer's full attention.
2302;"Joe Pantalioni is perfect for the role of 'Teddy' a ""friend"" of Leonard's and is very convincing as the overly."
2303;this film is well worth purchasing, as it will take a viewing or two to fully understand, appreciate and get used to the way this story is told.
2304;This is a phenomenal film.
2305;A wonderful film that I almost turned off halfway.
2306;It was satisfyingly surprising and made me re.
2307;If you start getting antsy, just hang tight, things will reveal themselves by the movie's end.
2308;I only gave it two stars cause guy is in it and he always does a fantastic job.
2309;i really enjoy this movie, which I feel is just as fresh and exciting now as it was when it was first released.
2310;But the thing that REALLY impresses me about this movie is that if you watch the scenes in order, the movie still works as a thriller, and a mystery.
2311;I enjoy the frustrations ofn the main charater and coming full circle at the end.
2312;This is a very good movie with a lot of twists.
2313;I think after years go by, this movie will be said as one of the best in the genre.
2314;this is a very good movie with a lot of twists.
2315;I think after years go by, this movie will be said as one of the best in the genre.
2316;The genius of this film lies in it's directing.
2317;That way you piece things together just as he does.
2318;'Memento' is a very well made film.
2319;The main character Leonard makes genuinely surprising discoveries throughout his search for the man who murdered his wife.
2320;One thread plays forward, another, which involves most of the action in the story, works backward, scene by scene.
2321;It works well, and is more than a gimmick.
2322;The climax is neither predictable nor over the top, and is one of the best I have seen in a while.
2323;the acting is astounding, particularly by Carrie Ann Moss.
2324;As her character gradually unfolds, the viewer sees the greatly varied facets of her personality.
2325;Joe Palantino is an excellent actor, and he is perfectly cast as an untrustworthy but seemingly helpful cop.
2326;due to its intricate plot, carefully attended details, and complex character motives, 'Memento' holds up on repeated viewings.
2327;Dark, suspense, at times humourous, a fantastic movie.
2328;This is a fast paced, edge.
2329;Joe Pantoliano (Teddy) gives an outstanding performance and deserves a nod for best supporting.
2330;well you'll still like the movie but you won't be thrilled with the ending.
2331;You *WILL* talk about this movie after you watch it.
2332;destined to be a classic and definitely on my list of movies to own.
2333;that being said, the movie is also cinematically brilliant .
2334;provoking, with a perfect balance of ironic humor and tragedy, and scientifically accurate to boot, this movie earns a solid 5 stars.
2335;This is one of the best movies of its year.
2336;This movie was really good.
2337;In summation, probably the best cast for the movie.
2338;Memento is surely one of the most innovative pictures in recent years.
2339;Christopher Nolan's screenplay (based on a short story by his brother Jonathan) is terrific and introduces us to a complete new way of storytelling.
2340;nolan very wisely chose relatively unknown actors to play in his complex thriller, so that the audience can focus on the bewildering story.
2341;Pearce, well known for his performance as an honest cop in Curtis Hanson's masterpiece L. a. Confidential, does a great job along with The Matrix stars Joe Pantoliano and Carrie.
2342;if there is one movie to watch this year, it's definitely Memento.
2343;I watched the entire movie with my mouth open, glued to the screen.
2344;And I still watch it with the same feeling of suspense and interest.
2345;This movie is truly a genius production, a masterpiece.
2346;(Except we, as the viewer, are able to see the 'future' and know what will happen to him next!)
2347;I thought the actors were great, the director did a great job and, to quit raving about this movie, I have to say that it's simply SUPERB.
2348;Watch it and you won't be dissapointed.
2349;This was such a good psychological thriller!
2350;It made me pity those with memory loss (I never knew how much it could hinder someone's life) but it also kept the mood heightened and intense with all the violence and deceit.
2351;Nolan's first explosive film, and in this set you get it.
2352;The film is set to be a mystery, seeing it in order removes the intrigue, which I personally keeps the film hinged, but it still makes for a fun re.
2353;And of course the behind the scenes are great, but the best extra on here is short story developed by Jonathan Nolan, where honestly the narrator feels completely lost and manages to bring the readers into his own internal aimlessness.
2354;I felt that Guy Pierce did a really good job of playing a complex role, and Carrie Ann Moss and Joe Pantiliano were pretty good too.
2355;christopher Nolan does a great job of intelligently directing what must have been quite a challeging movie to make.
2356;The editing, central to this movie, was quite smartly done.
2357;It is a good ending to a film in a Hitchcock sort of way but does not come close to the twist scene in the Usual Suspects but it is still leaps and bounds ahead of say .
2358;The film is mostly shot in reverse and that is a very cool concept that is committed to the screen in a very daring and remarkable way.
2359;Great entertainment value but not the best plot twist we have ever seen by a long shot.
2360;The format of the movie is very intriguing, the plot plays backwards, and you don't find the motivation for any of the characters' actions until after each scene plays out.
2361;"this is one of those movies that leave you questioning what really happened
2362;If you want to watch a movie that has the most jaw.
2363;This is a movie that demands attention and you will want to watch it several times.
2364;My best advice for the first time viewer is to sit back and enjoy the ride.
2365;I bought the movie believing it was a really good movie based on what I had heard but was really disapointed once I watched the movie.
2366;Christopher Nolan and his brother ( the writer ) did an great job and i think great things are to come of them.
2367;a tour de force of creative imagery and it keeps you interested throughout the whole movie no matter if it goes im complete reverse.
2368;i highly reccomend it to anyone with a working brain.
2369;I love this movie and I'm very happy about this limited edition.
2370;aside from that, the film looks great.
2371;So I appeal to everyone who reads this.
2372;in this first part I will mention that this film is highly unusual.
2373;You the viewer, are the final judge as to what actually took place within the story.
2374;This movie is that obscure, intricate, illusive, and downright subjective.
2375;i would recommend this film to anyone who enjoys being intellectually challenged.
2376;Those of you who are intuitive and sensitive to subtleties, those of you who notice things that others overlook, and those of you who are clever and inventive will love this movie.
2377;Detectives, medical professionals, psychologists, sociologists, scientists, mathematicians, and creative professionals, such as writers, will find this film very rewarding.
2378;There is also a website set up specifically for admirers of this fantastic movie.
2379;If after watching, you can figure out the website address, you are very clever.
2380;the way I see it, Leonard is a person who loves to kill.
2381;Leonard is extremely clever and intelligent, and he is disciplined and systematic to a precision.
2382;leonard was committed to a mental institution prior to meeting his supposed wife.
2383;There is special meaning to the one tattoo that Leonard can see at all times, """"Remember Sammy Jenkis,"""" and it is not because Leonard is Sammy."""
2384;And the real kicker is that Leonard would have everyone believe that his memory condition is a physical handicap, when in fact it is a mental projection produced by his severe psychosis.
2385;and the beauty of this film is that it does not matter if my opinions are near fact or far fetched, what matters is that this film allows me to create what reality I would have with it.
2386;what does that have to do with anything?This is a well made, well acted, suspensful movie with an interesting story.
2387;It's a great movie that holds your attention for almost 2 hours.
2388;Sure, some people won't be able to follow what's going on, and that's too bad for them, but this is a great movie.
2389;"All we wanted was to watch a movie and be entertained
2390;This is one of the best, and by far, the most original movie I have ever sceene.
2391;Its hard to follow at first becasue the sceenes go in revese order, but that is one of the aspects that makes this movie interesting.
2392;Great acting jobs all around and once you think you know people in the movie, you are proven wrong!
2393;Each sceene keeps you guessing as much as the main character on how he got there and what happened right before hand.
2394;See it and be blown away.
2395;That's the beauty of this film.
2396;It has great replay value!
2397;this film is directed by the british director Christopher Nolan, who also directed the brilliant come back of batman in the batman franchise title """"Batman Begins""""."""
2398;Memento is Nolan's second film and is the first film in cinema history to be told backwards.
2399;The film bassicly starts from the end and works it's way to the beggining which is the end of the film.
2400;this film should've taken home the oscars for best screenplay and editing for very good reasons, Christopher Nolan had to start with the end and work his way backwards, same goes for the editing.
2401;The performances are very good and exciting to watch, but the stand out is definately Guy Pearce's tough role as the the man with a condition he's still holding onto.
2402;Memento scores big because of intellegence, maturity, and most of all being unique.
2403;Guy Pearce puts on a very convincing performance of a nervous and confused Leonard.
2404;Joe Pantoliano also does a great job as Leonards friend, yet you never know for sure who he is until the end of the movie.
2405;ann Moss plays another one of Leonard's friends who puts on a great performance as a hard.
2406;memento is flawless, a masterpeice.
2407;Every element that makes up a good movie is present here, it is a deep and intellegent movie that will keep you on the edge of you seat, thinking and always dying to find out what will happen next.
2408;Without a doubt a 5 star movie, original, unique, exciting, and very intellegent, see this movie.
2409;The first disc is fine, the menu I can understand.
2410;I was also able to see the foreign posters and a special that was on IFC.
2411;the movie is great, just not the Special Edition disc set.
2412;This is perhaps the most intelligent and enthralling film I have seen for a long time.
2413;Not only does it have one of the most talented casts you will see but it has the story to go with it.
2414;For some people who enjoy their no brainer blockbusters it might be hard to comprehend but please persevere!
2415;You will be rewarded with the most twisty.
2416;turny film you will probably ever see.
2417;The real appeal of the film for me however lies in the cast.
2418;You have three of the best actors you can see at present.
2419;Guy Pearce is outstanding as is Carrie.
2420;The film thoroughly deserves it five stars and should be in some of those top five film lists that will soon be appearing!
2421;I liked the creative way that this story is told in bits and pieces.
2422;It keeps you thinking throughout, and the short.
2423;Each additional time you watch it you will see new things.
2424;This movie has been moved up to my #1 favorite movie ever.
2425;It is incredibly thought provoking, well written and directed.
2426;Guy Pearce does an excellent job and proves just how talented he really is with this performance.
2427;I highly recommend this movie to everyone.
2428;This is also a good thing, though, because you can watch the movie several times without it ever getting old.
2429;"The movie is done well, and adds a twist to both the ""backward."
2430;"drawkcab"" and amnesia themes, and it's an interesting murder mystery with a great twist at the end."
2431;My husband and I enjoyed this movie tremendously.
2432;This movie is very well made, but it may be a bit tough for some people to digest.
2433;This movie starts you off at the end of the story and takes you back to the begining.
2434;This technique is very effective in that it keeps the viewer on the edge from the start of the movie to the surprising ending.
2435;This collectors box is great condition!
2436;Definitely the coolest collectors edition box I own or seen.
2437;A lot of neat stuff on the inside as well to make it all the more a great box
2438;"Better people have made the map of this territory
2439;Memento looks pretty, projecting depth with tons of style.
2440;But it is essentially as slick and vaccuous as movies get.
2441;It is Deep Movie Lite.
2442;I thought this was an excellent film.
2443;The script was absolutely original and really kept you guessing until the very end.
2444;The whole backwards technique works, actually, and to great length.
2445;The soundtrack/score is also amazing in a subdued, quiet way.
2446;It's just a good time looking at the menus.
2447;The film, as you know by now, tells the story of the protagonist by presenting his events backwards in time.
2448;Simultaneously, the film tells a forward moving parallel story of a similarly affected person.
2449;The hero of the piece is a puppet without his awareness and you wish that he never knows the extent of his manipulation by the good folk that populate his world.
2450;Never ever boring and occasionally gripping, this movie is a movie lover's movie.
2451;It is an essential to any discriminating viewer's personal catalog.
2452;Group viewing is best for the conversation that the movie compels.
2453;I'd just like to point out that this is a great movie, however the ENTIRE story isn't backwards.
2454;The actual end of the film is the middle of the story, kind of confusing, but a very original and cool concept.
2455;One of the most innovative, original stories using a very innovative method of telling the story .
2456;I don't really like spoiling the story in movie reviews but if you like movies that make you think all the way through and enjoy great endings you have to at least watch this once.
2457;In a day and age where plot twists are common place, Memento takes it a step further working itself forward and back at the same time.
2458;An entirely origional plot, terrific dialoge, and superior acting make this movie an easy contender for almost anyones top ten list.
2459;I guarantee you will watch it over and over again.
2460;If you're like me, you will not only be happy to pick up something new each time, but also you will try to see any screw ups within the movie.
2461;And that is a testament to the director and editors who have done a superb job of not mixing anything up in such a complicated story line.
2462;Definitely one of those that you want to see .
2463;item summer movie, but as one that you have to see in order to say you have experienced all types of movies.
2464;My observation of the books selections is that a few of those movie I didn't really have to see but """"Memento"""" is one that lived up to the billing."""
2465;The retelling of the various scenes created impressions as well as doubts and that really came together at the end.
2466;Memento is one of the most innovative and intriguing films of the past 10 years.
2467;The singular thing about it is the way the film successfully puts the viewer in exactly the same position as the protagonist .
2468;in reverse order, causing the viewer to have to remember what came next , and .
2469;Rarely does a theatrical experience challenge the audience to this extreme.
2470;all look and feel is certainly 'Film Noir'.
2471;The whole experience is so unique that the mood is maintained throughout.
2472;Amazingly enough, Memento manages to accomplish all this without ever seeming self.
2473;The cast is uniformly excellent, and the script is sharp and precise.
2474;Memento is without a doubt an ingenious and clever thriller, and for that it should be fully commended.
2475;It is merely a tool used to add to the suspense and drama of the thriller, and it is here that the heart of the movie truly lies.
2476;Memento is an engrossing and deceptive thriller.
2477;Leave it at that, and this is definitely one to remember.
2478;And to those who bitched and moaned because the movie was backwards and as a result confusing, I can only say one thing: develop a sense of fun and adventure for a change!
2479;Leonard can recall everything up to the accident.
2480;i love this movie because it asks a valid question:Upon what do you rely to create your reality?Memories are faulty.
2481;tedy is a suspicious character, but he gives Leonard some information that is verifiably true.
2482;condition is the human condition.
2483;Great story and great attention to detail.
2484;and thus concludes my chessy synopsis of a pretty good movie!
2485;Exactly WHAT is going on in those black and white scenes is yet another mystery and wonderful entanglement of Memento.
2486;There's plenty of twists and turns as more and more is shown to you.
2487;When the movie wraps up and all the frayed ends are connected for you, the amazing twist at the end leaves you wanting to re.
2488;watch the whole thing right then.
2489;The wonderful writers, actors, and directors of this film have made that world possible.
2490;We all know the name of Christopher Nolan thanks to his superb Dark Knight Trilogy and Inception.
2491;What you may not know is he has other great films one being Memento.
2492;The editing, the shots, the acting the Noir style all add up to one great film with a great ending.
2493;Although some people may find it hard to keep up with the film as the sceenes of the film are played in reverse, but once you have pieced this together the film fits together into an exiting and unforgettable thriller.
2494;But this works for this film.
2495;It is a quirky, yet very original way a filming and creating a picture.
2496;Hands down, one of the best movies I have ever seen.
2497;It was definitely a movie I thoroughly enjoyed.
2498;insurance salesman, but he's very good nevertheless.
2499;Carrie Anne Moss and Joe Pantoliano are even better in key supporting roles.
2500;Telling the story backwards from the perspective of the protagonist (who sustained a brain injury that makes it impossible for him to sustain new memories more than a day) is a clever device that keeps the viewer intrigued and involved.
2501;It was reassuring to see this movie sweep the Independent Spirit Awards, and it wasn't much of a surprise that the Oscars largely snubbed it.
2502;Compare this to something like Moulin Rouge, which some think is so very creative.
2503;Memento satisfies on both the style and substance levels, a real rarity in the commercial film biz today.
2504;Not to mention Joe Pantoliano (numerous co. star roles).
2505;But, these 3 actors are all making a great name for themselves in Hollywood.
2506;All 3 delivery the goods in this backwards thriller.
2507;This widescreen 113 minute adventure starts at the end.
2508;and it leaves you guessing as to why it all happened.
2509;This film is just one of those amazing creations that you hear by word of mouth.
2510;You will want to see this movie 2 or 3 times and then you will realize the brilliance behind it.
2511;A modern classic (5 stars).
2512;Aside from the hook (the story backwards), this is fine, fine, fine film noir.
2513;Regarding the movie, it is certainly worthwhile to watch.
2514;Be sure to set some extra time aside after the movie as you'll likely want to watch certain things again.
2515;There's a good reason for it to be crossed out.
2516;the special feature that some reviews have mentioned would be nice is what this is for.
2517;It certainly makes it easier to rewatch.
2518;If you've seen the movie, you'll know what this is.
2519;The film has a precise structure.
2520;Leonard is a fighter, however.
2521;He tattoos information on his body.
2522;He has a flow chart on the wall of his hotel room with pictures and notes.
2523;the narrative structure for this story is Leonard's ability to frame his experiences.
