id;spiegazione
1;This film has helped me shape my soul.
2;entertaining w/ humor, dealing w/ issues that are still relevant in today's digital age .
3;This is my favorite movie of all times.
4;I have watched this movie from the day I received it in the mail.
5;Great price received on time.
6;Thank you thank you thank you.
7;I confess, I've never read the book but I sure do love this movie.
8;A gripping story lovingly told.
9;it is considered a classic both on paper and in film.
10;theres these 2 kids scout and gem who are growing up in the south long ago.
11;i think this is one of those rare movies that is likeable by everyone.
12;its good beginning to end also.
13;the trial is pretty intense and the closing scenes too.
14;a great great great GREAT movie!!!!!!!!!!!!!!!!!!!!!!!!!
15;worthy, the characters are groan.
16;Avoid this movie please, if you truly like movies.
17;I don't often view movies more than once, but this one is worth seeing every few years.
18;It is true to the great novel from which it came.
19;It brilliantly captures through the eyes of a child the nobility as well as the meanness of humankind.
20;Maybe it was just Harper Lee's style of writing.
21;But the movie is incredible.
22;Gregory Peck's Atticus is completely admirable, and Scout Boo Radley are two of the most innocent and adorable characters.
23;They're a trip, especially Scout!
24;The story is excellent on many levels, and it's a bit more complex than a retelling of the plot would indicate.
25;deserved Oscar for his portrayal of attorney Atticus Finch, one of literature's most memorable characters.
26;so how did this translate to the big screen?
27;The child actors, both newcomers, were excellent in their roles.
28;Ditto on the boy who portrayed Dill, whose part was far larger in the novel but which is good in the film as well.
29;The results are still as complex and multi.
30;I got a strong sense that the actors were equally aware, and that's cool.
31;"Later in this newsletter you'll see ""The One."
32;But this book, and this movie, are a fantastic example of what I'm talking about.
33;There is an old lady who is cranky.
34;These kids just wander around (to present a view of life).
35;"He tells ""Scout"" about the need for proper deportment in school."
36;Atticus returns to shoot it, he is known as a good shot.
37;A man shows up for a scary scene.
38;Atticus bars the door, he defends it with moral strength.
39;The courtroom is packed solid, but there is room on the second floor.
40;Mr Robinson takes the stand and tells what happened.
41;Finch asks for justice for his client.
42;Later Finch learns that Robinson was shot while trying to escape.
43;An example of poetic justice?
44;This ending damages the story.]
45;To Kill a Mockingbird is a Hollywood classic.
46;This is Gregory Peck's signature role, he won an Oscar for Best Actor.
47;He is flawless, gental, and humble in the role of lawyer Atticus Finch.
48;I love and admire this movie, has a meaningful message and a timeless story.
49;I highly recommend this treasure, enjoy!
50;This is my favorite movie of all times.
51;It arrived on time and in great condition.
52;This is a wonderful classic and he really enjoyed watching it after he read the book.
53;I would recommend this classic to anyone.
54;Good and evil are clearly drawn, and the values of justice and humanity portrayed with rare and memorable strength.
55;reading Harper Lee's Pulitzer Prize winning novel had a huge impact on me as a teenager.
56;horton Foote won an Oscar for his screenplay, which is so faithful to the book.
57;Set in depression era Alabama, it's seen through the eyes of 8 year old Scout, beautifully played by Mary Badham, and the sensitivity of director Mulligan's vision is remarkable.
58;he's intensely moving as this innocent and silent man).
59;russell Harlan's superb cinematography should be seen in the widescreen version to be fully appreciated, and Elmer Bernstein's Americana style score adds so much to the film.
60;gregory Peck's Oscar winning performance is magnificent.
61;His Atticus is a hero of immense proportions, with compassion, integrity, and humility.
62;and it's one of the many reasons I think this powerful classic deserves to be in every video library.
63;after having read the book, which, as is often the case, is better than the movie.
64;The visual and audio qualities were excellent.
65;This film is an excellent black and white adaptation of Harper Lee's book of the same name.
66;That dramatic tension, muted as it was by the cinematic and social conventions of the time, nevertheless made a strong statement about the underlying tensions of this society at a time when the Southern black civil rights struggle movement was coming in focus in the national consciousness.
67;"That part is in some ways, particularly when the children watch the trial from the ""Negro"" balcony section of the courtroom, the least successful of the film."
68;What is entirely believable and gives some relief from the travesty that is unfolding are the pranks, pitfalls and antics of the kids.
69;The tensions between brother and sister, the protective role of the older brother, the attempt by the sister to assert her own identity, the sense of adventure and mystery of what lies beyond the immediate household that is the hallmark of youth all get a work out here.
70;But in the end it is the quiet dignity of solid old Atticus and the bewildered dignity of a doomed black man that hold this whole thing together.
71;Now that I understand more about the story and what is really going on, I believe it should be required viewing.
72;town South at the trough of the Depression.
73;To me, the languid pace seems perfectly at home with small towns, summer heat, southern courtliness, and Gregory Peck's quiet integrity as an actor and his tendency to slightly underplay a scene.
74;Elmer Bernstein's musical score is a treat of Americana.
75;With such well casted actors, this movie truly portrayed the problems in ancient and even today's society.
76;It shows the world through the eye of a child, and how innocence knows no evil.
77;BOTH are the best of American classics ever!!
78;This movie also won an Academy Award.
79;The children's impression and admiration for their father grows throughtout the movie.
80;To Kill A Mockingbird is enjoyable and educational and it explores stereotypical prejudices of the deep south with many emotional experiences.
81;i highly recommend this movie for everyone.
82;He has no lines in it, but has a high impact of emotions.
83;The story is as powerful on the screen as in print.
84;Nothing is lost, and the performances are perfect.
85;Remastered version wonderfully captures the mood of this masterpiece.
86;Enjoyed this on a quiet Saturday morning.
87;I was born and raised in the state of Alabama so To Kill a Mockingbird was both a great story and provided wonderful historical backgroup for me.
88;This is a wonderful movie no matter where you are from.
89;There is a bit of a mystery and big scare for Scout and her brother.
90;There is also wonderful acting and great entertainment.
91;Most of us are familiar with Harper Lee's classical novel by this name about depression.
92;gregory Peck delivers a great performance as Atticus Finch, the conscientious lawyer who defends a black man against false rape allegations.
93;His children, Jem and Scout, played by Philip Alford and Mary Badham are extremely well.
94;cast and act very naturally.
95;screen, thanks in part to screenwriter Horton Foote.
96;Although filmed on a holywood set, the rustic ambiance of the old southern town is brought to life very vividly.
97;My family loves this film.
98;From the very first time I saw it when I was 4 or 5 years old, I have really enjoyed it.
99;The Atticus character is the ideal father figure, the kids are fun and innocent, and the world is damaged.
100;The acting is top notch for this time period (especially the adults).
101;The cinematography was also very beautiful, with a couple complaints.
102;Anyways, I love the movie, love the characters, and it is a must own for your collection!
103;The remastering on this Blue Ray is fantastic!
104;I'd recommend this for everyone who likes old movies!
105;This was a present for my wife who collects old movies and she was tickled.
106;This book captures so much of the feel of the book.
107;It is a wonderful story about a man who stands for his convictions and passes that legacy onto his children.
108;I love Scout's first person retelling of this touching, thought provoking story.
109;It is in black and white and is perfect that way!
110;to Kill a Mockingbird is a true classic!!
111;I remember going to see it in the theater as a child, and I loved it then as much as I love it now.
112;A true classic and so thankful to be able to watch it again.
113;Lttile deep fro your kids but still a great lesson.
114;Wonderful movie a true classic.
115;A great movie AND a great book!
116;I love every minute of this movie and hope that others will find the same joy in reliving this classic.
117;This is one of my favorite movies.
118;I love the great preformeces by all the actors.
119;It is a great follow up to the book or you can say it is a wonderful court.
120;I would love to see a bit more.
121;It is such a wonderful story and I'm glad to be able to add it to my collection.
122;Classic stuff and worth having in any home library.
123;This is a classic story, the film is very moving.
124;It portrays imagination, struggle, friendship, and many aspects of life that seem fresh, though the movie is very old.
125;The story is told from the unique prospective of a well to do family during the great depression, that alone sets it apart from most films.
126;There are several plot elements that come full.
127;circle by the end of the movie, and show that people can be, and are capable of doing both beautiful and ugly things.
128;It is an excellent film about taking a stand, friendship, trust, learning, and growing, among many other things.
129;It is exciting to me to see this movie given the attention that it deserves.
130;Reviewing it was an honor.
131;This movie is special to me.
132;I saw it as an early teenager as a two night special movie presentation.
133;Atticus Finch is for me like an amazing Uncle who showed me what values and character are all about.
134;I believe this story is among the most important of my generation.
135;This is a must have movie.
136;This is my favorite movie of all time.
137;year old son and he loved it, too.
138;I enjoyed listening to SCOUT as an adult telling what it was like to play her role as a child and and what it was like to walk up and just sit in Mr. Peck's lap whenever she wanted.
139;Just a wonderful family movie.
140;Knowing that it is rendered one of the finest cinematic accomplishments of all time had perked my interest early on but it became the movie I wanted to see but never got around to.
141;i guess the first thing I should say is that everything you've heard about this film is true, all the praise it received was well deserved and every second of it's running time is well worth it.
142;unquote prejudices with a neighborhood boy named Boo Radley they watch their father work to free a man he knows is innocent.
143;Atticus, a widower, works equally hard to instill good morals in his two children and raise them right and this is reflected in their ability to reason on situations, some even too big for them to fully understand.
144;`To Kill a Mockingbird' truly is a downright perfect film.
145;The acting is superb, which is something I never truly expected.
146;I have watched a fair share of older films and have always found that the acting never truly stacks up to the great actors of today, but the performances by Gregory Peck especially rival those of today.
147;Gregory Peck (who won the Oscar for this performance) comes across so natural, so organic here.
148;His performance is understandably tempered and it helps aid the message of the film along.
149;the two young children as well, Mary Badham and Philip Alford, are excellent here.
150;For young actors they grasped their characters exceptionally well.
151;Brock Peters is convincing as Tom Robinson, the black man on trial, and James Anderson is deliciously evil as Robert Ewell, the man accusing him of the crime (against his daughter).
152;it was also interesting to see a young Robert Duvall here in a very small yet very powerful role.
153;He was truly commanding and played a key part in making this film's message a universal one.
154;It's brilliantly scripted, acted and directed and stands the test of time, for while it was released in 1962 it still means something today, 45 years later.
155;`To Kill a Mockingbird' is a film that everyone should see in order to appreciate and one that I highly recommend to anyone with the slightest interest.
156;I love the book and love the movie even more.
157;The is a great movie for all to see.
158;To Kill a Mockingbird Bird is a classic.
159;This is truly a classic.
160;This makes the first half come alive.
161;It is so good that my students do not even mind it is in black and white.
162;Probably the best movie ever made.
163;They did an amazing job of evoking a feeling and an era that seamlessly matches that of the book.
164;That they succeeded in a film with child actors makes it that much more admirable.
165;An all time favorite movie and the extra features are almost as interesting as the movie.
166;Reading the book just adds to the experience.
167;it is apart of our history.
168;originally adapted from the Pulitzer Prize winning novel by Harper Lee, director Robert Mulligan reveals his vision of the classic when the picture opens with a monologue from a seemingly grown.
169;The frame is focused on an all.
170;"Mystery constantly surrounds their dilapidated home as gossip and tall tales run high in the town
171;Atticus is a character that demands respect both on paper and on screen, and the multi.
172;talented Peck delivers this attitude.
173;His calm demeanor and noble ways add to the character development in the film.
174;The tension between the word of a black person versus the word of a white person is depicted perfectly by Mulligan when the controversial case goes to court.
175;The small courthouse not equipped for many people is suddenly packed with eager onlookers.
176;When the case begins, Atticus asks Tom Robinson subtle, honest questions and receives truthful answers in return.
177;Nonetheless, it is well known throughout the movie that the jury still favors Mayella because of the color of her skin.
178;Not everything is as perfect and plain as it seems though.
179;Atticus's plans for the trial come to an unexpected halt, but his positive, sensible mind helps him come to terms with the outcomes of the whole debacle.
180;The sensation from the film's conclusion fills audiences everywhere with content and motivates them to be as noble as Atticus Finch in their daily lives.
181;In this intense yet satisfying ending, we see the invariable nature of humans to disagree, but the positive consequences for those who rise above.
182;Since the story is set in the 1930's, the classic look of the film adds weight to its historic reality.
183;Added to this is a stellar cast who manage to hold their own against the amazing performance given by, Gregory Peck, an actor at the peak of his abilities.
184;For those who also enjoy Robert Duvall's huge body of work, it may be interesting to note this film as his first, in a non.
185;there is an interesting contrast between what we see of Atticus and how his two children describe him.
186;A man who is strong enough to stand against hatred, and brave enough to highlight the weaknesses of flawed white girl against the strengths of an honest black man.
187;well, I reckon because mockingbirds don't do anything but make music for us to enjoy.
188;It was a magnificent movie Gregory Peck did a superb job of acting.
189;I dd see the movie when it was first released.
190;Every person should see this movie, I never read the book, my niece did, she said the book was better!
191;Peck is one of my favorite all time actors due to his consistent great performances.
192;His style is unique and character credibility as believable as any real life.
193;Harper Lee must have loved her Daddy and big brother.
194;Her warm fictional remembrance of them as Atticus and Jem in To Kill a Mockingbird is filled with respect and love.
195;She had a story to tell of race and hatred and tolerance and understanding, but underpinning all of it is her love of the two central males of her childhood, her kind and wise father, and her loving, protective brother.
196;This is the heart of her book, and it is the heart of this faithfully adapted film of that book.
197;The characters in this story of childhood adventures, awakenings and surprises, with the trial of an innocent black man in the South of the 30's at its center, are by and large decent people.
198;this flawlessly cast movie is a masterpiece.
199;It captures the innocense and wonder of childhood, and the sometimes tragedy struggle of adulthood without preaching.
200;The performances are first rate down to the smallest role.
201;Robert Mulligan manages to capture the world from a child's perspective without belaboring it.
202;It captured and moved me then.
203;It's simple truths and humanity are timeless.
204;Great classic film on the evils of segregation and the power of one man to champion an innocent against the accusations of members of the prevailing white class.
205;Such simplicity of form and thought is seldom seen in movies today, except, perhaps, in the rare instance of an Erin Brochovich fighting corporate greed.
206;The lead character, Atticus, is brilliantly portrayed by Gregory Peck.
207;The cinematography was outstanding given the limitations at the time.
208;This is a movie that is perfect for anyone, particularly families.
209;The movie is just a great, and Gregory Peck is just incredible.
210;Scout and Jem were fantastic as well.
211;I would recommend the book and movie to anyone.
212;I would also like to add that these reviews aren't a joke, and this book/movie should be appreciated, as it is the best book I have ever read, and the best movie I have ever seen.
213;It's absoulutely BRILLIANT and I strongly reccommend you should see it.
214;Not much to say other than this is a great movie.
215;It's rare that a movie has such universal appeal that even my nephew who was seven at the time he saw it loved it and wanted to see it again.
216;I remember watching this when I was young.
217;The relationship Scout and Jem had with their father was wondrous and moving.
218;Gregory Peck's performance as the widowed lawyer with 2 kids showed the strength, grace, dignity and vulnerability of Atticus Finch during the trial and aftermath of Tom Robinson the black man accused of rape.
219;Mary Badham's performance as the mischievous and willful tomboy named Scout who lovingly reminisces about her mother with her father is so pure and innocent.
220;She and her brother Jem's decision to make the town recluse come out of hiding is a fateful one that will forever change their lives.
221;The book was a masterpiece and although the film couldn't possibly include everything that was in the book all is forgiven because the film is a masterpiece in it's own right.
222;The order was received in a timely manner and I had no problems at all.
223;We read TO Kill a Mockingbird in our English class, and I loved it.
224;As well as Scout and Jem being played by the perfect people.
225;The film is extremely moving, and provides even more want to read the book and get into the whole story.
226;Some of my favorite scenes include the trial, Scout's talks with Atticus, and of course Radley's appearance.
227;The setting of the Novel is perfectly portrayed, and lets us understand the book even better.
228;Even if you didn't like the book, I encourage that you watch the movie becuase it was excellent!!
229;One of the best movies ever made, along with one of the best books ever made.
230;Movies are hard to come by in this day, but this is one that anyone and everyone could and can love.
231;I got this for a friend who never had seen the movie or read the book.
232;Loved Gregory Peck recalling Harper's comparison of him to her dad.
233;Gregory Peck's performance is 5 stars!
234;Amazing the plot of this film is somewhat still happening today in 'modern' times.
235;I need fingers and also toes of more than just me to count the number of times I have seen this movie since the first time I watched it when I was in fourth grade in the late 1960s, and my whole family sat riveted, huddled under wool blankets, on our unheated, glassed.
236;Many decades later, I can tell you that it still changes me every time I watch it.
237;In an era when little girls were being sold Easy Bake Ovens and there was no such thing as an alternative family, this movies protagonist is a tomboy (Scout) in a family headed by a man (Atticus Finch, who is a lawyer), and the childrens best friend is a delicate visiting neighbor modeled on Truman Capote.
238;To Kill a Mockingbird is equally a movie about how to learn from misguided assumptions, about recognizing love, and about creative survival.
239;I will stake my life and reputation that this is one of the best films ever made and that will ever be made.
240;Most films made now have one note themes.
241;Years after you watch it, you might hear the movie theme music and feel moved to tears.
242;It is told beautifully and Gregory Peck is, of course, his wonderful Oscar.
243;The script for this movie was based upon Harper Lee's sensitive and intelligent novel set in racially.
244;The film was put together by two excellent film.
245;read the original after a number of years.
246;I loved the writing and the """"southernisms"""" that reconnected me to the years I lived in the south (Texas, Alabama, Florida and North Carolina) and the travel I have done there."""
247;What a great example of southern culture of that time and the courage of a man for whom choosing to do the right thing was more important than what might happen afterwards.
248;Scout was a great spokesperson.
249;I just got through watching this movie again.
250;what a wonderful movie to add to you're collection.
251;She was so excited and we watched it together over two nights.
252;She loved it and I loved it again.
253;I was just a teenager still in high school, but immediately loved the movie, which I have seen countless times since.
254;Gregory Peck is probably the single greatest reason for the movie's smashing success, although the entire cast does a terrific job in bringing this momentous story to the screen.
255;Yet despite the sizzling if subdued sexual content and the divisive issues surrounding the movie, it quickly became the movie of the year, winning Peck the Oscar for his incredible portrayal of rural southern lawyer Atticus Finch.
256;no doubt it is the character of Atticus Finch who deserves most of the credit for the novel's enduring popularity.
257;Seldom has such a quietly heroic figure been so favorably and memorably described in such loving detail in an American novel as is fortyish Atticus Finch, the highly principled and somewhat befuddled widower.
258;lawyer trying his level best to raise his two young children alone in the midst of the deep South during the early years of the Depression.
259;And, as played by Gregory Peck, this thoughtful, moral, and courageous man became a model of modern American manhood for all who read or watched his story unfold.
260;Indeed, we watch with growing affection as Atticus increasingly relies and depends on their black governess, and are amazed by the degree to which he is concerned for her welfare as well.
261;So well and accurately drawn are the characters of this fable of the life and times of Scout Finch in To Kill A Mockingbird , that one can only hope it continues to be widely seen and appreciated as a modern American classic.
262;It was in black and white and picture perfect.
263;Such a classic and I am sure we will enjoy it for many years to come.
264;Not only is the message right on, but the prose is also really great.
265;I watched the movie with my mother (my ten year old sister was too young for it) and cried and laughed and suffered through every emotion with Scout and the rest.
266;Even though I saw the movie right after I finished the novel, I still was on the edge of my seat the whole way through.
267;Even for being an older movie, it was still very good
268;Gregory Peck's character is so dynamic, upstanding, courageous and human, that he stands above virtually all other masculine roles, and provides us with a hero for the ages.
269;Other heroes of like stature come to mind, seeing this movie, including Martin Luther King, Abe Lincoln, Jesus, Gandhi, and select few others.
270;Gregory Peck's character shows the epitomy of being a mature adult (a real grown.
271;This is the type of man, I think, we all strive to be.
272;I bought this edition because it was the best deal available but I have enjoyed watching all the added features.
273;Got the movie and is good shape.
274;A great reminder how our morals can get lost as adults when we chose not to think about our actions, and take responsibility for what we say and do.
275;The best movie a real lassic.
276;I was surprised at how well all the elements came together for this film.
277;I would classify this as one of Gregory peck's best movies.
278;They spend time daring each other and their summer friend, to go up to the neighbor house as it holds some mysterious crazed person.
279;Watch as the mystery unfolds.
280;I really enjoyed this classic movie.
281;I am a fan of old favorite movies.
282;I would recommend it to others
283;I would recommend this movie to anybody who appreciates a great story acted out by a brilliant cast.
