id;spiegazione
567;"as an audience of the film, we are exposed to the necessity of pursuing virtue as human beings and what it really means and how important it is to have basic good manners in one's life
568;The magnificent performance of Mary Badham as the irrepressible Scout won her an Oscar nomination for Best Supporting Actress only to miss out to Patty Duke in her stunning role inThe Miracle WorkerConsidering both performances, Duke and Badham (both children) should have won a Joint Oscar as both were absolutely magnificent in their respective roles.
569;despite this film opening forty years ago, the story and performances continue to be a model for present day filmmaking.
570;beginning with a great story, a well adapted screenplay, a director who loves the project thus all in the crew give 100%, and the same basic example of virtue and integrity communicated in the novel and adapted for the screen: compassion, kindness, courage, respect and love.
571;truly one of the all time great films of the twentieth century.
572;something to show the children, something to learn.
573;Outstanding performance by the late, great Gregory Peck.
574;A timeless story that will touch the hearts of all that watch it.
575;There is absolutely nothing more that can be said.
576;Just watch the movie and enjoy it!
577;Gregory Peck won an Oscar for his wonderful performance as Atticus Finch, a lawyer in Alabama during the Depression.
578;It shows how kids adapt to very serious situations around them but manage to keep the innocence.
579;He shows us to stand true to our convictions no matter how hard that may seem.
580;Harper Lee's classic novel on acceptance and intolerance was beautifully transformed into a classic film with a performance that placed Gregory Peck permanently in the film pantheon.
581;Additionally the film has Horton Foote's observant script, Elmer Bernstein's finest score and a supporting cast (Brock Peters, Phiip Alford, as examples) all of whom mesh well.
582;excellent Kim Stanley is the uncredited narrator (Scout as a grown up).
583;The film deserves its reputation and has endured the test of time.
584;everyone has to see this movie.
585;it is the sweetest movie.
586;it's great to watch with family and the children are the best!
587;scout makes the cutest lil faces :) well i hope you take this into consideration!
588;Let's get this out of the way first: To Kill a Mockingbird is a great film in many ways.
589;It's based off one of the most revered novels of the 20th century, so it clearly has an interesting story and an important message.
590;It's characters are fleshed out, it features unforgettable performances from Gregory Peck and Brock Peters, a most unexpected debut of Robert Duvall, and it's powerfully directed by Robert Mulligan.
591;Both are classics, but if one wants a more complete and accomplished work, seek out the novel.
592;His sense of humor and down to earth style and seeing his family and other live interviews just validated my feelings for the actor and the man.
593;a great book and movie!!
594;This is a very good movie.
595;It is truly a classic.
596;This film is beautiful in its intent"
597;Also, Atticus' relationship with his children (played wonderfully by the two young actors in the film) is precious to see.
598;to me, the best part of the film is simply watching Gregory Peck and the two young actors who play his children.
599;Great film in what it tries to accomplish, but clumsy and convoluted (imo) in its execution.
600;The extra's make this worth the extra charge.
601;It is a tale of growing up in a society that doesn't practice what it preaches (pun intended).
602;It's the story of a man whose entire life boils down to the simplest of emotions, empathy.
603;why is it that a movie loved and universally praised can't be used as a blueprint for the society from which it came and today's society as well?
604;i don't know about anyone one else, but aside from my Lord and Savior Jesus Christ, Atticus Finch, fictitious though he may be, is a personal role model for my life, and has been since I first read the book in third grade.
605;As for the movie, they cast everyone perfectly.
606;a must read and must watch for everyone.
607;I'm honestly super surprised by how cheap this is.
608;I bought my copy and love it.
609;This was one of the first items I spotted and instantly got it.
610;I enjoy classic movies and this one is a must for any collector's library.
611;I recommend it to everyone who appreciates fine acting.
612;"Gregory Peckl said that this was the one movie of which he was very proud and humbled to have been in
613;This movie is about accepting others differences and being happy about your own.
614;The movie is poignant and thrilling and sad.
615;I remember watching it as a child and the rabid dog scene was so profoundly compelling but now it is really nothing at all.
616;Great movie to watch at least once a year and explain to your kids.
617;Released in 1962, this compelling black and white film is as relevant today as it was over 50 years ago.
618;The beautiful story of a young girl's coming of age in the deep south skilfully entwined with the social issues of the 1930s that sadly still inflict us today: prejudice based on race/color"
619;And of course, a brilliant performance by Gregory Peck in the role as Atticus Finch.
620;This is such a classic movie and I'm so happy it's now part of my collection!
621;Excellent film, I can watch this movie over and over.
622;This film will forever be a classic.
623;The film tells an intriguing story of the prejudices that crippled our society.
624;Everyone should see this film.
625;I have seen this movie many times in the past, but this version of the film brings out the best in the movie and completes make your senses delight in the literary masterpiece which is this film.
626;Not only does the story itself intrigue the viewer, but the acting is completely top rate and Gregory Peck alone is remarkable in his role (in my opinion, it was made for him).
627;ray provides but also on top of this all of the special features that have been provided for the viewer.
628;packed with so many behind the scenes as well as interesting tidbits that you would have never known about the movie.
629;I highly encourage you to get this version for yourself as it is definitely one to keep for all times!
630;Getting to watch movie afterwards was a special treat.
631;It is a wonderful tribute to Gregory Peck and company.
632;Great social film for studying our society.
633;This is an amazing story.
634;Rich in theme and and character development.
635;Greg Peck received an Oscar for his performance over those in competition for this Gold Standard.
636;The only book written by Pulitzer Prize winning author, Harper Lee's telling of her story made its way to the big screen and set the standard for great performances.
637;Watching this will more than entertain its viewers, it will enlighten them.
638;time favorite movie and this new restoration for it's 50th anniversary is amazing, Universal has done a really good job restoring this black and white classic and it looks better than ever!
639;Gregory Peck's performance is unique and really powerful!
640;I am Black and I raised my children to be proud of being Black.
641;I'd recommend everyone to see this movie at least once, and to discuss at length.
642;"In addition to the classic movie (which we never tire of), the special features are very interesting, including interviews with ""Scout"" (Mary Badham), and ""Atticus Finch""."
643;to Kill a Mockingbird is an enduring classic, a moral lesson, as well as an entertaining story.
644;is all I can say about this American classic!
645;This movie is a classic, one of the best ever made.
646;This is easily one of the 10 best American films ever made.
647;That is, I suppose, what makes it so powerful: it walks the line behind the lazy summer days of Jem and Scout's childhood, and the hard truths of their father's courtroom drama.
648;TO KILL A MOCKINGBIRD brings back the joys and the pains of childhood more accurately than any film I've ever seen.
649;gregory Peck plays an unforgettable Atticus Finch, and all of the supporting players, including the children, are great.
650;Elmer Berstein's soundtrack is superb.
651;Always a classic, no matter what age you are.
652;They did a wonderful job with this movie and Gregory Peck is marvelous.
653;movie buffs alike should see this film, which touches on everything from the history of race relations in America to the relationship between a father and his children.
654;This a lesson on how we should treat each other as humans.
655;It is an excellent well written novel that was adapted for the screen very well.
656;The acting is superb and the story is rivetting.
657;The story stays close to the Harper Lee novel.
658;Those who were lucky enough to see this movie on the big screen that December 25th came out of the theater with another Yuletide gift of sorts .
659;they had just watched one of the finest motion pictures ever produced (IMHO).
660;A truly fabulous piece of American cinema .
661;"with a tender and bittersweet ending that always leaves one of those ""trying to hold it back"" lumps in the ol' throat."
662;the cast is ideal, with each actor seemingly molded for each of their individual roles.
663;"and ""Atticus Finch"" (Gregory Peck), one of the truly most memorable characters ever brought to the screen."
664;winning portrayal of that southern lawyer and father could have possibly been any better than we see it here.
665;It's one of several scenes in the film that illustrates the type of man Atticus is, and the type of example he's setting for his young children.
666;this film offers up many highly.
667;out tree that keeps filling itself up with all kinds of cool stuff.
668;Stand up, your father's passing.
669;Plus, that beautiful and stirring Elmer Bernstein music score.
670;there's also a good deal of humor residing in this screenplay.
671;"I always get a good healthy laugh when viewing the scene which has Dill drenching his dinner in syrup, to the shock and dismay of Scout (""Look, Atticus!"
672;A true LOL moment that's always good for at least two replays.
673;"And possibly the most memorable quote comes at the end of the film, when Atticus says to Scout: ""Miss Jean Louise ."
674;"The dignity with which Atticus ""introduces"" Arthur (""Boo"") to Scout is what makes this quote memorable for me."
675;universal Studios Home Video, on September 6, 2005, issued a beautiful.
676;"packaged under its ""Legacy Series"" banner, this 2."
677;It looks very nearly perfect to my eyes.
678;And the nighttime scenes are rendered in fine fashion, with next to no video annoyances visible at all.
679;"The film passes the ""Freeze Frame"" test as well ."
680;"i. e.: you can ""pause""/""still"" an image on screen in virtual perfect clarity, without the image blurring at all, which I usually take as a pretty good sign that what I'm seeing is a darn."
681;These poster art copies are very nice, being re.
682;"popular and successful John Travolta film ""Saturday Night Fever"" (in 1977).>"
683;rate documentaries on the second disc of this set.
684;Lots of interesting details about how this classic film got to the screen.
685;constructed presentation, with a good music score too, which delves in great depth into the personal side of the great Gregory Peck, who proves here that he was still more than capable of holding an audience's undivided attention at age 83.
686;It's quite literally a biography on the personal life and movie career of Mr. Peck.
687;"It's certainly one of the best ""bio"" pieces I've ever seen on the life of any actor."
688;show clips featuring Gregory, and lots of other interesting stuff that help to give even more insight into the life of this amazing American actor (who was born in California on April 5, 1916).
689;there's lots of candid footage of Peck (and family) here too, including some impressive shots taken at Niagara Falls.
690;"engaging bio/""Conversation"", we see proud granddaddy Gregory holding his just."
691;"born grandson (who was named ""Harper"", after TKAM author Harper Lee)."
692;These tender scenes with Gregory and his new grandson add the perfect sweet and sentimental finishing touches to the whole documentary.
693;"this ""Conversation"" bonus is a genuinely unique program."
694;It was produced with an obvious large dose of love and affection by Mr. Peck's daughter (and all others who were involved in putting it together).
695;And that might be the best compliment I can pay this very special and heart.
696;He will be missed forever by multiple generations of movie fans who loved his work in the cinema for many decades.
697;His talent is one that we'll likely not run across again, until we reach heaven.
698;But thank goodness for fabulous documentaries like this one, plus all of his cherished films as well, which enable fans to retouch the magic and greatness that will forever be associated with Mr. Gregory Peck.
699;"the packaging for this ""Legacy Series"" edition has a very solid and collectible feel to it."
700;There are also some interesting Production Notes and photographs printed on that 1998 TKAM insert.
701;To Kill A Mockingbird is a masterpiece of personally.
702;This is a motion picture you can watch again and again .
703;present lump in the throat that this movie masterfully induces each and every time it's watched).
704;Gregory Peck definitely earned his Best Actor Oscar for his lead role in this movie.
705;Everything about this classic is unsurpassed including direction and stunning acting, see this movie just for the amazing Gregory Pecks perfomance if nothing else.
706;it's hard to believe that the children in this movie were just that, children.
707;A friend and I were talking about this movie she'd bought and I remembered it from school (many yrs ago).
708;I thought my son might enjoy it.
709;Happy to give this as a gift and the recipient was pleased to add this to their collection.
710;The film is a timeless classic!
711;This movie is one of the best period movies of it's time.
712;Gregory Peck is at his finest!
713;A must for everyone interested in segregation in the South.
714;This is a movie with a timeless message speaking to our humanity and integrity and the equal value of all people.
715;We loved revisiting this and would highly recommend its viewing by all!
716;Along with the book, this is a necessary watch.
717;One for the best films ever.
718;All of the actors/actresses are excellent.
719;This is a must watch film.
720;To Kill a Mockingbird is a classic, a masterpiece, and it is Gregory Peck at his prime.
721;nominated), and teaches them about compassion and the evils of prejudice.
722;"To Kill a Mockingbird is the second best movie of 1962, next to ""Lawrence of Arabia"", and one of the best and most important movies of the 1960s."
723;Our son watched it with me the other day (he's 14) and he really liked it as well.
724;In recent years many of the movie collections are combined with interviews with the original cast.
725;One of my favorites is with Gregory Peck.
726;Peck often said that the role of Atticus Finch was his very favorite role in his long career as an actor.
727;Gregory Peck has always been one of my very favorite actors so this had great meaning for me to know that someone actually lead a principled life away from the stage.
728;the characters in the book are all very realistic for any community, not just a southern community.
729;I have enjoyed it throughout my life.
730;The screenplay and the movie is also pure Americana.
731;The movie was packaged well for shipping and in perfect condition when it arrived.
732;If you haven't watched the movie yet, I recommend it.
733;It is a great film and tells a great story.
734;Several performers gave Oscar worthy performances in this rendition of one of America's greatest novels.
735;An all time American Classic movie for all to see.
736;Clearly one of the best movies every made.
737;We were glad to find this really great film at such a good price to add to our video collection
738;I found it to be a mirror of our governance today.
739;This is my all time favorite.
740;My students love the reward of reading the book, knowing that they will get to view the movie following their final.
741;Ties my novel unit together nicely!
742;This is an excellent piece of literature with a timeless and thought provoking message!
743;Great book and movie to spark family discussion!
744;Rarely has a great classic of literature been so perfectly cast and so perfectly transformed to screen.
745;Harper Lee's nostalgic look at life in 1930's Alabama is a lazy walk in yesteryear that somehow gets hold of you and has you on the edge of your seat.
746;I read the book and watch the movie at least once a year and I still love it.
747;The characterizations were perfectly done in the book and very well imitated in the movie.
748;Gregory Peck makes the perfect Atticus and you are amazed at how well the children played the parts.
749;I'm not sure how they did it, but to restore and old movie and make it look as sharp and clean as this one is amazes me.
750;The sound and picture are absolutely brilliant on this Blu.
751;If you liked this movie, you will love it in Blu.
752;Do yourself a favor and experience this movie as it has always been meant to be seen.
753;This compelling actor played two of the most iconic characters in all of cinematic lore.
754;(And Peck played both roles in his own unique, creative style.)
755;With respect to Atticus Finch, Peck merely enhances an extraordinarily good film, TO KILL A MOCKINGBIRD, based on Harper Lee's phenomenal and timelessnovel.
756;"I've read the book and seen the movie, many times
757;In particular, the film works marvelously, for several reasons.
758;for openers, Horton Foote penned a riveting screenplay, while director Robert Mulligan brings Lee's novel to vivid life.
759;The film is blessed with very believable child actors in Mary Badham (Scout) and Phillip Alford (Jem), who both made their silver screen debuts.
760;The supporting cast is spectacular, including a grisly, disheveled James Anderson playing villain Bob Ewell and a very young Robert Duvall playing reclusive Boo Radley.
761;Add to that Peck's commanding performance as a widowed lawyer and father of two children in the Jim Crow South during the Great Depression, and TO KILL A MOCKINGBIRD is a movie for the ages.
762;Highly recommended for all movie collectors and cinema buffs.
763;Thought provoking, poignant and utterly captivating.
764;A favorite generational share and must have for every home video library.
765;The character of Atticus Finch quietly parsed the poverty and ignorance of his town with educated intelligence and the soul of a good man .
766;the casting, acting, photography, and musical score bring Harper Lee's original story to life.
767;The black and white film is perfectly fitting.
768;Gregory Peck's portrayal of Atticus was his very best work.
769;I still watch him in awe.
770;This movie brings back so many memories of my own childhood.
771;The daily antics of childhood's long summer days are portrayed with simple ease and grace.
772;The part played by Gregory Peck was played with such integrity and is a splendid thing to watch especially with children as they are not too often afforded the opportunity to see such a role model as this.
773;This movie makes it so easy to remember.
774;I love to set the mood when I watch this movie.
775;I'll remember it always as I hope my children and yours will too.
776;This is a great movie.
777;I feel a bit taken however, since the description of the disk lists it as """"widescreen"""" 1.85:1."""
778;Of course the movie arrived in wonderful condition.
779;We love the movie and watch it often.
780;Arrive on time and in perfect condition.
781;I saw this movie many times, and will pass it along to the younger generation.
782;I have always loved this movie, ever since it came out on TV when I was a child.
783;Gregory Peck is one of my favorite actors.
784;Also this was an anniversary edition with lots of extra stuff.
785;funny to hear about all the trouble they had behind the scenes, but how much fun it was doing the film to begin with.
786;my mother was very happy to have this, and she enjoyed it alotshe was very pleased to got this as a mothers day gift.
787;I had to read the novel in High School but found the film to add to my enjoyment.
788;Gregory Peck was a great actor!
789;As an educator it is always great to have a movie when the book is finish for compare and contrast.
790;To Kill a Mockingbird was an outstanding book which .
791;was made into an outstanding movie.
792;Gregory Peck won an Academy Award for his superb performance as southern lawyer, Atticus Finch, who controversially defends a black man unjustly accused of molesting a white girl.
793;Peck, a consistently fine actor, has frankly stated that this was his favorite role, and his performance is one of the most outstanding even given on film.
794;including those portraying his two children .
795;were also quite good and helped make this one of the greatest movies ever made.
796;as a professional, as a citizen, and as a father.
797;it is to the model set by my own father and to the portrayal of Atticus Finch in this film that I owe much of what has been good in the fulfillment of my duty to my community, to my patients, and to the children and grandchildren who were born into my responsibility.
798;if there is anything solid or valuable in the moral character of the male American Baby Boomer, it is attributable in at least some small way to the influence of this movie and the expectations it impressed upon us, consciously or unconsciously, in the darkened movie theaters of 1962 and 1963.
799;It is such a great movie that any sad thing that happens is for a reason and a teaching tool.
800;It's such a classic and writing a review can never do enough justice for this movie.
801;Rarely does Hollywood capture the essence and beauty of a novel.
802;This movie is a beautiful rendition of the best American novel ever written!
803;I seldom find a movie version of a story that is at least as good as the book in which it's based, but To Kill A Mockingbird is a rare exception: the film is, if possible, even better than the book.
804;Gregory Peck is superb here as the lawyer Atticus Finch, an everyman thrown into the role of a hero of sorts among his prejudiced community.
805;The film gives a tender but penetrating portrayal of the relationship between the widowed father and his children, of the children and the mysterious Boo, and of a community divided by hate.
806;that this is one of the classiest people ever to hit Hollywood.
807;Through the eyes of his wife, children, and adoring fans, this documentary allows you to get to know the real Gregory Peck, and I truly lament that the world has lost such a beautiful person.
808;May his wonderful movies keep his memory alive forever.
809;superb acting, though as has been noted Peck does come off seeming a bit too stiff.
810;And the human relationships that included Boo the man that saved the children.
811;I knew when I first watched this movie it was one of the best.
812;There are just so few better stories.
813;everyone should see this movie at least once in their lives.
814;This wonderful adaptation of Harper Lee's classic novel is a film of great dignity, a Norman Rockwell painting come to life.
815;"In the end, those of us who do mature find that there is often beauty on the other side of that mysterious door
816;On the contrary, it's one of the film's surprising strengths.
817;Mary Badham as Scout and Phillip Alford as Jem are utterly convincing as the children that many of us got to know in school.
818;deserved Oscar for his depiction of Atticus Finch "
819;Peck's closing argument to the jury is riveting, and is a stellar example of on.
820;There is inspiration and hope to be found here, a transcendence of time that few films can match.
821;Besides providing lovers of this work with a clean, sharp video transfer, we are treated to a beautiful making of documentary and given a decent director's commentary.
822;My memories did not betray me, for this is just as enchanting and moving a film as I remembered it to be.
823;Plus, there is a good commentary track and very in.
824;"documentary uses the film as a starting point from which to discuss the background era in which the film is set
825;so, you already know how great this film is and how great Gregory Peck is in it.
826;A 5 star effort all the way!
827;In other words, this is a timeless piece.
828;Rarely has a film so accurately captured the emotional consequences of human fallibility steadfastly within the grip of racial intolerance.
829;Facing great odds, Finch attempts to discredit Mayella on the stand, but Tom's sympathetic testimony proves to be his own undoing.
830;gregory Peck gives his career.
831;best performance as Finch, bringing the necessary human.
832;It's inspiring work from a great screen legend.
833;Mary Badham is wonderful as the inquisitive Scout never veering off toward precociousness in her acting, and almost as good is Philip Alford as Jem.
834;looking Robert Duvall makes his film debut as """"Boo"""" Radley, making his late appearance in the film impactful."""
835;white cinematography is effectively evocative.
836;This masterwork is as good as family films get.
837;Beyond providing an excellent print and audio transfer, the first disc contains a deeply insightful commentary track with full participation from Mulligan and the late producer, Alan J. Pakula, a superb director in his own right.
