id;spiegazione
1957;Truly all of the cast is phenomenal.
1958;As always, many of Lee's characters in this growing.
1959;This is a great addition for a classic movie collector.
1960;This is a classic, anyone who is into great films should see this movie.
1961;"Right on the cover it states that 12 reproductions of the original movie poster is included with this ""special edition."""
1962;This is a great deal for a cinema classic.
1963;It has a bunch of special features, which I'm excited to check out.
1964;The book and the movie both won major awards and any reader will quickly see why.
1965;Gregory Peck stars in this near perfection film adaptation of a magnificent novel.
1966;the film has to be considered one of the greatest dramas ever made, what makes the film even more enjoyable is that is family oriented.
1967;Before them are the impressive SOLID three panel each twin doors to the courtroom beyond.
1968;I gave it as a gift to my mother and my daughter and they were so happy.
1969;The packaging is beautiful and I love the tidbits of information on the inside cover about the movie.
1970;To Kill a Mockingbird is one of my very favorite movies.
1971;One of the best movies ever!
1972;A classic movie that is the ultimate for any library.
1973;This movie is the best at showing how life was in the south, it deals with racism and yet it shows respect for all people of color.
1974;It was easy to predict that Hannibal Lecter would be the top villain.
1975;I was genuinely surprised, and very, very pleased, that the top film hero named was, indeed, Atticus Finch.
1976;and, very simply, he thought it was the right thing to do.
1977;I think Atticus Finch's quiet devotion to his children, and his belief in doing what was decent and right in his life and profession, made this character a hero in my eyes.
1978;I always find it inspiring.
1979;this is a film I revisit at least once a year, and it never ceases to move and inspire me.
1980;Harper Lee must have been so proud.
1981;What I will say is this particular packaging of the Movie, was a wonderful bonus, and has increased my appreciation of the movie two fold.
1982;Like wise the interview with Mary Badham (who played Scout), provided me with additional enjoyment.
1983;I watched this over the weekend with my three year old son Jacob, kids today don't go out of their way to watch anything in B&W, but such is the power of this movie, that he sat wide eyed waiting for the final arrival of Boo Radley.
1984;I watched the same reaction in him, that I had all those years ago when I first saw Robert Duvall behind that door, the hairs even today, still stand on end!
1985;What a marvelous movie what a wonderful story.
1986;Also the post card sized movie posters included will look fantastic framed.
1987;Gregory Peck is the perfect Addicus,and the kids were so comfortable and real.
1988;sometimes things are not what they seem and we can be very surprised by the ending.
1989;I believe that this is a movie that suits kids of all ages.
1990;I am in my 20's and I still absolutely love this movie.
1991;Two thumbs up I have to say.
1992;Not only do you get one of the great films of all time, you also get the documentary about the film and its impact on the general public.
1993;This work is truly beautiful and has held up every bit as good as when it was first released.
1994;The film also follows the book very closely and does a wonderfull job of adapting the masterpiece.
1995;It is part of my personal film library and is truly a great addition.
1996;This is one of my personal favorite movies based on one of my favorite books.
1997;The cast has done a terrific job bringing the book to the screen.
1998;full of love for his children and worthy of their respect.
1999;The message will teach you to open your heart and mind to the world around you.
2000;Even though the book was fiction, it and the movie were the best work ever done concerning the lack of civil rights in America!The movie brought the characters to life and they were perfect!
2001;This movie (and the book) are classics.
2002;The acting and directing are excellent.
2003;I watched it the first time when I was a child and I have always loved it.
2004;It's a story of dignity as Atticus Finch, an honest God.
2005;in the meantime, we follow the lives of the three children during one summer, one who is a summer visitor and based on the life of Truman Capote, who was a neighbor of the story's author Harper Lee.
2006;45 years later the movie still stands the test of time for its acting, its story and proving once and for all there are lots of great movies and TO KILL A MOCKINGBIRD is one of them!
2007;This movie is definitely a classic for everyone to watch!!
2008;One of the great movies of of the Golden Era of filmdom: important lessons for all ages, races, and times.
2009;gregory Peck, who'd started working on Broadway and in movies 20 years prior to this film, does a very stable and critically acclaimed (Oscar rewarded) performance as Atticus Finch .
2010;much of this 1962 movie, which incidentally includes Robert Duvall's film.
2011;"debut, is played out through the eyes of Finch's motherless children, ""Jem"" and ""Scout."
2012;"I recommend it highly to anybody anywhere, regardless of age and culture, as it contains no foul language"" or ""severe violence."""
2013;For all the viewer is aware, this could be a recreation of actual historic events, which it in a sense is.
2014;"dominated 1950's Ingmar Bergman pictures (such as ""Smiles of a Summer Night."")"
2015;There are also Spanish subtitles and a French audio track.
2016;Made a great gift for my husband who loves this movie.
2017;He was very happy with his gift on Christmas morning.
2018;Gregory Peck is perfection as Atticus Finch.
2019;And a then unknown Robert Duvall is unforgettable as Boo Radley.
2020;It is an excellent adaptation of Harper Lee's book.
2021;plot, Finch's children amuse themselves in the pre.
2022;There are the endearing interactions between Atticus and his children.
2023;Harper Lee portrays small town life during the depression with great detail and the movie brings this out.
2024;This is one of my wife's faverate movies so I got it for our 22nd annaversary.
2025;My wife and girls watched it together and they all just loved it.
2026;That is the greatest thing going on.
2027;This is a poignant and heart warming story told from the point of view of a little tomboy, Scout, and her older brother, Jem, of growing up in the South during the depression.
2028;The colorful neighbors, their antics and their opinions, show the audience just what stuff this family, especially Atticus trying to raise his children alone, is made of.
2029;I think this is a all time classic you can enjoy over and over.
2030;Apart from being a story about a family living at a time when black people were not accepted for their true worth, it also depicts an understanding lawyer and a couple (or 3) natural kids who asked questions and tried to understand the answers.
2031;This movie is a classic and well worth viewing.
2032;I watched it with my mom and 8 year old grand daughter and both loved the movie
2033;It is otherwise a great movie.
2034;this was the best iof the best i give it a 10+
2035;To Kill a Mockingbird is one of the best American films I've ever seen.
2036;The acting is fantastic (including some of the most natural child performances you've ever likely to see), the score is magnificent, and the film is very well.
2037;This is one of the clearest and most beautiful transfers for a film of this age I've seen.
2038;The sound, while slightly held back due to this being a 50.
2039;year old movie, also fares very well.
2040;this release is packed many worthwhile and insightful extras, particularly a feature.
2041;a timeless masterpiece earns an equally impressive blu.
2042;It was nice to be able to see this when we thought it would be hard to find.
2043;Thank you for having a great selection of movies.
2044;I have always loved this movie and even though I have seen it a million times, I enjoy it each and every time I watch it.
2045;screen antics of Scout, Jem, Atticus and ultimately, Boo.
2046;LOVED the extra features, which is why I bought this version.
2047;to see the actors beyond the characters.
2048;"This is so much more than a movie
2049;raising a family, working two jobs, dealing with setbacks and disappointment, trying always to rise above the roadblocks, to make it all worthwhile, and even have some fun, along the way.
2050;I bought the film with high expectations, and all my expectations were exceeded by this masterpiece.
2051;This movie and the history behind Harper Lees work touched me so deep, that I went to imdb ([.])
2052;and gave it a perfect 10 rating.
2053;Fantastic acting and incredible story!
2054;Gregory Peck was one of the greatest actors of all.
2055;Watch this movie and be amazed!
2056;What an impressive story and movie.
2057;Gregory Peck is impressive and gives a great performance.
2058;I read the book years ago and was so pleased to see the movie is so well produced.
2059;Was great to watch with my teenagers.
2060;Peck will be remembered for this movie and his role in it.
2061;The great movie carefully preserved and restored with bonus materials.
2062;There is little deviation from the book and the cast are great.
2063;It is something that everyone should own.
2064;Besides, you absolutely have to keep an eye out for Robert Duvall.
2065;I had forgotten, what a meaningful movie this was and how wonderful and actor Gregory Peck was!
2066;I really enjoyed the movie"
2067;(I especially loved how the kids sat with the African.
2068;"Gregory Peck was the man's lawyer and really his ""advocate"" for justice!"
2069;It was truly a great story of UNDERSTANDING!!!!
2070;It is a great movie about prejudice, good and evil, and about how people with disabilities have been treated.
2071;I highly recommend the move for those who have not seen it, and for those who have.
2072;Even though the movie was set in the South, I felt a connection with these characters because my pre.
2073;So the connection was very intense.
2074;I immediately bought the book and read it cover to cover on my own and I loved the book even more.
2075;I think I bought it more for the extra features than the original movie since I had already seen it multiple times.
2076;The Special Features were tremendous.
2077;"To think that a movie that was so endearing and social relevant was actually filmed on the back lot of Universal Studios and was so ""movie fake"" was so good on the screen all bound together by one of the best movie sound tracks ever written is a testament to the creators of this motion picture."
2078;This work will be there through the ages.
2079;Gregory Peck did a superb job of portraying Atticus Finch and inspires us all to our better selves.
2080;Atticus Finch is a man for all times, a man of integrity who makes us believe we could all be better than we are, in our professional lives as well as in our personal relationships.
2081;everyone would benefit from viewing this movie not only once but periodically, for another dose of inspiration plus it is very entertaining and comical in places.
2082;able as well as inspirational.
2083;The product was recieved in excellent condition and was everything I expected it to be.
2084;The movie is a classic and I never tire of watching it.
2085;The acting was superb .
2086;Child actors that are convincing in their parts are rare these days and the children in this movie were very convincing.
2087;Gregory Peck is an excellent actor who never overplays his part.
2088;I would always recommend this movie.
2089;An excellent film with an extraordinary actor.
2090;One of the best loved novels of it's time, comes to life with power and force with no other than Gregory Peck.
2091;Robert Duvall and Alice Ghostley have cameos in the movie.
2092;Amazing work of art, story telling, and suspense.
2093;It takes a real good look at depression era deep south living, prejudice and moral values.
2094;The court room scene still makes me shiver and weep.
2095;One of the best movies ever made, and one of the best movies ever acted, by botht the child stars and a adults.
2096;I love how the movie portrays the tone of the town even better than the book.
2097;It can bring to focus so many identities.
2098;color, intelligence, gender, sexual preference, introvert.
2099;We can all relate to this classic.
2100;"I really enjoyed reading Harper Lee's book
2101;The film is wonderful .
2102;even though it does not follow the novel strictly, it still captures the essence of the story.
2103;the morality and strength of character that we see in Scout's lawyer/father is inspiring.
2104;The setting is filled with Southern Gothic magic.
2105;Both novel and film are highly recommended.
2106;This story is timeless How movies sd be made.
2107;Some great things that happened in the book are left out, but this is still a great movie.
2108;Peck is amazing as Atticus"
2109;Scout and Jem are pretty good, too.
2110;Time less, classic and great performances.
2111;There's very little to be said about this incredible film that hasn't been said before.
2112;I immediately decided it was my favorite film of all time, and, 40 years later, it still is.
2113;Horton Foote's brilliant screenplay accomplished a feat that is almost unparallelled: it reduced a complex, character.
2114;"Its profound effect on me has been a bit of a character builder for me
2115;I encourage all people with children in their life to show this to them.
2116;Kids often pay more attention to a film that's seen thru the eyes of kids.
2117;I've seen it happen to my own, and I, myself, am living proof.
2118;This is the best movie ever made.
2119;so ahead of its time and it was a great pkg for the price
2120;I was extra pleased to obtain and view this classic movie to help celebrate the 50th anniversary of the marvelous novel by Harper Lee.
2121;Although the movie cannot replicate the genius of Harper Lee's narrative, it is nonetheless one of the great films based on a novel.
2122;The Black and White Photography is clear, and the additional commentaries are interesting for those interested in learning more of this story, which happened to be Gregory Peck's favorite role of all the many motions pictures he starred in during his long and memorable career.
2123;This one does a particularly excellent job.
2124;and i own over 300 films.
2125;This movie is a classic and a must.
2126;A great story that delivers a powerful message of truth, tolerance and integrity.
2127;The 50th anniversary edition special features are a wonderful bonus.
2128;It is a wonderful addition to any Blu.
2129;This film is as powerful today as it was when it was first made in the sixties.
2130;a wonderful story of innocents and innocents lost.
2131;Story of strength, of race, of love, of exciting childhood times and all graced by an unforgettable movie sound track that in itself is a masterpiece.
2132;This is a true CLASSIC.
2133;A piece of art that you'll enjoy over and over again and i'm sure each one of us can relate to Scout in some way.
2134;this is a classic movie .
2135;law loved it, she's in to old movies.
2136;thank you, me and my wife love it to.
2137;If you enjoy drama, classic holiywood, a great story and a great actor, this is a must have.
2138;Gregory Peck is at his dramatic finest in the vehichle.
2139;Even if you have seen before, watch it again.
2140;A wonderful and moving drama.
2141;This is one of the best movies that I have ever watched.
2142;The best movie every made.
2143;Best picture oscar deserved for sure.
2144;Extras for 50th Anniversary are great and unexpected!
2145;Recommend it for all to see.
2146;Watching the movie helped him understand what the book was about and he is learning the difference between watching a movie and reading the book and how the book always has much more detail than a movie.
2147;What is up with the digital touch up of Gregory Peck's face!
2148;To Kill A Mockingbird is a beloved classic, and also one of my favorite films of all.
2149;robert Mulligan directs this film.
2150;making is one I've come to appreciate and love!
2151;driven films that are much more heartfelt and personal, plus so much more enjoyable and satisfying to watch.
2152;developed characters are the essence of great films.
2153;same goes for stories, too!Harper Lee's classic novel was a huge success, mainly because of the unforgettable characters.
2154;He was a brave man who didn't have to use his fist or a gun to get his message across.
2155;He embodied goodness, justice, virtue, integrity, courage.
2156;all relative qualities that I associate with honorable men.
2157;As for the film itself, it's timeless.
2158;It will no doubt be cherished and enjoyed by generation of moviegoers to come.
2159;It's a gem and one that I highly recommend!
2160;Gregory Peck's Atticus Finch is one of those great film performances that one can never get enough of.
2161;Some of the best child actors ever seen on screen as well.
2162;And what has to be the best portrayal of a single father to date.
2163;time best films on any list.
2164;See if you can spot Robert Duvall in his film debut.
2165;Robert Mulligan directed this movie and kept it faithful to the book, which is always a surprise.
2166;It also shows how a wonderful book can fit on the screen like a beautifully hung picture.
2167;Gregory Peck's subdued performance underlines the character of Atticus well.
2168;All the acting roles are beautifully done.
2169;worth watching and worth putting on your shelf.
2170;Added this to my collection and I am proud to show it to family and friends.
2171;Gregory Peck and this marvelous group of actors brought a difficult and painful truth in our history to the screen in a gentle, but forceful way, which has left a mark on American cinema, and that of the entire world, as well as our hearts.
2172;See if you can spot who was playing Boo Radley before you look it up.
2173;received in a timely manner.
2174;i'm as happy as flea on a dog.
2175;I first read Harper Lee's Pulitzer winning novel when I was in the 10th Grade, and I watched the movie adaptation soon thereafter.
2176;There is much to contrast with our notion of lawyers today.
2177;The added director's commentaries and featurette are of tremendous value in further understanding this movie.
2178;This movie was a labor of love and will touch anyone who watches it.
2179;A great novel turned into an even greater film!
2180;Gregory Peck's usual wooden acting style is perfect here as Atticus.
2181;The three children are wonderfully natural, as are the other actors, but the real stars are the novel itself, Horton Foote's screenplay, Robert Mulligan's direction, and Elmer Bernstein's haunting score.
2182;and then of course there are the additional little nuggets of gold such as that the film includes the debut of one of our greatest actors, Robert Duvall as Boo and that Dill is based on a young Truman Capote.
2183;Then (without the children) go watch the film Capote with Philip Seymour Hoffman's mesmerizing performance as Capote with the help of Harper Lee and see what Dill grew up to be!
2184;And read it and read it and read it again!
2185;What a thrill to experience this awsome movie again!
2186;Peck was the perfect choice to play Finch and received an Academy Award for best actor for that performance.
2187;A widower with two young children, he supports himself and his family as an attorney in a small town in Alabama during the Great Depression.
2188;His eloquent appeals for justice and racial tolerance are directed to everyone in the town, not only to members of the jury.
2189;As directed by Robert Mulligan, all members of the cast perform brilliantly.
2190;Of special interest is the screen debut of Robert Duvall as Boo Radley, a mysterious recluse who eventually becomes significantly involved in the plot.
2191;Finch is as credible to those who see this film as he is to those in the town in which he and his children live.
2192;When making word associations with the name Gregory Peck, intelligence, integrity, and dignity immediately come to mind.
2193;Credit must also be given to Horton Foote who wrote the highly literate screenplay based on Lee's autobiographical novel.
2194;This is a great film primarily because it contains a great performance by Peck and because (through Finch) it makes a power appeal to the best that is within us, whatever the color of our skin may be.
2195;Probably one of the best movies ever made.
2196;Everybody in it is wonderful and the story is one that needed to be told.
2197;I think it worked as an eye opener to issues about racial relations and what kids live with growing up in the South!
2198;Gregory Peck is fantastic as always.
2199;This movie will live forever!
2200;The charactures in this picture are enthrallling, It's such a delight to see a picture that captures yourheart.
2201;I watch this movie about 4 times a year, Truely a masterpiece.
2202;This is one of the all time greatest movies.
2203;This is a classic that everyone, young and old should see AFTER reading the book.
2204;The casting was superb and the book was really brought to life.
2205;Just one glance at Robert J. Mulligan's 1962 film and you will see why it (unlike many of today's contenders) is a true American masterpiece.
2206;as the Anglo protagonist Atticus Finch, Gregory Peck delivers one of the most excellent character performances of his film career.
2207;as the town """"idiot"""", he is an enigma to the local children."""
2208;who spend a considerable amount of time in the film fascinated by the rumors surrounding this man.
2209;My highly diverse (racially, socio.
2210;economically) class struggled a bit with Harper Lee's diction early so this film provided an excellent complement to the novel.
2211;told this story from a cinematic perspective.
2212;Great stories can still make great movies, even without sex and explosions.
2213;Midway through this outstanding movie, Atticus Finch (Gregory Peck) defends a black man accused of raping a white woman in an Alabama town during the Depression.
2214;This is one of the simple themes of the movie: all you have to do is confront and face bigotry, in order to eliminate it.
2215;tO KILL A MOCKINGBIRD is undoubtedly one of the most important and most engaging movies of post.
2216;wWII America, and a cinematic emblem for the civil rights movement of that era.
2217;From the incredible opening credits, complete with Elmer Bernstein's heartbreakingly beautiful score, you know you're in for a great movie.
2218;But the aptly named Scout also sees something that most other children do not: the dark world of grown.
2219;In this way, she is a sort of foil for her father whose fighting spirit is internal, calm, but just as effective.
2220;TO KILL A MOCKINGBIRD is full of outstanding performances.
2221;Gregory Peck is appropriately understated, although passionate when the moment calls for it.
2222;this is a film to be watched on several levels but none more important than its stirring interpretation of childhood rapidly coming to terms with the adult world around them.
2223;It is simply one of the best books and movies that has been produced.
2224;This is simply the best of Gregory Peck by far.
2225;A movie that shows a single Dad that doesn't succumb to the norm , yet Quietly instills patience, honor,responsibility, respect for everyone, non.
2226;"To me this is the most beautiful film I have ever seen that dealshead on the great social issue
2227;It has every element of a true classic cinema.
2228;Great performance and a great story that will hold your attention all the way through.
2229;Black and White is a great format for this semi.
2230;Gregory Peck turns in a great performance in a timeless movie about the old south.
2231;Well worth the money to see it.
2232;Glad I found it on Amaz0n!
2233;line movie,and """"To Kill a Mockingbird"""" fits the bill."""
2234;The father figure, Gregory Peck, teaches his children, in very well chosen, thought out, loving words about the ugliness, as well as the beauty that this world can bring.
2235;The characters are real, the children so innocent.
2236;"This movie teaches us that we are all in this game of life together, and that we should learn to ""play fair"", respect and appreciate each other, for our diversities."
2237;God bless us, one and all(thanks Tiny Tim).
2238;This one of the greats and anyone who watches it will be touched.
2239;I will always love this movie and it is just one of the great classics.
2240;Gregory Peck's portrayal of Finch is astounding.
2241;It's a movie I shall watch many times.
2242;Truman Capote's influence is felt everywhere in both the book and film versions of TO KILL A MOCKINGBIRD, Harper Lee's classic, beautifully haunting story of childhood, innocence lost, and of the cruelty that exists in people everywhere.
2243;Yes, Gregory Peck is Atticus Finch, and all of the players here inhabit their roles with grace, humor and gravity, but it is Mary Badham as Scout who steals the show, as it should be.
2244;The simplicity of a father's touch, of a rapist's grimace, of the wind gently blowing through the trees at dusk .
2245;everything in this movie evokes, from Scout's point of view, a time we each have in our lives that transforms us into adults.
2246;but the revelation carries with it a profound joy.
2247;Elmer Bernstein's score realizes each emotional chord of the film, and transports us without ever lambasting us .
2248;it is the best kind of movie score.
2249;You will be hooked from the opening credits, which are creatively brilliant .
2250;those crayons, the haunting and beguiling theme softly begins on the piano .
2251;through to the closing credits, at which point there will be well.
