id;spiegazione
1083;"The bending of rules at the end to protect one such mockingbird is utterly right and is justice
1084;it is to me a nearly perfect film adaptation, capturing the book's mood and spirit and meaning exactly.
1085;Both the book and the movie are very well done.
1086;~This is arguably the finest motion picture ever made about the Vision called America.
1087;It is an idealist recreation of small.
1088;town and rural United States.
1089;It explains the Great Depression, especially in the South, in a way that makes that ~ rendering of her book, its time, place and people.
1090;Fatherhood has never been so splendidly delineated, childhood so perceptively depicted, bigotry so thoroughly ~ see in the superb opening credits, each item being carefully taken from its place in an old cigar box.
1091;And finally, in the closing moments, we connect the title to the basis of this story's morality, much as Atticus Finch tells it to his son, Jem, when presenting him with a small.
1092;~ vision worth living up to, and seeing over and over.
1093;Peck won Best Actor, and Horton Foote best screenplay writer.
1094;The film won the British Oscar .
1095;for best foreign film, and Alan Pakula won BAFTA's award as best director of a foreign film.
1096;I use their media a lot and it was very handy for the convenience of how easy it is easy to access Amazon.
1097;I am mad at apple so this just works out fine.
1098;I enjoyed the movie very much.
1099;The acting was pretty good and it built up the suspense well.
1100;It also was described that the disc was in very good condition, which it was not.
1101;A true masterpiece that should be required reading by ever high school literature department in the Nation.
1102;highly recommended for everyone old enough to understand its message.
1103;I read this book over the summer and it is wonderful!
1104;The movie is a wonderful movie as well and it is one I would recommend to you, whether you have read the book or not!
1105;This is a timeless classic.
1106;The actors in this movie are excellent and it is a great movie to watch any time!
1107;It has always been one of my favorites.
1108;I bought this because I wanted to watch it with my 11 year old daughter.
1109;it opened up some very good dialogue about a lot of things.
1110;This is one of my favorite movies.
1111;Scout has always been my favorite character.
1112;If you haven't seen it, you are missing out on one of the best movies ever made.
1113;I bought this movie on recommendation, never having seen it.
1114;this may be one of the finest films ever made.
1115;This great classic shows Gregory Peck at his best.
1116;Every character in the film is perfectly cast, and this is another case where the book was followed extremely well.
1117;I love to watch this film again and again.
1118;Harper Lee must have been proud when this came out.
1119;Even all these years later both the book and the movie are movie and in their own right: timeless.
1120;The movie and the book are wonderful, a true story and Gregory Peck gives the movie the right touch of being a true father, an honest man, a very good lawyer and peace [fairness to all].
1121;a Must See for all ages to learn about the time when the black people and women had no rights at all.
1122;Gregory Peck has been one of my favorite actors for a long, long time.
1123;I loved he and Brock Peters in this unforgettable classic.
1124;His character is an inspiration to all.
1125;Great writing, a wonderful story and tremendous acting all around.
1126;You can't beat this one and you will enjoy it.
1127;(I suspect, young reader, that you have succeeded far beyond Harper Lee.)
1128;or your life, which is what makes the portrait of Atticus Finch a true profile in courage, a Southern Gothic version of Sir Thomas Moore in """"A Man For All Seasons."""
1129;"To be fair, we should take a glimpse around several essential films in the recent past which depicted with notable crudeness this sensible theme
1130;The allusive metaphors to nocturnal and spectral visions are eloquent testimonies of the tenseness at the verge of the boiling point.
1131;Interviews with actors, writers, and set designers many years after this film was produced are extremely interesting and give added value to a great movie.
1132;It was great to get to watch the movie with him.
1133;The extra bonus features were a great bonus.
1134;It's simply a perfect film on every level.
1135;Deep, funny, literary, charming, haunting, frightening, mysterious, compassionate, graceful, hopeful.
1136;It carries the all the weight of adulthood and all the magic of childhood, and encompasses our darkest demons and our brightest angels.
1137;Although this is Peck's performance of a lifetime .
1138;all the character portrayals are spot on, especially the children.
1139;If this isn't enough, the wonderful music and cinematography make it an over.
1140;I see something new each time I watch it.
1141;A classic right from the start.
1142;This is the great American novel brought to the screen!!
1143;It deserves all the acolades it has received and more!!
1144;This story will truly stir your heart!!
1145;I love classics, Black and White Films and even slow paced Hitchcock films.
1146;wIth all the great reviews (due mainly because its a classic) will have you thinking this must be an amazing black and white film!Well if you expect that, especially with todays fast paced films where the camera cant stand still for seconds on a character, you will find this film unbelievably boring.
1147;This is one of the best book to movie adaptations I have ever seen.
1148;i first saw it as a child and 'Atticus Finch' set the bar so high as to what it meant to truly be a man that I don't think any living person will ever be able to match it.
1149;humility, honor, dignity, truth, integrity, justice, compassion, bravery and love.
1150;every moment of this film is executed with complete integrity and every actor, most remarkably the children, is to be commended.
1151;It is easy to see why so many attorneys will tell you that this film made them take up law.
1152;A proud and fitting legacy from a truly remarkable actor.
1153;This movie is one of my all time favorites.
1154;Now, I have it with me always and close to my heart.
1155;What is interesting is how ahead of its time it was.
1156;Even my daughters who cringe when you ask them to watch something in black and white managed to be captivated.
1157;Love that young Robert Duvall.
1158;The courtroom drama is quite good, but disproportionately emphasized, with the result that the simple charm and poignancy of the childhood narration is lost.
1159;its real acting andyou will watch this over and over again.
1160;this was a great price and arrived very quickly!
1161;Just a good oldie timey story.
1162;Will probably look at it 2.4 times a year.
1163;When I saw the film, I was first impressed on how up to date the production was.
1164;I was, of course, impressed with both the directing and acting.
1165;There is a sensitivity that underscores everything.
1166;Many many reactions are subtle.
1167;The pace is always moving, Camera angles portray strengths and weaknesses.
1168;Warm and insightful it was, and always interesting.
1169;i would recommend this movie to anyone with a hunger for good film.
1170;A simple story well told"
1171;I think it deserves a high rating because of that .
1172;it is simply and quietly a really good story well told.
1173;This is another rendition of an American classic.
1174;She watched it as a teenager, my wife watched it as a teacher and I watched it as a lawyer and, for tonight, at least, a part.
1175;No matter how often you have watched this in the past, you will find something new to admire when you watch it again.
1176;It started with the gift of Harper Lee's magical book, a gift to literature., indeed.
1177;Then came the movie, a gift to cinema that withstands the test of time.
1178;just look at the opening credits, quite possibly one of the most ingenious and modern looking segments in cinema over the last forty years.
1179;It's simplicity absolutely captures the film, while setting the magical mystery on its course, the world of children in a box.
1180;"then move on to Gregory Peck's most moving, strong, amazing performance
1181;His dignity shines through a dignified role.
1182;and then there are the kids, two unknowns, who do their best acting by just being themselves.
1183;Mary Badham is absolutely charming and stunning in her innocent portrayal of a terribly difficult role.
1184;but what shines most is the story.
1185;This movie captures the racial tentions in small town south.
1186;This is one of the best films ever made.
1187;A true classic with a poignant message accompanied by outstanding acting.
1188;we both loved it and she's become a huge Gregory Peck fan!
1189;My grandchildren found it very interesting.
1190;Great cast lead by Gregory Peck as Atticus Finch who won the oscar for best actor.
1191;I have lost count how mant times I have seen this movie but it is for sure the one movie I have seen the most.
1192;Atticus does a wonderful job of showing Tom could not have committed what he is accused of.
1193;A great speech which I feel shows Gregory Peck at his absolute best as an actor.
1194;There are many other outstanding scenes in the movie.
1195;You just got to take the time to watch this if the chance ever arrives.
1196;To Kill A Mockingbird just relies on human emotion and the power of the spoken word.
1197;Give it a chance however and I think you will get caught up in this movie.
1198;Set in a small town with racial divides there is a gem.
1199;a man who lives by conviction coupled by wisdom.
1200;It goes without saying that this movie is very important as a portrayal of how AWFUL bigotry was (and still is), especially in the south.
1201;I knew some pretty detestable white people, and I knew some very kind, loving, smart black people.
1202;The movie was a fine portrayal of how people thought in those days.
1203;A wonderful movie that brought back memories of what it was like.
1204;My family love this old black and white movie.
1205;With many movies, the blu.
1206;ray, was like a whole new experience.
1207;The depth of the tones in black and white, sets it apart from many color movies.
1208;The sound was crisp and clear, plus all the """"extras"""" were really extras worth watching."""
1209;It's totally worth every penny!
1210;got here just in tome for movie night, thanks for the speedy service and actually having a movie still wrapped in plastic.
1211;Better than most contemporary films, the action is developed by the actors and the writer.
1212;Great film with an powerful message.
1213;The camera work and the timing help build the story.
1214;This video has been cleaned up and can be enjoyed by a new generation.
1215;The interviews in the extras add a lot of insight into how major this work was to produce.
1216;It is timeless and will be enjoyed for generations to come.
1217;Wanted to share the classics with my 27 year old Daughter.
1218;This is one of my favorites.
1219;It is one of a few that I'll watch over and again.
1220;This is, in my opinion, my favorite movie.
1221;directing, acting, cinematography, editing and yes, music.
1222;The music is how scores should be.
1223;the children are outstanding (hard to find in a movie).
1224;You really get the sense of viewing this world through the eyes of a child.
1225;the courtroom scene is by far the best ever made.
1226;Gregory Peck's closing argument shows just how perfect he was for the role of Atticus Finch.
1227;It is great to hear two filmmakers actually talk about making films.
1228;"Modern day producers should listen carefully to the late Alan J. Pakula as he explains what a ""real"" producer should do on a film."
1229;"It just seems to hit on every level, from a screenplay artfully edited from the classic Harper Lee novel, to terrific and believable performances by everybody, especially the child actors
1230;A classic, and an essential film.
1231;the 50th anniversary repackaging is terrific .
1232;ray comes with a batch of making.
1233;And the booklet has essays by Peck's wife Veronique, by Harper Lee, and .
1234;this is especially nifty for actors out there .
1235;it's revelatory to watch the scenes in question with the script in front of you.
1236;An essential ressiue of an essential movie.
1237;She was quoting the story as it went along, it was great.
1238;The difference being"
1239;the remastering of this classic in Blu Ray is without a doubt one of the best I have seen.
1240;"it contains a number of extras
1241;town Alabama lawyer and widower father of two, does an outstanding job of acting in To Kill a Mockingbird.
1242;The lesson that he teaches is relived with every challenge that Atticus faces.
1243;The strength Atticus shows us in dealing with the community and retaining the friendship of a wrongfully accused man is tremendous.
1244;I would recommend this movie for families to watch as a family.
1245;There is a strong message that we all can learn from on how to better deal with racial hatred.
1246;I love Gregory Peck, he has always been one of my favorites, but I certainly did not like him in this picture, nor anything about it.
1247;This is probably the best story that has ever been written about courage and commitment in the deep South.
1248;Atticus sets a wonderful example for his children.
1249;This is a fantastic companion to the story, To Kill a Mockingbird the students like having a clear visual to watch after a good read.
1250;This is a fabulous package.
1251;After searching Universal Home Entertainment's website, I found a customer service page.
1252;A gripping story for its time.
1253;This is an excellent movie to watch and discuss later.
1254;In addition, it has funny and light.
1255;hearted moments as well, about being a kid.
1256;Loved the book, and the movie is wonderful as well.
1257;Even though it's been around for years, it is a classic and would suggest anyone of all ages to see.
1258;I teach this book in my special education English class and then we watch the movie.
1259;The movie is well done, follows the important events of the book, and teaches important messages.
1260;To Kill a Mockingbird (Universal Legacy Series)Such a great classic!
1261;It's well written, well acted and of course the debut of the great Robert Duvall.
1262;I love classic movies and books.
1263;This one is worth the price.
1264;Loved this movie growing up.
1265;Highly reccommend this movie to anyone who loves the classics.
1266;One of my favorite movies as a teenager!Now that my son is in high school, it is a required book to read.
1267;a classic to add to our shelves of movies!
1268;Great movie, Gregory Peck at his best.
1269;Great story line, simple yet made interesting.
1270;My mom has the book, and she always tells people that they need to read it.
1271;So when I saw this movie, I thought that it would be perfect for her.
1272;She doesn't like movies that are black and white, or have the old western show look to them, so I didn't know whether she would like this or not, but she absolutely LOVED it!
1273;So It is worth 5 stars.
1274;I'm sure this one is on several film critics top 100 pics.
1275;Gregory Peck is fantastic in it.
1276;Excellent storyline, directing and acting.
1277;The children are also taught to value other's lives no matter their race or social standing in life.
1278;An entertaining piece that leaves a person with something to think about.
1279;Every English teacher can tell you that the film is never as good as the book.
1280;winning performance, wonderful child actors, and a cameo from young Robert Duvall make this film a don't miss.
1281;deserved, for it's a rare movie that stands up to a sensational novel like Harper Lee's To Kill A Mockingbird.
1282;This film is on many critic's Top 100 Movie lists, and it would be on mine.
1283;This disc contains a few extras, all of which are very good.
1284;length documentary are what make this worth spending the money.
1285;the commentary is by director Robert Mulligan and producer Alan J. Pakula, and offers many insights into making the film.
1286;Another minor drawback is that when not offering great information, Pakula and Mulligan are often complimenting each other and all involved on what a great job they did on the film.
1287;Alford and Badham spin great tales about their experiences making the film and appear to have no regrets.
1288;I absolutely was addicted to the movie from the beginning credits.
1289;I now read the book and watch this movie at least once a year.
1290;It is my favorite of all time!
1291;The movie does a pretty good job, in a lot of ways, of presenting a condensed version of the book, but the book is about soooo much more than just the racial issue.
1292;All kinds of themes are worked into the fabric of the book, and I am really glad I finally read it.
1293;watching the movie after reading the book seemed the natural way to go, and I hope anyone watching the movie who hasn't read the book will then read the book, because relatively minor changes do shift the flavor and import of the original work.
1294;Dated, but this still is powerful.
1295;Great application of a powerful story to film for reflection and a powerful impact.
1296;Peck's portrayal of Atticus Finch is one of the greatest cinematic characters of all.
1297;As the title line states: the best motion picture .
1298;The story is compelling and truly haunting.
1299;It brings to life the best and the worst of which society and individuals are capable.
1300;Atticus is an amazing character of courage, integrity and modesty.
1301;His portrayal is so convincing that he is exactly the phenomenal gentleman Harper Lee wrote of.
1302;His conviction to justice and respect for all people is unwavering and the epitome of character we all should possess.
1303;As an adult I have a full appreciation for its perfection and a great admiration for the broad spectrum of life's lessons it brought to the screen.
1304;A must see movie, a must read book.
1305;Be sure to do both.
1306;I especially love the dialogue between the producer and director as they discuss each scene, as you choose them.
1307;The 50th Anniversary edition was such a wonderful surprise!
1308;Not only for the movie itself being one of the all time classiics but the extra bonus features were outstanding!
1309;Seeing cast members recall making the movie, interviews with Gregory Peck, details of the production are such a delight to watch!
1310;It was a very enjoyable long afternoon.
1311;It is a very special event.
1312;Alan Pakula, Robert Mulligan and Horton Foote have made an absolutely terrific movie of one of the greatest books in contemporary fiction.
1313;The three years covered in the book are compressed into one year in the movie, and almost everything of importance is kept in the film version.
1314;The acting is extraordinary across the board.
1315;The children are wonderful, so real that they hardly seem to be acting at all.
1316;Mary Badham is absolutely perfect as Scout.
1317;Phillip Alford is excellent as Jem, and John Megna is fine as Dill.
1318;I especially liked Collin Wilcox as Mayella Ewell"
1319;the three characters who didn't live up to their counterparts in the book were Miss Maudie, Calpurnia, and Tom Robinson.
1320;"Ms. Maudie is a very intriguing character in the novel, a ditzy, wise, funny woman of bedrock integrity
1321;Estelle Evans is a fine actress and deserved a bigger role to give her talent more scope.
1322;speaking movie debut is just right as Boo Radley, and Scout's recognition of her formerly scary neighbor, with her tentative smile followed by 'Hey Boo', is one of the most affecting moments in the picture.
1323;i still remember when Peck won the Oscar for best actor"
1324;The movie 'To Kill A Mockingbird' is a labor of love of bringing a timeless classic to the screen, and Harper Lee must have been very gratified at the results.
1325;I loved it then (I loved the book too) and have remembered it fondly ever since.
1326;It's a classic, what else is there to say.
1327;we are happy with the product, the condition it arrived in and the ordering process.
1328;To Kill a Mockingbird has always been my favorite movie.
1329;This is a terrific movie and it is as effective today as it was when it first came out.
1330;I recommend this movie to anyone who enjoys a beautiful story that has a beautiful meaning along with a wonderful story line and absolutely GREAT acting.
1331;It is rare that a book capture the hearts and minds of those who read it and becom what is considered an American Classic.
1332;gregory Peck gives a wonderful portrail as Atticus Finch, the single father of two children in the Depression Era south.
1333;this is a great movie and a must watch for anyone who wants to watch brilliant acting and brilliant characters.
1334;It has everything: suspense, comedy, drama, and one of the best scripts to be adapted from a fine novel.
1335;Worth seeing over and over again!
1336;Gregory Peck was entirely deserving of the recognition that he got for playing Atticus Finch (including the Oscar for Best Actor), the strongest role in the movie was actually that of Scout (played by Mary Badham).
1337;to Kill a Mockingbird is the film adaptation of Harper Lee's Pulitzer Prize winning novel of the same title.
1338;The story deals with racism and morality in a very humanistic way.
1339;This is a story about race relations as well as community relations and in the end, about doing the right thing.
1340;"Somehow, the stories about the Radley home come together with the trial of Tom Robinson and the moment where Scout gently says, ""hey Boo"" is truly a beautiful moment."
1341;i could probably heap praise on this movie until my fingers can't type anymore, but I am simply going to end by saying this is a movie than anybody who wants to watch a great movie needs to see this.
1342;Both the book and the movie are truly American classics.
1343;What I will say is that the special features are outstanding and give you a glimse into what Gregory Peck was like as a man.
1344;Rare footage, behind the scenes and heart warming stories.
1345;All of this is packaged in a great looking case.
1346;The art of story telling is rare in film today.
1347;But on a rare occasion a timeless film is made that sets the mark of excellence.
1348;filmed in Black and White, although color was available then, the film captures the sleepy town of Macomb where tree lined dirt roads prevail, neighbors know one another and check in on each other, and the only thing a kid has to entertain himself is the endless miles of fields and a vivid imagination.
1349;With just a few exceptions the whole of this novel is kept and is well presented in the film.
1350;But Peck presence is only the glue that holds the film together.
1351;The true triumph of this film is in the casting of Mary Badham and Phillip Alford as the lead characters of Scout and Jem.
1352;this film also marks some early performance of Alice Ghostly and Aunt Stephanie the aunt of Del Harris who is based on the real life childhood of Truman Capote and the screen debut of Robert Duvall as Boo Radley.
1353;this film is a treat.
1354;also a perceptive, study of the relationship between two children and their single.
1355;Peck deservedly won the Oscar for Best Actor.
1356;The children actors were superb, especially the nuanced performance of the little sister tagging along.
1357;tO KILL A MOCKINGBIRD takes the cake!
1358;winning Harper Lee semiautobiographical novel, but if my nephew had written a similarly.
1359;structured script for his Walter screenwriting class at UCLA, it would have been thrown out!First of all, the film is divided in two parts.
1360;Sorry, but this is a film.
1361;The first half concentrates on Scout and really builds up her character.
1362;"It's almost like a thankless role, and yet he is the symbolic ""mockingbird"" of the tale."
1363;don't get me wrong, it is a most well intentioned film and well.
1364;I great movie, and had I not read the book beforehand, I would have liked it alot more.
1365;This movie is worth seeing again and again.
1366;It is a classic that everyone should see.
1367;It is almost as good as the book.
1368;time classic is even better with the Blu.
1369;Strong performances are from everyone.
1370;"If you've never seen ""To Kill a Mockingbird"" this is the time to do so."
1371;If you have seen it before, it's well worth another look.
1372;like appreciation for the attorney's defense.
1373;But every black character even the Finch maid and nanny, Calpurnia, is shown with respect and anonymity.
1374;This is a classic movie.
1375;It is well worth getting it and exploring all the extras.
1376;It's a wonderful, dramatic movie version of Lee's award.
1377;It won three academy awards and was quite daring and innovative for 1962 to talk about rape by a black man of a white teenager.
1378;The story takes place in a small Southern town in 1935, and highlights the relationships of children with the town, and the events are seen through their eyes, and of course, the white town's view of the black people.
1379;A fine review of what some of America's problems were in the past.
1380;It seems appropriate that I watched and reviewed the movie on MLK Day.
1381;My dad had introduced this movie to my sister and I when we were little.
1382;He always knew how to explain things so you could understand.
1383;This was one of Peck's best if not the best movies of his career.
1384;Robert Mulligan's film version of Harper Lee's classic is nothing short of excellent.
1385;It portraits a book in the best possible way.
1386;The story is about siblings Scout and Jem growing up in a small quiet southern town in the 30's with their father, a lawyer and widower called Atticus Finch (Gregory Peck).
