835;This movie sounds like a cheesy love story within an action movie but there is a special chemistry between the two leads and Cameron juggles them all like a professional circus performer.
836;Reece has never known deep emotions of love, and the only women he has ever known are tough soldier types.
837;The chemistry between Biehn and Hamilton is strong and believeable.
838;The action scenes are intense and you always know what's going on.
839;I would highly recommend this film.
840;It set a standard for many other Sci Fi films, as well as gave birth to one of the greatest sequels of all time, Terminator 2, Judgement Day.
841;known franchise that has action and science fiction combined into a blender.
842;The first is a great start in the franchise.
843;He eventually found the right one with Kyle and begins a battle that would continue throughout the rest of the film.
844;The visual effects were so real, the acting was well.
845;done, and the storyline is so convincing you would want to see it.
846;Judgment Day is a possible candidate for best sequel (like Star Wars Episode V: The Empire Strikes Back, The Lord of the Rings: The Return of the King, and The Dark Knight, for example), and best film in the action/science fiction genre.
847;I was born in 1974, so I'm now old enough to remember two entire decades .
848;hopeful, PC 1990s, it's amazing to see how dark, terrfying, and graphic many mainstream 1980s movies were.
849;The Terminator embodies many qualities of such dark movies, and serves as a historical social record for the paranoid, technophobic, cold.
850;it's also an awesome, balls.
851;fi film that pretty much set the standard for action movies.
852;this guy embodies the movie concept .
853;Death, destiny or doom, love, and courage are all themes wrapped into this outstanding movie, which refuses to be dated or made obsolete even in the face of advanced computer CGI that flood movies made these days.
854;action animation in this movie, but it still looks good even 18 years later.
855;It just gets right into the action at the beginning and I love that.
856;Not the best of the trilogy series, but still great.
857;Time travel can be hard to comprehend but that's part of what makes this movie so good.
858;The action is super charged and the Terminator, seemingly unstoppable because he is only a machine, appears human, and is a force to be reckoned with.
859;Sarah has a real hard time believing Reese when he explains to her what is happening but as events continue she realizes what he is telling her is true.
860;while this latest sequel fails on almost every level, the original continues to thrill, delight and fascinate.
861;Linda Hamilton is fantastic and she'll always be known as the original Sarah Connor.
862;the others are equally dynamic but its the brilliant way that director James Cameron keeps his story simple, uncluttered and just delivers a breathless race of hero and heroine trying to escape an unstoppable evil.
863;The musical score by Brad Fiedel adds immensely to the power of the film.
864;The final sequence of Sarah Connor riding off toward a horion filled with storm clouds gives this masterpiece the perfect ending.You sense that she knows the battle she faces and that she'll survive.
865;audiences like me will return to the original to be really entertained and thrilled.
866;at least we'll always have James Cameron, Arnold, Linda and Michael Biehn to keep showing us what a true masterpiece is.
867;The special effects by such great Hollywood masters as Sam Winston (Jurassic Park,Predator,Aliens) delivers a great mechanical muscle man played with great cold qualities by Arnie, who picks up weapon after weapon, vehicle after vehicle.
868;The music by Brad Fiedel has become a great staple for sci.
869;I love this movie to death.
870;Arnold was perfectly cast as a relentless killing machine.
871;Hamilton and Binhen's story really touches me as well.
872;This is the one that started the franchise and still entertains today!
873;The Terminator despite being made off a low budget managed to be a very effective Sci.
874;the Terminator is original and well directed by James Cameron in his first outing directing.
875;In widescreen, absolutely the only way to go, the film looks great and is loaded with some really neat extras.
876;What an excellent premise it is too.
877;The film is best when it is in the cat and mouse mode that Arnold and Biehn are continually engaging in.
878;in addition to a pretty darn good film, we're given two good documentaries.
879;One of those is an informal conversation between Schwarzenegger and Cameron about how the film came to be and some of the things that went on during production.
880;I found it interesting that before the film was made, Director Cameron was literally broke and had to rely on his mother to send him hamburger coupons.
881;The Terminator, while fun, has never really been held up as a great film.
882;But it is most notable for pushing Schwarzenegger into the stratosphere.
883;Still, the crisp, clean sound and video are great, and show how a scene contained a real mixture of the two.
884;Watch it once to enjoy the scenes (or scene snippets), and then watch it with the commentary track and find out why it was not used.
885;This classic looks great on blu ray!
886;This film stays with you and makes you think even while being completely entertaining action.
887;Call me a nostalgic but I loan for the days when action movies were intelligently crafted, fun to watch and even easy to follow, the movies of John McTiernan, Walter Hill, Don Siegel and James Cameron.
888;Even worse is that all these movies are shot with rapid cuts and quick edits, disrupting the visual flow and causing more headache and confusion than pleasure and insight.
889;that's why watching The Terminator for the first time in five years is a breath of fresh air.
890;But through James Cameron's skillful direction, this potential candidate for Z. grade turkey of 1984 was transformed into a stunningly well.
891;For example, in a clever use of exposition, Cameron has Biehn tell Hamilton what is going on in the midst of a car chase.
892;Even though it's 108 minutes, The Terminator finds the perfect balance of great action and human drama, using special effects for the sake of storytelling instead of the other way around.
893;But the movie is also rich with character development, particularly the relationship between Hamilton and Biehn, which forms the emotional core of the movie.
894;Hamilton is excellent as Sarah Connor, who throughout the movie undergoes a transformation from a sweet, confused innocent to a strong.
895;willed female warrior, a recurring theme in James Cameron's work, from Aliens (1986) to Avatar (2009).
896;Biehn is terrific as Reese, whose battles against the machines in the future have drained him of so much pain and feeling.
897;This is Schwarzenegger's best performance, in which he uses his limitations as an actor to make the character come to life and even add doses of black humor.
898;office hit in 1984 and launched the careers of director James Cameron and actor Arnold Schwarzenegger.
899;the Terminator (1984) remains one of the best action movies ever made and a necessary tonic to today's soulless headbangers.
900;ray has made it possible for moviegoers to venture through movie history and make startling discoveries.
901;The Terminator is definitely one of those great discoveries, especially for anyone who loves the medium of movies and action movies in general.
902;Everything's relative and, in 1984, Terminator's special effects were extraordinary.
903;This is the magic of the Terminator: it's a human story.
904;The action, the special effects, the camerawork, the actors.
905;the special effects in Terminator takes a back seat to its human storyline.
906;terminator is James Cameron's best movie.
907;"It has the perfect atmosphere
I:8408;908;The big `70's cars in the Terminator's chase sequences are reminiscent of the big cars in The French Connection's chase sequences.
I:8408;909;Being made in the early 80's, the Special Effects, story and acting are all really good, right up there with The Running Man .
I:8408;910;The terminator is the best as a bad guy, because that makes him such a love.
I:8408;911;The terminator's nonstop chaos causes you to remain focused, and it creates a certain stamina inside of you cheering for the terminator and a special liking for the fact that he is indestructable.
I:8408;912;They set the plot well.
I:8408;913;this film has special effects that makes the battle scenes ten times more wicked, my favorite was when Arnold was on fire in mid air and punched through the windshield.
I:8408;914;, Schwarzenegger is both frightening and funny, even as he brutally destroys anyone who interferes with his mission.
I:8408;915;Hamilton and Biehn handle their roles splendidly too, with credible intensity, fear, and against.
I:8408;916;Full of dazzling special effects and far better than its buffed.
I:8408;917;fueled fun ride into the future.
I:8408;918;The TERMINATOR is a true definition of how movies should be made.
I:8408;919;a big hit of the 80's and even after 22yrs it's still enjoyed by fans worldwide today.
I:8408;920;the movie also has a great cast of stars which includes Linda Hamilton and Micheal Biehn.
I:8408;921;While lacking the superior effects and epic preachy scope of its successors, the original film serves as a taut and gritty introduction to the Terminator mythos of James Cameron.
I:8408;922;There's also the original treatment, and Cameron's artwork.
I:8408;923;A fun movie for thise with apocalyptic leanings.
I:8408;924;It comes with a very quick shipp and delievery, was quite surprised at the efficiency.
I:8408;925;an original Science Fiction/Action thriller that has became a runaway success back in 1984 and is now reguarded as a classic among the genre.
I:8408;926;What makes it a classic is it's original storyline, the infamous """"I'll be Back"""" line, great acting, perfect direction by James Cameron ( which this is his debut film) and Arnold Schwartzenger was just perfect to play the title bad guy in this movie."""
927;There are a few special features on here like deleted scenes, a short behind the scenes thing and then some hilariously dated early 90s interviews with James Cameron and Arnold.
928;The transfer of this film is beautiful.
929;There are 2 well made documentaries but the first thing you will want to check out are the delted scenes.
930;oh, I like T2 well enough on its own terms, but even though it's got much higher production values than this one, it pretty much wrecks the premise on which the series is based.
931;This first one is complete as it stands.
932;"thrillers (admittedly a pretty narrow genre
I:8408;933;known one is _Timecop_, and it's far from consistent).
I:8408;934;there's lots of cool action, too, and even the low.
I:8408;935;budget special effects have held up well against the last twenty years of cinematography.
I:8408;936;it's still one of my favorites, and it's still every bit as watchable as it was twenty years ago.
I:8408;937;But mostly, it's just a great movie.
I:8408;938;Great movie that started something great that is until terminator 3 .
I:8408;939;it's a classic movie story that so many people remember.
I:8408;940;The Terminator is pretty intense, with guns and explosions peppered through the movie.
I:8408;941;this is a memorable film for Sarah Conner actor Linda Hamilton, who would later play the futuristic law enforcer, Robocop.
I:8408;942;And the love story is surprisingly compassionate.
I:8408;943;While we've all seen the masochistic male terrorist with weapons of mass destruction many times before, this is one of the first films in which the heavy.
I:8408;944;michael Biehn also does a splendid job as Kyle Reese, the no.
I:8408;945;of his life in the future are pretty dramatic, portraying a post.
I:8408;946;But """"The Terminator"""" was a great start, with minimalist special effects and hard."""
947;This movie Terminator more popular in the 80's my conutry in the so many people going theater.
948;this is a sci fi gem.
949;it is a master peice amoung movies.
950;it is smart and it has good action.
951;watch it and then watch it again
952;It was a good movie that came out of nowhere.
953;The music score by Brad Fiedel is good and sounds better in the sequel.
954;This film helped boost Schwarzenegger's career.
955;Arnold Schwarzenegger is superb as The Terminator.
956;Paul Winfield and Lance Henriksen are good as police officers.
957;Bess Motta is good as Sarah's friend Ginger.
958;The Terminator(1984) is a classic, action packed, science fiction.
959;Micheal Biehn is great as a rebel soldier sent back in time to protect her.
960;Schwarzenegger is great as a cyborg and this was one of his best films.
961;I love these blu ray book editions, they are filled with info and trivia on the production of the film.
962;The terminator gets this treatment and rightly so, a landmark film in the realm of action, sci.
963;The improved sound of Blu Ray, the crisp video, you can't go wrong.
964;This is the best way to see one of Schwarzenegger's earlier films since the big screen!
965;This movie is just so great!
966;Arnold is amazing and menacing in this film.
967;This is the movie that started the franchise and is honestly just as good as the second Terminator.
968;"The these are great
I:8408;969;5 Stars for originality, story, effects and action!
I:8408;970;this film capitalized on that fear and introduced us all to a new terror .
I:8408;971;the evils of machines rising up against mankind.
I:8408;972;Many other reviewers will relate every detail, but I suggest you watch the movie.
I:8408;973;Film has a dark tone that is compelling.
I:8408;974;Lots of action, weapons, and some Sci.
I:8408;975;The Terminator set the bar for Tech Noir films, and is the best of the series of three (T2 Judgement Day and T3 Rise of the Machines).
I:8408;976;Effects are awesome for the 80's.
I:8408;977;This version (special ed) is worthy of a place in your collection too, although a boxed set may be coming out with all three sometime.
I:8408;978;The first of the series with a memorable bunch of catch phrases and a great bunch of performers.
I:8408;979;The guy who plays the shrink is a riot.
I:8408;980;Arnord's first really good movie and Cameron's firs classic.
I:8408;981;linda Hamilton is a perfect choice for Sarah Conner's shoes.
I:8408;982;at the beginning of the film she is like anyone young woman,who has a job and she likes to have fun with her frieds.
I:8408;983;This film provides something for anyone: kids like to see great action, woman loves to see Sarah and Kyle's romance, man likes car driving situations and elder peolle will enjoy a fine sript.
I:8408;984;Until this day, it is still the best science fiction and action movie I have ever seen.
I:8408;985;Terminator has a very good story, not just blowing up stuff like many of the Hollywood movies these days.
I:8408;986;There are two behind the scenes feature which contain interview with the actors, director, producer and the special effect team.
I:8408;987;With the new television season in full swing I find myself bombarded with a plethora of new shows vying for my attention, few will actually succeed in gaining it in the end"
988;Now that the new season of this show has gone on for a few episodes, I recently found myself wanting to re.
989;watch the original movies that spawned this entertaining weekly sci.
990;ray copies of the Terminator trilogy and had myself a thrilling, action.
991;fiction movies when done well can be extremely entertaining pieces of cinema that on occasion become important facets of our popular culture.
992;That is, until a little known director named James Cameron released a movie starring a former Austrian body builder that would become the first true blockbuster for both men's careers, and cement Arnold Schwarzenegger as a cinematic icon, causing his character to become one of the most quoted and recognizable characters of all time.
993;The concept of having a cybernetic killer come back from the future to end the life of an innocent woman and her as yet unborn child was an intriguing one.
994;"An interesting element within this movie is that the future may not be set in stone, which introduces some really interesting consequences into the story depending on what happens
I:8408;995;It was nice to see that even back in 1984, long before the recent crop of sci.
I:8408;996;fi/superhero films set against a realistic, modern day backdrop, writer/director James Cameron was smart enough to create a fairly realistic world for his characters and his far fetched idea (although it doesn't seem nearly as far fetched with today's technology) to exist within.
I:8408;997;leading the cast for """"The Terminator"""" we have Arnold Schwarzenegger, who found great success as one of Hollywood's new action heroes in films such as, """"Predator"""", """"Commando"""", and """"Total Recall"""", and all of it was due to his star making performance in this movie."""
998;All the while you'll find yourself wondering is this possibly the future of our machines with the way A. i. is becoming more and more advanced these days.
999;the supporting cast led by Linda Hamilton and Michael Biehn was surprisingly solid, providing intriguing characters that were easily accessible, allowing for us to quickly begin rooting for their survival and ultimate success against the onslaught of the Terminator.
1000;"Over the course of this movie we see her character run through a wide range of emotions
I:8408;1001;Linda proved in this movie that she was definitely star material, by creating such a three.
I:8408;1002;Along with Linda, actor Michael Biehn (""""Aliens"""") created a very human, yet at times almost superhuman hero in Sarah's protector, Kyle Reese."""
1003;His devotion to not only his mission, but also to Sarah, was a nice twist to the character, because it made him into a much more realistic hero.
1004;lastly, writer/director James Cameron did an excellent job of creating a visually thrilling science fiction experience with a significantly smaller budget than anything produced in movies or television today, and yet still his visuals hold up better than most from that time.
1005;That is as much to do with the excellent work on behalf of James Cameron and his crew as it is with the talented people working with Stan Winston to create the stunning, yet sometimes frightening images of a future where machines rule over the humans with an iron fist.
1006;"Granted there are moments within the film where it definitely shows its age, and the practical and visual effects definitely look dated
I:8408;1007;overall, """"The Terminator"""" is an excellent science fiction thrill ride that grabs you early on, and only occasionally slows down long enough for you to catch your breath before quickly rushing forward once more."""
1008;With an outstanding story, a surprising cast, and mostly solid visual effects work, this is a movie that kicked off one of the greatest sci.
1009;fi movie series' of all time, and should definitely be on everyone's must see list!
1010;Anyways, this movie is one of the coolest movies that I have seen.
1011;For the year that it was made it has great special effects, better than any other movies of it's time.
1012;I love this movie every part great movie a mustHave in every blu ray collectionI am a huge Arnold fan and he nailed this part down perfect
1013;This movie was definitely a breakthrough movie.
1014;It had a great story, good effects, (for an old movie,)and good acting.
1015;I know that they are planning to make T3 and 4, and I really hope that (if any of you have played it) they refer to the game, and concentrate more on John Connors father, Reese.
1016;I like the new soundtrack which greatly enhances the experience of watching the film.
1017;"THE TERMINATOR has become a classic
I:8408;1018;This is the movie that made the Govenator a star.
I:8408;1019;adventure, THE TERMINATOR stands the test of time and remains a favorite in the hearts of its fans.
I:8408;1020;His performance as the merciless, unstoppable killer is chilling.
I:8408;1021;Linda Hamilton is terrific as Sarah Connor, a young woman who is stronger than she thinks and is able to overcome incalculable odds.
I:8408;1022;The special effects are excellent, especially for 1984, and they still look great today.
I:8408;1023;And I still enjoy it after all these years.
I:8408;1024;it was awsome picture and was the best movie in the 1980s a pure classic on blu.
I:8408;1025;The menu design (at least that of the British version) is very cool.
I:8408;1026;while entering Cyberdine Systems, and suddenly your TV is filled with the endoskeleton of the Terminator, constantly moving, showing its high.
I:8408;1027;scenes/who did the director think of that great story .
I:8408;1028;The movie is great, has ever been, but finally gets the treatment it deserves!
I:8408;1029;order it today, so you'll have it as soon as possible.
I:8408;1030;While this film may be the most violent of the Terminator trilogy it certainly sets the stage for the continuing story of John Conner and the Terminator.
I:8408;1031;The sound is outstanding so if you have your system hooked into a home theater system turn it up and enjoy the show.
I:8408;1032;This movie also propelled Linda Hamilton's (Beauty and the Beast tv series) career as well as Michael Biehn's (Tombstone, The Rock and The Abyss) career.
I:8408;1033;Also a little know actor Bill Paxton (Tombstone,Aliens) This movie is one of the best sci.
I:8408;1034;Not only that, one of the best movie lines ever said and parodied.
I:8408;1035;An unexpected hit for sure.
I:8408;1036;It has a good mix of story and action.
I:8408;1037;This is a fast paced, chilling and violent adventure in which the acting, characters, plot and directing just work very well together.
I:8408;1038;I was at the edge of my set the whole movie, yet I was also amused by some of the subtle humor, symbolism, and little hidden messages that the director through in.
I:8408;1039;Many people, with due right, consider T2 to be a modern classic.
I:8408;1040;disc bonanza is welcomed with open arms.
I:8408;1041;The extras are great (apart from the script drafts .
I:8408;1042;, and the package is nicely designed with a modern metallic take on the T1 poster.
I:8408;1043;There's even a great deleted scene where Michael Biehn gets all emotional about grass!
I:8408;1044;It boosted Arnie's career, and still remains one of his best performances to date.
I:8408;1045;But 5 stars it deserves, and 5 stars it gets.
I:8408;1046;Somewhat outdated, but still great!
I:8408;1047;The effects are kind of cheesy, but are still very fun to watch.
I:8408;1048;ray, with rich detail in the night scenes, good color balance in the few daytime scenes, and a killer soundtrack.
I:8408;1049;The extra clarity and sharpness of Blu.
I:8408;1050;ray make this classic even more enjoyable.
I:8408;1051;the T.101 gets terminated in the end, right under a hydraulic press.
I:8408;1052;Arnold Schwarzenegger is perfectly cast as the cold.
I:8408;1053;Though the FX weren't exactly innovative even in 1984, they're good enough to make the futuristic sets and high.
I:8408;1054;octane action scenes more than believable.
I:8408;1055;Cameron and co. scripter/producer Gale Anne Hurd created a story around a skeleton of realistic characters and some clever twists on the traditional time travel plot, which Cameron himself then molded into a masterpiece of cinematic suspense.
I:8408;1056;be of mankind's eventual savior and her protector"
1057;The French language edition of this cult classic.You know the movie, here it is in French.
1058;it is amusing to listen to Arnold speaking in the language of love, killing machine that he is.
1059;"have"" and I bought it."
1060;"famous line, ""I'll be back"" (which is actually a surprisingly less."
1061;and it established Arnold as a serious force to be reckoned with.
1062;And I'll be honest .
1063;The Terminator is a movie from The Good Old Days of action films .
1064;The best of the terminator movies you bet!!
1065;I have always liked this one the best Arnold is great as the terminator!
1066;James Cameron showed the world his modus operandi for the first time in this spectacular sci fi action.
1067;the action is thrilling, heart.
1068;Director Cameron, (Let's forgive him for Piranha 2) here shows what he can do when it comes to action, and boy, does he do it well!
1069;This is truly one of the most explosive, thrilling and amazing sci fi action films ever made.
1070;shredding pace of the film, production info and more.
1071;Classic movie which is very enjoyable.
1072;another note, terminator 3 is in production.
1073;"With its dark vision, extraordinarily well laid out plot and ""Arny"" starring as the bad guy, this film was destined to succeed."
1074;Not only was there an outstanding script, written and directed by James Cameron, but those starring in the film made it the success that it is and only to be matched by its sequel.
1075;the Terminator is James Cameron's first film and arguably the best film of his career.
1076;"While ""Conan the Barbarian"" put Arnold Schwarzenegger on the map, The Terminator put him in the dead center of the map and launched him on a streak of highly successful action movies."
1077;It was extremely interesting to watch a couple of the Special Features and find out that James Cameron and crew were basically putting this outstanding sci.
1078;Michael Biehn's performance as the sacrificial hero of the film is perfect!
1079;Along with the outstanding leading cast, look at the secondary characters, to name just a couple, Lance Henriksen and Paul Winfield.
1080;Even one of James Cameron's favorites, Bill Paxton has a small role in this extraordinary film.
