1;it is a bit much for the squaemish.
2;arnold gives one of his best performances even though he doesnt say much.
3;the important message is:do not trust machines!this movie is intense!this is arnolds third best movie.
4;I'm all for the extra features and superior sound.
5;What it does have is an excellent sci.
6;Even if they do release a Special Edtion with all the goodies, its nice to have the old edition, in its original splendor (if you can find it).
7;Shot on a tight schedule with an even tighter budget The Terminator shows what James Cameron can do with a story.
8;No need to go into detail on the plot but this movie saved Arnold Schwarzenegger's career and he was excellent in the title role.
9;Great movie, pretty impressive FX for it's time.
10;But I look at it now, and I can tell how old it is.
11;Terminator 2 is alot better than this one, and the special effects look clean even 12 years later.
12;Still, its a must see for all Terminator fans.
13;This is one of the best movies ever, and is certainly Arnold's best.
14;Linda H. is much better in this movie than in T2.
15;The Terminator is a great piece of Sci.
16;fi, and provides great action sequences, but it's not the star.
17;Next thing she knows she's attacked and then in the middle of a shoot out.
18;He was a legend, a savior, a leader.
19;Throughout the night she hears more about John and the legend she herself will become.
20;She starts using Reese's first name, Kyle, after he gives her a message from John.
21;Next thing Sarah knows it had hijacked a gasoline truck, and is coming to run her over.
22;Splitting up Sarah runs, while Kyle manages to plant an explosive on the truck.
23;Kyle activates as many machines as possible, to make tracking them harder.
24;Finally touching the strength inside her, Sarah re.
25;Sarah catches a piece in her leg, and Kyle is killed.
26;Her speech patterns, her facial expression, the look in her eyes, and her entire entire body language shifts.
27;Taking on the form that Kyle, and the Resistance used.
28;I love the entire science fiction concept of time travel and destiny, but also how we as human beings have choices and can shape our futures depending upon the ones we make.
29;This movie nails all of these on so many levels.
30;This movie is the perfect blend of classic sci.
31;Now I realize that this has a lot to do with the way the movie was done and the age, (it was done in 1984) but at night especially, you can see the fuzzy specs in the background.
32;Get it and be happy.
33;When this first came out, I loved it.
34;see because it sets the stage for the remainder of the trilogy.
35;The movie is a great classic.
36;"character, so is James Cameron's breakthrough film, ""The Terminator."""
37;Securing its status as a sci.
38;fi classic almost immediately upon impact, it made a star out of a certain Austrian bodybuilder, introduced Hollywood to one of the finest blockbuster directors of our time and forever changed the landscape of both the science fiction and action genres.
39;the film opens with a muscle.
40;paced and well oiled it really is.
41;Sure, there are action scenes galore and you can bet it'll keep you on the edge of your seat.
42;Crucial to the film's success though are moments where the film breathes, letting in moments of social commentary and humor like fresh air at all the right moments.
43;To be sure, the Terminator's pursuit of Kyle and Sarah is made all the more intense because you believe in them and are placed amidst the chaos via your own investment in the characters.
44;while Schwarzenegger is absolutely unforgettable as the unstoppable killing machine, the film is certainly helped a great deal by Biehn's intensity and commitment to material that may have sounded ridiculous on paper.
45;Shame her career never really extended beyond this film and its sequel, as she really embodies a character you want to root for.
46;Keeping true to such a theme, the film is intense from front to back.
47;while there are certainly things that date the film .
48;it has held up remarkably well over the years.
49;At close to 30 years of age, there are few films that have come along in its wake that can even compare.
50;"Truly a bonafide classic, ""The Terminator"" stands in a class by its own."
51;The Terminator is a classic!
52;And it was a great price as well.
53;She got ripped for 2!
54;Although a bit dated, it still holds up.
55;This is an excellent movie.
56;It has a terrific plot and excellent effects for it's time and money.
57;one of the best sci.
58;The Terminator is the first installment of one of the best Sci.
59;fi franchises, but this movie not only is one of the best Sci.
60;fi movies that you can find, it's also one of the best action movies as well.
61;The story in this movie is so clever that it doesn't matter if some of the visual effects look outdated today, or if some music tracks sound kinda silly, because the plot of this movie must be the most intelligent story about machines.
62;the main characters have a lot of depth, specially when we are talking about robots.
63;Arnold Schwarzenegger is just perfect for the role of a killer cyborg that travels from the future whose mission is to kill Sarah Connor, the woman that eventually will give birth to John Connor, the leader of the humanity in an apocalyptic future.
64;michael Biehn is also great as Kyle Reese, a warrior that travels from the future to protect Sarah from Arnie.
65;James Cameron also built a strong reputation with this film, Cameron is one of the best directors in the Sci.
66;fi or action genres, also he knows a lot of stuff about technical aspects like visual effects and action sequences.
67;The Terminator is one of the best Sci.
68;By far the best sci.
69;fi movie of the 80's if not the best ever.
70;Oh well, maybe in terminator four right?
71;A must see and a must own.
72;It not only showed that Ahhnold could handle a more challenging role than Conan the Barbarian, but that he was quite capable of taking career risks.
73;The pace of the movie is, like the villain, full of purpose and relentless.
74;Brad Fiedel's effective musical score, Stan Winston's amazing make.
75;up effects, and Cameron's directing helped make The Terminator a classic of the action/science fiction genre.
76;definition transfer widescreen version with both its original mono sound track and a new 5.1 Stereo Remix.
77;The extra features (such as deleted scenes, making.
78;Based on that it appears they have done a good job.
79;This is such a wonderful movie I can't even begin to describe it!
80;"The fights are absolutely superb(few are more intense)there is lots of funny stuff, such as the quotes ""Yar clothes."
81;There is love and fear in this movie, as well, and Ah.
82;nold does a wonderful job.
83;I especially liked the last fight, where we see the Terminator's real form.
84;All laid out, this is one of the best movies I have ever seen and if you like intense fighting and iron determination, this movie is for you.
85;It is a fantastic science fiction thriller that not only keeps you on the edge of your seat but also gives you food for thought of the possibilities of the plot line really happening.
86;The special effects only add more to the impact of this film as well as the superb acting abilities of those not only in major roles but also in minor roles.
87;My favorite trio of fast action and sci fi movies are Terminator and its sequals.
88;They are fun to watch.
89;This is a great classic that is a staple in many personal movie collections.
90;The action and suspense scenes are great.
91;The most improvement is in the on.
92;"ray is not just ""nice."
93;The SUPERCLEAN video is the best I have seen.
94;definition transfer, well I GUESS SO!
95;And the added 5.1 audio is a nice bonus.
96;and definitely close enough to make it sound great.
97;The effects are definitely dated, but the concept is still solid.
98;I had a college class in which one of my professors made us watch this flick so he could explain that it's actually an allegory for the abortion debate.
99;I don't know if I'm willing to credit James Cameron with such a sophisticated agenda, but it does make one view the film in a new and interesting way.
100;The whole family really enjoys this movie.
101;I recommend this to anyone
102;The Good Things*Good amount of action and special effects.
103;There's not as much as the sequels, but there is enough to make it edgy and exciting.
104;The scenes of the future war are stark and frightening.
105;It's very fresh, original, and memorable.
106;It's very simple but also very original.
107;this is still one of the most quintessential sci.
108;Its simple premise is executed effectively, leaving lots of room for strong characters, gripping action, and some good emotional moments.
109;filmed, and contains some good special effects for its time.
110;Still, it really is one of the best.
111;This is one of the greatest movies i have ever seen, it is almost as good as the second one.
112;this fast paced time travel thriller is definetly worth purchasing.
113;Almost eveything is great about it, the action, the story line, the suspense, and even the roar of kyle's pump shotgun is nicely done.
114;I just received this blu.
115;"There is still a small amount of ""dust or dirt"" and a few small scratches but this film is still in excellent condition in my opinion."
116;"keep in mind this film was low budget, the film medium used was ""rough grain"" and that NO high."
117;def transfer will ever yield a sharp and crystal clear image.
118;"A perfect example: The new Battlestar Galactica series was purposefully shot ""grainy"" and it will never look crystal clear in a high."
119;This movie was a favorite from my past and re.
120;watching it with my kids was fun.
121;The beginnig of one of the best franchies of all time, arnold at his almost best.
122;`The Terminator' is one of those cult films that every `guy' in America, and quite possibly all over the world, has seen and has loved.
123;the film takes place in the present (well, the 80's) but the real story is what happen in the future, the year 2029 to be exact.
124;this brings me to my point mentioned in my title.
125;Is this really a classic?
126;`The Matrix' for example is much smarter, much sleeker and constructed much better.
127;The synth music is great I think, it gives it the whole robot 80s feeling that the 2nd movie couldn't make with the stupid strings and steel clank noises.
128;Anyways, this movie is classic and it doesn't make me scared anymore because 1997 has already passed and that's when the war was supposed to happen.
129;All in all a great flick
130;with that cryptic message, the heart.
131;"pounding music begins and one of the most awesome opening title sequences starts and ""The Terminator"" is underway."
132;Few movies have the audacity and confidence in their audience to reveal their plots as gradually as The Terminator.
133;It's a movie that's got it all: action, horror, a love story, and, above all, old school science fiction.
134;"in the rare event that you know little or nothing about ""The Terminator"" franchise, this movie is much more enjoyable if you don't know the plot of the movie before you see it."
135;This movie is worth the price so don't read any more reviews after this one.
136;For such a low budget, this movie is very well done.
137;The story is very well.
138;written, the actors are great, especially Arnold, and for the money they had, the special effects aren't too shabby.
139;In fact, this movie was so well.
140;This is a classic sci.
141;Oh, speaking of classic, look for all of the old 80's fashions, just for fun.
142;This is anolds fisrt big role and james fisrt big movie and great.
143;this one of fist films and just like his later films its just as good.
144;and see the seuel which is just as good.
145;All I can say about Terminator is that it has class!
146;I'm not really a Science Fiction movie fan, but this movie was amazing!
147;He is the 'good guy' of the movie (not to mention cute!)
148;He is a person from the future and has come to help Sarah.
149;A very thrilling, yet touching movie.
150;One of the best classic movies to exist
151;art 5.1 stereo remix and also a fantastic hi.
152;But I just have to say that this was a job well done.
153;Love those old Schwarzenegger movies.
154;This movie is an absolute classic.
155;It was fun watching this one.
156;Arnold's being himself, acting wise, the machine part was the best.
157;Michael Biehn and Linda Hamilton did great performances, a classic.
158;It is now accepted that The Terminator , the predecessor of Terminator 2: Judgment Day, is a classic science fiction film.
159;I am happy to lavish praise on both movies.
160;Consider though that T1 had a production budget of less than one fifth of T2 and you may start to get a feel for what an outstanding job was done on it.
161;When you get down to it, that is the essence of the film and also the source of the suspense and empathy we feel for that character.
162;Everyone else has said it so I may as well.
163;Schwartzenegger was perfectly cast in the role of an emotionless machine of destruction.
164;Played by Michael Biehn, Kyle Reese is determined to save the woman that he loves.
165;In my opinion, it is Biehn that shines in this picture.
166;terminator was a fast paced film with a relentless series of suspenseful chases and terrifying action sequences.
167;I could not at the time imagine a film that could be as gripping, that is until I saw Judgment Day, otherwise known as T2.
168;The special effects in T2 were ground braking and the attention to detail was flawless in every part of the movie.
169;sets, which get distorted, as he passes them.
170;while you normally watch a sequel with an appreciation of where it came from, in this case, you watch the original with an appreciation of what it led to: the film that many praise as one of the greatest sequels in cinematic history.
171;In fact, it's a lot of fun.
172;all adequate performances, and most of all, terrific action sequences.
173;motion animation, a technique that had by this time lost its appeal), is not a great movie, just a pretty good one.
174;It has everything: story (true love, drama, and an unstoppable bulletproof cyborg with a hyperalloy combat chasis), great acting, stunts, and some funked out '80s music.
175;I love the terminator movies, and even though this one is kinda bad with the specail effects, its awsome.
176;The Terminator is considered one of the greatest action movies of all time.
177;THE MOVIE: 5/5Terminator (or The Terminator, if you prefer) is and always will be an excellent movie.
178;It expertly combines the two genres of science fiction and action.
179;After this, he made classic movies such as Aliens, The Abyss, Terminator 2, and of course, Titanic.
180;Terminator truly is a modern classic.
181;fi B. movie) It's definitely a nostalgic experience in sound.
182;Still, it was a great video improvement.
183;It added new sound effects and made the dialogue sound normal.
184;To top it all off, I found that the Blu.
185;ray as it looks modern and sounds technically better.
186;Part thriller, part romance, part time travel paradox, The Terminator was a blast when it first came out and is just as much fun to watch now.
187;an 18 minute retrospective with James Cameron (JC) and Arnold Schwarzenegger, and the new one.
188;There is a lot to see here and it is all interesting.
189;There are some fascinating revelations here .
190;I just receive my copy and what a surprise !
191;Viewed: 11/03, 6/07, 6/12Rate: 106/07: The Terminator is so good that it is an absolutely devastating picture.
192;The bodybuilding work in the former days has served Arnold extremely well because he was born to be ready to play the Terminator.
193;His Terminator is a magnificent villain.
194;There are many great scenes in The Terminator, and even the ones when the Terminator goes in a slow.
195;He totally set the tone of the picture by heightening the realism along with the stark tone in how he described the Terminator and the future.
196;He really created The Terminator the film by his attitude, and Arnold Schwarzenegger did the rest of the work.
197;His performance as the Terminator is 100% pure Oscar work.
198;Meanwhile, we can thank Stan Winston and his staff for their excellent special effects work.
199;Yes, The Terminator is one of the greatest and most influential films ever made.
200;A haunting, devastating, and thrilling picture.6/12: This is the film that made Arnold Schwarzenegger a household name, and he will continue to be one forever.
201;Also, it's just may as well be so that all of the three end up in a factory that happens to be unlocked for them, and it seems perfectly capable of dealing with the Terminator.
202;"Reese summed up the film succinctly well and what it means to face the Terminator, ""Listen, and understand."
203;All in all, despite the logic flaws, The Terminator is filled with classic scenes and will always be regarded as a masterpiece.
204;The Terminator is, by most accounts, one of the true sci.
205;fi classics of all time.
206;Even going by dated 1984 effects, this is the true affecionado's movie, whether you like action movies or sci.
207;Even though you know how the story will eventually end (there are no real plot twists), the action will keep you gripping at the edge of your seat from the very beginning to the very end.
208;this is a classic movie that belongs in every movie fan's collection.
209;fold, because not only do I think 1984's THE TERMINATOR (T1) is the best and undisputed of all the Terminator movies, I also think it's the best and undisputed of James Cameron's films!
210;It has fantastic effects, but ZERO character development or story!
211;Cameron got it right with T1.
212;t1 is an superb amalgamation of several genres working in perfect synergy: science fiction, horror, action, love story, AND speculation!
213;arnold Schwarzenegger's performance is a wonder to behold to this day!
214;Both Michael Biehn (as futuristic rebel soldier Kyle Reese) and Linda Hamilton (as Sarah Connor future mother of resistance leader John Connor) deliver knockout performances as well.
215;"The actors really ""sell"" the movie and lift it to a higher level than lesser or miscast actors would have."
216;t1's main draw is it's claustropobic, unsettling, atmospheric, noirish tone and feel throughout, thanks in large part to the memorable beating, bouncing score that accompanies the Terminator whenever he shows up.
217;I think it is due to the condition of the original master.
218;There is much grain throughout.
219;The rest of the audio is top notch.
220;Probably the best this film has ever sounded.
221;All in all, it is a modest transfer.
222;This futur is fort probable and very easily conceivable !
223;An sure the terminator who's describe in this movie will be !
224;Honesty, this is my favorite movie of all time.
225;I've seen it at least 20 times and every time I see it I pick something else that makes me realize how truly great it is.
226;my favorite part is when Kyle descibes a picture he had of Sara and then confesses his love for her.
227;What I would give to take her place!I could go on and on forever about this, but I'll end here by saying that both this and sequel are excellent, but this one is better.
228;The Terminator is likely one of the most widely screened movies of the last twenty years.
229;"In many ways its effects on popular consciousness have been notable, and it also made a major star of Arnold Schwarzenegger, who up to that point had appeared only in supporting roles in minor films like ""Stay Hungry"" with Jeff Bridges and ""The Villain"" with an aging Kirk Douglas."
230;wrenching action, and the viewer is assaulted by both sights and data that intrigue and astound him or her, for this is science fiction very well done, a story that has meat and bones over its substantial interior, and like the cyborg that Arnold plays, is ready to slay you into submission.
231;This is a classic thriller, folks, one that has already spawned another hit movie (T.2), and rumor now has it that Schwarzenegger and company have T.3 ready to begin production soon.
232;Just grab this, some popcorn, and a box of Jujifruits.
233;Which makes this casting of Arnold as the terminator, a robot with a human flesh covering, perfect.
234;the Terminator is a classic action film but it does have a sub.
235;Terminator is a classic sci.
236;ray version does the best it can with the very old special effects.
237;Special feature about creating some of those effects was interesting.
238;James Cameron's The Terminator is not only one of the best actionmovies ever made, it is also among the most influential sci.
239;Even films like last year's The Matrix were at least inspired by the man vs. machine.
240;from the beginning to the end, this film is packed with incredible action scenes.
241;It is especially wonderful that the action is not just there for its own sake.
242;The fine screenplay motivates everything that happens onscreen.
243;The film never lets up for one moment.
244;It also put director James Cameron on the map.
245;I can say with confidence that I dislike Arnold Schwarzenegger as an actor.
246;His movies were once really exciting and adrenaline.
247;Michael sure has his work cut out for him as far as convincing Sarah he's actually the good guy!
248;This makes a compelling storyline.
249;Back in the day this was considered an enormous deal and a total surprise to everyone.
250;and watching them move around is comparable to watching a movie within a movie.
251;It has to due with my love of science fiction when executed a certain way.
252;The Terminator succeeds on both counts.
253;This is a *wonderful* way to enable my heart to pump with unbelievable nonstop excitement.
254;It's just really freaking freaky!Overall, a highly recommended film.
255;Does it hold up well?
256;A young girl running for her life presents a ton of suspense.
257;This is how a good action/science fiction should be in my opinion.
258;One of The best movies ever.
259;Also, one of Arnolds best perfomences.
260;The Terminator series is classic entertainment.
261;ray transfer is very good.
262;The picture is good and the sound even better.
