1081;Jumping forward a bit, the Terminator has made his move and Reese has stepped in to try and save Sara.
1082;i highly recommend this outstanding science fiction classic to all who haven't seen it yet, for it is truly one of the best films in the history of the genre and well worth repeated viewings.
1083;The movie is good, I have all three terminator movies now, all three are really good, I just felt like getting all three terminator movies
1084;Great movie that started it all.
1085;the terminator was and still is one I my favorite movies of Arnold's expertise of all time.
1086;I remember seeing this movie when I was about 8,and this movie instantly got me hooked on Arnold's acting because the only movie of his tht I have seen before this is jingle all the way which was poodoo.
1087;it is very intense thrilling movie with sharp turns and great plot.
1088;if you like 80's action,or are an arnold freak.
1089;this classic will give you you're money's worth!
1090;The Terminator is one of the most important films of our time.
1091;James Cameron is a genius.
1092;tech special effects in the first Terminator compared to the wizardry we have today, you have to realize this is an all time great!
1093;James gives us a gutsy female heroine (Linda Hamilton as Sarah Connor) long before they became popular.
1094;The always underrated Michael Biehn as Kyle Reese is as superb as he is darling and appealing.
1095;And wonderful Arnold Schwarzenegger is perfect as the single minded killing machine.
1096;Arnold and James make wonderful movies together.
1097;he takes direction very well and can physically and emotionally do exactly as the director envisions.
1098;Arnold is just great and just keeps getting better.
1099;When I first saw this film, I told friends I thought that was funny when Arnold said ''I'll be back.''
1100;It is a truly captivating line.
1101;That line became Arnold's most famous ''catch phrase''!
1102;Yes, this movie is A#1 in my book.
1103;exciting, frightening, riveting, romantic and unforgettable.
1104;This one is the best of them all.
1105;"also Recommended: Alien
I:8408;1106;You know, like Casablanca, the first Star Wars, Blair Witch and Funny Cide (the horse).
I:8408;1107;even judged by today's standards, when CGI and over the top special effects are run of the mill stuff, this 1984 film holds up very well.
I:8408;1108;The piercing, red robot eye that Arnold's Terminator reveals behind his human flesh exterior is haunting, revolting and amazing, all at the same time.
I:8408;1109;The final confrontation scene, when the Terminator has been reduced to his naked, mechanical skeleton, is also extremely well done for the time, and again, those Satanic red eyes add to the suspense and uneasiness that the viewing audience feels as they watch this machine relentlessly pursue Sarah Connor.
I:8408;1110;And, the famous """"I'll be back"""" line that leads to an incredible police station shootout is as great as ever."""
1111;Overall, it was a very satisfying experience both video and audio wise.
1112;this is the first film in a great action series, and I highly recommend it.
1113;It'll be a classic, for sure.
1114;This is Arnold Schwarzenegger's best film yet.
1115;Great acting by the entire cast.
1116;Arnold makes a perfect villion.
1117;This is the best of the three films.
1118;Great film, good for anyone.
1119;There was a lot of creativity and thought put into Terminator II, but this one has the better story.
1120;The Terminator now acknowledges the work of Harlan Ellison, whose teleplays of Solider and Demon With a Glass Hand on Outer Limits are clearly antecedents for this tale, but in many ways Cameron's movie is a high.
1121;Keep in mind that his previous directorial effort was Piranha Part Two: The Spawning, and from this film he moved on to Aliens.
1122;Furthermore, it turns out the stakes are a whole lot higher than that as well.
1123;fiction fans who enjoy a good time travel paradox narrative, whatever the problems in logic and physics.
1124;In fact, that is true of the entire trilogy, which has ended the series without every providing a moment when the lead character and the rest of us can believe that things are going to be okay.
1125;even though the end scene is really crappy looking (i mean it was stop motion) it was a great 80's movie.
1126;the special edition looks really cool with the new scenes and the new 5.1 sound.
1127;i just hope they fully restored the picture also.
1128;Hope this review helps everyone.
1129;Disc arrived on time and in perfect condition.
1130;The movie looks and sounds great and i have no complaints at all.
1131;Got it at a fair price and would definitely recommend to any and all Terminator fans.
1132;Yes, the hero of the story speaks of how in the near distant future a nuclear war happens and wipes everything that is seen today out for good.
1133;She had finally learned to have the guts and courage Reese had spoken to her of.
1134;Arnold usually is a good guy.
1135;About Arnold as a robot and has a lot of guns.
1136;This was absolutly one of the best movies Arnold did.
1137;I'm sure I'll watch it again.
1138;the plot is simple, actually too simple for me.
1139;first, you have to remember that in 1984 when this first came out, the whole gritty future.
1140;That transformation is just amazing.
1141;there are just so many touches in the movie that show the care that James Cameron put into the film, making it truly the 'baby' of him, Arnold and Linda.
1142;linda Hamilton in this was always a huge role model to me and many of my friends.
1143;But she saw what had to be done, and she gathered her strength and did it.
1144;a great movie in its own right, and a must.
1145;see for anyone interested in T3!
1146;I think most of the shootouts was good.
1147;I think most of film look sharp and detailed.
1148;I like that the colours looked good.
1149;I think all those explosions sounded good with clear deep bass.
1150;All the shoouts in the present time sounded good in my opinion.
1151;Apart from those 3 mentioned things, i think it sounds very good.
1152;As i said earlier, the subwoofer channel is used a lot to good effect.
1153;I really liked that the rear speakers was used a lot.
1154;I was on the edge of my seat, biting my nails, and forgot to finish the wonderfully greasy popcorn I was so involved in fast paced action and how it was going to end.
1155;ray transfer helps and it is still a wonderful sci.
1156;A good thriller type of film to watch on the TV or Theatre.
1157;The effects were very cool at the time and the robot and mechanical effects were pretty impressive.
1158;but this one had a simple story and motivated the characters to really move.
1159;linda Hamilton and Michael Bein were great together and the action very intense.
1160;With the obvious exception of special effects, The Terminator is far superior to the sequel in every way, and remains James Cameron's masterpiece.
1161;The writing, direction, and acting are all outstanding, with a sense of style being maintained throughout the entire experience.
1162;The action sequences are truly brilliant with slow motion, foreboding music, and razor sharp editing all combining to create an original and brutal benchmark for both action and science fiction films!
1163;I thought you could only get better with time!
1164;There is some action with good shooting and the Infrared gun is used a lot by the Terminator.
1165;This is a great movie so watch it.
1166;The Terminator is thrilling, edge.
1167;This is expanded upon in T2 but the original appeals to me more because the viewer has to do the thinking.
1168;The colours are rich and warm, considering much of the movie is at night.
1169;The Terminator is a violent and chilling action film with spirit and humanity.
1170;I thought that this movie was perhaps one of the best movies of the eighties.
1171;Arnold is great in this movie, and so is Linda Hamilton and Michael Biehn.
1172;It has a great storyline and a very intricate plot.
1173;He is too smart for that I think.
1174;"In spite of its low budget and sometimes cheesy visual effects, ""The Terminator"" is definitely a spectacular sci."
1175;It has a lot of action in it.
1176;The story and the idea are amazing.
1177;This movie is kind of like matrix.
1178;A wonderful modern version of the oldest of all tales.
1179;tERMINATOR is a movie purely incredible in many ways, but the two best things in it are first the successful modern retelling of THE tale mentioned in the title, (a tale which appears at least once in all human cultures since the dawn of time) and then the unique and powerful love story.
1180;This Dragon is a powerful and cunning monster .
1181;Few of those who will cross his path will live to tell the tale .
1182;and even those lucky few will be marked by its passage for ever, in their chair and in their mind.
1183;The Princess name is Sarah Connor and she bears a strong resemblance to young Linda Hamilton.
1184;She is absolutely not aware of her importance and being born in a very average family, she lives a rather banal life of hard labor and simple pleasures.
1185;but in fact she is the most important woman in human history since Virgin Mary!
1186;And if the Dragon finds her and kills her, all humanity will perish with her!Lucky for her and the whole humanity, the Dragon has been tracked and followed by the Knight (the Prince, the Paladin, the Hero, the Warrior, the Monster.
1187;slayer, the Great Hunter, etc.) who swore to save the Princess (and therefore the whole humankind) no matter what the price, without any regard for his own safety.
1188;And surprisingly TERMINATOR, when one looks carefully, is in fact a story about an incredible love.
1189;And it may well be, that by this love the whole humanity will be saved .
1190;There is the excellent camera work, great music and an incredible atmosphere of a great city (Los Angeles) at night with its game of lights and shadows .
1191;all of which is the trade mark of great James Cameron, who signed here his first masterpiece.
1192;There are excellent second roles of Paul Winfield, Lance Henriksen and Earl Boen.
1193;There are action scenes which still are impressive 28 years later and which did not age at all.
1194;i can not find any more words which could praise this movie enough, so I will stop here, inviting you with all my heart to discover this immortal tale, in which the Dragon, the Princess and the Knight will meet their respective fates.
1195;but in the same time they will also all win (as it is explained with more detail in the less magnificent, but still very honest sequel).
1196;James Cameron made much more than just a action Picture The Terminator is a brillent film with a very good story.
1197;I liked this movie and its one of my favorite's there is not much more I can say except that its a good movie and I loved it.
1198;This is a great sci.
1199;fi and a brillent movie thanks to James Cameron.
1200;did these scenes lol)but overall good job on special effects.
1201;but anyways great film/an instant classic!i hope the new terminator flik is as good as 1&2.
1202;but a nice addition to your B. ray collection.
1203;in spite of the early CGI limitations it's the story that carries the viewer to a world imagined having taken the wrong path.
1204;The movie is a little bit dark but nevertheless very entertaining and after the sequel I would like to see it's prequel for a change.
1205;I hear the rumours of a Terminator III, but the first one remains the best.
1206;released with a new score.
1207;THe action is classic, the story is first rate, and the new sound IS GREAT!!!!!!
1208;It's much better than the old sound it used to have.
1209;This updated version of the classic Terminator movie is by far the best this movie's ever been.
1210;The sound must be heard to be believed, with the remixed 5.1 digital making good use of all surround sound channels.
1211;I brought this movie 'cause.
1212;Anyone who has yet to see this or the franchise, well you have to start here, but remember this movie is going on 30 years old, so the effects aren't as they are now, but the movie was great for its time and the story still holds up!
1213;A good action/SciFi movie for its time.
1214;The Terminator stands as one of the truly great movies ever made in my books.
1215;Like many people, I maintain a fluid list of favorite movies in my head, however, the top three spots have never changed.
1216;James Cameron's opus will always be Aliens, but the Terminator is his second best work and his directorial debut.
1217;This film is exquisite start to finish and a masterpiece of contrasting imagery that spans forty years between the stark, rain swept night time streets of `present day' Los Angeles in 1984, and a dark, foreboding future where mankind clings to life in a terrific struggle against the machines.
1218;Silvery aerial and tracked hunter.
1219;It is implied that the humans capture the facility, are able to send a protector to look after her, and make it possible for John to be born.
1220;part of what makes this movie so perfect is the lead heroine.
1221;Nowadays strong female characters, the Mara Jade types, are usually confrontation, arrogant, and mean.
1222;Sarah Conner, like Aliens' Ellen Ripley, is a wonderful mix of very attractive qualities.
1223;She is thoughtful, intelligent, and possessing of an inner strength that even she doesn't believe she has within her.
1224;But at the same time she is depicted as lonely, which leads to a great sense of isolation when she realizes that she is next on the killer's list.
1225;The dynamic between Hamilton and Biehn is electric.
1226;There is real passion there, because in many ways they are the same person, just reversed.
1227;Kyle is a warrior, with a sensitive caring soul held just beneath the surface that Sarah brings to the surface.
1228;It's an epochal event as the Terminator finally comes face to face with her.
1229;visually, the film is first rate.
1230;skeletons are some of the finest moments in Science Fiction film making.
1231;everything, the rear projected, stop motion animated Terminator effects are still very good, standing up well in the light of eighteen years of technological innovation.
1232;One of the most popular sci.
1233;Multiple sequels guarantee this will be bought for years to come.
1234;nold is great in this movie about dystopic America in the first of the Terminator series.
1235;Not as outright funny as T2 but a great movie.
1236;Along with the improved sound the viewer can enjoy interesting deleted scenes with director commentary and also some interesting interviews.
1237;One thing I like about this movie is it has a very good story and it's not drown out by special effects.
1238;A must see for Sci Fi fans.
1239;Classic, one of the best movies ever.
1240;One of my all time favorites.
1241;This has to be one of Arnold's best.
1242;The Terminator is one of the greatest action sci.
1243;It has one of the best performances of Arnold Schwarzenegger's historic carear.
1244;in 1984 the world is safe.
1245;He has a skin outside with a metal exo.
1246;skeleton and he has one purpose.
1247;She is skeptic at first but goes with Kyle.
1248;arnold Schwarzenegger is the man in this film.
1249;He plays it to perfection.
1250;The whole look with the glasses and leather jackets and with Arnolds body makes one of the best bad guys ever.
1251;Arnold really is good enough in the moive to earn an Oscar nomination.
1252;You don't think they will ever take him down in the film, and the ending is great.
1253;linda Hamilton is great as Sarah Connor.
1254;This is one of the best performances of her carear as well.
1255;the special effects are great in this movie.
1256;James Cameron's movies have always had great special effects Terminator is no exception.
1257;The movie is made so well.
1258;He also needs credit for writing this masterpiece of a film.
1259;the Terminator is one of the greatest films ever made.
1260;It's a huge movie and especially with pop culture today.
1261;The famous line I'll be Back is from this movie, but it's always been here.
1262;If you haven't seen this movie you must go pick it up and watch it.
1263;The Terminator is one of the few action science fiction movies with an interesting, well a storyline at all.
1264;the terminator is a cyborg with human tissue around a mechanical skeleton inside it could pass as a human in a crowd, it is so powerful almost indestructable.
1265;it's purpose to go back in time and murder the mother of it's enemy so that he would have never existed.
1266;ray movie you always need to keep in mind what you're working with.
1267;Sorry, I'm a huge fun and they came out with an impressive product at the time, but not all the special effects hold up well.
1268;ray book is great packaging.
1269;It's actually a really cool feature for collectors to have.
1270;All in this is easily worth the money spent.
1271;fi movie is just a treat for buffs like me.
1272;the story is now, well known.
1273;the film follows this wild chase with unfaltering skill giving place to high voltage anthological scenes as the irruption of The Terminator in the police station and the motorcycle pursuit.
1274;arnold Schwarzenegger gives his best interpretation, of his early actor's career.
1275;His stolid unflinching personification of deadly android is paramount and it will remain a trade mark for him.
1276;Linda Hamilton as Sarah Connor, the fleeing girl, is very good.
1277;"director James Cameron carved a name for himself with this ""hit"", allowing him a successful career that includes ""Aliens"" (or ""Alien 2"") and ""Titanic""."
1278;fi and action film's fan.
1279;This movie is one of my favorites.
1280;The thrill of the movie keeps you on the edge.
1281;picture is so real it felt like they made it 2 months ago.
1282;I'll admit that I watched Terminator 2 before I saw this movie (and was rather young to see T2, lol) but this movie actually helped to explain the events of T2.
1283;overall this is a pretty good movie which helps to kick off the Terminator saga, and in my personal opinion, the best installment in the series.
1284;ray master, go ahead and pick this up.
1285;I also prefer Arnie in the later movies than this one.
1286;see Aliens and The Abyss.
1287;The terminator has two other lines onscreen, one with the voice of a police officer overdubbed, and one with the voice of Sarah's mother overdubbed.
1288;There are also many lines with the voice of Sarah's mother, and we learn that the terminator is actually saying them, but we don't see it.
1289;personally, I'll always prefer the second and third movies to this, but it's still great, as it really introduced the whole story to the viewing audience.
1290;The second and third have slightly better effects, plus the third has a female Terminator plus Arnie!
1291;Always a must for the guys in the audience.
1292;Once you wrap your head around the premise, the sequels are fun and exciting!
1293;The movie Terminator throws us into a world beyond imagination, beyond our own worst fear, and its storyline grips us in its hand as we watch the fight for humanity begin.
1294;Our survival rests in the hands of one woman, who will give birth to the one to save us, John Connor.
1295;As the days of our future's end unfolds, we are dazzled with brilliant and chilling special effects, glimpses of a world gone dark, and the hope of survival.
1296;The music strikes the chords of our soul, and our eyes drink in the passion and strength of two characters brought to life by talented actors.
1297;This movie truly defines what we hunger most, which is to know what is waiting for us in the end and will we be able to save ourselves.
1298;This was the premiere movie that thrust Arnold into the spot.
1299;light of action film heroes.
1300;The result is some of the best special effects you will ever see in a movie.
1301;Action in this movie is nonstop as wellas breathtaking.
1302;This film will keep you on the edge of your seat.
1303;Arnold is the dominant force in this film.
1304;This is one of the best action movies you will ever see.
1305;great to watch with family on a relaxing afternoon.
1306;co. actors perform awesome as well.
1307;Terminator is the perfect sci.
1308;It is dark, gripping, well acted, great effects, great story and timeless.
1309;The extras on this disc are fantastic also.
1310;An untested director, James Cameron.
1311;create a believeable science fiction movie in the age of Star Wars type special effects.
1312;It is at times tense, funny and above all exciting.
1313;Before you see T3, be sure you see where it all began.
1314;This movie looks great on Blu.
1315;Is The Terminator the greatest story of modern sci.
1316;a machine fitted within a living body.
1317;flavored empire has also discovered the means of time travel, and a cyborg assassin .
1318;This involves several exciting set.
1319;The story gives the term Immaculate Conception an ironic and tender new meaning.
1320;elaborate SFX of the 1991 sequel, but the effects work as it is does the job quite nicely, notably in Kyle's flashback where he and a squad blow up a walker machine and are then attacked by an aerial raider .
1321;shades of The Empire Strikes Back and Battlestar Galactica nicely rolled in one.
1322;there is chilling humor as well, from The Terminator's accosting of a trio of degenerates to the afforementioned I'll be back tagline to his curt dismissal of a janitor at a low.
1323;Director James Cameron has Schwarzenegger speak in the monotone of a Cylon, albiet without the synthesized harshness, and it pays off perfectly.
1324;This is a true classic of the sci fi genre.
1325;a five star movie classic, That being said Warner Brothers made no attempt to clean up the print for the blu ray release.
1326;They since have released many flicks with excellent cleaned up pictures.
1327;Dear readers,I belive the Terminator is an amazing film.
1328;this is a sweet movie so check it out!Michael Howell
1329;It shows its age from the aspect of the special effects, but will forever remain a favorite movie of mine
1330;This film is very inventive in terms of story line.
1331;The film is expertly directed and established James Cameron as a real talent.
1332;This movie is one of a kind.
1333;It is certainly the type of movie a 9 year old boy would enjoy.
1334;hi i am the terminator fans and i really enjoy this film and can not wait to see the terminator 5.
1335;A chilling electronic score sets the tone.
1336;One notable exception to my lukewarm attitude toward science fiction films is a 1984 James Cameron film that I consider to be one of the very best of its genre.
1337;"The Terminator, starring Arnold Schwarzenegger, Linda Hamilton, and Michael Biehn, is a very, VERY good film indeed!Before this week, I had pretty much forgotten just how good ""The Terminator"" is."
1338;introduced to the film recently when I received in the mail my latest order from Amazon.
1339;this film is just as good now as it was seventeen years ago!
1340;pounding excitement, none of its originality.
1341;"Recently, as I watched ""The Terminator"" for the first time in perhaps ten years, I found myself once again transported to the dark world created by director/screen writer James Cameron, and brought to life by Schwarzenegger, Hamilton, and Biehn."
1342;"The acting in ""The Terminator"" is actually pretty good."
1343;contending material, but definitely of a lot higher caliber than I expected the first time I saw the movie.
1344;office star) proves that, yes indeed, he really can act.
1345;linda Hamilton is excellent as Sarah Connor.
1346;Her evolution from a cute, all.
1347;michael Biehn is also very good in his role as Kyle Reese.
1348;He delivers his lines powerfully and demonstrates a wide spectrum of on.
1349;Like Schwarzenegger, he possesses tremendous physical acting ability.
1350;"ish"" feel that greatly adds to the film's overall suspensefulness, tension, and excitement."
1351;"mY VERDICT: Although it's seventeen years old now, ""The Terminator"" remains an intense, exciting film, imbued with a highly original story line, excellent special effects (at least for its day), and pretty darn good acting to boot."
1352;fact is, it is better but NOT mountains better.
1353;There are more special features on the 2.
1354;bUT until then, if you wanted the best possible picture and sound of this movie, the blu ray is the way to go.
1355;I bought this movie for about a dollar from cyberzoo, the disc was in excellent shape and played well.
1356;I absolutely loved the movie when it originally came out in the theatres, and up till now i never realized how cheezy the special effects are.
1357;All in all its a great movie and everyone should have this movie in their library.
1358;Wow have films have come a long way!
1359;"The ""Terminator"" made Arnold a superstar, James Cameron a hot product and a franchise going ito its third movie."
1360;The visuals and special effects are a little crude, but Cameron injects a kinetic style that makes up for it.
1361;Their cat and mouse chase is gripping, and Arnold is chillingly cold as the machine.
1362;We also have superb action scenes, such as a car chase through a tunnel, the Terminator rampaging through a police station, and especially Resse's flashbacks to the future.
1363;Also, Linda Hamilton is effective as Sarah, a usually timid LA girl who learns of her future, iconic like status.
1364;this is one of the best action movies period.
1365;The story is mythic, the acting well done and the direction top notch.
1366;Even 20 years after its inception, this is still one of the premier action movies around.
1367;I collect movies and most popular movies are released several times on the most popular media form.
1368;Michael Biehn did a good job playing Kyle Reese as well.
1369;Even though Terminator 2 is as good if not better than The Terminator, I still think this movie is one of the best!
