1;This movie is excellent from the script to the actors to the cinematography.
2;I highly recommend watching if you enjoy art film or British cinema or even if you love a love story that will never work out.
3;I wish I could be more specific but I just loved the film so much.
4;This classic weepie still holds up pretty well and takes us back to a bygone age where people did not feel the need to flaunt themselves and their emotions in public.
5;celia Johnson holds this romance together.
6;johnson has to narrate the movie as well as act in it and gives a performance of remarkable restraint and power.
7;"Trevor Howard, the doctor, is a bit over the top, declaring in that thrilling British voice, ""I love you, I love you"" again and again."
8;it's amusing the note how British accents have changed in the past 60 years.
9;Nobody speaks in that clipped, hoity.
10;also we get a glimpse of the British class system circa 1945.
11;But Cary delivers a nice performance of a cockney trying to put on an upper class accent.
12;For the most part, it still works pretty well.
13;It is his best film, as far as I am concerned.
14;I am huge film fan.
15;This film is perfect in every way.
16;Noel Coward is a brilliant screenwriter and this is one of the best screenplays ever writen.
17;This film was voted 2nd best British film ever made under The Third Man (which I also love and Trevor Howard was also in).
18;a film of such perfection is so rare and underrated that it is sad that this beautiful film has been viewed by so few.
19;Sparkling, moving preformaces given by both Celia Johnson and Trevor Howard.
20;Celia Johnson was very convincing and her voiceovers and facial expressions were superb.
21;The way the start the film out at the end and she retells the story is brilliant.
22;The editing is even perfect.
23;This film is very realistic.
24;It captures the time beautifully and how people used to have higher standards actually cared about their families, unlike the vulgar times of now.
25;capturing the smokey dark train stations with high contrast black and white.
26;If you like Casablanca, you'll love this movie.
27;I love ending because it is so mysterious.
28;Thank you for coming back to me.
29;Yes, the movie itself is superbly written and filmed, with brilliant music and cinematic effects.
30;Yes, it deserves five stars.
31;A refreshment room in a British suburban railroad station is a perfect place for a predatory man to meet women so innocent that they are not even aware they are looking for romance, so Dr. Alec Harvey checks this one out.
32;People with character disorder are accomplished liars, and they feel great pride when their lies are believed.
33;nevertheless, this is a truly great movie!
34;The true hero is, of course, Fred.
35;With what Laura calls his wisdom and gentleness, he is just the right man to carry her throughthe dangers of this brief encounter with an emotionally barren man who enacts the perfect lover.
36;Many great works of art come from the hidden depths.
37;I absolutely loved this movie.
38;It had heart, and the music.
39;rachmaninoff was perfect for background music.
40;I loved whenever someone asked for sugar with their tea.
41;This movie was brilliantly acted, the direction and story were just marvelous.
42;I have always loved this movie, and was delighted to find it referred to in a blog, so searched it out, and again enjoyed this wonderful pair of english actors.
43;It is a region B (UK).
44;So, in that way I can see this film as very relevant for today's usual type of viewer.
45;deserving of the main characters.
46;i also enjoyed the side story of the train station manager and the cafe hostess with their more down.
47;So the scene disturbs the logical story line.
48;Probably a lesson for us all, in many ways.
49;ray does look very good, but beware if you don't have a region B blu.
50;rays, however, this is a very good bd from ITV of a great David Lean film.
51;Everyone who has loved and lost his/her object of affection will feel deeply touched by this little unforgettable movie.
52;As the love affari develops in such a peace that it is impossible not to get in the mood with them, and root for the lovers.
53;Either a man she loves very much but barely knows .
54;Great acting and it ends leaving a smile on your face.
55;"This is one of my favorite films
I:8593;56;It contains all the elements of a great, yet doomed, romance.
I:8593;57;He's my kind of man!
I:8593;58;If you loved Lost in Translation, you'll love this.
I:8593;59;if you love Sleepless in Seattle and similar modern romance classics, see the movie that inspired those filmmakers.
I:8593;60;Beautiful, compelling film based on the play Still Life by Noel Coward (though it doesn't feel like a filmed stage play)and shot by David Lean (before he decided to make epics .
I:8593;61;The best thing about it (and this is saying a lot) is the two lead performances, Trevor Howard and (particularly) Celia Johnson in her crowning role, the only role she is remembered for.
I:8593;62;She, """"Then we must be happy without it."""
63;David Lean did an exceptional job of directing this film whom later directed Hopscotch.
64;the use of Rachmaninoff's Concerto no. 2 in C minor, helps set the mood and added continuity to the film.
65;And with that we have the beginning of one of the great love stories on screen.
66;Both are married to others, yet they continue to meet weekly at the train station.
67;"Their love blossoms, but they are ""sensible"" middle."
68;class people, and when they realize it can't go on, the good doctor takes a job in South Africa.
69;it's a simple story, not very much happens, yet it's poignant and moving.
70;The message seems to be that love can happen anywhere to anyone, and though obligations and decency be elsewhere, nothing can destroy that love.
71;for any one who has loved and lost, this movie can be nothing else but moving, and a great sad pleasure.
72;A beautiful movie in all respects.
73;Filmed in Great Britain in the 1940s, and therefore black and white.
74;A thoughtful, reflective presentation, from the woman's perspective, of a relationship that developed over a period of a few weeks.
75;I loved this movie when I saw it and finally bought it.
76;It's such a well written and directed movie that it was destined to be considered a classic.
77;subtle, moving actors and stunningly filmed.
78;Quiet little film with good acting on all parts.
79;"One of these ""slice of life"" films ."
80;It is the epitome of love stories with train stations on the background: e. g. Casablanca.
81;the film is made with clockwork precision and tactfulness.
82;There's something about trains that captivates.
83;Their last few precious moments together in the tea.
84;This will bring tears to your eyes.
85;In fact the pain will lessen and his memory will become dream.
86;the tale is cleverly told in that we are shown the end of the film at the beginning and then have the rest of it filled in in flash.
87;There is also a comical sub.
88;"room barmaid with a ""posh"" voice (Joyce Carey), and her aspiring lover, the Station."
89;the haunting third movement of Rachmaninoff's Piano Concerto No. 2 adds immensely to the emotional content of the film and is at least partially responsible for its enduring popularity (indeed where would the film be without it?)
90;With its fine script and good acting and its nostalgic black and white photography of a time gone by, it delivers a unique experience and is a film to be treasured.
91;"and, along with so many other old films, it also brings with it another thought
I:8593;92;Every time this movie comes on my husband (who is English) and I watch it and laugh our heads off.
I:8593;93;the thought of two stodgy old English people being driven wild by their passion for each other is,well.
I:8593;94;I give it 5 stars for being so darn funny.
I:8593;95;But it is worth watching for a good laugh!
I:8593;96;This was a good story line for an older black and white movie.
I:8593;97;Its nice to see romance without all the smut.
I:8593;98;In fact, the bantering and humor of the tertiary characters in the train station's coffee shop was much more entertaining.
I:8593;99;This is a beautiful film that touches the core of human experience.
I:8593;100;It's also a masterfully crafted film from a technical standpoint.
I:8593;101;One of the most sympathetic stories of two people who meet, quite by chance, at a local train station refreshment shop and form a relationship of indelible love and companionship but are married to other people.
I:8593;102;In a script and story directed with infinite care we see the internal struggle of two star.
I:8593;103;This is a classic tearjerker.
I:8593;104;it is a simple tale that makes whole the saying, It is better to have loved and lost then not to love at all.
I:8593;105;Overall it is lovely telling picture that I highly recommend.
I:8593;106;Criterion has yet again done a magnificent job with the digital transfer making you feel like you are back in the Cineplex of the mid.
I:8593;107;So curl onto your couch with a bowl of popcorn and enjoy while the rain hits the window . . .
I:8593;108;One of the best film romances I've ever seen.
I:8593;109;The music, the acting, the plotline.
I:8593;110;The story is an endless tail of love found and love lost.
I:8593;111;The movie is wonderful acting from the leads to all the secondary actors.
I:8593;112;This film brought Celia Johnson acclaim with a well.
I:8593;113;observed performance and she is matched by Trevor Howard in his best acting ever, and it was his first lead.
I:8593;114;Watch it and remember one's own romance.
I:8593;115;the reason for that is explained that these were decent, honest folk who knew very well what they were doing from the start.
I:8593;116;despite the sentimental nature of this melodrama, Lean and his collaborators used restraint and let the actors, especially Celia Johnson to work out their characters' torment, which is as much of a moral dilemma as it is a romance.
I:8593;117;Of course romance it is.
I:8593;118;The word pops up in one of Celia's husband, who hunts for words for his crossword puzzle and asks his wife about a line from Keats (""""When I fears that I may cease to be"""") sonnets, and the word """"romance"""" fits."""
119;It is a node, and it signifies that he had some subconscious knowledge of what happens.
120;"He does finally realize that his wife had lived in a ""dream,"" and wisely he welcomes back when she is finished with her ordeal and the doctor is gone."
121;much has been made about the photographic wizardry of this movie and the Rachmaninoff music (Piano Concerto #2) which establishes the atmosphere and tone.
122;also much is made of the economy of the movie.
123;It is compact, fast paced, and immensely focused, for it is told from entirely from Laura's point of view, in a flashback voice.
124;In the end, it seems that this is the technique that allows the viewer to be totally immersed in Celia's psyche and understand her hesitations, moments of bliss, and despair and guilt.
125;This is a genuine passion, and, paradoxically, it is the doctor who makes the most important moves.
126;She hovers between temptation and a strong decision.
127;But the doctor is decent too.
128;This is a story of an intense romantic involvement that only between two married people which only takes the first step.
129;Is the end of the affair to be considered a happy ending?
130;for this is a real romance between two passionate lovers who, unlike Paolo and Franscesca (and countless others) did not end up in hell.
131;But they did experience that one unmistakable and sweeping feeling that comes around only about once or twice in a lifetime, and, almost always, it is more memorable if it remains unfulfilled.
132;That is noble of him, for he understands that a woman, even one that has the most refined sense of duty as wife and mother, can be tempted.
133;"for it takes a while for him to do so that the mistake is shared, that may be he is the most responsible, for he is the one who had asked for a second meeting, and the one who admits that ""something has happened."""
134;That style precludes scruples for momentary enjoyment.
135;And the heroes of such stories are usually amoral.
136;"Celia Johnson, as Laura, is stronger, acutely distressed, genuinely in love, and escapes with her life and happiness, though the ""dream"" may have unhinged her forever."
137;She knows she can be stirred to feelings that transport her to another level of existence, but those, as is well known to humankind, male or female, wound the most.
138;That is why the title fits so well.
139;He had made a much more successful, unofficial adaptation of Flaubert's book, via a Noel Coward playlet, a quarter of a century earlier, with his first masterpiece, 'Brief Encounter'.
140;the film IS incredibly moving.
141;We notice that, as a reader and film.
142;goer, how prone to flights of fantasy she is (see the glorious travelogue montage).
143;She is often seen constructing stories or moods .
144;because, 'Brief Encounter' is ultimately, like 'Madame Bovary' for France, a fierce critique of middle.
145;the very atmosphere of Britain decays the soul.
146;Lean is very sympathetic to Laura's agony .
147;'Encounter' is so focused on the couple, we forget what a brilliant, funny and detailed portrait the film is of post.
148;there is something poignant about a man and a woman getting together briefly, developing a deep bond, and then, like two ships passing in the night, separating without having consummated their relationship, and never seeing one another again.
149;i love all of the modern movies listed above .
150;they are among some of my favorite movies.
151;And I love film history, so this was a must.
152;see for me, to see the film that may have started this theme of Amor Interruptus in the film world.
153;Brief encounters of this sort do occur in real life, and no doubt audiences of that era understood the characters better, for this was a popular and acclaimed film in its time.
154;"in ""Brief Encounter"", everything is neatly tied up and returns to A. oK normal at the end, as Laura's husband tells her, somewhat cryptically, ""Thank you for coming back to me""."
155;Seejng the movie again greatly enhanced our experience with this production which is a tour de force.
156;This is my favorite British film of all time.
157;Brilliant writing, fine acting, ecconomicaly concise production and inspired direction all combine to make a landmark movie and a defining moment in social history.
158;She is talented and beautiful.
159;More than girlishly pretty, she has the deep resonant beauty of a full grown woman.
160;Her eyes are huge and so expressive, as she copes with the guilt and sordidness of an extra.
161;She narrates to move the story along in places.
162;Her performance draws you in and holds you.
163;Their screen chemistry is subtly electric.
164;There is a 'forward to the past' kind of message.
165;The film portrays a British middle.
166;if you've never seen it, you are in for a rare treat.
167;If you haven't seen it for a while, then it is well worth revisiting.
168;I thought it fitted since he wrote the screenplay, and the main setting is a railway station.
169;A wonderful, romantic story in the old fashioned sense.
170;You can see and feel the love grow between them, while the world rambles along around them, unaware of their secret.
171;"award winning director for his later films, ""Brief Encounter"" was the fourth and final film he would work with Noel Coward."
172;She is a woman who has had an affair with another man.
173;Happily married with two children, she goes on with her daily life riding the train into town and checking out a book to read at a local store, going to lunch with friends and enjoying a picture.
174;while she goes to the tea house at the train station, while waiting for a train one evening, some grit gets into her eyes.
175;The two have a great discussion and we learn that Alec is happily married with children.
176;Laura showing her kindness for helping her with removing the grit in her eye, the two go to catch an event at the Palladium.
177;but the two start to realize they enjoy each other's company.
178;Blacks are nice and deep, whites/grays are vibrant and clear.
179;It helps that the cinematography and the shots and camera positioning was well.
180;done and captured the various mood of Laura.
181;"May it be her making a phone call to Alec or running through the rain, Robert Krasker (""Romeo and Juliet"", ""Alexander the Great"", ""The Running Man"") did a wonderful job in capturing the emotion of this film."
182;tape transfer, they were able to access most of the original film elements and found the various positives and negatives, they found in the 35mm fine.
183;grain master positive to be exemplary.
184;done and this is the best this film has looked until now.
185;"Also, the adaptation of ""Still Life"" to cinema."
186;"Interesting enough, how this abruptness was an inspiration for director Billy Wilder for his film ""The Apartment""."
187;But for the most part, an informative commentary track.
188;"jUDGMENT CALL:It's quite interesting to watch a film such as ""Brief Encounter"" because we see extra."
189;marital affairs in film as common place in cinema.
190;he's very much in love with Laura but for Laura, it's the lying and hiding that starts to break her each and every day.
191;She knows its wrong but her heart continues to tell her to go for love and she is torn between her conflicting emotions.
192;it's also important to emphasize that back in the mid.1940's, extra.
193;Sure, divorce rate is high now, extra.
194;both Celia Johnson and Trevor Howard provide a fantastic performance.
195;"I enjoyed the cinematography and the use of ""Piano Concerto no. 2' by Sergei Rachmaninoff (played by Eileen Joyce) throughout the film."
196;"overall, ""Brief Encounter"" is an enjoyable film that keeps things simple."
197;No need to stretch the film past its 86 minutes and despite one scene that the historian Bruce Eder points out in the commentary, for the most part this film is very well done.
198;A romantic film showing us how love can happen unexpectedly but how love can easily be lost.
199;Brief Encounter is definitely worth watching.
200;day expectations, but there it is.
201;Brief Encounter is an exquisite film with an overwhelming performance of heart.
202;Long before he made his grand widescreen epics, master director David Lean made small, intimate films about normal people who find themselves outside of their comfort zones.
203;His most famous of these early works .
204;fated love stories are compared .
205;allan) and actually begins with the quiet farewell between Laura and Alec.
206;Watching the events unfold in her memory and listening to her narration, we are drawn completely into her mind as Rachmaninoff's Second Piano Concerto floods the soundtrack.
207;"Probably because Laura's narration is so honest and involving, this movie resonates far more than a more Baroque ""chick flick"" like Irving Rapper's ""Now, Voyager"" or Jean Negulesco's ""Humoresque""."
208;layered performance as she makes Laura's desperation palpable but never off.
209;With her saucer eyes and emotionally pinched demeanor, she truly brings a genuine soul to this vulnerable, emotionally closeted woman who is unable to come to terms with her unconsummated affair.
210;criterion has once again done a superb job in bringing this movie to life as the pristine print really brings out Robert Krasker's crisp cinematography.
211;Film historian Bruce Eder provides informative audio commentary on an alternate track and goes in.
212;depth into not only the production but also the careers of Lean, Coward and all the actors with speaking parts.
213;Beyond that, there is the original trailer and an interesting demonstration of the restoration process.
214;The powerful symbol of the rushing steam locomotive is iconic.
215;"I had seen this gorgeous movie only once before on ""Bravo"" (here in my country called ""Film and Arts"", and I thought it was a Masterpiece."
216;This is David Lean at his very, very best.
217;Sincerely acted, simply, with excellent, restrained, understated performances by both leads, Celia Johnson (what was of this wonderful actress, after this tremendous performance!)
218;This is one of my favorite pictures.
219;The actors, Ms. Celia Johnson and Mr. Trevor Howard are superb,.
220;Ms. Johnson, especially, can express a whole panoply of emotion through her exceptional eyes.
221;modulated, articulate and gorgeous voices add to the romance of the film.
222;I find this movie endlessly watchable because of the fascination, which never dulls, at watching these two performers.
223;the picture is achingly beautiful in a way that surpasses the ability of words to express.
224;I love Lean's films, mostly the epics.
225;"But I love his ""smaller"" films as well."
226;I think they're both terrific.
227;a beautiful movie than put a tear in my eye at the end.
228;it definitely proves that you dont have to be young to feel the heart wrenching pains of love
229;Their romance blossomed and ended in matter of 7 weeks.
230;I did, and one afternoon, all by myself, I sat down and enjoyed watching a lovely clean love story.
231;they did a good job and I wish, in today's world we had some restrictions rather than letting it all hang out.
232;I received it in excellent time, and even though it was a used VHS, it was still fine to watch.
233;This film is captiving and envolving since its first shots .
234;The briefness of this love affair is so credible and so real that literally engages the viewer from beggining to end .
235;this brief happiness shared between these two lovers make that every little encounter expands itself and produces in the viewer a disturbing sensation who will let you thinking about what is right or what is wrong .
236;The rapture sequence in the hall concert is unforgettable.
237;since she is a unhappy woman married with a boring and predictable husband , she will have at last these two days of happiness and be loved , respected and considered as a woman.
238;mature film and an instaneous classic from its initial release .
239;one of the countless gems given for the best british director of the XX century : David Lean .
240;epic that didn't burst, early into the film, with sexual aggression.
241;lean's style is stylistic in subtle doses (we can neither forget the atmosphere of the train station, nor the tilting camera when suicide almost happens).
242;It is a compact, Lean (pun intended) narrative that had to be, immediately upon completion, an eternal masterpiece.
243;Worth having on your shelf and to pass along.
244;This is a wonderful movie .
245;all done by a look, a brief touch, a few words.
246;"brought the entire range of emotions to this ""never to be completed"" very brief love affair."
247;The ending was a real heart breaker.
248;This subtle, heartfelt British gem will still drench most anyones Kleenex sixty years after its release.
249;Even with the British reserve much in evidence, overall effect is intensely moving.
250;I see new things every time I watch it.
251;And I love everything each time.
252;Brief Encounter is an emotionally wrenching movie for the viewer who has, at one time or another, experienced personal struggles to contain desires that need not come to the forefront.
253;Among these passions are the perpetual excitement and euphoria that one feels in a relationship to the extent that this association could develop into an extramarital affair.
254;One can only sympathize, perhaps empathize, with Laura as she tries to come to terms with how events in her life have transpired.
255;Experiencing heightened levels of contrition for her ever.
256;condemnation flourishes, she comes to a proverbial fork in the road.
257;She tells herself that since she is married to a good household provider, she has acquired levels of security and comfort that are higher than one could reasonably hope for in a marriage and should be entirely fulfilled.
258;with the transitions from one scene to the next, as masterfully laid out by David Lean, the movie is, quite arguably, a sexually charged masterpiece.
259;"One moment, the communication is, essentially,""We must end this now!"
