523;This film is a timeless gem.
524;Prior to Brief Encounter Lean had directed This Happy Breed, the story of a Southwest London family up to the advent of World War Two.
525;Their integrity provides pressures which do not surface with individuals lacking their levels of advanced character.
526;the use of Rachmaninoff's Piano Concerto Number Two in C Minor serves as the perfect backdrop as Johnson ruminates narratively about her love for Howard.
527;One of the most uniquely memorable scenes in film annals occurs when, at a time when Howard would like to say goodbye with proper affection to Johnson at the Milford Junction train station, where so much of the film's action occurs, the opportunity is destroyed with the emergence of a well.
528;As a result, when Howard's train arrives he is compelled to restrict himself to a properly polite verbal goodbye with an accompanying affectionate tug on the shoulder.
529;another interesting element of the brilliant Noel Coward screenplay is the train station flirtations between two of Britain's foremost character performers.
530;Joyce Carey, who runs the station snack bar, and Stanley Holloway, the local station master, engage in perpetual flirtation.
531;Coward's successful ploy is to add a touch of levity to a story dominated by a profoundly dramatic love affair doomed to end without the level of fulfillment each party sought.
532;Thirty years ago, Brief Encounter was one of the popular movies played on late night TV.
533;Whenever it was scheduled, I looked forward to it with great anticipation.
534;I always forget what a masterpiece of cinema David Lean's Brief Encounter is, but am instantly reminded when I sit down again to be mesmerized by its spell.
535;On the contrary, Noel Coward's drama is transformed into something uniquely cinematic.
