260;"
I:8593;261;the wonderful script and the language and deliverance by the the two stars goes down in the record books as the standard that other love stories should try to measure up to.
I:8593;262;the writers of this movie created absolutely beautiful lines that the stars delivered with grace and expert acting.
I:8593;263;no on screen sex,, no curse words,, no fighting,, just wonderful thoughts,, touching memories and gentleness that hasn't been duplicated.
I:8593;264;I fell in love with the actors, the characters they played, the music, and England.
I:8593;265;What a story, what a movie.
I:8593;266;The first time I saw this wonderful movie was over five years ago on PBS.
I:8593;267;The superb acting by all of the principals and the moving story of unrequited love deeply affected me.
I:8593;268;if you want to enjoy a movie about love.
I:8593;269;site, unrequited love and fabulous acting and directing .
I:8593;270;In the old days, trains were a good place to meet people, and like planes today, those meetings had a great air of expectation and could change lives.
I:8593;271;Brief Encounter was one of the last great examples of Film Noir.
I:8593;272;If you have never watched it, run and see it instantly.
I:8593;273;It's a classic love story.
I:8593;274;All of you hopeless romantics will love it !
I:8593;275;i read Richard Dyer's book on BRIEF ENCOUNTER years before actually seeing the movie, so I watched the picture in a Dyer frame of mind, and let me say, he was actually spot on in nearly every frame and in every mood.
I:8593;276;Now that's a great book.
I:8593;277;Its theme, after all, is travel, whether psychic or actual, and the device of laying most of the actual on the confines of a train station is a neat way of bringing in modernism (invented, you know, at the same time as the steam engine, so that a characteristic of both is speed) and to show the fractured, anguished inner workings of Laura's mind and heart.
I:8593;278;Every little thing combines to create a picture of a society at war with its self.
I:8593;279;Doesn't she look beautiful in her alternate, imaginary life, in which she finally goes to a hairdresser who makes her look good, and the gorgeous opera gown she gets to wear.
I:8593;280;respectable in a blah way.
I:8593;281;Thank God for montage sequences!
I:8593;282;She is a radiant actress and the shame is she made so few pictures.
I:8593;283;This is one of those movies that make you want to come back for more.
I:8593;284;The scenes are very romantic and you know the ending is not going to be good but still.
I:8593;285;watch Brief Encounter and you'll see why!
I:8593;286;As an admirer of David Lean's work and Trevor Howard's fan, this was the movie I had not seen.
I:8593;287;enjoyed the drama and found it actually factual.
I:8593;288;If you're familiar with the way a David Lean film looks, you'll recognize this one.
I:8593;289;It's a beautiful haunting story, with great acting and cinematography.
I:8593;290;Celia Johnson comes across as such a genuine everyday person, who can still fall in love with another man, even though it was totally unintentional, and it can happen at any age.
I:8593;291;It was a simple movie, but it is one of my favorite love stories.
I:8593;292;But she did have a simple beauty that was compelling, and therefore very attractive to her lover.
I:8593;293;This is a movie that I plan to watch many times.
I:8593;294;There are a few films about love that are so beautifully made and true that I return to them over and over again.
I:8593;295;i first saw Brief Encounter as a teenager and from the opening scene to the last, accompanied by the gorgeous Rachmaninoff score, I was utterly captivated by itbut what remains so extraordinary about the film is the very ordinariness of its topic and subjects.
I:8593;296;what happens next and how they decide to deal with it is so touching and so real that even decades after its release the film remains completely relevant.
I:8593;297;Trevor Howard and Celia Johnson, with her incredible, sad eyes that convey enormous depths of emotion while she herself remains contained, are both perfect in their roles.
I:8593;298;Highly, highly recommended but please get out your handkerchiefs.
I:8593;299;Theirs is a brief encounter, but is filled with longing, ecstasy, and heartbreak.
I:8593;300;The narration is from Celia's point of view, and captures all the heady rapture of a woman's infatuation.
I:8593;301;Trevor Howard is very appealing as the nice doctor, and displays wonderfully romantic tendencies.
I:8593;302;an excellent depiction of how two duty.
I:8593;303;Both my husband and I enjoyed it so very much.
I:8593;304;Brief Encounter is an old movie which I enjoyed very much.
I:8593;305;This has made the movie special for me.
I:8593;306;I would recommend it to any older movie buffs however.
I:8593;307;A walk through the gift shop was a must, where you can also view the movie in parts as you wait for your train.
I:8593;308;After a while I watched a movie so powerful and rich in image, sound and the content "
309;This is my favorite movie in the world.
310;The story is beautiful, the acting wonderful, the writing brilliant.
311;the film takes place in England in a sweet, simpler time.
312;Noel Coward's marvelous sceenplay, David Lean's spectacular directorial debut, the marvelous Eileen Joyce playing the Rachmaninoff score throughout.
313;And into our romantic consciousness lodges David Lean's terribly British morality tale and cinematic legend.
314;bombing was still a very real threat in London).
315;Best Actress, Screenplay and Director (a first for a British Director).
316;He is a nice man and they are a 'happily married couple' .
317;lady played by Joyce Carey.
318;while Dolly Messiter is also brilliant as Everley Gregg .
319;but the movie belongs to its two leads .
320;They must make an agonizing decision and ultimately sacrifice their 'true' love.
321;It is Oscar Wilde's famous phrase moulded into a film .
322;and their combined work here is exceptional.
323;filled versions you've seen down through the decades, this wonderfully clean restoration is the best the film has ever looked.
324;you can now see her make.
325;up and lipstick* Laura at home sewing in a chair .
326;her perfectly pressed blouse and big buttons .
327;all gives it a new 'world.
328;you can see the glinting of the water on their coats .
329;beautifully clear* As Laura runs away from the flat owned by Stephen (Alec's Doctor colleague) where she might have given in to her emotions for Alec .
330;beautiful shadows and light* Sitting down on the bench beside the War Memorial .
331;the scene in the Regent Park's boathouse when he is drying his clothes and he so eloquently confesses his love for her .
332;I love your wide eyes.
333;"and the way you laugh at my jokes."""
334;There isn't a booklet which is a bit of a visual let down, but there are extras worth noting .
335;another point worth mentioning is that Celia Johnson's character is given the ingenious device of a 'voiceover' .
336;(his growing passion for her) .
337;"her joy after they've shared their first kiss ""And I'd said I loved him."
338;It's an innocent world really, so it was probably genuinely shocking to the audience of the day when Laura disembarks towards the end of the film from the train home only to run to Alec who is waiting in his friend's flat (a doctor called Stephen played so coldly by Valentine Dyall).
339;Are they going to consummate their love .
340;in the decades that have since passed, David Lean's 'frightfully' downbeat British romance has been parodied relentlessly and beloved with a passion in equal measure.
341;And yet it still holds a powerful resonance even today and is likely to make 'one' reach for a handkerchief .
342;Brief Encounter on BLU RAY is a triumph and both The British Film Institute and CINEIMAGE are to be congratulated on this reissue and its wonderfully restored print.
343;"In Celia's words ""I want to remember every minute."
344;A chance meeting on a train turns into a harmless, though touching affair.
345;(She was nominated for a Best Actress Award.)
346;The staging is first rate.
347;The scenes in the snack bar, with the tart tongued bartenderess are sharp and poignant.
348;"The supporting cast, all of whom hang in the bar are wonderful in that British ""old movie"" way."
349;Americans never did scenes like these as well.
350;"Those that watched Mr. Howard in the classic The Third Man"", are due for a surprise."
351;"In ""BE"" he plays a sensible, sensitive and caring Doctor obviously in painful love with a woman he can never have."
352;This reviewer would easily give 5 stars to the overall production, the secondary cast, the settings and that black and white filming.
353;Brief Encounter is a superbly crafted film with some of the most convincing performances that I've ever seen.
354;The film's plot, pace, acting and use of narration are wonderfully timeless.
355;It really is a miracle that a film made so long ago can be so perfectly preserved.
356;hats off to Criterion, David Lean and all of the wonderful actors in Brief Encounter!
357;Brief Encounter is the most romantic, sensuous movie ever made.
358;"There is so much ""electricity"" and passion ."
359;One thing leads to another and boom, they're in love.
360;Chaste love, but love all the same.
361;Lean and cinema photographer Robert Krasker open with great shots of speeding trains coming and going through the station with heavy steam blasting from their smoke stacks.
362;The filmmakers make great use of their sets with interesting angles and the use of shadows.
363;This is a technically terrific movie but at the same time an artifact of the era.
364;Entranced by this movie and its soundtrack when I first viewed it 15 years ago, it is a classic of superb acting .
365;an excellent presentation of passion and love without the gratuitous sex of modern film.
366;It will turn the viewer into a romantic, and most please the already.
367;This film by the Director David Lean is fairly massive in Japan.
368;If you haven't seen David Lean's BRIEF ENCOUNTER you are in for such a treat.
369;Every shot, every sound, every nuance [to this viewer at least] seems perfectly judged, and the film's economy is breath.
370;But it's the performances and that wonderful, wonderful script by Noel Coward that make it a great piece of cinema.
371;"Howard and Johnson are so impressively ""natural"" that one forgets the skill required to play ""real"" people convincingly."
372;"And the last moments of the film, when Laura's husband, we realise, seems to have ""known"" and yet remains so accepting, so full of love, is heart."
373;Weep for joy and sadness, dear viewers!
374;but once the story unfolds, the actors make it a very touching, very realistic encounter.
375;Celia Johnson is remarkable, and Trevor Howard.
376;in both literature and cinema, the themes of illicit love, the routineness of long.
377;"Turn on the afternoon ""soaps"" (if you dare to) and it's all there, just as it is in majestic works like this one."
378;Many of us have lived out these themes.
379;And that explains the general reaction to this film among its viewers.
380;This beautifully mounted, superbly cast and exquisitely acted production is a gem.
381;noel Coward collaboration traffics in ambiguity, creating an extraordinary interplay of delirious human happiness and nagging, draining moral issues.
382;"with Lean and Coward at the throttle, ""Brief Encounter"" was destined to explore these themes in superior fashion."
383;But what truly lifts this production into the stratosphere is the performance of Celia Johnson.
384;Trevor Howard may lead the action forward, but it is Johnson who leads forward the emotions, facially and vocally.
385;Of special note is her flashback narrative work.
386;Johnson nails her flashback narrative time and again, providing us with wonderful vocal work as her face reacts perfectly to outer intrusions or inner vexation.
387;And one also bets that, in time, both lovers .
388;still friends and lovers in their minds .
389;will come to believe that the opening of an apartment door at an inopportune time may have been one of the best things to ever happen to them.
390;And that's something many of today's younger viewers may never understand.
391;Beautiful film, with perfect cast.
392;It's a timeless story no matter what the year.
393;Made shortly after the end of the second world war, it is one of the finest films ever produced by the British film industry.
394;Concerns two very decent people who meet and fall deeply in love by accident even though they both are already married.
395;It is one of the greatest love stories ever put on film and deserves all the praise it's been given.
396;Very well done, it was on my list and so happy to have seen it.
397;Very well acted I thought.
398;What a gem of a movie!
399;Goes to show that with a great script (by Noel Coward), masterful direction (by David Lean), and a terrific cast of the most gifted actors, great films can be made on a modest budget.
400;brief Encounter is truly a work of art.
401;Celia Johnson's performance alone is absolute perfection.
402;i hope young writers, filmmakers, and actors will view this film as a beacon.
403;Brief Encounter demonstrates how much the collaboration of great talent can achieve without big budgets, salaciousness, and violence.
404;The repression of the emotions is part of why this this is poignant and powerful.
405;the film is gorgeously filmed, in black and white in post WWII London, when it seems that life is finally getting back to normal, at least for the characters here, who seem to be comfortably well off.
406;the real gem of the picture, though, is Celia Johnson.
407;One wonders how she can develop into the star of this romance.
408;There is a huge difference in her demeanor with her husband and social acquaintances, and when she is with the doctor.
409;Rachmaninoff's lush music adds another wonderful dimension to the film.
410;Of course those who look closely in these films will see that Lean chose only the best actors to flesh out real, true characters caught in the midst of overwhelming events.
411;witness Peter O'Toole's vivid characterization of T. E. Lawrence and Peggy Ashcroft's beautiful, indelible Mrs Moore from A PASSAGE TO INDIA.
412;"Whether the characters will be adulterers or not is important to them
I:8593;413;david Lean directs this adaptation of Coward's play.
I:8593;414;Many consider the Lawrence of Arabia director the best Brit director ever.
I:8593;415;The kids are sniveling but cute, and her weekly Thursday afternoon getaway in town turns into a lover's affair with Howard.
I:8593;416;He's married too and works at a hospital only on those Thursdays.
I:8593;417;It's all very mature those knowing grasping moments of happiness once a week.
I:8593;418;This is all very understated, a bone for the middle.
I:8593;419;Certainly this must rank with the great romance films.
I:8593;420;Some viewers may be turned off by this aspect but it is great nevertheless.
I:8593;421;The train imagery and its tie to fleeting relationships is superb.
I:8593;422;Noel Coward's script is clever, a model of well.
I:8593;423;spoken English and a pleasure to listen to.
I:8593;424;Tell me that it's true, that it's the same with you!
I:8593;425;Rachmaninoff's Piano Concerto No. 2 is deftly woven into the film adding emotional depth.
I:8593;426;There is a great scene where she tries to tell her husband that she met a man, had lunch with him.
I:8593;427;When husband does not seemed concerned, she, who has obviously been agonizing over the situation, is engulfed with emotion.
I:8593;428;And for those who love moments of romance, this has many.
I:8593;429;An absolute classic English movie .
I:8593;430;If you love old movies this one is a must.
I:8593;431;Any film that can draw tears from this cynical heart of mine is something very special, indeed.
I:8593;432;Trevor Howard and Celia Johnson are exceptional"
433;The screenplay is nothing short of extraordinary and the use the Rachmaninoff Piano Concerto No. 2 was truly inspired.
434;It is an engaging film, well acted, and with a great musical (rachmaninoff) score.
435;"This is not merely my favorite David Lean film
I:8593;436;Instead of epic, the tone is intimate.
I:8593;437;the story of the film is paradoxical.
I:8593;438;The story of the unexpected and unintended love between two people who do not want to violate or hurt their loved ones is a story of moral and personal heroism as it is of love.
I:8593;439;The film is one of the most unique I know.
I:8593;440;the opening scene is shot twice.
I:8593;441;The second time, after the entire background has been supplied, it comes across as one of the most passion filled, and profoundly tragic scenes in all of cinema.
I:8593;442;celia Johnson and Trevor Howard were both impeccable in their roles.
I:8593;443;Like in so many great films, it is impossible to imagine anyone else playing their respective roles as well.
I:8593;444;Stanley Holloway, one of Great Britain's great character actors of the forties and fifties (who finally achieved Hollywood fame and an Oscar as Eliza Doolittle's father in MY FAIR LADY) provides comic relief as a railway worker.
I:8593;445;Shot in black and white, this film is almost a signature of the 40's, as was the more popular and successful Casablanca.
I:8593;446;Without mention of World War II, this film deals with internal struggles of the heart.
I:8593;447;Cecila Johnson stars as the romantic heroine, a married woman and Trevor Howard the love interest, a married doctor.
I:8593;448;It's a romance that is mostly feelings and emotions, furtive glances, sighs, talk and regular meetings that are brief in a train station.
I:8593;449;david Lean is experimenting with many techniques, particularily intimate angles and interior monologue.
I:8593;450;No film can ever top his Doctor Zhivago, but this film is at least second best and good for its time in 1946.
I:8593;451;There is a particularly impressive scene in which the lovers are interrupted and Celia Johnson's character must take a train trip with a very chatty, annoying woman friend.
I:8593;452;Another reason besides the great acting and the story itself is the fact that Rachmaninov's Piano Concerto No. 2, regarded as his finest, is played in this film.
I:8593;453;The dramatic, romantic storm that is the first movement, followed by a melancholy adagio, is very effective for this type of film.
I:8593;454;Brief Encounter is an unusual and beautifully made film.
I:8593;455;The direction by David Lean is well.
I:8593;456;paced and photographed beautifully so the film becomes a consuming experience.
I:8593;457;It is easy to relate to their lives and for their desire for each other.
I:8593;458;This film promises an emotional experience.
I:8593;459;Brief Encounter is pure cinema and a magnificient example of dramatic art.
I:8593;460;this is one of those few movies that you can enjoy its every second and it is guaranteed to affect the first time viewer.
I:8593;461;I am sure Criterion has again done a terrific job just like it has done with The Grand Illusion, The 39 Steps or the Third Man.
I:8593;462;This is one of my favorites.
I:8593;463;I watch it over and over and enjoy it every time.
I:8593;464;It is a beautiful story of love and duty to family.
I:8593;465;This movie is about love and heartbreak, sure, but the really amazing thing about it is the way they portray the ennui that comes from a long marriage, and how even normally faithful spouses can become tempted when facing the boring day.
I:8593;466;In this aspect, it is truly masterful.
I:8593;467;When she breaks down at the end, it was perhaps the most """"real"""" movie moment I've ever experienced."""
468;I saw this for the first time about 10 years ago and I return to it again and again.
469;The suburban housewife played perfectly by Celia Johnson does the right thing when she realizes what she was about to lose.
470;There is passion without profanity or nudity, and in the end, everybody does the right thing.
471;After reading about Brief Encounter and how it was one of the best movies of the 1940s, I anxiously looked forward to viewing it myself.
472;a lovely film, in classic black and white, with subtle, understated, powerful performances by Trevor Howard and Celia Johnson, it's a basic story of a man and woman meeting by chance and falling in love.
473;The woman is a housewife, also married.
474;while we never see the doctor's family, we do see the housewife, Laura's, family.
475;he's a nice man and she has a nice family.
476;You feel every ounce of her pain, her torment and her indecision on what to do, thanks to Celia Johnson's flawless acting and the beautiful musical score.
477;A classic for other pictures to follow.
478;Perfect plot, perfect dialogue, perfect cinematic choreography, haunting story, powerful message indelibly imaged by the massive, pitilessly punctual trains that encorce the brevity of the encounter.
479;For starters, I love post WWII British melodramas, and this is a perfect one.
480;I love the fact that the main characters are of a certain age (along with a humorous subplot of a romance between a shop keep and train station guard, who are also older') and that this film so beautifully conveys that love can arrive at any time in life, at any age, whether or not one is happily married or ordinarily so.
481;celia Johnson and Trevor Howard are perfect cast as the star.
482;crossed lovers, who want so much more from their new found love, but each, particularly Miss Johnson's character Laura, full well knowing that they cannot have each other, which is heartbreaking.
483;A brilliant movie, that could never be remade in the 21st century.
484;This is one of my two favorite films of all time.
485;Everything is perfect, the lighting and art direction, the acting, writing by Noel Coward, the use of Rachmaninov's Piano Concerto No. 2 as the score, and of course,the directing by David Lean.You don't have to take all your clothes off and moan and groan in a sex scene in order to convey eroticism.
486;It's very subtle in this film and tied to romance, which makes it better.
487;Celia Johnson and Trevor Howard were perfect in this film and they were cast perfect for the roles as well.
488;The range of emotions, the peaks and lows are quite extraordinary.
489;An excellent script and great cinematography.
490;known cinematic romances to ever hit the big screen.
491;A friendship develops between the two and love soon blossoms as they spend more time together.
492;"Yet, despite the sense of sadness that lingers throughout ""Brief Encounter,"" it still is passionately romantic."
493;screen couple but their love story is touching nonetheless.
494;"Full of heart and full of insight, ""Brief Encounter"" is as poignant today as it was when it first came out."
495;brilliantly adapted by David Lean from brilliant playwright, Noel Coward.
496;"This story of two married people who meet, fall in love and then ""do the right thing"" is one of the most perfect films ever made."
497;Having read Mrs Palfrey at the Claremont and seen the film.
498;This story was delightful because it smacks of a time when people had integrity.
499;Interesting story of intrigue and romance which teaches a lesson that 'the grass is not always greener' elsewhere than in your marriage.
500;At last, my wife and I have been able to enjoy this classic tale of desire, deception and despair in all its black.
501;The restoration is immaculate, every frame crystal clear, and the soundtrack is perfection.
502;this movie is sublimely directed by David Lean, whose use of the charging train is quite powerful and symbolic.
503;This movie is quite unique in how it is very moral, yet shows the nature of temptation in a very realistic and not stagey way or with guile, which most relational stories suffer from today.
504;The passions are real and so is the struggle.
505;It is so very honest.
506;adding more depth is the way in which the story stays within the bounds but allows one to travel the experience.
507;Although, I think the depth of acting and excellent writing and cinematography succeeds for all.
508;It provides something for contemporary people that the story of Samson or David cannot.
509;the incidental music is Rachmaninov's Piano Concerto #2, with Eileen Joyce skillfully playing the piano and conducted by Muir Mathieson with the National Symphony Orchestra.
510;this movie is in my top ten best made movies.
511;it fulfills precisely what John Gardner said is necessary in a story.
512;Saw this wonderful film 50 years ago.
513;It was great to find it again.
514;"Criterion Collection"" is a gorgeous restoration of an exceptional and enduring work of art."
515;A fantastic film, with brillant acting that is subtle and realistic, and although the dialogue seems a little dated at first, after the first few minutes you forget all about this and are totally emersed in what is understandably a classic film.
516;It's not often that I am so emotional after a film that I just sit there for 10 minutes or so, not wanting to move, but this film had this effect on me, and I would recommend it to anyone who likes a good story and real romance.
517;A heartfelt story about a unexpected love affair between two person's who meet and fall in love, but who are married to others.
518;The chance meetings with persons the woman knows, and how she attempts to cover their relationship.
519;This masterful film shows how hungry normal, ordinary people are for the feeling that life is exciting, and that there is someone who finds them interesting to share it with.
520;So they find it one day, accidentally, illicitly, secretly, dishonestly, soul wrenchingly in a stranger.
521;I think this movie has a powerful message for our times.
522;I love the way the film ends, with repentance, forgiveness and reconciliation.
