id;spiegazione
1086;Only simply because it is one of those rare and complicated films that fuses so many emotions and stories that you're left wondering.
1087;It was a masterful, intricately webbed film about love, hate, failure, death, life, and our own journeys to truth and self.
1088;This film slowly grows into its own darkness and beauty.
1089;This complex movie is superbly acted and directed .
1090;Tom Cruise's Oscar nomination is definitely warranted here, and Aimee Mann's songs are the glue that holds the multiple plots together.
1091;Julianne Moore is spectacular as the harried wife of dying Jason Robards, and Philip Seymour Hoffman is a standout as Robards' male nurse.
1092;A complex story with the whole range of emotions, this is a definite must see.
1093;I have just seen the VHS Version of this movie, and I can tell that with no doubth this is the best 1999 movie.
1094;p. t. anderson continues surprising us with it's assebly of characters, music and dialogs.
1095;I thought the performances in this film were stupendous.
1096;Cruise was nominated for best supporting actor for it and I thought should have won it, hands down.
1097;This movie also can lay claim to the weirdest beginning and ending in movie history!
1098;Penis crazy Tom Cruise gets sensitive enough to restrain himself from kicking a dog.
1099;Julianne's been one of my favorite actresses for a long time, but the script has her only saying variations on the f. word and making unattractive faces.
1100;See it and decide for yourself.
1101;Magnolia was a very interesting movie.
1102;I went too see because of the collection of excellent actors involved.
1103;ridden because she loved him for his fame and money.
1104;I though Paul Thomas Anderson did a fantastic job juggling characters and making me think how they're lives are linked through consequence.
1105;I found the acting incredibly strong and convincing.
1106;The movie clocks over 3 hours and you need an open mind to enjoy the movie.
1107;I would strongly recommend this movie.
1108;Marvellous, divine, angelic, with a good dose of sugar on top and whip cream la mode.
1109;and to make that miracle of reformation happen God will send a powerful sign in the middle of the night from the sky and that I won't reveal.
1110;The taller the tale, the more believable.
1111;An extremely intricate and enthralling story played out by a perfectly assembled ensemble cast.
1112;Just thinking about it makes me want to watch it again.
1113;P. t. Anderson is one of the few directors out there worthy of the title Auteur.
1114;Hitchcock, Scorcese, Tarantino (if he decides to make more).
1115;They are a new breed of director who don't just make movies, they make films.
1116;watch and you'll notice that Anderson is in full control of MAGNOLIA (he wrote and directed it).
1117;He takes long scenes and keeps them interesting by way of great performances and constant motion of the camera.
1118;You feel yourself moving through his films as the films move within themselves.
1119;MAGNOLIA opens with a fantastic first half hour filled with continuous cameral panning, music overlay and character introduction.
1120;It really is one of the most exhilarating openings.
1121;The middle of the film has a musical interlude with Aimee Mann's beautiful song Wise Up .
1122;A very nice and unusual touch.
1123;up to the ending is truly uplifting as John C. Reilly's character talks about people and redemption.
1124;It leaves the viewer with hope.
1125;Because the movie is about the good in people.
1126;The sound is phenomenal, especially with a film whose music is as integral to the plot as the characters.
1127;and 3 hours is a lot to invest in a movie, but if you loved Anderson's BOOGIE NIGHTS, you'll appreciate MAGNOLIA.
1128;Cruise IS as good as the critics said, and everyone else surely deserved to be nominated as well.
1129;Someday The Academy is going to have to offer a BEST CAST PERMORMANCE award, because Anderson's actors are always at their best.
1130;First off, the myriad positive and well.
1131;Then, you have films like 'MY OWN PRIVATE IDAHO' or 'MEMENTO', films that march to a beat all their own and demand that the audience pay close attention.
1132;The flow and ebb of this film is akin to a heartbeat, with natural pauses, natural progressions, natural rhythms.
1133;life of all characters involved, and start to see how they are all connected, each revelation heart.
1134;there's one other factor that goes into watching this film that, while not taking away from it, is absolutely essential in understanding and appreciating it, and that's a certain level of experience and understanding with the lonliness that the film exudes like sweat.
1135;The issues in this film hit home the most with people who've lived a life a little outside the norm.
1136;All in all, I find this film beautiful, heartbreakingly real, and true.
1137;I would hate ruining someone's experience of a film, especially one I love this much.
1138;It is true that he confesses his infidelity to Rose, but I'd argue this is because of his selfish need to unburden himself
1139;The survivors are given another chance and a clean slate.
1140;He wants only to be with her, help her to heal, and listen to her without judgement.
1141;He finally seems to understand how to put his Christian morality to use, and you get the idea he will be a much better, more discerning police officer for it.
1142;This gives the dad a second chance.
1143;He wanted no doubt in the minds of the characters or the audience that this occurrence was divine in nature.
1144;i love, love, love this film.
1145;related and go back and forth throughout the movie, very clever, interesting and well done.
1146;i thought the first song went especially well with what was going on in this movie.
1147;that sequence*many memorable scenes, twists, witty humor, Magnolia will stay with you forever
1148;One of my favorite movies of all time .
1149;One of the few movies I own that I had to go back and make sure I rebought on Blu.
1150;handed), Magnolia seems to me now the most heartfelt and original movie epic since, well, since forever.
1151;(I was going to say since Nashville, but the truth is, Magnolia is a considerably richer and more personal work than Altman's.)
1152;With only his third film, Anderson made a masterpiece, a film that walks the high.
1153;Even so, Magnolia confounded many viewers (myself included obviously) with its brazen originality and disregard for movie conventions.
1154;To fully appreciate the scope, depth, and intensity of Anderson's film, it may be necessary to meet the writer.
1155;As Anderson said to the crew on the first day of shooting, making a great movie is nothing to be ashamed of.
1156;As a work of art, Magnolia is hugely entertaining, as well as being the closest American movies have come in recent years to a genuine labor of love.
1157;Against all odds, Anderson has made an intimate epic that stays true to his individual vision, a film that is both disturbingly personal and sweepingly universal in its reach.
1158;Anderson makes a proud and plaintive cry to be saved from the ranks of the freaks who suspect they can never love anyone
1159;with his ability to pull off something this freakish.
1160;paul Thomas Anderson proved himself to be a truly Promethean talent, a bona fide filmmaking genius.
1161;As Pauline Kael wrote of Coppola in his heyday (The Godfather Part Two), that's the inner voice of the authentic hero.
1162;Brilliantly directed, fantastic performances all around.
1163;telling, with a very original framing device.
1164;Stick with it, it's worth it.
1165;This is the greatest movie than i ever seen!!!!!!!
1166;Paul Thomas Anderson is the best writer and director of all the 90', and an amazing peformance of all the cast
1167;I couldn't recommend anyone away from MAGNOLIA simply because it's worth seeing John C. Reilly's superb performance as a messed.
1168;up cop and William H. Macy's equally fine performance as a former child genius.
1169;I wonder what it's like for a person like p. t. anderson to make a movie so complex, intriguing and interesting that it inspires people to write really long paragraphs about it.
1170;Everyone doesn't just say 'good movie, go see it', they in fact write a really detailed fully paragraphed review that's actually more than just a review
1171;Boogie Nights (especially being written at the age of 19), Punch Drunk Love, There Will Be Blood, The Master and this movie are all masterpieces, this is a what happens when a truly bright intellectualist makes it in the movie business.
1172;Stanley Kubrick, P. t. Anderson and Wes Anderson make truly amazing movies that touch the hearts of the intellectual beings.
1173;Magnolia was a great movie for many many reasons.
1174;The intricate plot, with amazing character work.
1175;and even though the movie is three hours long, it really moves along nicely.
1176;Tom Cruise is absolutely spectacular.
1177;All of the intricate plot lines and character analysis is what makes the movie an amazing joy to watch.
1178;it can really change the way you view life.
1179;Let me preface this review by stating that P. t. Anderson has real potential and Frank T. j. Mackey is one of the all time funniest characters ever to grace the screen.
1180;Tom Cruise gives his career performance, Macy is amazing as always, and Philip Seymour Hoffman is solid as Phil.
1181;PT Anderson's Magnolia is a beautiful picture that tackles many interpersonal issues.
1182;Mr. Anderson has said he got the idea for the film from his good friend Aimee Mann, who had written a song with the lyric, later to be used in the film, now that I've met you, would you object to never seeing each other again?
1183;When newly acquainted with someone you are putting on your best face
1184;So I will run away first before I ruin the good first impression you have.
1185;the filming style of this movie (cinematography) is amazing.
1186;Julianne Moore plays perhaps her best role yet as a woman who marries a man not for love, but for his money and only when he is dying of cancer does she finally realize that she loves him deeply.
1187;the best description of the ideas of this movie comes in the form of the songs of Aimee Mann, on the soundtrack.
1188;She inspired this movie and the music is transcendental.
1189;overall an amazing film, and awkward to talk about
1190;Magnolia is a wonderfully crafted and executed account of 9 people whose stories and troubles are all strangely connected with eachother's.
1191;worthy performances from the entire cast (especially Tom Cruise, Melora Walters, John C. Reilly, and Phillip Seymour Hoffan) and crew (especially P. T. Anderson), this is probably the most underated movie of all time.
1192;Deeply moving, and highly entertaining, this film is nothing short of genius.
1193;this movie, sporting an excellent cast, had great potential.
1194;The first ten minutes of the movie made me feel I was truly in for a great movie.
1195;The next hour and a half kept me on the edge of my seat waiting for how the plots were going to come together.
1196;All I can say is.
1197;when it rains, it pours!
1198;This is my 3rd favorite film of all time besides The Godfather and Pulp Fiction.
1199;Following might be Taxi Driver, Star Wars Trilogy, Fargo, Memento, LOTR Trilogy, Goodfellas, and others.
1200;But anyways, this is truly a great movie.
1201;There's been so much talk about this film, either hearing it's amazing or it sucks.
1202;paul Thomas Anderson is one of the best new directors of our time, and is one of my favorite directors of all time.
1203;Some other new directors to note would be Quentin Tarantino, Joel Coen, Darren Aronofsky, Spike Jonze, Sofia Coppola, Kevin Smith, Christopher Nolan, Guy Ritchie, and so on.
1204;The film essentially tells the story of 9 lives in the San Fernando Valley following one day.
1205;The film is 3 hours, but works perfectly operaticly with the time.
1206;It actually is one of the most operatic movies in the running time it works within.
1207;Read Roger Ebert's review if you want to fully understand why this is such a great movie.
1208;But the story is great, welding 9 stories in one blend of themes and emotions, and I really felt chills down my spine.
1209;It's simply engrossing to experience Magnolia.
1210;I liked Paul Thomas Anderson's Boogie Nights when I saw it a few years ago, so I gave Magnolia a shot after stumbling over it at the video store.
1211;What really suckered me in was the roughly ten minute opening sequence, one of the most original and intriguing opening sequences I have ever seen in a movie, about a murder filled with amazing coincidences hinting at inescapable fate.
1212;But there is something else going on here that transcends these ideas and moves Anderson's picture into the realm of the religious.
1213;Magnolia concerns a day in the life of a host of characters both big and small in modern day Los Angeles.
1214;His concern at the present is a taped interview he agreed to do with a nosy reporter, an interview that ominously threatens to lift the carefully crafted veil of secrecy Mackey placed around his personal life and childhood.
1215;All of the performances in this film are excellent.
1216;As good a job as Cruise does here, John C. Reilly steals the show in the role of police officer Jim Kurring.
1217;Then something remarkable happens: the healing begins.
1218;Match the religious themes with a great soundtrack, the performances, and the somber feel of the film and you have the makings for a marvelous three.
1219;as far as the movie, I really enjoyed it.
1220;A masterpiece movie that gets under one's skin and grows in retrospect.
1221;this is one of my all time favorite soundtracks.
1222;Aimee Mann, who incidentally was the inspiration for a few of the story lines, singing Save Me, Wise Up and covering Harry Nilsson is a thing of beauty.
1223;I loved this movie the first time I saw it, but I knew there was something more to it.
1224;The way the director pulls you into each of the nine characters is amazing, and the climax was hilarious, awesome, and disgusting at the same time.
1225;There is also some symbolic play with the colors used.
1226;If you have any insights into this I would love to hear them!
1227;I absolutely love this movie, and keep learning more and more about it every time I see it, which is only two times.
1228;And if you missed some of these things, try watching it again, and maybe you'll see something deeper.
1229;This is a review of a great film, that I like a lot.
1230;What a really great film, just great.
1231;He may be a visionary, but not a writer.
1232;This movie is sprawling and sometimes disconnected and pure genius.
1233;time top ten favorite movies list, but I have noticed that a lot of people either love it or hate it.
1234;The packaging was nice and snug.
1235;Very trustworthy and worth every penny!
1236;Made a wonderful Valentine's Day gift.
1237;Thank you for my movie!
1238;This is a movie of characters facing great challenges in their life and how each individual challenge is linked together.
1239;The acting is terrific, the use of music superb, and the view of life as a depressing weather forecast is clever.
1240;Magnolia is one of the most fascinating movies ever made.
1241;Best thing Moore and Cruise have ever done, and that's saying something!
1242;Macy and Reilly are terrific.
1243;Ranks up there in my top five of all time.
1244;Tom Cruise's performance alone was worth watching the film.
1245;I had a great feeling about this film when it started.
1246;The opening scenes concerning coincidence were great, and the sharply edited introductions to the characters had me expecting something truly exceptional.
1247;So from the outset I had this feeling I was really going to enjoy this film .
1248;I usually tend to love or hate films, but with this one it's both at the same time.
1249;There are some truly outstanding performanes here, and there are moments of genuine brilliance in terms of direction, script, camera work etc. which made me feel I was watching something truly special.
1250;all of a sudden, my feelings of 'this is an incredible film', started to be replaced by 'I'm being preached to'.
1251;To conclude, it's a brilliant idea, marvelously acted .
1252;I'd recommend that people see this film to make up their own minds, and I'm glad I saw it myself .
1253;It is a movie of urban legends, wrath, human sense and sensibilities.
1254;Paul Thomas Anderson (Punch Drunk Love, Boogie Nights among others) both directed and wrote this eclectic film.
1255;The film was very creative in using narration, the beginning history lesson on chance and during the film, chance sums up the film.
1256;It was one of the most creative films made, packed with stars and I will guarantee you that you have never seen another film like it.
1257;The film follows the trials of people, successful and outcasts and had some great performances and ended with religious overtones (the wrath part), maybe as a metaphor for how the people in the film lives developed and ended.
1258;I loved it not knowing it was hollywood.
1259;the characters are totally real.
1260;On the edge of being a general character but very very real.
1261;This movie is real be quiet.
1262;But the director is nice to rich, powerful people, so, despite this schlock and romance novel show, I'm sure he will annoy us on Oscar night for many years to come.
1263;A story that reaches into the human sould and reveals all of the dirt and all the beauty.
1264;It is human and that is probably the best term that I can use to describe this epic story.
1265;One way that you can tell how good a movie is the response that it generates.
1266;Well I loved it and I will tell you why.
1267;It is what we are and it shows what we can be.
1268;It will split you open and tear you apart on a first or second viewing.
1269;When I first watched this movie, I thought the prologue was ingenius and totally got drawn in to the story.
1270;We treat each other wrong and do it over and over.
1271;now I realize how powerful and amazing this movie truly is.
1272;I have to see it again!
1273;What I liked about this movie is the characters.
1274;They are frail and have weakness in them, and sometimes you have to look for reasons to like them, like in real life.
1275;Tom Cruise takes a good turn here, I think, better than most of his movies.
1276;There is a Frank TJ Mackey infomercial that is hilarious, some deleted scenes (check for them on the color bar segment), and a nice Amy Mann video.
1277;There was a great story, incredible actors and performances, wonderful photography and production values, but a butchered screenplay and editing job.
1278;Crash got 4 1/2 stars from me, this gets 1 1/2 stars, strictly for the technical work and acting.
1279;MAGNOLIA is one of the greatest movies ever made.
1280;I have watched it many times and am still in awe.
1281;This film, this Magnolia, was a piece of heavenly humanity on film.
1282;We see a number of seemingly all.
1283;This something comes together in many realistic ways but under the umbrella of a miraculous event at the end of the film.
1284;The man's son, Tom Cruise, is living with his own pitfalls and attempts harboring his pain by playing the daily role of a extremely confident sex guru.
1285;Tame her is his theme and his following involves thousands of men with voids themselves.
1286;there is a Christian cop who has the heart of a lamb but the insecurities of a psych patient.
1287;It is their relationship, in my opinion, that steals the show.
1288;there are others, of course
1289;manages to steal our hearts in a handsome display of well.
1290;Despite their confident smiles and tones, each person in this film is deeply frail.
1291;a stirring film with raw emotion and deep compassion.
1292;provoking and beautifully graceful, Magnolia is an emotional powerful film if there ever was one.
1293;If you have three hours to spare, give this film a chance!
1294;cute, all lower case p. t. anderson in Magnolia's credits)is both a wonderful writer and director.
1295;I loved both Hard Eight, and Boogie Nights, in which he managed to wring an interesting performance out of drab Mark Wahlberg.
1296;there is an assortment of interesting characters, who deliver at times great, wholly unique believeable lines ( It IS safe to confuse children with angels! )
1297;driven as it is emotions.
1298;For over three hours, we see characters agonize their way through their day.
1299;beating hysteria that characterizes most of this movie.
1300;Hidden themes, unveiling of an extraordinary plot, and the correlation of all the actions and words out of a character to build up to one of the most mind.
1301;moving endings that a movie could possibly offer.
1302;The cinematography is perfect, used to enhance each moment of this drama.
1303;The musical score and soundtrack for the movie is practically award.
1304;Watch it with an open mind and look hard and try to reveal for yourself the true theme.
1305;If you do this successfully, you will find that Magnolia is the best movie you have ever seen.
1306;The power of this film is however the brilliant directors ability to blend these stories into a tale of the bizzare and the unusual through one day in the San Fernando Valley.
1307;The mix of characters are moving and the stories can make you think and make you cry.
1308;Next to American Beauty this is my favorite film of 1999.
1309;Paul Thomas Anderson's Magnolia is a brilliant film.
1310;Anderson beautifully directs this film to perfection, and makes us want more.
1311;This film will keep you hooked from the beginning to the final conclusion, and I highly recommend it if your a fan of Anderson's other 2 films.
1312;also to be applauded is the music, by Aimee Mann.
1313;He's saying that life mirrors nature.
1314;that life's imperfections, indeosyncratic ripples, and poignant stories all interconnect and depend on one another.
1315;Anyway, Aimee Mann's soundtrack caps of this fulfillment of one of the greatest motion pictures every made.
1316;This film is emotionally charged, tapping into the strongest feelings that we have: love (whether it be heterosexual or homosexual), loss, and ultimately happiness and reconciliation.
1317;I thought it was pretty clear what the climactic moment of the movie was (coughfrogscough).
1318;another thing that Hoffman said was that he loved playing a good guy, someone with real morals and his ducks all in a row.
1319;I admire Anderson for directly confronting this trait of our society.
1320;so go watch all of your wonderfully hip stories of losses of innocence and sadness.
1321;See if you get any emotional fulmillment.
1322;The unusual narrative, which jumps from one storyline to the other, adds a lot to make magnolia a very special movie, certainly unlike any you've seen.
1323;The mix of the stories is very well conducted, not rendering your mind useless if you blink, like other I've seen experiences on this area.
1324;It'll stay on your mind, keeping you thinking, and soon you'll watch it again.
1325;And you'll find it even more pleasant.
1326;The movie is long, but will keep your mind's attention.
1327;A good friend of mine reccomended this movie to me, telling me it was good.
1328;The same goes for Unbreakable , which I thought was a genius film.
1329;All of the charcters are very believable in the sense that their personality traits are very common, however beautiful or ugly they may be.
1330;I personally HATE his idea, but it is the fact that he is a human being, and that nobody is perfect, that makes it believable.
1331;The best scene in the movie, by far, is the universal singing scene.
1332;That's one of the few scenes in a movie that has ever made my eyes fill with tears.
1333;It wasn't sad, but it was just so powerful.
1334;This film is a true piece of art.
1335;This film is a true masterpiece.
1336;I hope he knows that he has made one of the greatest films of all time.
1337;This film changed my life, it is filled with ideas and stories and scenarios that you will most likely relate to yourself, at least with one of them, but this filmmaker masterfully crafts these multiple stories and characters and never leaves any of them hanging, they all have their voice heard and will have you discovering meaning with each additional viewing.
1338;This movie held my interest, particularly because of the cast.
1339;The acting was exceptional, though at times, I felt that maybe some of the performances were a bit over.
1340;Paul Thomas Anderson's Magnolia is a beautiful, breathtaking collage of a film, a rare three hour movie that doesn't seem it's length.
1341;Every scene matters, and the haunting music of Aimee Mann, whose Save Me was nominated for an Oscar, drives the film and gives it a unique grace.
1342;Magnolia takes place on one eventful day in the lives of eight men and women living in California.
1343;There are several themes that run through all of the stories, namely the search for real love, the death of fathers, misunderstood children, and the need for forgiveness.
1344;ridden about her infidelity, and his estranged son (Tom Cruise) has become a popular sex self.
1345;Claudia also begins a tenative relationship with a well.
1346;these characters and their stories all interconnect in surprising and moving ways, and Magnolia emerges as a study in human connection.
1347;The performances are outstanding all around, with special credit going to Tom Cruise as the ferocious Frank Mackie, and Julianne Moore, whose Linda spends much of the film on the verge of a complete breakdown.
1348;John C. Reilly also impresses in a role that is a nice change from the clueless husband he played in The Good Girl and The Hours.
1349;Also noteworthy is the fantastic performance of Jason Robards, who conveys completely the slow, painful indignity of death.
