id;spiegazione
532;the film has a wide assortment of characters with the key being that they all intersect and through association, know each other.
533;magnolia I think is one of those kind of films where there's just a genuine spunk of energy and spontaneity that even if you didn't like it, you had to admit there's a lot of passion to make it work and everyone gives it their all.
534;solid performances all around from Cruise (yes, I said him: forget the crazy antics, when he wants, he CAN act) to the Reilly/Walters story to the confidence in the writing and directing, it's a film I can certainly appreciate.
535;From the characters to even the pacing and several memorable moments, there's always something that'll click.
536;minded filmmaking to the Matrix and its visuals, Magnolia fits right in.
537;hour film, but Magnolia's fascinating plot and eccentric characters captured me.
538;There are other stories in the film.
539;This is a rather touching film that should have gotten more recognition.
540;Believe me, it's worth it.
541;This is one of the very few movies that I felt a deep emotional connection to upon watching.
542;Magnolia is truly a remarkable piece of artwork, and a must.
543;see film for any movie lover.
544;certainly one of 1999's best and most misunderstood films, magnolia is not for everyone.
545;it is most certainly an arty film, and a dificult and sad one to watch, but is most worthwhile.
546;ooh and the extra stuff on the second disk is very good.
547;a wildly overpraised movie that will leave you with an intense headache from its length and volume as well as three hours gone from your life.
548;thread story in this film about life and the strange turns it sometimes takes, and the connections that exist between its characters.
549;A wonderful movie, a film buff's movie.
550;In this sense, the movie is no more realistic than those sentimental films of the past, where everyone is a good decent person at heart, and the good guy always does well in the end .
551;image will be applauded just as much as the original was.
552;the movie features excellent performances (however, not Tom Cruise), good production, and powerful direction.
553;One common consequence of one.
554;Worst movie I ever seen.
555;Better yet find 3 hours of something better to do.
556;Frequently refer to this as my favorite movie ever, it's more than just good it's one of the best modern movies ever made.
557;This film provides an emotionally powerful character study of emotional trauma, naked pain, bitterness, forgiveness .
558;The cast is simply outstanding, and Paul Thomas Anderson is a brilliant writer/director.
559;tom Cruise gives arguably the best dramatic performance of his career, and as far as I'm concerned, was downright ROBBED of the 1999 Best Supporting Actor Oscar.
560;I suspect that the real reason he didn't win (and Michael Caine did for that cinematic snorefest The Cider House Rules) is because Hollywood is just plain jealous of the guy: He's good.
561;The Academy will probably make Cruise wait a while (like Steven Speilberg, Julia Roberts and Al Pacino had to wait) before bestowing Oscar gold upon him .
562;crafted film with a good script and good acting but one of the best films of '99 and groundbreaking?
563;Everyone from a genius kid on a quiz show to a TV.
564;The first hour of the film is the best because it sets up all the conflict and introduces us to a handful of interesting characters.
565;The acting is very good for a Hollywood film.
566;If you want to see real family tragedy at it's best you should see clips of Jason Rubert Jr. performing Eugene O'Neill in the theater.
567;I won't give away the ending but I thought it was very contrived and tried to be arty and symbolic without making a good film.
568;Magnolia is by no means a bad film and I recommend watching it but I can't even begin to accept it is brilliant and groundbreaking.
569;Boogie Nights still remains Paul Thomas Anderson's best work so far.
570;earl (Jason Robards) is tragic and likeable enough.
571;earl's wife (Julianne Moore) is gorgeous as ever, but her character again doesn't seem to affect the plot much.
572;earl's male nurse (Philip Seymour Hoffman) gives one of the better performances of the film, and he is probably the most likeable and engaging character of them all.
573;the Cop (John C Reilly) is convincing enough as the clumsy cop he plays and another likeable character, but again, as pointed out by Richard .
574;stanley (Jeremy Blackman) puts in a fine performance as the young prodigy forced into the limelight, and is another likeable character.
575;kid Donnie Smith (William H Macy) is strangely likeable even through his irritating self.
576;providing one the films twists near the end, and is well played.
577;all the actors actual performances AS their characters are very good, as are the direction, score and screenplay.
578;the film does of course, have many good points, including, as mentioned, it's introduction and it's score.
579;PT Anderson is a great director.
580;when i first watched it i felt as though there was a little part of me in every charcter of the film and that's what got me so emotially attached to it and why i loved it so much.
581;i was really impressed with Cruise's part in the film.
582;he did a really great job of acting like the egotistic male then being complealty sensitive on the inside.
583;After all, it won a lot of awards.
584;a very dark yet magnificent movie.
585;all the symbolism makes this movie the best one yet.
586;Very powerfull movie with lots of meanings.
587;I give two thumbs up to the director also for being able to bring this stories together and making them whole.
588;Definitely a must see if u like movies that are odd yet make sense.
589;Magnolia is an interesting film.
590;It is littered with colorful characters, and each has a story to tell.
591;As I said to a friend, Magnolia would be wonderful if it was cut in half and made into two seperate films.
592;And believe me, this movie has many strong characters and actors.
593;The only character I could connect with was Tom Cruise's, because Cruise gave easily the best performance of his career.
594;So, take the advice, P. t., keep writing these interesting characters but please please keep the time to two hours or less.
595;Skip this one and go do something worthwhile.
596;MAGNOLIA is one amazing film.
597;it is quite bizzare and you really have to pay attention.
598;it has a great cast and was one of the best films i have seen in a long time.
599;the other features were ok but the movie is the real prize.
600;He changed my life by making this exquisite, beautiful epic of eleven interwoven, powerful, and stunning characters.
601;What I will speak about though are the characters.
602;What made this film so exceptional was that the characters ARE life.
603;They all experience emotion that we, the audience, as normal people, relate to becuase we feel the same emotions.
604;melora Walters was so honest as Claudia.
605;Julianne Moore (my favorite actress) proved once again that she can take on any role given her (this is probably my favorite performance from her).
606;He is surely one of the most honest and controversial filmmakers today, and I can only hope that his career blossoms with Magnolia, definitely his best film to date.
607;p. t. a. has courage to show us what life is, and for that he should be commended.
608;It is now my goal to make films, because of the beauty of this one, and Magnolia is surely not only my favorite film, but also the one closest to my heart.
609;top performances call more attention to the fact that the viewer is watching a movie .
610;one amazing thing about this film is how the score enters and simply does not know when to stop.
611;In giving the film two stars instead of one, I found a couple storylines interesting.
612;The interview and gradual breakdown Cruise shows is believable.
613;important monologues and camerawork that aspires to Kubrick and Scorsese, I will watch the real archetypes at work in the future.
614;Thanks to everyone who's been writing reviews.
615;What a powerful, powerful film.
616;If you haven't seen it yet, hold on, give it time, stay with it.
617;The connections of characters, themes, cuts, and music are all perfect.
618;egypt certainly clinched that image.
619;like Leonard Cohen's powerful song Future .
620;character told guys to lie about to women but the policeman is sincere
621;It has been vastly UNDERrated!
622;The cuts, the characters, the music, the themes: Get it right for yourself and give a hand to those around you.
623;Just know, this movie is worth your time
624;it's modern poetry, beginning with the title.
625;He is right though, you do need brains to watch and understand this movie.
626;I thirst for more, enlighten me again Mr. Anderson.
627;Life is dark and beautiful at the same time, don't you think?
628;Paul Thomas Anderson's sweeping, biblical film is too epic for its own good.
629;Every scene is overflowing with emotion, and it becomes exhausting to watch after the first two hours.
630;The film is very self.
631;indulgent, and it could win the award for the most hubristic piece of cinema I've ever seen.
632;It's all in their, every theme you could ever want.
633;On the better side, the acting is fabulous.
634;It found it to move rather fast.
635;Magnolia is one of those films that we're told is 'important,' so you see it.
636;Fun in the sense that I enjoyed bouncing from one interesting character to the next, wondering when I'd get to go back to another character and see where they are in the grand scheme of things.
637;the performances are very good, with a lot of Anderson's regulars here.
638;Each character is well developed and enjoyable.
639;The film is a bit long but nevertheless enjoyable.
640;Tom Cruise is wonderful as the smarmy seduce and destroy seminar leader, until the deathbed scene near the end, when he goes right over the top, wailing and flailing.
641;i keepreading that 'Cruise steals the show' that is a lot of .
642;The length is good for this type of movie.
643;it is brilliant, i am actually writing this as i am watching it for the second time.
644;For most other movies you always feel this 'great sensation' of suspense at the very end of the movie.
645;so those are just a few things i thought i should share.
646;It is a near masterpiece.
647;Cruise manages to shine, delivering an energetic and overall excellent performance.
648;And be weary of all the great reviews.
649;Can the world really be this messed up .
650;People are very good about not revealing much about it, as it is an indescribable piece of work.
651;I responded to this film unlike I have responded to anything in a long time.
652;from reading the reviews before me, I can certainly see that this is a work that begs for opinion.
653;we take a beating), cancer, the foibles of humanity.
654;Anderson jumps around his world, makes up rules, breaks them.
655;He puts the unconventionality in your faCE, and lets you know that your life watching this film is going to go on the same ride that the characters go on.
656;I think Cruise is excellent.
657;John Reilly is fabulous as well.
658;Well, let's face it, this is a wonder cast.
659;one possible drawback There is one great moment in the documentary where Phillip Baker Hall is lamenting the use of the f. word so much, and that certainly is a quandry.
660;I think this is one of the most original, challenging pieces I have ever seen.
661;You will love it, or hate it.
662;i love the Wise Up section.
663;after all, this was such a highly acclaimed film that I owed it to myself to give it every change possible.
664;Whoever knows he is deep, strives for clarity
665;combined with outstanding acting .
666;particularly from Tom Cruise and Phillip Seymour Hoffman, snappy dialogue and wonderful directing, Magnolia is a film that speaks to your heart.
667;But PT Anderson creates engaging scenes and dialogue (watch Henry Gibson at the bar) and pulls you all over the place.
668;it's possible to be a fan of Altman and enjoy this movie.
669;Watch it, then go check out Hard Eight and Boogie Nights and watch for the same camera tricks PT Anderson has been using since his first film.
670;There have been many terrific reviews written by other Amazon members that go into great detail about why this film was fabulous or why it worked or didn't.
671;Magnolia is a near masterpiece.
672;to the decision to keep super star Tom Cruise's name in the background .
673;Now that I've seen Magnolia on video and have finally been able to philosophically, intellectually and logically string together its elements, there is no doubt that this is a wonderful accomplishment on film.
674;Magnolia takes you on a journey whereby a master story teller challenges you to hang onto a breathtaking ride of images, content and music, and find the thread that strings everything, including the last 20 minutes.
675;But it's also worth previewing.
676;I guarantee you will enjoy it.
677;The acting, the story, the dialogue are consistently mesmerizing.
678;it's 99 7/8ths the work of a young master.
679;Magnolia Should have won an Oscar like Crash.
680;but the real great movie was Magnolia and timing is everything.
681;provocative Performances from everybody in it.
682;The cast list reads like a Who's Who of contemporary character actors, each pitch perfect in their role.
683;The direction and cinematography are obsessive in detail.
684;it is a challenge to its audience's aesthetic expectations and their humanity.
685;Those that meet the challenge, who are willing to forgive Anderson's pretensions, as his characters ultimately forgive each other's, are rewarded with one of the most emotionally involving and wrenching films of this or any age.
686;Full of revelations, this movie is a complex study of the human psyche.
687;A self proclaimed womanizer, a gold.
688;You can understand and empathize with their lives.
689;It allows you to understand what compels people to make the choices they do, while taking little pity on them.
690;It gives you a behind the facade look at characters that film rarely portrays.
691;He lets you make your own associations at your own pace.
692;Three times in the movie he links all of the characters together.
693;1) Through watching a popular television show.
694;2) Through singing a popular song.
695;On a deeper level it reminds us that we are all connected just by being humans on the earth.
696;It brings them back into reality, reminds them we live in an unsure world and you don't always know what is going to happen next.
697;You can watch this movie time and time again each time taking away a new meaning and a new level of understanding.
698;In the end, I was quite impressed with its boldness and emotional power.
699;It was a very good film.
700;From the first frame it struck me as daring, vivid and unconventional.
701;But I was still captivated by what I was watching.
702;Every actor fit his or her part perfectly.
703;I saw a film that had a genuine message and took risks in order to convey that message in the most effective way.
704;But this scene, while admittedly fantastic, worked.
705;Another message I saw is that we must challenge ourselves to be honest, open and forgiving.
706;But by the same token, I saw each character show genuine happiness and contentment as well.
707;I understood this to be an expression of how we all have happiness and sadness, and the best way to find peace and love is to be yourself.
708;And if you are fascinated by the human condition and life in general, and if you find bad situations slightly humorous on some level, then you will love this movie.
709;It is also one of the finest castings of Tom Cruise that I've ever seen.
710;it is the best movie I have ever seen.
711;he should have won the Oscar.
712;John C. Reilly was great.
713;Movies lacked originality, message, and art.
714;magnolia is one of the new breed of movies that tells a story with thought, grace, beauty, and sincerity.
715;Along with Crouching Tiger, Hidden Dragon and Traffic, I am proud to be a movie.
716;tell the movie industry that the public will reward them for a brilliant, creative product.
717;It is refreshing to see him play a guy with some issues and a pretty crazy profession.
718;When will I learn?This movie is fantastic!
719;Incredibly complex, yet it all fits together.
720;Paul Thomas Anderson is a brilliant director (and scriptwriter.)
721;worthy performances, most notably Julianne Moore and Melora Walters.
722;(The frog scene on the other hand was great!)
723;So many things seem to be happening at once and watching it is very intense.
724;it only stands to reason that such an ambitious movie production would of course take on ambitious subjects of the human condition.
725;It opens showing a series of humorous events, supposedly true, about strange coincidences and unexpected connections between people.
726;The whole movie expands on this theme, with a large ensemble of characters are unexpectedly linked in various ways.
727;As we follow the characters on one particular day, we explore how hate and insensitivity cultivates itself, what it means to be in love, what it means to be human, and how small compassionate acts can extinguish hate and lead to redemption.
728;The movie is more of a stunt show showing these ideas in rapid fire action, rather than contemplating them.
729;This is a movie that prefers to yell rather than whisper, but succeeds because of its creativity, ambition, and fearless risk taking with the material.
730;Great move, performances and intrigue!
731;I also watch this at least once a year.
732;Love moves that depict unique interconnections.
733;Tom Cruise is great, William H. Macy is great.
734;It's great weakness is the ending.
735;Something greater is at work here connecting people's lives together.
736;Audiences and critics alike see that the film lasts over 3 hours and think, Oh wow, a 3 hour movie, that's gotta be good.
737;There has to be a lot in it for it to last 3 hours!
738;The performances are so over.
739;Avoid this movie at all costs.
740;Fans of Hollywood endings and/or happy flicks probably would not be a fan of this beautiful movie.
741;Many critics comment on the length of the film (3hours) but I believe every moment is vital.
742;The mood of the story is somber but there are many funny moments throughout Magnolia.
743;Tom Cruise is amazing and provides much of the comic relief in the beginning of the film.
744;I watched this film numerous times (a sign of a good movie) and it gets better each time.
745;Fans of intelligent cinema will enjoy this gem.
746;I was first introduced to PTA via Boogie Nights.
747;If you liked that film, you should love Magnolia.
748;Paul Thomas Anderson (fans call him PTA) sees life through the eyes of a film.
749;He gets his actors to act in ways you never thought they could.
750;he gives them lines and films them in ways that draw you into their lives.
751;Yes, it's a morality play at a time when we need morality plays.
752;There is a right and a wrong, and strange things happen, but there is justice, and peace, and love after the rain of frogs.
753;magnolia itself is a rain of frogs, and nothing will ever be the same for you once you've succumbed to this beautiful, disturbing storm of emotions.
754;it's an amazing piece of work and has stayed with me all the this week since i saw it.
755;it resonates on so many levels, lonliness, realization, family relationships.
756;aimee mann's music fits so well into the film, you aren't even surprised when the characters start singing halfway through the movie.
757;crafted, meandering and beautiful film.
758;never a strong actor to begin with, he almost manages to wring a believable performance out of the script, when he's clearly outgunned by the rest of cast, who are strong and incredibly understated.
759;For all the reasons that audiences praised American Beauty for depicting the human experience on film, Magnolia adds a more realistic, relatable, and multi.
760;layered version of modern day themes of humanity.
761;It is a reflection of our own lives, flashing back to us a reminder of what's important in life and how it's never too late to make amends for lifelong mistakes.
762;on a technical note, the soundtrack is beautifully implemented and the picture quailty is very detailed and clear.
763;Most important, this is a movie where the extra disc full of bonus materials will help to illuminate the mulitple dimensions and deeper layers for the film.
764;simply put, this film is an amazing work, more deserving of Best Picture than American Beauty.
765;Magnolia is a film of the highest regard, taking on a massive amount of story and turning it into three hours of nothing but real.
766;This is done with the utmost precision and intelligence in storytelling and brilliance, providing an intriguing and mesmerizin look into their lives.
767;the cast, the moving ways in which the script manipulates them, and the overall effect are outstanding, making this the best picture of 1999.
768;But I wanted to see PHillip Seymour Hoffman, who is, as always, wonderful.
769;This is one of those movies you don't see often.
770;The way of filming isn't normal either, and I think that real movie lovers will love this movie because of the beautifull way of filming and montage plus the very good score and songs which fit perfect in the film.
771;the movie begins brilliant which shows right away that this isn't a normal movie.
772;The acting is also fantastic, from the prefect preformance of Tom Cruise as the sex.
773;therapist to the boy genius.
774;i think this movie is a must to see for all movie fans, and you will like it as well if you like strange and very deep movies.
775;PT Anderson pulled of an amazing bit of magic with this dark, intense, maddening but oh.
776;are amazing: Hoffman, J. Moore, Walters, John C., and William H. Macy who is simply astounding.
777;I know some people find it tough going or are intimidated by the long running time, but patience here provides an amazing reward.
778;I loved every hour of this monster masterpiece.
779;The plot defies description, so many diverse lives, so much desperation and beauty that the mind reels.
780;Somehow it all comes to about as much resolution as any life does.
781;Watch this work of art with an open mind and heart.
782;the complex themes and character development take time to fully comprehend.
783;True art makes you think a bit and helps you see the beauty in even the rough parts of life.
784;about the aesthetic appeal of the movie .
785;Aimee Mann's soundtrack played an integral role and helped create a definite mood.
786;Go watch it yourself
787;Great, the bible says something about frogs in a verse that was referenced throughout the movie, but come on.
788;Once again, I can respect the director's idea, to show how the random events in a series of lives intertwine, but overall I did not enjoy this movie the least bit.
789;I give the director an A for effort and originality, but I give the movie a big thumbs down.
790;I can only hope that Anderson wakes up and goes back to making a really good film like he did with Boogie Nights and Hard Eight.
791;Either one will be worth owning.
792;It documents stories of amazing coincidence that have occurred in real life, and then tries to establish freak coincidence as the theme of the film.
793;Has anyone ever been successful at this?
794;7) Anderson throws in every issue he can he to give the film more dramatic heft.
795;let it be known that I enjoyed PT Anderson's last two films.
796;They were tightly constructed, entertaining, and always made sure to not take themselves too seriously.
797;The performances were all great.
798;William H. Macy was excellent!
799;He had the best line in the movie, I've got some much love to give.
800;Anderson's developed an innate talent for crafting versatile, flawed, joylessly realistic characters facing the end of their rope, and in that regard this might just be his best work.
801;While the author's deliberate pace is admittedly a major hurdle, it also allows him to explore his cast to an intimate degree that's untouched by his contemporaries.
802;A terrific exercise in characterization, it's tragically narcoleptic at times.
803;this film is absolutely for you!
804;Though it's longer than most viewers would like, or even be able to stand, it was worthwhile.
805;I was so completely taken in by the strange depth and profound troubles of the characters that unfolded more and more through the film, along with the slowly revealed motivations for their actions and their unexpected connections to each other simultaneously, that time flew by without my awareness.
806;And Mr. Tom Cruise's Academy award nomination was no accident or publicity stunt
807;And as far as the screen play is concerned, the recurring line about the past in this movie is one that should become a part of cinematic history.
808;worth seeing more than once.
809;It's more like a well orchestrated opera .
810;or like a carefully crafted car: everything works so in sync that the final result is visually, mentally and spiritually enjoyable.
811;magnolia is a movie with amazing characters, a well crafted plot, dark.
812;comedy moments, some surprising twists and a lot of provoking visual metaphors.
813;No moral lessons here, just a fantastic portrait of our world on the stories of these persons and the (casual?)
814;all united under the fantastic music of Aimee Mann.
815;funny how 9 years ago, when the movie first came out.
816;but now 9 years later, I watched the movie again,and this time I have to say that I liked it.
817;I TRIED to enjoy this film, very hard, in fact!
818;Simply for the fact that super star Tom Cruise and wonderful character actor Philip Seymour Hoffman were in this film.
