id;spiegazione
1;I was fascinated at first with how intriguing Magnolia seemed to pretend to be.
2;Great performances by he actors.
3;all did a charming job.
4;Half the movie was a music video for Aimee Mann's great songs.
5;as the movie has it .
6;Still, the experience, once experienced, will loom larger than the grudging, prosaic truth .
7;this is also the best movie of its type since Short Cuts.
8;What is important to some may not be to others, but director Paul Thomas Anderson obviously wanted to say something he felt was important and I believe he accomplished that goal.
9;There is a beautiful poetic sense here that I feel was overshadowed by last year's poetic champion, American Beauty.
10;The last hour is when I begin to feel being in the theatre, but the ending always makes up for it and revives me.
11;This film deserved far better accolades than it received.
12;It is funny how Hollywood demands seriousness and self.
13;This is tragic, because the Boogie Nights commentary was so good.
14;Sound and picture are very good.
15;there is a lot of gratuitousness.
16;the acting is what saves it from a one star rating.
17;This is really a great film.
18;The interplay between Cruise, who gives a performance which is just beyond belief, and his father is remarkable.
19;The end is very unique and special.
20;Alot of credit to those involved.
21;The movie starts and you're caught in the stories that life can offer for us to know, and with the hand of liitle more than genious Paul Thomas Anderson, Magnolia offers you the chance to experience sweet, sour, devastating, funny, dramatic moments in the life of some people one rainy day in San Fernando Valley.
22;Mellorah Walters performance is magnificent.
23;Laughing, crying or screaming, Mellorah manages to capture Claudia's constant desire to be saved and loved.
24;One of the last genuine good people left in San Fernando and the world, jim's only wish is to help people and find someone to love.
25;Tough sometimes ingenuous jim manages to make you beleive in his good intensions towards others.
26;Phillip Baker Hall is superb displaying an amazing dominium of his experienced actor skills.
27;A regular family man, famous host of the most popular tv show ''what do kids know?''
28;Claudia's secret is then revealed and so is jimmy and our minds and judmental side start to interact with this complex characters.
29;The whole character is defined with his great dialogue.
30;''I really do have love to give.
31;the new star of jimmy's show.
32;julianne Moore, truly one of the best actreses of our time.
33;she asks him with a look that says more than her vivid words.
34;Tom Cruise's greatest performance so far, another great character with a big secret about his past.
35;In his case, his past is revealed in front of the cameras by a reporter.
36;Cruise's performance at these scenes is just amazing.
37;Earl's nurse, phil feels that he has the need to help earl's final whish come true and he works as a channel for it.
38;phillip seymour hoffman's performance is remarkable even in the little scenes.
39;These scenes are also great.
40;all in all magnolia is a great piece of cinema and something is garanteed, at some point even if its just a second, you will see your self there at San Fernando valley one rainy day.
41;studded film that presents varying perspectives on the coincidences of life.
42;Good and bad happenstances that intertwine for an entertaining look at life and the ripples that flow from ordinary people caught up in extraordinary events.
43;Those that thought it was brilliant and moving, and those that thought it lacked interconnectedness and was perhaps somewhat pedantic.
44;O. k., I concur that all the elements don't always appear to fit together as a seamless package.
45;still, this movie is, without a doubt, powerful and stirring.
46;It WILL make you feel something and that is the true criterion by which to judge a movie such as this.
47;As an aside, a suggestion for viewing.
48;This movie has great power.
49;Try to enjoy it for what it is, and not what you might wish it could be.
50;It's an amazing film when the brain allows a moving step to the next faze of live to be better of as defined by Abraham Maslow 1908.1970 with his Maslow theory.
51;I've liked Boogie Nights .
52;Taking home the second of the year's floral offerings .
53;I was preparing myself for something very rewarding.
54;for the first half an hour I was intrigued by the 3 accidents .
55;i sat back and thought .
56;my attention span exceeds the movie's length by couple hours.
57;when the transitional age comes everything is so complicated, nice people just pretend to be nice, your body changes and demands it's due, you get nasty, you flare up.
58;later we mature, become more balanced, see things in a perspective, acquire stoicism and understanding, the will to carry on.
59;Ambitious and undereducated genius wants to show us the way life is, the adult life, the life that provided him with so few meaningful experiences.
60;and her touching narrative is transformed into the nerve.
61;one of the central to the film.
62;also has to be used to the full.
63;the film is twice the normal size .
64;I've married him for money and now I love him!
65;Yes, the finale is unexpected.
66;Tom Cruise shines in this movie as a boisterous chauvinist self.
67;It is a compulsively watchable movie, even if the ending is a little inaccessible to the audience.
68;This is a must for anyone interested in how films are created, from the concept to the script, to the actual shooting.
69;I adored Boogie Nights and thought the cast and director could only top it.
70;But my research revealed mostly positive ratings by reviewers.
71;if you want a positive look at some of the same types of problems, with fine performances and useful insights, try Lawrence Kasdan's Mumford or Grand Canyon .
72;i love this movie it is one of my favorites.
73;its a good movie i recommend it to any one
74;This is one of the best movies I have seen in a long time.
75;Though it was long and I was exhausted by the end of the movie I really felt it was a great movie.
76;A Wonderfully quirky MovieWe enjoyed seeing this again as we haven't seen it since it first came out.
77;We enjoyed the music score and the humor also.
78;I will instead give my personal experience with this movie.
79;After 12 years I still listen to it regularly, and in fact I'm listening to it now as I type this review.
80;It's sad and poignant, and the music and the movie fit together perfectly.
81;The people who passionately love this movie love it on an emotional and experiential level.
82;Just remember that there's only 1 first time, and if you love it, be prepared to watch it again many times.
83;There's the question of Tom Cruise's performance, as well, undeniably forceful, yet a touch shrill and mannered for my taste.
84;PT Anderson, America's finest young filmmaker, worked on two excellent movies before this (I'm especially impressed with Boogie Nights ), but who could have expected such an awesome, ambitious, utterly outrageous monster like Magnolia on only his third try?
85;Indeed, this is a visionary work of art, one that gazes directly at the tempest of modern life (and death) without flinching.
86;At the very least, he had me thinking about such things, which is a rare accomplishment for a mainstream American movie these days.
87;She's absoltuely stunning here, in what must have been a quite challenging role.
88;The fact that she's matched strengh for strength by a huge ensemble cast that includes John C. Reilly, Phillip Seymour Hoffman, Melora Walters, Phillip Baker Hall, Melinda Dillon, William H. Macy and the great Jason Robards only reaffirms what was obvious from Anderson's previous two outings: He's a great actor's director, capable of coaxing strong performances from even mediocre talent (ie.
89;Gwenyth Paltrow's haunting portrayal in Hard Eight ).
90;That Aimee Mann's marvelous songs take such a central role is only icing on the cake.
91;See this movie for yourself.you may love it, you may hate it, but it will make you think.
92;Paul Thomas Anderson is today's greatest filmaker.
93;hotties guru, his character's sheer vileness works against any sympathy the audience may build for him.
94;Anderson thrilled me with Hard Eight, and blew me away with Boogie Nights.
95;Many viewings later, this movie has become one of my favorites.
96;The story is great
97;paul Thomas Anderson is a great director and writer
98;Tom Cruise is wonderful as the sex guru
99;Julianne Moore is one of the best actresses out there today.
100;, but he is also wonderful in this film in an understated role as Phil, a male nurse.
101;Melora Walters, John C. Reilly, and Jason Robards also have wonderful roles.
102;There are so many excellent actors and actresses in this film, it is hard to name a favorite performance.
103;the soundtrack is excellent also
104;I loved the entire movie, and wouldn't change anything.
105;This is the type of thing you watch with friends, then discuss it afterwords.
106;Maybe you'll love it and watch it again and again (each time I see it, it's like seeing it for the first time).
107;Just take a chance and watch the film.
108;Magnolia is one of the few movies I have ever seen that can be classfied as pure art.
109;You will begin to notice that all their lives intertwine in an excellent climax.
110;Even if the plot does not attract your attention this film is an original and is worth a look.
111;The ending in this film answers some things and others it leaves unsolved.
112;I think that Magnolia was a brilliant movie full of symbolism and art.
113;If you want a light, easy.
114;The one sin I haven't heard enumerated yet by other disappointed reviewers is that PT Anderson demonstrated so little storytelling ability!
115;The actors are perfectly casted for their roles.
116;Each and every one of them fits his/hers better than a glove.
117;The storyline with all its twists and turns, the laughter and the tears .
118;the Coen brothers and Robert Altman come to mind.
119;Paul Thomas Anderson's unique ironic view of reality will stay with me for the rest of my life.
120;Paul Thomas Anderson is a remarkable creative mind.
121;the film is good, but it is missing something.
122;It surprises me, because that is one thing I find so fascinating about Anderson's other work
123;Even something as dark as `There Will Be Blood' is emotionally landscaped in way so that you can feel the ups and downs, the highs and lows with precise effect.
124;`Boogie Nights' balanced tones so effortlessly
125;Even a film as `uneven' as `Punch Drunk Love' felt remarkably well thought out (despite my lack of true passion for the film, I easily consider Anderson's direction exceptional).
126;Going all the way back to his debut, `Hard Eight', it is notable the way that Anderson plays with darkness in a way that feels eerily accessible.
127;There is one emotion that permeates the entire film.
128;but, there is something about this film that speaks to me.
129;I mentioned, in my review title, a sliver of the film's conclusion, and it is a moment that took me by complete surprise and helped me to appreciate it all the more.
130;It added a layer to this film that I wholly need to explore.
131;Julianne Moore is heartbreaking and completely sincere as the trophy wife with a plateful of regret.
132;William H. Macy and Jeremy Blackman complement one another beautifully, playing the same role just decades apart.
133;Cruise is a firecracker, throwing charisma at everyone in his path and yet it is his emotional breakdown that feels the most real
134;The way he uncovers us layers of true caring while watching over Cruise's dying father
135;the film
136;In fact, I kind of find this film utterly fascinating.
137;Like many have said about most all Anderson's work
138;anderson has undeniably honed his skill as a director.
139;and yet, maybe it is a masterpiece.
140;It is touching, funny, surprising, involving, has great dialogue, amazing cast, fascinating characters with a character driven intertwining story all to meet at one hell of a climactic ending, sustainging its position as the most shocking, amazing, and truly brilliant endings to a movie I have ever seen.
141;paul Thomas Anderson is a genius.
142;dRUNK LOVE (Proves PT Anderson gets a great performance from anyone) and SYDNEY (First film.
143;Spend any amount on it, I promise any amount you pay is a good price.
144;I do have love, says William H. Macy in a moment of bitterness that is both heartbreaking and funny.
145;I have so much love to give.
146;For anyone who ever had a dark day, or who sang along when the song One came on the radio, have I got a movie for you.
147;this is the best film I've seen in years .
148;humor and pathos, high drama that scales almost operatic heights, and sweet ironic light touches of sweetness that will stay with me forever.
149;It's a gorgeous piece of work.
150;But even for him there is hope for redemption, as the film points out.
151;what's wonderful about Magnolia is the way Anderson takes everything a step further.
152;And then we see that all of this is just a facade, and that there's a good person still capable of tears locked away behind that mask.
153;It's incredibly powerful, and yes, Cruise was robbed of that Oscar.
154;(Sorry, I love Michael Caine, but really.
155;Yes, there are some not so nice people in this film, but as with American Beauty, there's an overall sense of compassion and forgiveness to Magnolia, as if an unseen eye really wants all these people to find happiness and a moment of grace.
156;And for every character in the dark there's another in the light .
157;characters like the incredible Philip Seymour Hoffman's quiet caregiver, or Reilly's sweetly optimistic cop.
158;Throw all these characters together, along with some moments of quiet awareness and mythical whimsy, and Magnolia is a gorgeous movie.
159;The wonderful songs by Aimee Mann become almost another character in the film, the voice of their hidden hopes and fears.
160;This is most poignantly illustrated in the final moments of the film, as well as in another absolutely strange, absolutely amazing scene that I won't even begin to spoil for you.
161;You'll know it when you see it.
162;And a special mention has to go to Melora Walters, who in the end provides the story's surprising but all.
163;The changing expressions on her face at the film's end, combined with the perfect musical accompaniment in Aimee Mann's Save Me, provided me with one of the most perfect movie moments I've ever experienced.
164;All of their parts were good and easy to keep straight.
165;i think all of the storylines were very good.
166;I thought the script was very good.
167;It was about 3 hours long, but it was so interesting the time flew by.
168;A fantastic film full of creativity and wonder.
169;although I gave this film five stars, it's mainly due to a personal preference.
170;I liked this film years ago in the theater.
171;I sometimes watch favorite movies again and again.
172;but I've never had this experience of a movie I liked and knew pretty well just suddenly knocking my socks off and vaulting to the top of my best movies list.
173;and I'll also add a nicely written piece of an old review which I think sums it up well for me:If you can appreciate that a movie can touch your heart, can be something more than just simple entertainment, and can actually say something both simple and profound about the human condition, then you will love Magnolia.
174;And yet, through all of this there is a beacon of hope and redemption that shines through, and most of the characters do find the strength to carry on.
175;Watching Magnolia is like having an entire lifetime's worth of powerful emotions crammed into a three hour movie.
176;If you have an open mind, and an open heart, you must see this movie.
177;It was a great copy of the movie and will always be a classic movie.
178;Well, Magnolia will definitely entertain you, but it will also make you think and feel deeply.
179;It is fiercely intelligent and unashamedly passionate.
180;but it IS by far my favourite film of the 1990's.
181;If one looks very carefully at one point in the crowd at the game show, a man even holds up a sign with the Biblical citation on it.
182;When the sunshine don't work, the good Lord bring the rain in.
183;Congratulations, Paul Thomas Anderson, for not dumbing down your film.
184;Thank you, again, Paul, for enriching my sadly impoverished American mind.
185;I really DO love American culture at its best.
186;This film is one great example.
187;it has more to say than you may think.)
188;P. t. Anderson has written and directed a film that you either love or hate.
189;For those who love this film are true fans of great movie making.
190;It's very obvious that P. t. is one of the best directors as well as writers out there today and by making Magnolia he's on the top of my list.
191;It's allot better then it sounds.
192;Overall, I just have to agree with Roger Ebert and say: Magnolia is alive and free to surprise us.
193;This is one of those rare intelligent, artistic movies that manages to deliver both entertainment and impact.
194;With its large, magnificient cast, it spins a story of many people, both as individuals and as members of the society they belong in.
195;There are so many threads in the movie, you'd almost expect it to disintegrate in some sections, but somehow it all holds together to form a beautiful mozaic.
196;it's profound, entertaining, provoking and produced with zeal and talent.
197;A great reflection of what life really is like.
198;well homosexual, (g) a cocaine.
199;Writer/Director Anderson must have a pretty awful view of this world of ours.
200;It's more than one month I saw this film and I am still thinking of it.
201;Part of its lyrical context, part of its splendid cast, part of its splendid screenplay.
202;It's what a call a true movie.
203;Magnolia is the latest film by P. t. Anderson,a director whose previous Boogie Nights was one of the most exciting pieces of American cinema to come around since Tarantino.
204;the camera's 360 degree panning and frequent crosscutting unite the seemingly disparate stories and subtly reveals its theme as the character's connections to one another become clearer.
205;a flower believed to be able to cure cancer).
206;the film's dramatis personae is quite impressive.
207;only to be seduced and destroyed himself by a lovely interviewer gently confronting him with the truth
208;effacing nurse,one of the few good characters in the film who consistently in his own awkward way tries to help
209;an unforgettable nightmarish scene done with bravura
210;trying to find love and respect in this pathological world.
211;my personal favorite scene is the one where the major protagonists quietly sing Aimee Mann's Wise Up ,a scene in lesser hands which would have come across as silly,is exhilarating as it triumphant in Anderson's power to create the unforgettable.
212;the large cast is so well acted and has been nominated and won so many awards, that there is no need to single out anybody.
213;known Melora Walters,whose performances in Boogie Nights and this film are so strong,we should be hearing more about her in the future.
214;But the delivery of the monologues and the use of the soundtrack make this one of the best movies I've ever seen.
215;Magnolia , P. t. Anderson's philisophical and imaginative follow up to Boogie Nights , is a daunting descent into realms of human emotion.
216;All the actors in this film express the desire of the same kind .
217;While these actors subject their instincts into their character's drives and feelings, we begin to suspect that Anderson's creations are just metaphors for ourselves
218;Anderson, inventive, subjective, morally and immorally, creates a world of truths and lies, and does so beautifully.
219;Yes, I can see how some people like it.
220;The best actor was the girl who was molested by her father.
221;She is a wonderful actress and did a supurb job with her part.
222;Magnolia is one of those movies that reminds one of the power of film.
223;Director Paul Thomas Anderson masterfully weaves together the stories of several people, all interrelated, into one brilliantly orchestrated work.
224;Every aspect of Magnolia adds tremendously to its ultimate design, from the cinematography to the music to the flawless cast.
225;all the performances are right.
226;Aimee Mann's songs also add further dimension.
227;all, I give Magnolia my highest rating and recommendation.
228;It is bold and beautiful.
229;I agree that this film was the best film of 1999.
230;Here is a tip for the film makers.your characters must be at least semi believable and potentially likable for an audience to care about the story you are trying to tell.
231;Paul Thomas Anderson's Magnolia is one of the most powerful, intersecting, and profane movies I've ever seen.
232;forth emphasis on various characters, as well as its language and occassional startling elements.
233;Again, it's a powerful portrayal, yet it paints a fascinating and compelling picture of peoples' rises and falls, redemption, despair, and the Biblical.
234;acted, along with a terrific score by Jon Brion (Punch.
235;Watch it at least for the ensemble cast (including Phillip Seymour Hoffman, Tom Cruise, Julianne Moore, Jason Robards, William H. Macy, etc. etc. etc.).
236;Everyone did great, and the premise of colliding coincidences makes the movie unusual and entertaining.
237;One of the best movies ever!
238;The script is wonderful, characters are complex and well written and the acting is superb from every actor.
239;This is a great cast with a great story (or should I say stories) to tell.
240;This is a great movie.
241;Doesn't the best sound, but works anyway.
242;PTA is a master, a brilliant Director.
243;The actors are on the top.
244;Julianne Moore gives the best acting I ever seen.
245;Aimee Mann did the perfect song that matching with the story.
246;THe third release from director Paul Thomas anderson ( Boogie Night, Punch Drunk Love) is a classic as his other works.
247;This is a movie you have to watch when your REALLY awake it clocks in at over 3 hours
248;More for the anthropologists to review in 3030 A. d. than enjoy as an evening's entertainment.
249;I know that many people love this movie, but.
250;Except one guy, who loved it.
251;Magnolia is one of the best films ever made, period.
252;I haven't enjoyed a movie so thoroughly the first time through, thought about it for months afterward, watched it again, and was even more astounded by it, ever.
253;hour running time may turn off the audience members with cases of ADD, but for those of us who stick around, it's a filmmaking experience like no other, driven by the kinetic energy of a director whose sheer joy for the art gives every moment on the screen poignant meaning and visual grace.
254;Mann's music is always at the soul of the movie, starting with her jazzed up remake of One, getting under our skin during a brilliant montage of all the main characters singing Wise Up, and finally knocking us flat on our collective rears with her inspired Save Me.
255;(She was robbed by Phil Collins at the Oscars) Yet, amongst all of the music from one of the world's most gifted musical artists, there are some of the finest screen performances of 1999.
256;amphetamines, but she pulls it all off nicely, and Philip Seymour Hoffman always wins us over with his heartfelt performance as the nurse to the sickly Earl Partridge, played with devastating authenticity by the late great Jason Robards.
257;And those are just my personal favorite characters.
258;I'll say it again, this is one of the very best films I've ever seen, and working in a video store, I've seen a lot of movies.
259;It's endlessly inventive, engaging, wonderful, heartwarming and breaking at the same time, with an endless supply of life being fed into it by one of the best directors since Scorsese.
260;And there's no shortage of actor moments with such a big cast, as each one seems to have their personal grandiose scene.
261;oh yeah and I forgot to mention, I bought the New Line 2.
262;but w/Magnolia, P. t. Anderson's masterpiece, I could not take my eyes away from the screen for a second.
263;Aimee Mann's soundtrack is incredible.
264;I got goosebumps and shivers up my spine.
265;It was such an incredible moment in the film, probably one of my favorite moments in film.
266;But the movie speaks for itself.
267;For added fun, try to count all of the references to the numbers '8' and '2'.
268;For even more fun, try and figure out what they mean.
269;There are about ten characters who are prominent and Paul Thomas Anderson cleverly weaves their stories together over the course of the film.
270;paul Thomas Anderson does a beautiful job writing and directing this film.
271;The screenplay juggles each of his richly developed characters so that all of them seem convincing and powerful.
272;This is only a minor quibble with another wise perfect film.
273;After seeing the brilliantly entertaining 'Boogie Nights', what a dissapointing film.
274;Yes it's spectacular, and yes good acting (Cruise a standout), but the film goes nowhere.
275;Magnolia is one those rare films that I can watch over and over again and am always moved to tears by the final frame.
276;This is filmmaking at its brilliant best.
277;the scenes that stand out and touch me the most are Julianne Moore's emotional ourburst at the pharmacy, William H. Macy's heart wrenching speech of having love to give but not knowing where to put it, the goosebump inducing musical interlude to Amy Mann's touching Wise Up and of course the frogs.
278;everything about this film is perfect.
279;THIS is what movie making is about, a film lovers dream.
