id;spiegazione
1901;their performances are truly what save this movie.
1902;the rest of the performances were solid enough, and would've been fine, if there hadn't been such downers from the aformentioned actors.
1903;I mean it just pained me to see some actors give heart and soul, whose performances had me admiring their craft every step of the way, while some actors had me wondering how the director stood there and allowed that kind of acting to be filmed.
1904;paul Thomas Anderson is immensely talented, but he needs to learn about subtlety, and that its not neccesary to have every single moment of the film be a dramatic revelation/realization/confrontation.
1905;Rarely does a film take the viewer on an emotional rollercoaster as incredibly stunning as this.
1906;This film is three hours of stupendous, top.
1907;line acting from the greatest ensemble of actors in a long long time.
1908;P. t. Anderson has put together a mind.
1909;blowing journey through a day of the lives of nine people.
1910;It exposes everything behind the faces in the media and in the world.
1911;The beginnings, the ends, the incredible love we posess for each other.
1912;One word can describe this film, beautiful.
1913;This film is absolutely beautiful.
1914;It has THE perfect cast, brilliant writing, and is an intellectual challenge.
1915;This was one of the best edited films I've seen.
1916;It also had a hint of Kubrick flavor to it.
1917;The slow music playing in the background the entire time was wonderful.
1918;I found myself repeating over and over I love this movie.
1919;P. T. Anderson crafted this jewel perfectly.
1920;This movie gets seven stars!
1921;Magnolia is a film that I greeted with high expectations .
1922;a brilliant, tight little thriller .
1923;as the opening sequence reveals.
1924;The result is completely anarchic and nauseating.
1925;Like Scorsese, he seems fascinated with aesthetic for aesthetic's sake.
1926;The Southern California dialogue is consistently filthy and indistinguishable from person to person.
1927;The Coen Bros.' Fargo is a remarkable example of a film that dealt with seriously disturbed characters, yet created a unique rhythm for each one.
1928;There is a great divide amongst those who have watched this film
1929;It is, indeed, a very polarizing film.
1930;good movie, the characters are very well drawn and developed, the music is great as well, highly recommended to anyone who likes good stories
1931;The dialogue here, and the direction, is reminiscent of other films that have previously been hailed as thought.
1932;provoking film, speaking of its powerful message about society.
1933;It mocks its characters, it mocks its audience, and it mocks other films that manage to entertain by providing a pleasant and/or complete resolution.
1934;I commend this film on its success, for it has managed to prove its point: film audiences and critics alike know nothing about storytelling, only about what they are expected to appreciate.
1935;More importantly, though, a second disc is included which contains a number of interesting extras, including a seminar done by Tom Cruise while in character.
1936;I think Paul Thomas Anderson is one of the best American directors and hopefully over time and through his career which is already amazing (There Will BE Blood, Boogie NIghts, Punch DRunk Love, Hard EIght) he will be included alongside other great American Directors such as John Huston and Robert Altman.
1937;This film was extremely well written.
1938;At the theatre I was moved,shaken,inspired,uplifted and emotional.
1939;Paul Thomas Anderson is one of the finest filmmakers of all time, we will know this when the world ends and we can cast our vote.
1940;Magnolia is absolutely amazing, excellent writing, character orginization, time, elements, color, weather, plot, story, resolution, cinematography.
1941;Every element of a fine film.
1942;Magnolia is a brilliant movie.
1943;It draws you in and drives you on to its final crescendo.
1944;from its writing and directing to the numerous stunning performances and the excellent cinematography.
1945;moore plays Robbards's wife) is flawless.
1946;The frogs, and the respite following the frogs, offer us each the chance to soften our hearts and live open and free lives.
1947;The Hours, which came out a few years later and took home the top prize, borrowed deeply from Magnolia's style and form.
1948;magnolia blooms, not just with its artful description of humanity's pain, but also with the hope of better days and the possibility of love and grace being just around the next bend.
1949;On the positivie side, there is some good character creation: I particularly liked the work of Robards, Macy and Cruise.
1950;There IS some really nice camera work.
1951;And there are a few riveting scenes.
1952;But there are also scenes that played like nails on the blackboard .
1953;While I found this movie interesting, captivating and compelling, it was also very moving.
1954;The film introduces our protagonists and follows them through an extrordinary day.
1955;While I found the film to be at times melodramatic (screaming, crying, etc.), the film overall was powerfull and innovative.
1956;I liked this movie and found it very interesting.
1957;This film is pretty good.
1958;The Bottom Line:A great film that introduces and develops a half.
1959;dozen connected storylines in a thoroughly unique manner before introducing a plot element that has polarized viewers but completely fits in the context of the film, Magnolia is a modern masterpiece by PT Anderson which will stay with you long after much tamer and shorter (it is long, though very fast.
1960;moving) films are gone
1961;The characters of this poingant film are each caught in their own tradgedy, trapped and struggling to find meaning, to find resolution, even to find life, and yet in the chaos of thier lives is an honesty, and an inexplicaple beauty.
1962;Paul Thomas Anderson has created a masterpiece.
1963;He uses fresh tecniques to tell a complex set of stories about sorrow, cancer and corruption, that instead of being depressing, is a life.
1964;Many of actors adeptly portray fascinating characters, Tom Cruise in particular is a suprise with a fresh new style.
1965;I can honestly say, without reservation, that this is the best movie I have ever seen.
1966;I just wrote a review stating that Polanski was my favorite director and The Tenant my favorite film.
1967;Magnolia is my favorite film and the Tenant is second.
1968;Paul Thomas Anderson is a brilliant filmmaker and cements his already sure status with this brilliant three hour opus.
1969;In 1997, he came into Hollywood with Boogie Nights, a 2 1/2 hour epic about a porn star's rise and fall in 1977.
1970;He preceeded that with Hard Eight, a 1997 film about gambling and the relationship between a pro and a bum.
1971;His ear is for dialogue, his characters are sympathetic and hopeful,and his real talents lie in the brilliant Camera he possesses.
1972;But the film itself is something else and really moved me.
1973;Yes, it's a long movie, but it is put together well
1974;Granted the story line is a tad unrealistic, but it makes it nonetheless enjoyable.
1975;It's worth picking up just for Tom Cruise's performance!!!
1976;I prefer movies that deal with relationships and this fits the bill for me.
1977;It is an older movie, but vey engrossing.
1978;I recommend it highly for those that prefer this type of movie also.
1979;I am definitely going to watch it again soon.
1980;After that I had given up all hope for this being a good movie.
1981;That's disappointing too because the beginning of the movie is so good.
1982;The stories they show in the very beginning are interesting.
1983;And not one story has a satisfying ending.
1984;At that point you can tell that the director has given up on this and he just wanted to get it over with as soon as possible.
1985;This film has more in common with Richard Linklater's Slacker than it does with Boogie Nights, so if you liked the former and not the latter, you might want to give this film a try.
1986;If you liked the latter and not the former, give it a pass.
1987;This movie is a must see for anyone who appreciates artistic well thought out movies.
1988;The music, Starring Aimee Man's Beautiful voice captures the atmosphere of the movie with insane accuracy as does the superb camera work.
1989;Paul Thomas Anderson IS the most creative, most brilliant, most daring writer/director of all time.
1990;i was literally swept away from each and every cast member's preformance and I marvel at the symbolism and irony that this film captures.
1991;And for that, Magnolia is my favorite film of all time!KUDOS TO EVERYONE THAT WAS APART OF MAGNOLIA!
1992;This movie has a lot of depth.
1993;Each one is written well.
1994;Each one with one exception has a mouth on him or her.
1995;since it is such a counter culture picture and the culture of the last 20 years celebrates all that is dysfunctional a counter culture picture can only be one of confidence and redemption and happy endings.
1996;i'm sure PETA had a fit at the end of this picture.
1997;then again it could just be a cheep stunt for some guys who couldn't figure out how to get from a. b. Either way you'll find the performances all very good particularly by the supporting cast.
1998;This film is an absolute masterpiece.
1999;Every part of the film is outstanding.
2000;So the acting was incredible.
2001;The songs were great and in order all the time.
2002;The editor was great and the script was really well written.
2003;I like esoteric filmaking and was lured by the stellar cast and Roger Ebert's thumbs.
2004;I thought it was ok, beautifully filmed, but it didn't meet my expectations.
2005;Because I knew of the multiple storylines, i expected something tarantino.
2006;esque with something that tied together neatly.
2007;Boogie Nights also really affected my expectations.
2008;It is very emotional, and that is why i had trouble dealing with it.
2009;I noticed so much more, and i realized how amazingly real the acting is.
2010;I thought about this movie everyday of my life.
2011;i don't think it's perfect yet, but it might be perfect to me one day.
2012;it continues after the credits have rolled and creeps into your life.
2013;This is a movie that keeps growing everytime you watch it.
2014;I'll count myself in the minority who don't think this movie is completely brilliant or alternately a waste of celluloid.
2015;no one can deny that P. T. Anderson is ambitious in the scope and style of the story he attempts to tell here.
2016;I found the multiple plot lines, acting and themes to be captivating.
2017;The final resolution (and the whole film for that matter) was completely original.
2018;The melding of music and story was beautiful.
2019;Anderson chose well in using Aimee Mann's music to reveal the complex emotions of the characters.
2020;conversely, the acting (while well done) at times seemed out of place.
2021;but all else being equal, it was a beautiful, haunting and original movie.
2022;highly highly HIGHLY recommended if you want an enriching and interesting movie experience, far from the usual Hollywood cookie cutter plots .
2023;Someone whom I highly respect and appreciate made me promise to see this so I did.
2024;He said it was his favorite movie of all time.
2025;I sense that the more times one sees it the more they will appreciate it.
2026;Someone who has the patience and temperament to absorb it can see the artistry that went into it.
2027;intellectuals, emotionally unstable people, and holdovers from last decade's coffeehouse scene.
2028;in which case, enjoy, you have found your pied piping prophet
2029;I have seen this film three times and each time am struck by the brilliance of director, Paul Anderson.
2030;Tom Cruise in one of his best performances as the crude Frank.
2031;Jason Robards as the drying man so loved and hated.
2032;All of these lives come together and in the final minutes of the film the skies open up and all have their lives in front of them.
2033;three for writer and director Paul Thomas Anderson, 29, who follows Hard Eight and Boogie Nights with his most ardent and ambitious movie yet.
2034;Anderson keeps a tight lid on his work so that audiences can approach his character.
2035;based dramas with a sense of discovery.
2036;Magnolia is one of the best movies of the year .
2037;startling, innovative, hugely funny and powerfully, courageously moving.
2038;hilarious performance of Tom Cruise as the male dominating sex guru really grabbed me.
2039;top drugged out wife, Julianne Moore.
2040;She could have accomplished the same shock with fewer exclamatory f. words.
2041;She played the range of hysteria.
2042;if you can stick through the early parts of the film that bring you to the brink of despair as you witness the depths of the pain of these characters, you will be rewarded by the depths of simple goodness and warmth of some of them.
2043;That role is carried mostly by John C. Reilly as the good cop.
2044;The relatonship between Reilly and Melora Walter, who is Wonderful!
2045;affecting William H. Macy are the true stars of the film.Yes, Hoffman has a depth that is rare in film actors and he is very affecting here.
2046;That's a quibble, though, and the fact that he went to such lengths to contact Robards' son is one of the moral strong points that makes this film more than a horror show.
2047;henry Gibson gives a brilliant bit as a cynical character Macy meets in a bar.
2048;this is a film that attempts grand themes.
2049;I loved the suggestion of another reviewer.
2050;At any rate, the acting is uniformly first rate.
2051;I rarely watch a film more than once.
2052;But this is one that I think I will see again.
2053;This film is a true classic.
2054;unbelievable performances from a huge cast, delivering emotionally potent performances in the most difficult of circumstances, allows Magnolia to win through rewarding the viewer with one of those rare movies which can touch the soul.
2055;Another feature which is hidden from the user is outtakes which I found very funny.
2056;esque version of Wise Up in the middle of the film.
2057;the whole movie just bunched together at the end, and hit me like an atomic thrust to the heart, made me think about myself and others in a whole new light.
2058;i recommend this movie to anyone preoccupied with living, breathing, sucking the marrow out of life.
2059;Although the film concentrates on the lonely, destitute, confused people, it really hits the ones that take love and affection for granted.
2060;It really touches those of us who never thought that all we have can be taken away at any second.
2061;This is the second movie of Mr. Anderson's that I have watched.
2062;The first was the phenomenal Boogie Nights.
2063;The fact that is deals more intimately with familial relationships makes it, in that respect, a bit more difficult to watch than Boogie Nights.
2064;To say that they are in the midst of a storm is a masterpiece of understatment.
2065;The cast, many of whom were in Boogie Nights is again positively first.
2066;The calming influence in the midst of all the turbulence is John C. Reily as a police officer who is lonely and in need of someone to love, so much so, that we become appalled at the fact, that his need of love is so strong as to cause him to make a monumentally horrible choice.
2067;If you are in to character study, this is indeed an excellent vehicle.
2068;Tom's performance here is riveting.
2069;provoking, and ultimately worthy to be included in any movie collection.
2070;rate, and at no point, does one thread become more interesting than all the others.
2071;So there is no disappointment when the scence changes.
2072;This movie has a lot to say about the role of chance in one's life, and about how much of what we do is really our own choice.
2073;The ending is both funny and surprising, and will most likely cause you to think about it for days.
2074;Okay, this film deserves 4 stars, but I added one for the supplimental stuff on the second disc.
2075;which was a nice treat and is well.
2076;And I'm also proud to say that I'm a fan of Mister Anderson's work (do yourself a favor and check out Hard Eight and, of course, Boogie Nights ) and his story.
2077;image (I know you want to be known as a nice guy Tommy, but you're an actor) and for the emotional depth of his performance which was quite stunning to watch (was he panting like a dog in one scene?
2078;he's outstanding in mostly everything he does.
2079;Redemption comes in the form of a Biblical downpour of frogs, which is creative and Oh.
2080;The metaphysical side of the movie is extremely subtle but always present.
2081;I thoroughly enjoyed the whispy nature of the metaphysical side of the film.
2082;the third viewing is just fun to try to find all the references to Exodus 8:2, like a Where's Waldo on a moving screen.
2083;This exercise is actually more enjoyable to do with more than one person.
2084;It is this point that is key
2085;a flawless union of filmscoremusic and a moment in time.
2086;You get a feeling that you've got your money worth and thinking to yourself I am going to get this.You will know this is a classic the moment you start watching the film, like all good movies, the cast has to gel well, the story has to be good, the acting has to be great and the director must be on form.
2087;Every actors here gave great performances, Tom Cruise deservedly got his Oscar nomination, PT Anderson (writer and director of boogie night, which he also wrote this too) should have got one too, he certainly at least deserved a Oscar nomination for best director and best film.
2088;Each one have their own problems to deal with and the director deal with them all superbly.
2089;All the characters have a connection with one and other through either relations or this What do kid know game show.
2090;the real treat here is that all these stories are told in such a way that you won't keep your eyes off the screen, all the scene have an importance in the film in the story telling.
2091;Even though the film is a little over 3 hours long, it will fly by.
2092;Which brings me to the editing of this film because the film is so well put together from one scene to another, this helps the stories immensely, in addition the music by Aimee Mann is also well suited to the film, it gave the film an extra dimension and character.
2093;All these elements together made this the movie of the year for me
2094;Excellent, Wonderful, Clever, Brilliant and Engaging only comes close.
2095;s. look out for the strange weather phenomenon at the end of the film, you'll never see that coming and it's so funny and clever.
2096;Do you like great characters ( Better Call Saul comes to mind), great writing and great acting?
2097;Cruise,Philip Seymour Hoffman, Bill Macy and others are superb in a movie that relies on the theme rather than one or two characters.
2098;Amie Mann's songs add to the mood.
2099;This is about real people not super heroes with a twist of fantasy.
2100;I came to watch some great performances.
2101;anderson seems to emphasize two aspects of film in Magnolia: the complete and uninhibited expression of his characters and the emotional connections those characters share with each other.
2102;face glimpse into the depths of human beings, one which deserves undivided attention.
2103;in can share an emotional bond that exceeds their opposing circumstances.
2104;More subtly, the connection that Philip Seymour Hoffman and the Seduce and Destroy hotline man .
2105;stresses the undeniable significance of personal bonds between the most unlikely, and in some cases unnecessary, of human beings.
2106;I love this movie, go see it.
2107;Thought provoking questions for the ages, some would say, proficiently addressed here by writer/director Paul Thomas Anderson in his discursively brilliant film, Magnolia.
2108;Anderson puts the lives of a diverse cross.
2109;The story Anderson weaves is fast.
2110;paced, sometimes frantic, and thoroughly engrossing, achieving levels of emotional intensity that are at times remarkable.
2111;It's a dynamic piece of filmmaking, extremely well written and delivered by Anderson and his superb cast.
2112;There are a number of memorable performances here, among them Tom Cruise, who plays Frank T. j. Mackey, a self.
2113;It's an intense performance (for which he deservedly received an Oscar nomination), quite unlike anything he's done before, and possibly his best work since Rain Man.
2114;But the most superlative performance of the movie is given by Philip Seymour Hoffman, as a male nurse named Phil Parma.
2115;His sensitive, subtle portrayal of this caretaker to dying man Earl Partridge (Jason Robards), is delivered with nuance and incredible depth, and provides some of the most poignant moments in the film.
2116;One of the best films of 1999, Magnolia conveys a moral without moralizing, is rich in metaphor and altogether captivating, with an ending that may take you aback, if indeed, you haven't been paying close attention (there are at least two clues during the film, admittedly obscure, but there nevertheless).
2117;It is intense, unremittedly so, and may leave you breathless and pondering the mysteries of life
2118;watchers, one that absolutely must not be missed.
2119;Possibly the best character movie since Short Cuts, this film is more off the wall and a whole lot of strange.
2120;The multi stories are all interesting.
2121;His performance was so antistereotype of his persona and was so brilliantly acted.
2122;His scenes were breathtaking at times.
2123;John C. Reilly also did a superior job, but these men aren't alone.
2124;All the cast was super and you care about the characters.
2125;That part was simply great.
2126;One of the best movies that was not nominated for best picture.
2127;I find that movies that have a lot of characters and a lot of factors involved are among the best.
2128;I also loved the way the film was directed.
2129;A fantastic film, from a fantastic film maker.
2130;I would recommend it to anyone.
2131;It is a bit on the long side but still really awesom.
2132;i find myself thinking about the film often, and then thinking about it again, hunting for the soundtrack with the amazing Aimee Mann songs (Save Me and Wise Up are particularly good), and connecting elements of the film as I listen to the music, considering what it means to me, what it might mean to people I know.
2133;To go from that chaos, though, and create such a powerful film from it.
2134;Despite being more than 3 hours long, Magnolia is well worth seeing more than once.
2135;PT Anderson has done it again!
2136;After Hard Eight and Boogie Nights, he has again pulled off one of the best dramas I've seen.
2137;The characters are real, the story is compelling and the acting is out of this world.
2138;Clocking in at over 3 hours this is perfect to watch on a rainy day or cuddled up in bed at night.
2139;Some really wonderful performances by an ensemble cast, and it's a layered movie.
2140;We actually watched it twice in two nights just to be able to catch more of the show.
2141;I thought it was really enjoyable, and the music is great.
2142;known of movies, but an excellent film.
2143;Magnificent performances by everyone in the cast.
2144;John C. Reilly, Phillip Seymore Hoffman and William H. Macy are absolutely stellar.
2145;It's not a movie for everyone, but it is worth watching at least once.
2146;This abomination makes the director's wonderfully under.
2147;I say unequivicably that this is the best movie of the year.
2148;stories
2149;with Aimee Mann singing wonderfully, especially for the movie and some incredible acting, this movie was fascinating and disturbing.
2150;And the scene where everyone sang all at once was a wonderfully symbolic and bold gesture that some may have found odd, but I absolutely loved.
2151;so is it just a coincidence or is it a miracle?
2152;The tension in the film as this mysogynist was being interviewed was palpable, a tribute to Anderson's direction.
2153;there are few movies that are as bold and thought provoking as this.
2154;I found this movie to be both disturbing and captivating at the same time.
2155;I found it to be mesmerizing.
2156;The performance rendered by Tom Cruise alone makes the film worth the price.
2157;This was my favorite movie of 1999.
2158;It's true that it feels almost like stream of consciousness with no editing (in length anyway), but that is part of it appeal.
2159;It is an outpouring of emotion and energy.
2160;The performances (especially by Hoffman, Moore and Cruise) are exceptional.
2161;The music is astoundingly good.
2162;P. t. Anderson once again shows his brilliance.
2163;up Magnolia was a brilliant Altmanesc story of one day in the valley.
2164;Astounding fast pace directing and fantastic performances make this a runner.
2165;up for the best picture of 99' next only to Being John Malkovich .
2166;Maybe visual effects are a new form of art in itself, but I wish movies were still movies , in the first place.
2167;Saw this movie years ago and THOUGHT I loved it.
2168;definitely worth your time to watch though, has a great cast.
2169;High Praise must be given to this film.
2170;The greatly intwined plot deserves much credit and the actors played their roles quite superbly.
2171;It was great, unexpected, and brilliant.
2172;This movie keeps you on the edge of your seat from the first minute.
2173;Paul Thomas Anderson knows a thing or two about homages.
2174;His second feature,Boogie Nights, was built around an ensemble cast.
2175;Criterion Collection), and in some ways passed the great director.
2176;this is a wonderful movie.
2177;One of the best of the year, in a very good year by the way.
2178;boogie Nights had been my favorite (and yep, I picked up the 2.
2179;i think Paul Thomas Anderson is a genius.
